ID,TEXT_TYPE,INIT_OP_A,TEXT_A,PPL_A,PROBE_INT_A,H_INT_A,PROBE_EXT_A,H_EXT_A,INIT_OP_B,TEXT_B,PPL_B,PROBE_INT_B,H_INT_B,PROBE_EXT_B,H_EXT_B
112.0,tot,1.0,"Climate change is one of the most pressing issues of our time, affecting not only the environment but also public health, economies, and social equity. The evidence is undeniable—rising temperatures, extreme weather events, and melting ice caps are all consequences of human activity. Urgent action is needed, not just from governments but also from individuals and businesses to reduce carbon emissions and shift towards sustainable practices. The time to act is now, as the longer we wait, the more severe the repercussions will be for future generations. It's essential to foster awareness and advocate for policies that prioritize the planet's health. Every action counts.",1.8558656154853475,1.0000000537701583,2.570864391064514e-07,,,5.0,"I believe that the focus on climate change has been exaggerated and often distracts from more pressing and immediate issues facing humanity, such as poverty, healthcare, and education. Many proposed solutions, like drastic policy changes and economic upheaval, could harm economies and livelihoods without guaranteeing significant impact on climate. Instead of prioritizing climate alarmism, we should invest in innovation and technology that can address environmental issues without sacrificing progress and development. It's important to critically assess the data and consider the broader picture of human welfare rather than focusing solely on climate narratives.",8.635811450601522e+40,4.001568498950282,0.013518355749483891,,
112.0,disc,1.0,"Climate change is a critical challenge that we cannot afford to ignore, as it threatens not only our environment but also our health and economic stability. Every year, we witness more extreme weather events and shifts in ecosystems, reinforcing the need for urgent action from all sectors of society. I believe that fostering awareness and encouraging sustainable practices at both individual and collective levels are essential steps toward mitigating this global crisis.",2.166360912004977,1.0000000003624563,3.0021499362644815e-09,,,5.0,"While I acknowledge that climate change is a concern, I believe that emphasizing it often distracts from more immediate issues like poverty, healthcare, and education that directly impact people's lives. Prioritizing drastic actions can lead to economic disruptions that might hurt many without guaranteeing a meaningful impact on climate outcomes. Instead, we should focus on fostering innovation and technology that effectively addresses environmental challenges while ensuring human progress is not compromised.",2.5628966099267974,4.000005696819274,0.000155580225828643,,
112.0,disc,1.0,"I understand your concerns about the immediate issues of poverty, healthcare, and education; however, these challenges are intrinsically linked to climate change. For instance, extreme weather events can exacerbate poverty and hinder access to healthcare, making it necessary to view climate action as a means of promoting social equity and improving overall well-being. Investing in innovative and sustainable technologies can indeed lead to a robust economy while addressing environmental challenges, proving that we can pursue both progress and preservation simultaneously.",2.206373570823057,1.0000003506293784,1.5130771275271591e-06,,,5.0,"I appreciate your perspective, but I maintain that the urgency placed on climate action can sometimes overshadow the pressing needs of vulnerable populations facing poverty and lack of healthcare. While it’s true that extreme weather can impact these areas, addressing immediate human welfare should take precedence, as many of these climate-related policies may not deliver the promised results and could inadvertently worsen socioeconomic conditions. We can certainly promote innovation and sustainable practices, but it’s crucial to ensure that the focus remains on solutions that genuinely uplift communities and support their development, rather than solely chasing climate narratives.",2.3156386920253462,4.000109722322384,0.001364574061399955,,
112.0,disc,1.0,"I completely agree that immediate human welfare is paramount, and it's essential that our climate actions do not inadvertently harm vulnerable populations. However, it’s important to recognize that climate change is a long-term threat that will increasingly disrupt livelihoods and worsen poverty if left unaddressed, making it a critical priority. By integrating community-focused solutions into climate policies, we can create initiatives that improve social equity while simultaneously addressing environmental challenges, ensuring that both people and the planet can thrive together.",2.1601637651846017,1.0000004502725004,1.916227532010007e-06,,,5.0,"I understand the concern about climate change being a long-term threat, but we must carefully evaluate whether current climate policies genuinely deliver on their promises without causing harm to those already struggling. Often, the proposed solutions may lead to significant economic shifts that can exacerbate vulnerabilities instead of alleviating them. The focus should be on solutions that address immediate human needs and invest in technology that can offer real progress, allowing communities to thrive without getting caught in the complexities of climate narratives that do not always produce the desired outcomes.",2.7658669538580134,3.9996732295408552,0.0021524247884019587,,
112.0,disc,1.0,"You raise an important point about the necessity of critically evaluating climate policies to ensure they truly benefit vulnerable populations. However, it’s essential to approach climate action with an understanding that sustainable solutions can create jobs, improve health outcomes, and foster resilience in communities already facing hardships. By prioritizing inclusive and equitable climate strategies that incorporate local voices and needs, we can develop innovative technologies and practices that address both immediate human needs and long-term environmental sustainability, ultimately fostering a healthier planet and society.",2.0496418441963407,1.0000006554107772,2.732487416218897e-06,,,5.0,"I agree that evaluating climate policies is crucial, but it's vital to ensure that the proposed sustainable solutions do not jeopardize economic stability or livelihoods in the short term. While the potential for job creation and improved health outcomes is promising, these benefits often rely on the successful implementation of complex policies that may not yield immediate results for those in need. We should prioritize strategies that directly address pressing human issues first, using technology and innovation to enhance welfare, rather than placing an overwhelming focus on long-term climate goals that might leave vulnerable populations behind.",2.1304588792669943,4.002369855353055,0.01811114033609513,,
112.0,disc,1.0,"I appreciate your emphasis on the importance of protecting economic stability and livelihoods in the immediate term, and I completely agree that we must prioritize addressing pressing human issues. However, it's vital to recognize that climate change is an escalating crisis that can exacerbate existing vulnerabilities and impact economic stability if not proactively addressed. By taking a holistic approach that integrates short-term welfare solutions with long-term climate strategies, we can create pathways for immediate relief while ensuring a sustainable future, demonstrating that these goals are not mutually exclusive but rather interconnected in fostering resilient communities.",2.2075099870352433,1.0000405200620774,0.00012662692902765452,,,5.0,"I appreciate your recognition of the need to protect economic stability, but I remain cautious about framing climate action as an urgent crisis that demands immediate, sweeping responses. Integrating such strategies often leads to policies that can disrupt local economies and livelihoods, potentially harming those we aim to help in the process. Rather than attempting to combine immediate relief with long-term climate initiatives, we should first focus on effective solutions directly addressing pressing human needs, ensuring that any future climate actions are carefully considered and genuinely beneficial to all communities involved.",2.340524870581302e+43,4.003147912917868,0.021682762215753205,,
