ID,TEXT_TYPE,INIT_OP_A,TEXT_A,PPL_A,PROBE_INT_A,H_INT_A,PROBE_EXT_A,H_EXT_A,INIT_OP_B,TEXT_B,PPL_B,PROBE_INT_B,H_INT_B,PROBE_EXT_B,H_EXT_B
126.0,tot,2.0,"Climate change is one of the most pressing issues of our time, posing serious threats to ecosystems, economies, and human health. The scientific consensus is clear: human activities, particularly the burning of fossil fuels, are driving unprecedented changes in our climate. These changes result in extreme weather events, rising sea levels, and altered agricultural patterns, impacting food security and biodiversity. 

Addressing climate change requires urgent collective action, including reducing greenhouse gas emissions, transitioning to renewable energy, and promoting sustainable practices. Furthermore, it necessitates global cooperation and equitable solutions to support vulnerable communities most affected by climate impacts. The longer we delay, the more severe the consequences will be, making it imperative for individuals, governments, and organizations to work together towards a sustainable future.",1.6028114582204382,1.000000128981511,5.884746328746848e-07,,,1.0,"Climate change is one of the most pressing issues of our time, affecting not only the environment but also public health, economies, and social equity. The evidence is undeniable—rising temperatures, extreme weather events, and melting ice caps are all consequences of human activity. Urgent action is needed, not just from governments but also from individuals and businesses to reduce carbon emissions and shift towards sustainable practices. The time to act is now, as the longer we wait, the more severe the repercussions will be for future generations. It's essential to foster awareness and advocate for policies that prioritize the planet's health. Every action counts.",1.860597749596419,1.0000002126423375,9.435976399931204e-07,,
126.0,disc,2.0,"Climate change is not just an environmental issue; it is a multifaceted crisis that threatens our ecosystems, economies, and health. We need to address the profound impacts of rising temperatures, extreme weather, and sea-level rise on both natural and human systems. To create sustainable solutions, it is essential that we collaborate across borders, industries, and communities to implement effective strategies for reducing greenhouse gas emissions and promoting resilience in the face of these challenges.",1.632173333640094e+50,1.0000000005270606,3.129422039373418e-09,,,1.0,"I completely agree that climate change is a multifaceted crisis that extends far beyond environmental concerns; it fundamentally impacts our health, economies, and societal structures. Collaboration is indeed crucial, as no single entity can address this issue alone— it requires concerted efforts from governments, businesses, and individuals alike. We must act swiftly to implement sustainable practices and policies to mitigate the consequences of this crisis and ensure a livable planet for future generations.",5.762060334104051e+50,1.0000000135982383,6.96896794677422e-08,,
126.0,disc,2.0,"Absolutely, your points resonate deeply with the urgency of the situation. Every sector, from government to private industry to individual actions, plays a pivotal role in creating systemic change, and without that collective engagement, our efforts may fall short. By prioritizing sustainable practices and advocating for strong policies that support both equity and environmental stewardship, we can pave the way toward a more resilient future for all.",2.5094784309235827,1.0000000011157872,6.415776557215154e-09,,,1.0,"Thank you for your insightful response; it's heartening to see such agreement on the need for collective engagement in addressing climate change. Prioritizing both equity and environmental stewardship is essential, as the impacts of climate change disproportionately affect the most vulnerable communities. By fostering collaboration and ensuring inclusive policies, we can build a resilient future where both people and the planet thrive together.",1.7074555798753137,1.0000000034374767,1.881313637568593e-08,,
126.0,disc,2.0,"You're spot on; the disproportionate effects of climate change on vulnerable communities highlight the urgency for inclusive policies that prioritize equity. It's essential that we listen to and empower those most affected by climate impacts, ensuring their voices are integral to decision-making processes. By fostering collaboration that embraces diversity and inclusiveness, we can create solutions that not only address environmental challenges but also promote social justice, leading to a healthier planet for everyone.",1.8325734877745432,1.0000007421641577,3.061425229826175e-06,,,1.0,"I absolutely agree—empowering vulnerable communities and amplifying their voices in decision-making is crucial for creating effective and equitable solutions to climate change. When diverse perspectives are incorporated, we can develop strategies that not only tackle environmental issues but also uplift social justice and enhance community resilience. By prioritizing inclusiveness, we truly enhance our capacity to address the multifaceted nature of this crisis, ensuring a healthier planet that benefits all.",2.396003376980974,1.0000000197837056,9.957893301646155e-08,,
126.0,disc,2.0,"You're completely right; incorporating diverse perspectives is vital for crafting holistic solutions to climate change that consider the realities faced by all community members. By integrating the knowledge and experiences of marginalized groups, we can uncover innovative strategies that address both environmental and social justice issues. Ultimately, fostering inclusiveness not only strengthens our response to this crisis but also cultivates a sense of shared responsibility that is essential for achieving lasting change.",2.3473820596477055,1.0000000224143195,1.1207081468591091e-07,,,1.0,"Thank you for highlighting the importance of integrating the knowledge and experiences of marginalized groups; their insights are invaluable in crafting effective solutions that tackle both environmental and social justice challenges. This shared responsibility is indeed crucial, as it encourages collaboration and connection among community members, fostering a sense of collective ownership in the fight against climate change. By actively embracing diverse perspectives, we can drive innovative practices that lead to meaningful, long-lasting change for both people and the planet.",1.2922854739203926e+49,1.000000003896381,2.1186096344503132e-08,,
126.0,disc,2.0,"I wholeheartedly agree; fostering a sense of collective ownership is a powerful way to engage communities in the fight against climate change. When we actively embrace and amplify diverse perspectives, we not only enrich our approaches but also create a more inclusive environment where everyone feels valued and invested in the solutions we pursue. This collaborative spirit is essential for driving innovative practices that can lead to meaningful and sustainable change, benefiting both our planet and humanity as a whole.",1.8571282063630241,1.0000010798447998,4.353178808290148e-06,,,1.0,"I couldn't agree more—the collaborative spirit you've described is fundamental to mobilizing communities toward effective action on climate change. Valuing diverse perspectives not only enhances our solutions but helps build trust and unity, fostering an environment where everyone feels empowered to contribute. By harnessing this collective energy, we can catalyze innovative practices that promote sustainability and create a healthier future for both our planet and all its inhabitants.",2.3952288600029035,1.0000000326105234,1.5999477003524092e-07,,
