ID,TEXT_TYPE,INIT_OP_A,TEXT_A,PPL_A,PROBE_INT_A,H_INT_A,PROBE_EXT_A,H_EXT_A,INIT_OP_B,TEXT_B,PPL_B,PROBE_INT_B,H_INT_B,PROBE_EXT_B,H_EXT_B
14.0,tot,1.0,"Climate change is one of the most pressing issues of our time, affecting not only the environment but also public health, economies, and social equity. The evidence is undeniable—rising temperatures, extreme weather events, and melting ice caps are all consequences of human activity. Urgent action is needed, not just from governments but also from individuals and businesses to reduce carbon emissions, invest in renewable energy, and promote sustainable practices. Addressing climate change is crucial for ensuring a habitable planet for future generations. We must act now to mitigate its impacts and adapt to the changes already underway.",1.6582292860027086,1.0000001876574909,8.385916785005446e-07,,,1.0,"Climate change is one of the most pressing issues of our time, affecting not only the environment but also public health, economies, and social equity. The evidence is undeniable—rising temperatures, extreme weather events, and melting ice caps are all consequences of human activity. Urgent action is needed, not just from governments but also from individuals and businesses to reduce carbon emissions and shift towards sustainable practices. The time to act is now, as the longer we wait, the more severe the repercussions will be for future generations. It's essential to foster awareness and advocate for policies that prioritize the planet's health. Every action counts.",1.8522909768196905,1.0000000120016983,6.188229310854443e-08,,
14.0,disc,1.0,"Climate change is a pressing challenge that we can no longer afford to ignore, as it poses significant risks to our environment, health, and economies. The evidence is clear, and the time for action is now; we must prioritize reducing carbon emissions and investing in renewable energy sources. I believe that addressing this crisis requires collaboration across all sectors—governments, businesses, and individuals alike—to create sustainable solutions for a better future.",1.8757235641395216,1.0000000023621216,1.3139301281831905e-08,,,1.0,"I completely agree that climate change is an urgent challenge that demands our immediate attention. Collaboration across all sectors is indeed essential, as it empowers us to harness diverse resources and expertise in developing effective solutions. By coming together, we can create a robust action plan that not only reduces carbon emissions but also promotes social equity and public health for generations to come.",1.9858627043571815,1.0000000056688758,3.029244536759191e-08,,
14.0,disc,1.0,"I'm glad to hear that you share the urgency of addressing climate change and recognize the importance of collaboration in this effort. By uniting our resources and expertise, we can not only tackle emissions but also ensure that the solutions we implement are equitable and beneficial to all communities, particularly those most vulnerable to the impacts of climate change. Together, we can forge a sustainable path forward that creates a healthier planet and society for future generations.",7.753704589323117e+51,1.000000005666435,3.028001281815482e-08,,,1.0,"Absolutely! It's crucial that our solutions are not only effective but also equitable, as marginalized communities often bear the brunt of climate impacts despite contributing the least to the problem. By prioritizing inclusivity in our climate action strategies, we can ensure that everyone has a stake in the transition to a sustainable future. Together, we can build resilience and create opportunities that empower all communities while safeguarding our planet for generations to come.",1.433682780767849,1.0000000326097602,1.5999121610148554e-07,,
14.0,disc,1.0,"You raise an essential point about the disproportionate impact of climate change on marginalized communities, and it's vital that we center these voices in our climate action strategies. By prioritizing inclusivity, we not only address social equity but also enhance our overall resilience, ensuring that all communities can thrive in a sustainable future. Together, we can create opportunities that empower those who have been historically overlooked, ultimately benefiting our planet and fostering a more just society for generations to come.",1.6809934332296044,1.0000000782243814,3.667156637754912e-07,,,1.0,"I wholeheartedly agree that centering the voices of marginalized communities is a fundamental aspect of effective climate action. By actively involving these communities in decision-making processes, we can ensure that their unique needs and perspectives are acknowledged and addressed. This inclusive approach not only promotes social justice but also strengthens our collective resilience, paving the way for a more sustainable and equitable future for all.",1.4457792164179157,1.0000000008695145,5.066673769361002e-09,,
14.0,disc,1.0,"I completely concur that involving marginalized communities in decision-making is crucial for creating effective and inclusive climate solutions. By actively listening to their unique perspectives and needs, we can develop strategies that truly reflect the diversity of experiences and challenges faced by different groups. This collaborative approach not only fosters social justice but also enhances our resilience, as it empowers all communities to contribute to and benefit from a sustainable and equitable future.",1.6230449392805537,1.0000405199663152,0.0001266252666009477,,,1.0,"You’ve articulated the importance of this issue beautifully! Actively listening to and incorporating the diverse perspectives of marginalized communities not only leads to better solutions but also strengthens the social fabric needed for collective action against climate change. By fostering collaboration and empowering all voices, we can build a resilient, just, and sustainable future that works for everyone.",2.224764314456053,1.000000069033724,3.2580846868652823e-07,,
14.0,disc,1.0,"Thank you for your kind words; I truly believe that fostering a culture of collaboration is key to addressing climate change effectively. By valuing and respecting the diverse perspectives of marginalized communities, we can create more innovative and practical solutions that resonate with the broader population. Ultimately, this collective action not only builds resilience but also nurtures a sense of community and shared responsibility, paving the way for a truly sustainable future.",2.098034745618725,1.0000001461453072,6.622545018611936e-07,,,1.0,"You're absolutely right—the culture of collaboration is essential for harnessing the creativity and innovation needed to tackle climate change effectively. By respecting and valuing diverse perspectives, we not only enhance our problem-solving capabilities but also cultivate a sense of belonging and shared purpose among all community members. This approach will inspire collective action and solidarity, leading us towards a truly sustainable future that benefits the planet and everyone who inhabits it.",1.9567240633943679,1.0000000782267469,3.666868705573801e-07,,
