ID,TEXT_TYPE,INIT_OP_A,TEXT_A,PPL_A,PROBE_INT_A,H_INT_A,PROBE_EXT_A,H_EXT_A,INIT_OP_B,TEXT_B,PPL_B,PROBE_INT_B,H_INT_B,PROBE_EXT_B,H_EXT_B
153.0,tot,2.0,"Climate change is one of the most pressing issues of our time, posing serious threats to ecosystems, economies, and human health. The scientific consensus is clear: human activities, particularly the burning of fossil fuels, are driving unprecedented changes in our climate. These changes result in extreme weather events, rising sea levels, and altered agricultural patterns, impacting food security and biodiversity. 

Addressing climate change requires urgent collective action, including reducing greenhouse gas emissions, transitioning to renewable energy, and promoting sustainable practices. Furthermore, it necessitates global cooperation and equitable solutions to support vulnerable communities most affected by climate impacts. The longer we delay, the more severe the consequences will be, making it imperative for individuals, governments, and organizations to work together towards a sustainable future.",1.6003022890010175,1.0000003972709675,1.700810525184243e-06,,,2.0,"Climate change is one of the most pressing issues of our time, posing serious threats to ecosystems, economies, and human health. The scientific consensus is clear: human activities, particularly the burning of fossil fuels, are driving unprecedented changes in our climate. These changes result in extreme weather events, rising sea levels, and altered agricultural patterns, impacting food security and biodiversity. 

Addressing climate change requires urgent collective action, including a transition to renewable energy, sustainable transportation, and effective conservation strategies. It’s essential to invest in innovations, promote awareness, and engage communities in finding solutions. By acting decisively and collaboratively, we can mitigate the impacts of climate change and safeguard the planet for future generations.",1.821758328126479,1.0000003093878511,1.3439007312136886e-06,,
153.0,disc,2.0,"Climate change is not just an environmental issue; it is a multifaceted crisis that threatens our ecosystems, economies, and health. We need to address the profound impacts of rising temperatures, extreme weather, and sea-level rise on both natural and human systems. To create sustainable solutions, it is essential that we collaborate across borders, industries, and communities to implement effective strategies for reducing greenhouse gas emissions and supporting vulnerable populations.",1.837154920438944e+53,1.000000019777802,9.950706579860384e-08,,,2.0,"I completely agree with your assessment that climate change is a multifaceted crisis affecting every aspect of our lives. Collaborating across borders and sectors is crucial, as climate change knows no boundaries and requires a unified response to mitigate its impacts. By prioritizing sustainable solutions and supporting vulnerable populations, we can create a more resilient future for both ecosystems and communities worldwide.",1.6128851312690617,1.0000001656040618,7.453642447340963e-07,,
153.0,disc,2.0,"I appreciate your agreement and emphasis on the importance of unified action against climate change. It’s encouraging to see a shared understanding that addressing this crisis will not only protect our ecosystems but also empower vulnerable communities who are disproportionately affected. Together, we can advocate for policies and practices that prioritize sustainability and resilience, ensuring that no one is left behind in our efforts to combat this urgent challenge.",1.7303097661572306,1.0000000026766345,1.480513411498646e-08,,,2.0,"Thank you for your thoughtful response; it's heartening to see such a strong commitment to addressing the inequalities exacerbated by climate change. Advocating for inclusive policies is vital, as it ensures that the voices of those most affected are heard and considered in decision-making processes. By fostering collaboration and prioritizing sustainability, we can build a more equitable future where everyone has the opportunity to thrive despite the challenges posed by climate change.",1.4295566487912321,1.0000000011157872,6.415776557208133e-09,,
153.0,disc,2.0,"You're absolutely right; incorporating the voices of those most impacted by climate change into decision-making is essential for creating equitable solutions. It's crucial that we not only focus on sustainable practices but also on empowering communities to participate in shaping a resilient future. By fostering inclusivity in our climate strategies, we can ensure that our efforts not only combat the crisis but also uplift and support those who are often marginalized in these discussions.",2.2509641282053376,1.0000003972551288,1.7007821272503393e-06,,,2.0,"I couldn't agree more—empowering communities and fostering inclusivity are essential components of effective climate strategies. When marginalized voices are integrated into the decision-making process, we can develop solutions that truly reflect the needs and strengths of all communities. This holistic approach not only enhances our ability to combat climate change but also fosters social justice and resilience, ensuring a brighter future for everyone.",1.6786834892426603,1.0000000014348531,8.160188373283134e-09,,
153.0,disc,2.0,"Absolutely! Integrating marginalized voices not only enriches our climate strategies but also creates a more just and equitable framework for addressing the challenges we face. By recognizing and leveraging the strengths of all communities, we can craft solutions that are not only effective in mitigating climate change but also promote social cohesion and resilience. This holistic perspective is vital for ensuring that our collective efforts lead to a sustainable and inclusive future for everyone.",1.6277911759470356,1.000031557087201,0.00010058839357279506,,,2.0,"I completely agree that a holistic perspective is key to developing effective climate strategies that foster both environmental sustainability and social equity. By recognizing the strengths and insights of all communities, we not only enhance the efficacy of our solutions but also build stronger, more cohesive societies. It is inspiring to think that by working together and embracing inclusivity, we can pave the way for a future that uplifts everyone while addressing the urgent challenges of climate change.",1.8568644237775693,1.0000000174566146,8.83734204424375e-08,,
153.0,disc,2.0,"Your insight beautifully captures the interconnectedness of environmental sustainability and social equity, which is fundamental in our fight against climate change. When we embrace inclusivity and collaborate with diverse communities, we can harness their unique perspectives and experiences to create more impactful solutions. It is indeed inspiring to envision a future where our collective efforts lead to not only a healthier planet but also a just society that uplifts every individual.",2.0295185582910653,1.0000005100814373,2.15190475582242e-06,,,2.0,"Thank you for your kind words; it truly reinforces the importance of inclusivity in our climate action efforts. By valuing diverse perspectives, we can develop innovative solutions that address both environmental and social challenges, leading to a future that is equitable and sustainable. Together, we have the opportunity to create a world where our collective commitment not only restores the health of our planet but also fosters justice and well-being for every individual.",3.979706170253266e+52,1.0000000135970502,6.977291673316783e-08,,
