ID,TEXT_TYPE,INIT_OP_A,TEXT_A,PPL_A,PROBE_INT_A,H_INT_A,PROBE_EXT_A,H_EXT_A,INIT_OP_B,TEXT_B,PPL_B,PROBE_INT_B,H_INT_B,PROBE_EXT_B,H_EXT_B
165.0,tot,2.0,"Climate change is one of the most pressing issues of our time, posing serious threats to ecosystems, economies, and human health. The scientific consensus is clear: human activities, particularly the burning of fossil fuels, are driving unprecedented changes in our climate. These changes result in extreme weather events, rising sea levels, and altered agricultural patterns, impacting food security and biodiversity. 

Addressing climate change requires urgent collective action, including reducing greenhouse gas emissions, transitioning to renewable energy, and promoting sustainable practices. Furthermore, it necessitates global cooperation and equitable solutions to support vulnerable communities. It’s crucial for individuals, businesses, and governments to work together to foster a sustainable future for generations to come.",1.6054095650030158,1.0000004501516742,1.913141865004032e-06,,,2.0,"Climate change is one of the most pressing issues of our time, posing serious threats to ecosystems, economies, and human health. The scientific consensus is clear: human activities, particularly the burning of fossil fuels, are driving unprecedented changes in our climate. These changes result in extreme weather events, rising sea levels, and altered agricultural patterns, impacting food security and biodiversity. 

Addressing climate change requires urgent collective action, including reducing greenhouse gas emissions, transitioning to renewable energy, and promoting sustainable practices. Furthermore, it necessitates global cooperation and equitable solutions to support vulnerable communities most affected by climate impacts. The longer we delay, the more severe the consequences will be, making it imperative for individuals, governments, and organizations to work together towards a sustainable future.",1.6050652014416718,1.0000000039019983,2.1215233970286425e-08,,
165.0,disc,2.0,"Climate change is a critical challenge that we cannot afford to ignore any longer, as its consequences are already being felt worldwide. We must recognize that the overwhelming scientific evidence points to human activities being the primary driver of these changes, particularly through greenhouse gas emissions from fossil fuels. To effectively combat this urgent issue, we need to engage in thoughtful dialogue about actionable solutions, including a transition to renewable energy and sustainable practices that prioritize the wellbeing of both people and our planet.",2.1523026845063264,1.0000000418747739,2.0282964397353065e-07,,,2.0,"I completely agree with your emphasis on the critical nature of climate change and the undeniable role of human activities in driving it. Engaging in thoughtful dialogue is essential to inspire collective action, and we must prioritize not only the transition to renewable energy but also equitable solutions that support vulnerable communities. It is imperative that we act urgently and decisively, as the consequences of inaction will continue to escalate, affecting ecosystems and human health globally.",1.823295664794031,1.0000000197794794,9.951508647770604e-08,,
165.0,disc,2.0,"Thank you for your insightful response, and I wholeheartedly agree that prioritizing equitable solutions is essential to ensure that no community is left behind in the transition to a sustainable future. Addressing climate change requires not only technological advancements but also a strong commitment to social justice, ensuring that vulnerable populations receive the support they need to adapt and thrive. By uniting our efforts and fostering collaboration across sectors, we can create impactful change that protects both the planet and the well-being of all its inhabitants.",1.718743876468082,1.0000000224111856,1.120559281812098e-07,,,2.0,"Thank you for your thoughtful reply; I appreciate your focus on the intersection of climate action and social justice. It’s vital that our efforts include not just technological innovations, but also policies that empower marginalized communities and promote resilience in the face of climate impacts. By fostering collaboration across sectors, we can build a more inclusive approach to sustainability that truly safeguards both our planet and the diverse populations that call it home.",1.7299757501325403,1.0000000326099834,1.5999225622883185e-07,,
165.0,disc,2.0,"I completely agree that empowering marginalized communities is central to effective climate action, as they are often the most disproportionately affected by climate impacts. Implementing policies that promote resilience and inclusivity will not only strengthen our overall response to climate change but also ensure that diverse voices are represented in decision-making processes. Together, by integrating social equity into our sustainability initiatives, we can create a more just and resilient future that honors both the planet and its people.",1.7643137630703172,1.0000007421632742,3.0614218066727853e-06,,,2.0,"I truly appreciate your insights and the emphasis on integrating social equity into our climate initiatives. Inclusive decision-making is crucial; it ensures that the voices of those most affected by climate change are heard and prioritized in crafting solutions. By fostering resilience through equitable policies, we can not only address immediate climate challenges but also build a sustainable future that benefits all communities and preserves the planet for generations to come.",1.932721001436048,1.0000000782286265,3.667394973308606e-07,,
165.0,disc,2.0,"Thank you for your thoughtful comments; I couldn't agree more on the importance of inclusive decision-making in crafting effective climate solutions. By actively involving those most impacted by climate change, we can develop policies that truly reflect their needs and aspirations, fostering a sense of agency and ownership in the transition to sustainability. Ultimately, this collaborative approach not only helps us address current challenges but also lays the groundwork for a more equitable and resilient future for all communities and the environment.",1.622752740430661,1.000000240951254,1.061746326759374e-06,,,2.0,"Thank you for your thoughtful response; I wholeheartedly agree that fostering agency and ownership among affected communities is vital for crafting truly effective climate solutions. When those most impacted are actively involved in the decision-making process, we can create targeted and meaningful policies that resonate with their needs and aspirations. This collaborative approach not only enhances our ability to tackle immediate climate challenges but also fosters long-term resilience and equity, ensuring a sustainable future for all communities and the environment.",1.863446680978881,1.0000000020864659,1.1670692980651652e-08,,
165.0,disc,2.0,"I appreciate your agreement and recognition of the importance of fostering agency within affected communities; it truly is a key element in developing effective and sustainable climate policies. By incorporating the perspectives and experiences of those on the frontlines of climate change, we can craft solutions that are not only relevant but also culturally and contextually appropriate. This collective approach will empower communities, strengthen resilience, and ultimately contribute to a healthier planet that benefits everyone now and in the future.",2.0140982182834297,1.0000007421641577,3.0614252298236205e-06,,,2.0,"Thank you for highlighting the significance of incorporating local perspectives and experiences in our climate policy development; this is crucial for crafting solutions that resonate with the unique needs of each community. When we adopt a collective approach, we not only empower those on the frontlines but also ensure that our strategies are both culturally relevant and effective in addressing the challenges they face. Ultimately, by working together in this inclusive manner, we can create a healthier planet that promotes equity and sustainability for all, both now and for future generations.",4.259057027312754e+43,1.0000000018400417,1.0360246266582989e-08,,
