ID,TEXT_TYPE,INIT_OP_A,TEXT_A,PPL_A,PROBE_INT_A,H_INT_A,PROBE_EXT_A,H_EXT_A,INIT_OP_B,TEXT_B,PPL_B,PROBE_INT_B,H_INT_B,PROBE_EXT_B,H_EXT_B
168.0,tot,2.0,"Climate change is one of the most pressing issues of our time, posing serious threats to ecosystems, economies, and human health. The scientific consensus is clear: human activities, particularly the burning of fossil fuels, are driving unprecedented changes in our climate. These changes result in extreme weather events, rising sea levels, and altered agricultural patterns, impacting food security and biodiversity. 

Addressing climate change requires urgent collective action, including reducing greenhouse gas emissions, transitioning to renewable energy, and promoting sustainable practices. Furthermore, it necessitates global cooperation and equitable solutions to support vulnerable communities most affected by climate impacts. The longer we delay, the more severe the consequences will be, making it imperative for individuals, governments, and organizations to work together towards a sustainable future.",1.598165066646678,1.0000000326166019,1.6002307214116646e-07,,,2.0,"Climate change is one of the most pressing issues of our time, posing serious threats to ecosystems, economies, and human health. The scientific consensus is clear: human activities, particularly the burning of fossil fuels, are driving unprecedented changes in our climate. These changes result in extreme weather events, rising sea levels, and altered agricultural patterns, impacting food security and biodiversity. 

Addressing climate change requires urgent collective action, including reducing greenhouse gas emissions, transitioning to renewable energy, and promoting sustainable practices. Furthermore, it necessitates global cooperation and equitable solutions to support vulnerable communities most affected by climate impacts. The longer we delay, the more severe the consequences will be, making it imperative for individuals, governments, and organizations to work together towards a sustainable future.",1.5998279673947657,1.0000000136054663,6.972491563450762e-08,,
168.0,disc,2.0,"Climate change is not just an environmental issue; it is a multifaceted crisis that threatens our ecosystems, economies, and health. We need to address the profound impacts of rising temperatures and extreme weather events, which are already causing significant disruptions worldwide. It's vital that we unite in our efforts to reduce greenhouse gas emissions and transition to a sustainable energy future that prioritizes resilience and equity for all communities.",9.858271706650976e+55,1.0000000001938947,1.1997237372049232e-09,,,2.0,"I completely agree with your statement; climate change indeed transcends environmental concerns and is deeply intertwined with social, economic, and health challenges. It is essential that we recognize the urgency of the situation and take coordinated action to reduce greenhouse gas emissions while fostering a just transition to renewable energy sources. By prioritizing resilience and equity, we can help ensure that vulnerable communities are supported in adapting to the changes already underway and in building a sustainable future for everyone.",1.8611054539851961,1.0000000254023471,1.2624668441336483e-07,,
168.0,disc,2.0,"I'm glad to hear that you share my perspective on the interconnectedness of climate change with social and economic issues. Prioritizing a just transition not only addresses the immediate impacts of climate change but also empowers marginalized communities that often bear the brunt of environmental degradation. Together, we must advocate for policies that promote equitable access to renewable energy, ensuring that everyone has the opportunity to thrive in a sustainable future.",1.524508970263892,1.00000000441579,2.3872172314065337e-08,,,2.0,"Absolutely, empowering marginalized communities is crucial in addressing both the impacts of climate change and the systemic inequalities that exist within our society. Advocacy for policies that promote equitable access to renewable energy is not only a matter of environmental justice but also essential for building resilient communities capable of adapting to ongoing climate challenges. Together, we can amplify our voices and create a movement that ensures a sustainable future is accessible to all, fostering both environmental stewardship and social equity.",1.7946757995954934,1.000000069034822,3.258376230000712e-07,,
168.0,disc,2.0,"You've articulated the heart of the matter beautifully; the intersection of environmental justice and social equity is fundamental to our collective action against climate change. By amplifying our voices and building a diverse movement, we can ensure that sustainable policies are not only implemented but also embraced by everyone, particularly those most affected by climate impacts. It’s essential that we combine our efforts to advocate for systemic change that uplifts communities, fosters resilience, and creates a truly sustainable future for generations to come.",3.2509632000296224e+46,1.0000000418696067,2.0280590774249688e-07,,,2.0,"Thank you for your kind words; I truly believe that a diverse and united movement is key to driving systemic change in the face of climate challenges. By advocating for sustainable policies that consider the needs and voices of those most affected, we can create a more inclusive framework for action that benefits all communities. It’s our shared responsibility to not only promote resilience and sustainability but also to ensure that future generations inherit a healthier, more equitable planet.",1.8343817409650114,1.0000003972535993,1.700872760954598e-06,,
168.0,disc,2.0,"I wholeheartedly agree that a diverse and united movement is essential for enacting the systemic changes necessary to tackle climate change effectively. By prioritizing the needs and voices of the most affected communities, we can ensure that our actions are genuinely inclusive and equitable, fostering a sense of ownership and agency in the fight for a sustainable future. It is indeed our collective responsibility to safeguard the planet for future generations, ensuring they inherit not only a healthier environment but also a society rooted in justice and opportunity.",1.7390663357423801,1.0000002126338121,9.436188047236653e-07,,,2.0,"Your commitment to inclusivity and equity resonates deeply with the core of our mission to combat climate change. Empowering affected communities to take ownership in this fight is vital, as their insights and experiences are invaluable in shaping effective solutions. By working collectively, we can cultivate a sustainable future that not only protects the environment but also promotes social justice and opportunity for generations to come.",1.9890010860583518,1.0000000690460231,3.2601633871146946e-07,,
168.0,disc,2.0,"I appreciate your recognition of the importance of inclusivity and equity in our climate mission; it's truly the backbone of effective and sustainable solutions. Empowering those directly affected by climate change not only enhances our understanding of the challenges they face but also enriches our efforts to develop targeted and impactful interventions. Together, we can drive meaningful change that achieves both environmental protection and social justice, ensuring that future generations inherit a world where both people and the planet can thrive.",3.397146923281708e+48,1.000005483839648,1.9879024041480724e-05,,,2.0,"Thank you for emphasizing the significance of empowerment in our approach to climate action; it truly is essential for crafting interventions that are both relevant and effective. By integrating the voices and experiences of those most affected, we can tailor our efforts to produce genuine and lasting impacts that benefit both the environment and social equity. Together, through collaboration and shared purpose, we can pave the way for a future where humanity and nature coexist harmoniously, ensuring a thriving world for generations to come.",9.262548231428534e+46,1.0000000253959835,1.262050251538696e-07,,
