ID,TEXT_TYPE,INIT_OP_A,TEXT_A,PPL_A,PROBE_INT_A,H_INT_A,PROBE_EXT_A,H_EXT_A,INIT_OP_B,TEXT_B,PPL_B,PROBE_INT_B,H_INT_B,PROBE_EXT_B,H_EXT_B
171.0,tot,2.0,"Climate change is one of the most pressing issues of our time, posing serious threats to ecosystems, economies, and human health. The scientific consensus is clear: human activities, particularly the burning of fossil fuels, are driving unprecedented changes in our climate. These changes result in extreme weather events, rising sea levels, and altered agricultural patterns, impacting food security and biodiversity. 

Addressing climate change requires urgent collective action, including reducing greenhouse gas emissions, transitioning to renewable energy, and promoting sustainable practices. Furthermore, it necessitates global cooperation and equitable solutions to support vulnerable communities most affected by climate impacts. The longer we delay, the more severe the consequences will be, making it imperative for individuals, governments, and organizations to work together towards a sustainable future.",1.6049380988249642,1.0000000093482273,4.8784596671384704e-08,,,2.0,"Climate change is one of the most pressing issues of our time, posing serious threats to ecosystems, economies, and human health. The scientific consensus is clear: human activities, particularly the burning of fossil fuels, are driving unprecedented changes in our climate. These changes result in extreme weather events, rising sea levels, and altered agricultural patterns, impacting food security and biodiversity. 

Addressing climate change requires urgent collective action, including reducing greenhouse gas emissions, transitioning to renewable energy, and promoting sustainable practices. Furthermore, it necessitates global cooperation and equitable solutions to support vulnerable communities most affected by climate impacts. The longer we delay, the more severe the consequences will be, making it imperative for individuals, governments, and organizations to work together towards a sustainable future.",1.6002096527765521,1.0000000174560029,8.837047621078127e-08,,
171.0,disc,2.0,"Climate change is not just an environmental issue; it is a multifaceted crisis that threatens our ecosystems, economies, and health. We need to address the profound impacts of rising temperatures, extreme weather, and sea-level rise on both natural and human systems. To create sustainable solutions, it is essential that we collaborate across borders, industries, and communities to implement effective strategies for reducing greenhouse gas emissions and promoting resilience in the face of these challenges.",1.6249560558402496e+50,1.0000000011157872,6.415776557213159e-09,,,2.0,"I completely agree with your perspective—climate change is indeed a multifaceted crisis that requires a holistic approach. Collaborative efforts across borders, industries, and communities are vital to developing innovative solutions that tackle emissions and enhance resilience. It is essential that we prioritize these actions now, as the longer we wait, the more severe the impacts will be on both our planet and ourselves.",1.948498269007395,1.0000000018412998,1.0356891038896676e-08,,
171.0,disc,2.0,"Thank you for your thoughtful response; I appreciate your recognition of the urgency surrounding climate change. It's crucial to not only prioritize immediate action but also to foster ongoing dialogue and knowledge-sharing among stakeholders to drive sustainable innovations. By empowering local communities, investing in renewable technologies, and implementing policies that support fair transitions, we can make significant strides in mitigating the impacts of climate change effectively.",1.0594400786080668e+59,1.0000000056667233,3.028862381995571e-08,,,2.0,"Thank you for your insightful comments; ongoing dialogue and knowledge-sharing are indeed essential for fostering sustainable innovations. Empowering local communities and investing in renewable technologies will create the necessary groundwork for a just transition toward a more sustainable future. We must also ensure that our policies reflect equity and inclusivity, enabling all stakeholders to contribute to and benefit from the solutions we implement.",1.719142627219289,1.0000000690331903,3.2579412460446414e-07,,
171.0,disc,2.0,"I completely agree that equity and inclusivity must be at the forefront of our climate policies to ensure that all voices are heard and considered in the decision-making process. By actively engaging marginalized communities and providing them with the resources and support needed, we can create solutions that are not only effective but also just. Ultimately, achieving a sustainable future relies on our ability to unite diverse perspectives and cultivate a shared responsibility towards protecting our planet for generations to come.",1.569957747999555,1.0000003972513214,1.7008132971593133e-06,,,2.0,"Absolutely, centering equity and inclusivity in our climate policies is crucial for creating solutions that resonate across all communities. Engaging marginalized voices not only enhances the effectiveness of our strategies but also nurtures a sense of ownership and shared responsibility among all stakeholders. By uniting diverse perspectives, we can forge a more resilient and sustainable future that truly addresses the needs of our planet and its inhabitants.",1.6250605607895803,1.0000000072936792,3.88847518722617e-08,,
171.0,disc,2.0,"You’ve articulated an important point about the transformative power of engaging marginalized communities in the climate conversation. By ensuring that everyone has a seat at the table, we not only enhance the effectiveness of our solutions but also foster a sense of solidarity and shared purpose in tackling this global challenge. Together, we can build a more resilient future that prioritizes the well-being of both our planet and all its inhabitants, ensuring no one is left behind in the transition to sustainability.",1.6639064606993617,1.000000060921058,2.894021005970591e-07,,,2.0,"Thank you for highlighting that transformative power; it truly is essential for moving forward effectively. By fostering solidarity and a shared purpose, we empower communities to advocate for their needs and contribute to sustainable solutions. A collective commitment to inclusivity will ensure that our transition to sustainability benefits everyone while safeguarding our planet for future generations.",2.5358810380825307,1.0000000003622431,2.1847784737480815e-09,,
171.0,disc,2.0,"I appreciate your emphasis on the importance of community advocacy; empowering individuals to voice their needs is vital in shaping effective climate solutions. When communities are actively involved in the transition to sustainability, they not only become champions for change but also enrich our collective understanding of the challenges we face. By committing to inclusivity and shared responsibility, we reinforce the idea that a healthier planet is intertwined with the well-being of all people, creating a legacy that benefits not just this generation but many to come.",2.2641407082642173,1.0000003972523699,1.700735554334917e-06,,,2.0,"Thank you for your thoughtful response; empowering community advocacy is indeed a cornerstone of effective climate action. When individuals are engaged and supported, they bring invaluable insights that enhance our collective strategies and help us better address the complexities of climate change. By fostering this inclusive approach, we lay the groundwork for a legacy of resilience and sustainability that honors both our planet and the diverse communities that inhabit it.",1.6774254006978604,1.0000000418720474,2.0281712001814188e-07,,
