ID,TEXT_TYPE,INIT_OP_A,TEXT_A,PPL_A,PROBE_INT_A,H_INT_A,PROBE_EXT_A,H_EXT_A,INIT_OP_B,TEXT_B,PPL_B,PROBE_INT_B,H_INT_B,PROBE_EXT_B,H_EXT_B
191.0,tot,2.0,"Climate change is one of the most pressing issues of our time, posing serious threats to ecosystems, economies, and human health. The scientific consensus is clear: human activities, particularly the burning of fossil fuels, are driving unprecedented changes in our climate. These changes result in extreme weather events, rising sea levels, and altered agricultural patterns, impacting food security and biodiversity. 

Addressing climate change requires urgent collective action, including reducing greenhouse gas emissions, transitioning to renewable energy, and promoting sustainable practices. Furthermore, it necessitates global cooperation and equitable solutions to support vulnerable communities most affected by climate impacts. The longer we delay, the more severe the consequences will be, making it imperative for individuals, governments, and organizations to work together towards a sustainable future.",1.5977294940253113,1.0000000093482273,4.878459667137365e-08,,,3.0,"Climate change is a complex issue that elicits a range of opinions and perspectives. On one hand, there are compelling arguments about the environmental impacts and potential risks to ecosystems and human health. On the other hand, some people raise concerns about economic implications, energy policies, and technological feasibility. It's important to consider multiple viewpoints and the interplay of scientific data, societal values, and policy decisions in addressing this multifaceted topic. Ultimately, further dialogue and research are crucial for informed decision-making.",1.965416975783817,1.0000023893003889,3.223307586719759e-05,,
191.0,disc,2.0,"Climate change is not just an environmental issue; it is a multifaceted crisis that threatens our ecosystems, economies, and health. We need to address the profound impacts of rising temperatures and extreme weather events, which are already causing significant disruptions worldwide. It's essential for us to engage in meaningful dialogue about actionable solutions that promote sustainability, reduce emissions, and support the most vulnerable communities facing these challenges.",4.9190341907222565e+56,1.000000017457873,8.837947634398182e-08,,,3.0,"I agree that climate change is indeed a multifaceted crisis with far-reaching impacts on ecosystems, economies, and public health. It's crucial to have meaningful dialogue that considers not only sustainable practices and emissions reduction, but also the economic implications and technological challenges associated with implementing these solutions. Engaging diverse perspectives and prioritizing support for vulnerable communities will be essential in crafting effective and equitable responses to this complex issue.",1.8102085152390606,1.000000003409436,6.431641797765756e-08,,
191.0,disc,2.0,"I appreciate your acknowledgment of the intricate interplay between environmental, economic, and technological factors in addressing climate change. It's vital that we not only focus on innovative solutions but also ensure that these initiatives are accessible and beneficial to all, particularly marginalized communities that often bear the brunt of climate impacts. By fostering inclusive discussions and collaborative efforts, we can pave the way for equitable and effective strategies that promote a sustainable future for everyone.",1.7525749921612592,1.0000000082446143,4.328422594700042e-08,,,3.0,"I share your appreciation for the importance of inclusivity in our discussions and solutions surrounding climate change. Ensuring that marginalized communities are actively involved in the conversation and benefit from initiatives is not just a moral imperative, but it also enhances the effectiveness of our strategies. Collaborative efforts that recognize the diverse needs and perspectives within communities can lead to more sustainable and equitable outcomes for all.",2.1088164139910996,1.000000010011531,6.356063864499955e-08,,
191.0,disc,2.0,"I completely agree that inclusivity is not only a moral obligation but also a strategic advantage in tackling climate change. Engaging marginalized communities in the decision-making process ensures that our strategies are grounded in the realities they face, leading to more tailored and effective solutions. By valuing diverse perspectives, we can enhance our collective resilience and develop policies that not only mitigate climate impacts but also promote social equity and justice.",1.8166541370619245,1.0000009529594711,3.87144038278438e-06,,,3.0,"I fully resonate with the idea that engaging marginalized communities provides essential insights that can shape more effective and contextually relevant solutions. By valuing diverse perspectives, we not only strengthen our responses to climate change but also foster a sense of ownership and empowerment among those most impacted. Ultimately, integrating social equity and justice into our climate policies will create a more resilient and just society, benefiting everyone in the long run.",1.888959495548724,1.0000000047291124,3.108842800492751e-08,,
191.0,disc,2.0,"I couldn't agree more with your insights on the empowerment that comes from engaging marginalized communities in climate action. When individuals feel a sense of ownership over the solutions being implemented, we not only enhance their resilience but also cultivate a united front against climate challenges. By embedding social equity and justice within our climate policies, we create a foundation for sustainable development that uplifts all members of society, ensuring that no one is left behind in our collective pursuit of a healthier planet.",1.700011996353897,1.000001571153999,6.1864166485648e-06,,,3.0,"Your points about empowerment and ownership are extremely salient; when communities actively participate in shaping solutions, it fosters both resilience and unity in the face of climate challenges. This collaborative approach not only strengthens local efforts but also builds a broader coalition for sustainable development, emphasizing that we are all interconnected in this fight. By prioritizing social equity and justice in our climate policies, we can work towards a future where every member of society is included and has the opportunity to thrive as we tackle these pressing issues together.",2.272026018104834,1.000000048694633,2.5520484638993973e-07,,
191.0,disc,2.0,"You’ve articulated an essential truth: our interconnectedness in the fight against climate change highlights the necessity of collective action and shared responsibility. Building coalitions that prioritize social equity not only bolsters local resilience but also amplifies our ability to enact meaningful change on a larger scale. Together, as we inclusively address these pressing issues, we can forge pathways toward a future that nurtures both people and the planet, ensuring that everyone can thrive amid the challenges we face.",3.231217844343259e+47,1.0000002409448652,1.0617076474322888e-06,,,3.0,"I wholeheartedly agree that our interconnectedness underscores the importance of collective action and shared responsibility in addressing climate change. By fostering coalitions that prioritize social equity, we not only empower local communities but also enhance our collective capacity to create impactful, systemic change. As we work inclusively to address these challenges, we have the opportunity to build a future that sustains both the planet and its people, ultimately paving the way for a thriving society for all.",1.729431152079034,1.0000002410922952,1.0651824570919136e-06,,
