ID,TEXT_TYPE,INIT_OP_A,TEXT_A,PPL_A,PROBE_INT_A,H_INT_A,PROBE_EXT_A,H_EXT_A,INIT_OP_B,TEXT_B,PPL_B,PROBE_INT_B,H_INT_B,PROBE_EXT_B,H_EXT_B
202.0,tot,2.0,"Climate change is one of the most pressing issues of our time, posing serious threats to ecosystems, economies, and human health. The scientific consensus is clear: human activities, particularly the burning of fossil fuels, are driving unprecedented changes in our climate. These changes result in extreme weather events, rising sea levels, and altered agricultural patterns, impacting food security and biodiversity. 

Addressing climate change requires urgent collective action, including reducing greenhouse gas emissions, transitioning to renewable energy, and promoting sustainable practices. Furthermore, it necessitates global cooperation and equitable solutions to support vulnerable communities most affected by climate impacts. The longer we delay, the more severe the consequences will be, making it imperative for individuals, governments, and organizations to work together towards a sustainable future.",1.596928564306299,1.0000000039019983,2.1215233970286425e-08,,,4.0,"I believe that while environmental issues are important, the emphasis on climate change often overshadows other pressing concerns that deserve equal attention. There are natural climate fluctuations that have occurred throughout Earth's history, and many argue that humanity's ability to adapt is more crucial than trying to control a complex system that's influenced by numerous factors. Additionally, the policies proposed to combat climate change can sometimes lead to economic challenges and may not always benefit the average person. I think we should focus on a balanced approach that considers a wider range of environmental and socioeconomic issues rather than prioritizing climate change above all else.",2.16183207152418,3.920820116672908,0.27782930686387075,,
202.0,disc,2.0,"Climate change is not just an environmental issue; it is a multifaceted crisis that threatens our ecosystems, economies, and health. We need to address the profound impacts of rising temperatures, extreme weather, and sea-level rise on both natural and human systems. To create sustainable solutions, it is essential that we collaborate across borders, industries, and communities to implement effective strategies for reducing greenhouse gas emissions and promoting resilience in the face of these challenges.",1.6294636830687468e+50,1.0000001146726056,5.416256201096259e-07,,,4.0,"While I acknowledge the importance of addressing environmental issues, I believe we should not let climate change dominate the discussion at the expense of other significant concerns. Yes, extreme weather and environmental changes can have serious ramifications, but we also need to recognize humanity's capacity to adapt to natural fluctuations and the potential economic challenges posed by some proposed climate policies. A more balanced approach that considers a broader range of socioeconomic and environmental issues may lead to more effective solutions for everyone.",2.3061003501934345,2.8929094299677978,0.9930395155427166,,
202.0,disc,2.0,"I appreciate your perspective and agree that a holistic approach is essential; however, the urgency of climate change cannot be understated, as its impacts are increasingly intertwining with various socioeconomic issues. Failing to prioritize climate action may exacerbate the economic challenges we already face, particularly for vulnerable communities who are often the first to suffer from extreme weather events. By integrating climate considerations into our broader discussions, we can develop innovative solutions that benefit both the environment and our economies, creating a sustainable future for all.",1.9612167036405073,1.0000000619136593,4.170312379303442e-07,,,4.0,"I appreciate your agreement on the importance of a holistic approach, but I still contend that the narrative around climate change sometimes overlooks other crucial issues that also require urgent attention. While it's true that climate impacts can exacerbate challenges for vulnerable communities, it's essential to critically evaluate whether the policies aimed at combating climate change truly serve those communities or inadvertently add to their burdens. By fostering discussions that consider a diverse array of environmental and economic factors, we can create solutions that are equitable and sustainable without overemphasizing climate change at the expense of other pressing concerns.",2.197742519540322,3.486403899910252,0.7386873961599246,,
202.0,disc,2.0,"You're absolutely right that we must critically assess the effectiveness of climate policies and ensure they genuinely support vulnerable communities rather than create additional burdens. It is crucial that our climate solutions are designed with input from those directly impacted, ensuring that equity remains at the forefront of our efforts. By fostering inclusive discussions that consider diverse environmental and economic factors, we can develop comprehensive policies that address not only climate change but also the interconnected challenges faced by all communities.",1.9924796569411,1.0000004502900448,1.9166255460119242e-06,,,4.0,"I agree that involving those directly impacted by climate policies is essential for ensuring that our approaches are truly beneficial and equitable. However, it's important to remember that the focus on climate solutions shouldn't overshadow the need to address other pressing social and economic challenges that may be equally critical to communities. By maintaining a broader perspective, we can foster discussions and policies that balance both environmental and socioeconomic needs, ultimately supporting a more resilient future for everyone.",2.534485256942376,3.143653191302091,0.44400039368814787,,
202.0,disc,2.0,"I completely agree that a balanced perspective is vital, as we must address not only climate issues but also the broader social and economic challenges that communities face. By integrating climate solutions with other pressing concerns, we can empower communities to thrive in a more resilient and sustainable manner. The key is to ensure that our policies are intersectional, recognizing that addressing climate change can also create opportunities for economic growth and improved social equity, benefiting all aspects of society.",4.501716033396133e+49,1.0000001290102432,5.894781607416687e-07,,,4.0,"I appreciate your perspective on the potential for climate solutions to create economic opportunities and improve social equity, as these are indeed important considerations. However, we must also be cautious about assuming that all climate-related policies will inherently lead to positive outcomes, as some may have unintended consequences that affect marginalized communities adversely. By actively seeking a dialogue that equally prioritizes a variety of social, economic, and environmental issues, we can better ensure that our collective efforts lead to meaningful and inclusive benefits for all.",3.747278754126737e+45,3.325718541647971,0.8041873254551835,,
202.0,disc,2.0,"You raise an important point about the need to critically examine climate-related policies, as unintended consequences can indeed affect marginalized communities. It’s crucial that we engage in continuous dialogue and collaboration to assess the impacts of our actions, ensuring that our climate solutions are designed with nuance and sensitivity to the diverse needs of all stakeholders. By prioritizing inclusivity and being open to learning from different experiences, we can shape policies that genuinely promote social equity while effectively addressing climate change and its far-reaching effects.",3.931642896343791e+45,1.000004840133402,1.77090966054733e-05,,,4.0,"I completely agree that continuous dialogue and collaboration are essential to create climate policies that are both effective and sensitive to the needs of marginalized communities. Recognizing the diversity of experiences and challenges faced by different groups is crucial in designing solutions that truly benefit everyone. However, we should also remain mindful that while addressing climate change is important, it should not come at the expense of other equally pressing issues that affect society's overall well-being and resilience.",2.1806637932738098,3.035805963378063,0.1721932922935125,,
