ID,TEXT_TYPE,INIT_OP_A,TEXT_A,PPL_A,PROBE_INT_A,H_INT_A,PROBE_EXT_A,H_EXT_A,INIT_OP_B,TEXT_B,PPL_B,PROBE_INT_B,H_INT_B,PROBE_EXT_B,H_EXT_B
219.0,tot,2.0,"Climate change is one of the most pressing issues of our time, posing serious threats to ecosystems, economies, and human health. The scientific consensus is clear: human activities, particularly the burning of fossil fuels, are driving unprecedented changes in our climate. These changes result in extreme weather events, rising sea levels, and altered agricultural patterns, impacting food security and biodiversity. 

Addressing climate change requires urgent collective action, including reducing greenhouse gas emissions, transitioning to renewable energy, and promoting sustainable practices. Furthermore, it necessitates global cooperation and equitable solutions to support vulnerable communities most affected by climate impacts. The longer we delay, the more severe the consequences will be, making it imperative for individuals, governments, and organizations to work together towards a sustainable future.",1.6049788963683442,1.0000000105929292,5.494916123301115e-08,,,4.0,"I believe that while environmental issues are important, the emphasis on climate change often overshadows other pressing concerns that deserve equal attention. There are natural climate fluctuations that have occurred throughout Earth's history, and many argue that humanity's ability to adapt is significant. Rather than focusing solely on climate change, we should prioritize economic development, technological innovation, and improving living standards globally, which can also contribute to better environmental stewardship. Addressing immediate human needs can lead to more sustainable long-term solutions without the alarmism often tied to climate narratives.",2.167991490516705,3.8424233693288863,0.41705936722667863,,
219.0,disc,2.0,"Climate change is not just an environmental issue; it is a multifaceted crisis that threatens our ecosystems, economies, and health. We need to address the profound impacts of rising temperatures, extreme weather, and sea-level rise on both natural and human systems. To create sustainable solutions, it is essential that we collaborate across borders, industries, and communities to implement effective strategies for reducing greenhouse gas emissions and promoting resilience in the face of these challenges.",1.6252285224721441e+50,1.0000000136358491,7.072858977866453e-08,,,4.0,"While I acknowledge the importance of addressing various crises, I believe that the focus on climate change often overshadows other pressing global issues that deserve equal attention, such as economic development and poverty alleviation. Yes, extreme weather and environmental concerns are valid, but humanity has historically demonstrated resilience and adaptability, often thriving despite natural climate fluctuations. Instead of centralizing our efforts solely on emissions reductions, we should prioritize improving living standards and fostering technological innovation, which can lead to more sustainable solutions for both people and the planet.",7.180428048507525e+42,3.883091011051631,0.3384644107762291,,
219.0,disc,2.0,"I completely understand the importance of economic development and poverty alleviation, as these issues are undeniably interconnected with climate change. However, we cannot overlook that climate change exacerbates existing inequalities and creates new challenges, particularly for the most vulnerable populations who are least equipped to adapt. By addressing climate change through emissions reductions and sustainable practices, we not only protect our planet but also create opportunities for innovation and economic growth that can uplift communities and improve living standards worldwide.",1.5060691082666484,1.0000003973166862,1.7022688336104826e-06,,,4.0,"I appreciate your perspective on the connections between climate change and social inequities; however, I believe that addressing immediate human needs should take precedence in our discussions. While it's true that climate change can create challenges, the emphasis should be on fostering economic development and technological advancements that uplift vulnerable populations without being hindered by alarmist narratives. By focusing on practical solutions that improve living standards, we can create a foundation for more effective environmental stewardship that benefits everyone in the long run.",1.8719064948747128,3.3112535815441024,0.9346933876322802,,
219.0,disc,2.0,"I agree that addressing immediate human needs is crucial and that improving living standards should be a priority; however, we must recognize that neglecting climate change can undermine these very advancements. Practical solutions that promote economic development and technological innovation must also consider environmental sustainability to ensure that progress does not come at the cost of future generations. By integrating climate action with efforts to uplift vulnerable populations, we can create a holistic approach that supports both immediate human needs and long-term planetary health, ultimately benefiting everyone.",1.5596966015433602,1.0000008411653443,3.4472171309744105e-06,,,4.0,"I understand your point about the need for a holistic approach, but I believe that the urgency surrounding climate action often diverts attention and resources from pressing social issues that can yield immediate benefits. If we focus too heavily on integrating climate action without addressing economic growth and human development first, we risk stifling innovation and progress that can actually help communities adapt and thrive. It's essential to strike a balance where our strategies prioritize uplifting people and improving living standards, which, in turn, can lay the groundwork for more sustainable practices in the future without being constrained by climate alarmism.",5.756727454186273e+38,3.5483183292537515,0.731937891758514,,
219.0,disc,2.0,"I appreciate your concern about prioritizing immediate social issues, but it's essential to recognize that the urgency of climate action stems from the tangible impacts we are already witnessing on communities and ecosystems worldwide. By failing to address climate change now, we risk exacerbating social issues in the future, as rising temperatures and extreme weather will disrupt livelihoods and exacerbate inequality. Striking a balance is indeed important, and integrating climate action with economic growth and human development can lead to innovative solutions that not only uplift communities today but also safeguard their future from climate-related disruptions.",2.170026718877669,1.0000002730728594,1.1954696358354414e-06,,,4.0,"I see your point about the urgency of climate action, but I maintain that we must not lose sight of the need for immediate solutions that directly address the challenges people face today. Historical data shows that humanity has continuously adapted to natural climate fluctuations, suggesting that an overemphasis on climate-related threats can sometimes lead to paralysis in addressing more pressing economic and social issues. By focusing on robust economic development and technological progress, we can empower communities to build resilience and adapt to changes without being overly constrained by the climate narrative, ultimately fostering a healthier society and environment in the long run.",2.341397095131461,3.9050165755769948,0.3259231194102352,,
219.0,disc,2.0,"I understand your belief in humanity's resilience, but it's important to note that current climate change is occurring at an unprecedented rate, which could outpace our ability to adapt effectively. While economic development and technological progress are vital, they must incorporate sustainable practices that prevent further environmental degradation and ensure long-term resilience for communities. By taking proactive climate action alongside initiatives aimed at improving immediate living conditions, we can create a future where both people and the planet thrive, rather than risking the stability of both by prioritizing one over the other.",2.0209779401100825,1.000009043968078,3.169953805827742e-05,,,4.0,"I appreciate your concern regarding the pace of current climate change, but I still contend that immediate economic development and technological innovations can lay the groundwork for effective adaptation and resilience. Focusing predominantly on climate action without addressing the root causes of poverty and inequality can inadvertently neglect the very populations we aim to protect, potentially hindering their capacity to adapt. By prioritizing human development and sustainable practices together, we can create a more balanced approach that addresses pressing needs while also fostering a healthier environment for future generations, ensuring that we don’t sacrifice one for the sake of the other.",2.530073031813751,3.6988619825836677,0.6358660920152073,,
