ID,TEXT_TYPE,INIT_OP_A,TEXT_A,PPL_A,PROBE_INT_A,H_INT_A,PROBE_EXT_A,H_EXT_A,INIT_OP_B,TEXT_B,PPL_B,PROBE_INT_B,H_INT_B,PROBE_EXT_B,H_EXT_B
238.0,tot,2.0,"Climate change is one of the most pressing issues of our time, posing serious threats to ecosystems, economies, and human health. The scientific consensus is clear: human activities, particularly the burning of fossil fuels, are driving unprecedented changes in our climate. These changes result in extreme weather events, rising sea levels, and altered agricultural patterns, impacting food security and biodiversity. 

Addressing climate change requires urgent collective action, including reducing greenhouse gas emissions, transitioning to renewable energy, and promoting sustainable practices. Furthermore, it necessitates global cooperation and equitable solutions to support vulnerable communities most affected by climate impacts. The longer we delay, the more severe the consequences will be, making it imperative for individuals, governments, and organizations to work together towards a sustainable future.",1.6045380928115902,1.0000003972709675,1.700810525184243e-06,,,5.0,"I believe that the focus on climate change has been exaggerated and often distracts from more pressing and immediate issues facing humanity, such as poverty, healthcare, and education. Many proposed solutions, like drastic policy changes and economic upheaval, could harm economies and livelihoods without guaranteeing significant impact on climate. Instead of prioritizing climate alarmism, we should invest in innovation and technology that can address environmental issues without sacrificing progress and development. It's important to critically assess the data and consider the broader picture of human welfare.",5.936357491336512e+43,4.000191845060298,0.002053793295590353,,
238.0,disc,2.0,"Climate change is not just an environmental issue; it is a multifaceted crisis that threatens our ecosystems, economies, and health. We need to address the profound impacts of rising temperatures and extreme weather events, which are already causing significant disruptions worldwide. It's vital that we collaborate on innovative solutions, transition to renewable energy sources, and promote sustainable practices to mitigate the repercussions of this urgent challenge.",3.0102738458067885e+57,1.0000000537875853,2.5770621903851664e-07,,,5.0,"While I understand the concerns raised, I believe that focusing solely on climate change can divert our attention and resources from more immediate and pressing issues like poverty, healthcare, and education that directly affect people's lives. We should prioritize technological innovations that can address environmental issues without jeopardizing economic growth and human development. Collaborating on solutions is important, but they should not come at the expense of livelihoods or entail drastic changes that may not deliver the promised results.",4.3495879867874294e+49,4.000032998156756,0.0004264008784427422,,
238.0,disc,2.0,"I appreciate your perspective, and it’s true that poverty, healthcare, and education are critical issues that deserve attention. However, climate change exacerbates these problems by threatening food security, increasing health risks, and displacing communities, making it an urgent concern that cannot be sidelined. The pursuit of sustainable solutions can actually enhance economic growth and human development, as investing in renewable energy and green technologies creates jobs and fosters resilience, ultimately benefiting both the planet and people.",1.7155702462183793,1.0000000093853412,4.964051943901697e-08,,,5.0,"I recognize that climate change may impact aspects of poverty and health; however, the solutions being proposed often come with economic risks that could disproportionately harm vulnerable populations. It's crucial to consider how immediate investments in healthcare, education, and poverty alleviation could yield benefits that are both urgent and tangible without potentially derailing economies through costly transitions. While the concept of green technologies and renewable energy is appealing, we must ensure that these initiatives are implemented in ways that genuinely support growth and do not compromise essential services or jobs for those who rely on traditional industries.",3.22188357394747,4.000426445648225,0.0038165413499584226,,
238.0,disc,2.0,"You raise an important point about the potential economic risks associated with the transition to green technologies, and it’s essential to ensure that vulnerable populations are supported throughout this process. However, we must recognize that failing to act on climate change could lead to far greater economic and social costs in the long run, particularly as extreme weather events and environmental degradation increasingly disrupt livelihoods and public health. By implementing just transition strategies, we can make investments that not only address climate change but also create jobs in new industries, improve community resilience, and ensure that essential services continue to thrive for everyone.",4.644344637182742e+38,1.0000001290211324,5.894264815803941e-07,,,5.0,"While I appreciate the emphasis on supporting vulnerable populations, it’s important to critically evaluate if the predicted long-term costs of inaction truly outweigh the immediate impacts of a rushed transition to green technologies. Many of the proposed ""just transition"" strategies can still carry significant economic burdens, particularly for communities reliant on traditional energy sectors, which may lead to job losses rather than gains. Instead of rushing into potentially detrimental policies, a more balanced approach focusing on innovation and gradual improvements in technology could create sustainable solutions that benefit both the economy and the environment without risking livelihoods.",2.3482244202957276,3.9955495714612876,0.02162295484973163,,
238.0,disc,2.0,"It’s crucial to critically assess the pace and implementation of our transition to green technologies, and I agree that a careful approach is necessary to avoid unintended consequences for communities reliant on traditional energy sectors. However, the longer we delay meaningful action, the more severe the impacts of climate change will become, leading to increased instability and job losses not just in the energy sector, but across various industries due to extreme weather and resource scarcity. A balanced approach can indeed involve gradual improvements and innovation, but it must also include proactive measures that ensure we protect livelihoods during the transition, providing retraining and support for workers while fostering a sustainable economy that can thrive in a changing climate.",2.0012604509296255,1.0000070419077196,2.509659832108433e-05,,,5.0,"I understand the concern regarding the timing of our actions in relation to climate change, but we must approach the problem with a realistic view of the potential economic consequences of hasty decisions that could disrupt various sectors, including those providing jobs for many. Proactive measures and support for workers are certainly important, but if we focus too heavily on transitional policies based on climate alarmism, we risk undermining economic stability and progress in other critical areas such as education and healthcare. A more prudent strategy might involve investing in diverse sectors and promoting innovation that can naturally lead to better environmental practices without forcing drastic changes that could harm communities and their livelihoods.",1.6666081348327695e+35,3.999137671529006,0.010017587302526535,,
238.0,disc,2.0,"I appreciate your caution regarding the timing and potential economic impacts of our climate policies, and it's vital to strike a balance that considers both immediate and long-term realities. However, climate change is already affecting economic stability through increased natural disasters, reduced agricultural yields, and strained healthcare systems, which can disrupt livelihoods and directly impact education and health outcomes. Investing in diverse sectors is certainly valuable, but integrating sustainability into these investments can enhance resilience and create new opportunities; by fostering innovation in ways that prioritize both economic growth and environmental stewardship, we can ensure a healthier planet and sustainable communities for the future.",1.909738581839738e+75,1.0000032411856539,1.5993474409237e-05,,,5.0,"I agree that integrating sustainability into investments can enhance resilience and offer new opportunities; however, it's essential to ensure that these sustainability initiatives are grounded in realistic expectations and supported by sound economic fundamentals. The empirical evidence on the degree to which climate change is currently disrupting economies is mixed, and we must avoid overestimating its impacts, which can lead to misplaced priorities that detract from urgent social issues. A sustainable future should not prioritize environmental goals at the expense of economic realities; instead, we should seek practical solutions that foster growth across all sectors while carefully considering the broader implications of our policies on human welfare.",8.491289167698777e+36,3.9993149725879706,0.03698723624915279,,
