ID,TEXT_TYPE,INIT_OP_A,TEXT_A,PPL_A,PROBE_INT_A,H_INT_A,PROBE_EXT_A,H_EXT_A,INIT_OP_B,TEXT_B,PPL_B,PROBE_INT_B,H_INT_B,PROBE_EXT_B,H_EXT_B
242.0,tot,2.0,"Climate change is one of the most pressing issues of our time, posing serious threats to ecosystems, economies, and human health. The scientific consensus is clear: human activities, particularly the burning of fossil fuels, are driving unprecedented changes in our climate. These changes result in extreme weather events, rising sea levels, and altered agricultural patterns, impacting food security and biodiversity. 

Addressing climate change requires urgent collective action, including reducing greenhouse gas emissions, transitioning to renewable energy, and promoting sustainable practices. Furthermore, it necessitates global cooperation and equitable solutions to support vulnerable communities most affected by climate impacts. The longer we delay, the more severe the consequences will be, making it imperative for individuals, governments, and organizations to work together towards a sustainable future.",1.6081573732201149,1.0000000174560029,8.837047621078127e-08,,,5.0,"I believe that the focus on climate change has been exaggerated and often distracts from more immediate and pressing issues facing humanity, such as poverty, healthcare, and education. Many proposed solutions, like drastic emissions cuts or the shift to renewable energy, can have significant economic ramifications that might harm communities, particularly those that rely on fossil fuel industries. Additionally, I think that the Earth's climate has always been subject to natural changes, and history shows that we have adapted to these changes over time. Instead of prioritizing climate change, we should focus on practical solutions that improve overall quality of life for people today.",2.088586874731762,4.000229782880057,0.002170068194131765,,
242.0,disc,2.0,"Climate change is not just an environmental issue; it is a multifaceted crisis that threatens our ecosystems, economies, and health. We need to address the urgent need for collective action, focusing on reducing greenhouse gas emissions and transitioning to renewable energy sources. Let's also consider the importance of global cooperation to ensure that vulnerable communities receive the support they need to adapt to these changes and thrive in a sustainable future.",1.6128539826718615,1.0000000004785254,4.96101909573329e-09,,,5.0,"While it's true that climate change has various implications, I believe that the emphasis on it can sometimes overshadow other critical challenges like poverty, healthcare, and education that require immediate attention. Transitioning to renewable energy and reducing emissions can lead to significant economic disruption, particularly for communities dependent on fossil fuel industries—something we must consider carefully. Instead of prioritizing climate initiatives, our focus should be on practical, immediate solutions that enhance the quality of life for people today.",1.935052478639229,4.000202341932183,0.0019459232258798903,,
242.0,disc,2.0,"I completely understand your concerns about the importance of addressing immediate challenges like poverty, healthcare, and education; however, these issues are inherently linked to climate change. Climate impacts can exacerbate poverty, threaten healthcare systems, and disrupt education, making it essential to consider a holistic approach that integrates climate action with social equity. Moreover, a transition to renewable energy can create new economic opportunities and jobs, particularly if we prioritize support for communities historically reliant on fossil fuels, ensuring they are not left behind in this crucial transformation.",1.7859483595126338,1.0000003507872097,1.5168838879697355e-06,,,5.0,"While I appreciate the perspective that climate impacts can influence other social issues, I still contend that the immediate needs of people facing poverty and lack of access to healthcare should take precedence over climate initiatives. The economic opportunities touted with the transition to renewable energy can be overestimated and may not materialize for everyone; there’s a real risk that some communities could face job losses during the shift. Instead of focusing on an integrated approach centered on climate change, we should prioritize direct improvements to living standards and economic stability for those most in need.",2.521230017248318,4.000260906674932,0.002420136549199363,,
242.0,disc,2.0,"I respect your viewpoint that immediate needs must be prioritized, but it’s crucial to recognize that tackling climate change can lead to substantial long-term benefits for those living in poverty. Investing in renewable energy and sustainable practices can create job opportunities while also fostering resilience against the economic shocks that climate change can bring, making communities more stable in the long run. By integrating climate initiatives with social support, we can provide immediate assistance to vulnerable populations while laying the groundwork for a sustainable future that benefits everyone.",3.504310405795497e+45,1.0000033263909074,1.2479336012333563e-05,,,5.0,"I understand the argument that tackling climate change may offer long-term benefits, but I worry that the focus on these initiatives can divert attention and resources away from addressing the very real and immediate struggles faced by vulnerable populations today. The promise of job creation in renewable energy is not guaranteed, and without careful planning, those jobs may not be accessible to the communities most affected by the transition. We should concentrate on implementing practical solutions that directly enhance the lives of those in need, rather than relying on uncertain future benefits tied to climate change initiatives.",2.025678496289859,4.008576792165275,0.0493663769884368,,
242.0,disc,2.0,"Your concerns about the potential diversion of resources from immediate needs are valid, and it is essential that we approach this transition with the utmost care and planning. However, addressing climate change doesn't have to come at the expense of supporting vulnerable populations; in fact, it can complement those efforts by creating a more resilient economy and environment. By prioritizing equitable access to new job opportunities in the renewable energy sector and ensuring that these initiatives are designed with community input, we can meet today's urgent needs while also safeguarding the future for generations to come.",8.756793027179981e+82,1.0000003506862483,1.5146092056615201e-06,,,5.0,"I appreciate your acknowledgment of the need for careful planning, but I remain skeptical about the assumption that climate initiatives can seamlessly complement immediate support for vulnerable populations without risking their current stability. The complexities of transitioning to renewable energy often lead to unintended consequences, particularly for those whose livelihoods depend on fossil fuels, and we must not overlook those potential challenges. Instead of pursuing this dual approach, we should focus our efforts on enhancing existing services and infrastructure that directly uplift communities and improve their quality of life right now.",1.9481872274830037,4.037324870926653,0.15937717139337051,,
242.0,disc,2.0,"I understand your skepticism regarding the complexities of transitioning to renewable energy, and it’s vital that we approach this transition with sensitivity to the potential challenges faced by communities dependent on fossil fuels. However, it's also important to recognize that enhancing existing services and infrastructure can indeed occur alongside climate initiatives, creating a pathway for sustainable development that protects livelihoods while improving resilience. By thoughtfully integrating immediate support with long-term climate solutions, we can aim to stabilize communities today while also preparing them for a future that is increasingly impacted by climate change.",2.35750029533222,1.0000760472165238,0.00023023899774240363,,,5.0,"I see your point about the potential for enhancing services to coexist with climate initiatives, but I still believe that the urgency of pressing issues like poverty and healthcare should take priority, as they are immediate concerns that directly affect people's day-to-day lives. The integration you propose may sound ideal in theory, but in practice, it often leads to compromises that dilute the focus and resources needed to tackle those urgent challenges head-on. Rather than attempting to merge these efforts, I suggest we concentrate solely on addressing the immediate needs of communities, ensuring their well-being today before considering future climate solutions.",2.1756876533607086,4.029307687043549,0.1323949769635936,,
