ID,TEXT_TYPE,INIT_OP_A,TEXT_A,PPL_A,PROBE_INT_A,H_INT_A,PROBE_EXT_A,H_EXT_A,INIT_OP_B,TEXT_B,PPL_B,PROBE_INT_B,H_INT_B,PROBE_EXT_B,H_EXT_B
248.0,tot,2.0,"Climate change is one of the most pressing issues of our time, posing serious threats to ecosystems, economies, and human health. The scientific consensus is clear: human activities, particularly the burning of fossil fuels, are driving unprecedented changes in our climate. These changes result in extreme weather events, rising sea levels, and altered agricultural patterns, impacting food security and biodiversity. 

Addressing climate change requires urgent collective action, including reducing greenhouse gas emissions, transitioning to renewable energy, and promoting sustainable practices. Furthermore, it necessitates global cooperation and equitable solutions to support vulnerable communities most affected by climate impacts. The longer we delay, the more severe the consequences will be for future generations. It's imperative that we prioritize climate action now to create a sustainable future.",1.6385623578479271,1.0000000119979973,6.186413473396587e-08,,,5.0,"I believe that the focus on climate change has been exaggerated and often distracts from more pressing and immediate issues facing humanity, such as poverty, healthcare, and education. Many proposed solutions, like drastic policy changes and economic upheaval, could harm economies without solving the problem effectively. Furthermore, there are natural climate cycles that have occurred throughout history, and it's essential to consider all factors rather than attributing everything to human activity. Instead of prioritizing climate change, we should direct our resources towards sustainable development and technological innovations that can address a variety of global challenges.",2.0442425901240577,4.000701811334712,0.005931741269138897,,
248.0,disc,2.0,"Climate change represents a critical challenge that affects every corner of our planet, impacting ecosystems, economies, and the health of communities. As we witness the increasing frequency of extreme weather events and shifts in agricultural patterns, it becomes imperative that we acknowledge the urgent need for collective action. Together, we must explore and implement solutions that prioritize reducing greenhouse gas emissions and transitioning to a sustainable, renewable energy future for the benefit of all, especially the most vulnerable populations.",1.797469539061337,1.0000000174871644,8.919716073515412e-08,,,5.0,"While I understand the concern regarding climate change and its impact, I believe that the narrative often exaggerates the urgency and overlooks more immediate issues like poverty and healthcare that require our attention. It's crucial to recognize that extreme weather events and agricultural shifts are part of natural climate cycles that have occurred throughout history. Instead of solely focusing on reducing greenhouse gas emissions, we should channel our efforts into sustainable development and technological innovations that can address a broader range of global challenges effectively.",1.7093059869393017,4.001169119026578,0.00907028660344627,,
248.0,disc,2.0,"I appreciate your perspective on the importance of addressing poverty and healthcare, as these are undeniably critical issues. However, it's essential to recognize that climate change is intricately linked to these challenges; worsening environmental conditions can exacerbate poverty and threaten health outcomes worldwide. By prioritizing climate action alongside sustainable development and innovation, we can create holistic solutions that not only address immediate socio-economic issues but also ensure a livable planet for future generations.",1.6510208418667862,1.000000187871314,8.436281701076929e-07,,,5.0,"I acknowledge that there can be connections between climate change and socio-economic issues, but I maintain that the long-term natural climate cycles should be considered before implementing drastic climate policies that could harm economies. Focusing too heavily on climate action could divert the necessary resources and attention away from addressing critical needs like poverty alleviation and healthcare improvements. A more balanced approach that prioritizes sustainable development and technological innovations will ultimately yield better outcomes for communities and the planet alike.",1.346586552678649e+49,4.000258349527423,0.0024538780641781546,,
248.0,disc,2.0,"It's important to acknowledge the natural climate cycles, but the current rate and scale of climate change are unprecedented and heavily influenced by human activities, particularly fossil fuel consumption. Failing to address this urgent crisis threatens to undermine economic stability and exacerbate social inequalities, as vulnerable communities are often the first to bear the brunt of climate-related impacts. A balanced approach can certainly include sustainable development and technological innovations, but we must also ensure that proactive climate policies are at the forefront of our strategies to create a resilient and equitable future for all.",1.9667363628057613,1.000000742258139,3.0636232634463825e-06,,,5.0,"While I recognize the concern about human influence on current climate changes, I still believe that the proposed proactive policies often overlook the potential economic repercussions and may not effectively address the root causes of vulnerability. Prioritizing immediate socio-economic issues like healthcare and poverty can create a more stable foundation for communities, which can, in turn, foster resilience to environmental challenges. Instead of focusing primarily on climate policies that could disrupt economies, we should seek solutions that promote sustainable development and innovation, benefiting people while considering environmental stewardship in a more integrated manner.",2.377521673280604,4.000106712734662,0.0011288280930237201,,
248.0,disc,2.0,"Your emphasis on addressing immediate socio-economic issues is valid, as strengthening communities is essential for building resilience against environmental challenges. However, it's crucial to understand that climate change is not a separate issue but a significant underlying factor that worsens health disparities and economic vulnerabilities. By integrating climate action with sustainable development and innovative solutions, we can create a comprehensive approach that not only tackles pressing socio-economic needs but also ensures long-term environmental stewardship and stability for all communities.",1.8061350039742237,1.0000005104064038,2.1591705086376178e-06,,,5.0,"I appreciate the point about the interconnectedness of climate change with socio-economic issues, but I still argue that the urgency surrounding climate action can sometimes overshadow the immediate needs that are directly affecting people's lives. It's essential to approach these challenges without assuming that climate change is the primary driver of all vulnerabilities, as many factors contribute to economic and health disparities. By focusing resources on sustainable development and technological advancements, we have the potential to create solutions that address a diversity of challenges, ultimately fostering more resilient communities without the potential economic disruptions that strict climate policies might entail.",2.331144375124652,4.000425317380809,0.003829123164126908,,
248.0,disc,2.0,"I completely understand your concerns regarding the urgency of climate action and the importance of addressing immediate needs; these are valid points that merit thoughtful consideration. It’s true that a multitude of factors contribute to economic and health disparities, but climate change exacerbates these vulnerabilities in ways that cannot be ignored, leading to more severe consequences for those already struggling. By integrating climate action into our sustainable development and technological advancements, we can create multifaceted solutions that enhance resilience, ultimately benefiting both people and the planet without sacrificing economic stability.",1.9891467254400326,1.0000048529308083,1.795142803994002e-05,,,5.0,"I appreciate your acknowledgment of the importance of addressing immediate needs, but I maintain that we should be cautious about how we frame climate change as an exacerbating factor, as this can lead to policies that may do more harm than good in economic contexts. While I understand the desire for integrated solutions, I believe prioritizing climate action could detract from tackling pressing issues like poverty and healthcare, which can yield more immediate benefits to vulnerable populations. Ultimately, our focus should be on fostering sustainable development and encouraging technological innovations that can address a variety of challenges without the risks associated with imposing strict climate policies that may disrupt livelihoods.",2.3126914961446796,4.00247097609616,0.01733251786698889,,
