ID,TEXT_TYPE,INIT_OP_A,TEXT_A,PPL_A,PROBE_INT_A,H_INT_A,PROBE_EXT_A,H_EXT_A,INIT_OP_B,TEXT_B,PPL_B,PROBE_INT_B,H_INT_B,PROBE_EXT_B,H_EXT_B
260.0,tot,3.0,"Climate change is a complex issue that prompts a wide range of opinions and perspectives. On one hand, there are compelling arguments about the environmental impacts and potential risks to ecosystems and human health. On the other hand, some people raise questions about the effectiveness of proposed solutions and the economic ramifications. It's important to consider multiple viewpoints and the nuances involved in discussions surrounding this topic. Awareness and dialogue may help in addressing the various challenges associated with climate change, regardless of individual stance.",1.1154701845026225e+47,1.0000029277143094,4.003307457632846e-05,,,1.0,"Climate change is one of the most pressing issues of our time, affecting not only the environment but also public health, economies, and social equity. The evidence is undeniable—rising temperatures, extreme weather events, and melting ice caps are all consequences of human activity. Urgent action is needed, not just from governments but also from individuals and businesses to reduce carbon emissions and shift towards sustainable practices. The time to act is now, as the longer we wait, the more severe the repercussions will be for future generations. It's essential to foster awareness and advocate for policies that prioritize the planet's health. Every action counts.",1.8640346982447102,1.0000000135966225,6.968180255916526e-08,,
260.0,disc,3.0,"Climate change is an intricate issue that invites a diverse array of opinions, and it's crucial we explore these perspectives to gain a fuller understanding of the challenges we face. While the scientific consensus highlights significant environmental impacts and health risks, we also need to critically examine the proposed solutions and their economic implications. By fostering open dialogue, we can better navigate the complexities of climate change and work towards effective strategies that take various viewpoints into account.",1.8189460088495975,1.0000000056795977,7.159803568093683e-08,,,1.0,"While it's important to acknowledge a diversity of opinions, we must prioritize the overwhelming scientific consensus that climate change poses dire risks to our planet and future generations. Open dialogue is essential, but it should be framed around actionable solutions rooted in evidence that effectively reduce carbon emissions and promote sustainability. As we navigate these complexities, we cannot lose sight of the urgency to act; every moment we delay jeopardizes both the environment and public health.",2.207433897420587,1.000000578000646,2.42037555766286e-06,,
260.0,disc,3.0,"I completely agree that the scientific consensus on climate change is critical and underscores the urgency of the situation we face. It’s important, however, to ensure that the dialogue around actionable solutions includes a variety of voices, as this can foster innovative ideas and approaches that might not be immediately evident. Ultimately, while we prioritize evidence-based strategies to reduce carbon emissions and promote sustainability, maintaining an inclusive conversation can help build the necessary consensus and collective action needed to address this pressing issue.",2.00223601126161,1.0000000155347328,8.158828843966659e-08,,,1.0,"I wholeheartedly agree that inclusivity in dialogue can spark innovative ideas, which are vital for developing effective climate solutions. However, we must ensure that this inclusivity does not dilute the urgency or the gravity of the scientific evidence—every decision we make must prioritize the health of our planet and its inhabitants. By combining a diverse range of perspectives with a steadfast commitment to evidence-based policies, we can create a robust framework for action that resonates across different sectors of society and drives meaningful change.",2.1232493685801845,1.0000000056695693,3.0295976368293586e-08,,
260.0,disc,3.0,"You're absolutely right; balancing inclusivity with a firm commitment to scientific evidence is essential in our discussions about climate solutions. By integrating diverse viewpoints while keeping the urgency of the situation at the forefront, we can foster an environment where innovative and effective strategies can emerge. It’s a challenging but necessary endeavor to ensure that any framework for action is not only grounded in evidence but also resonates with various stakeholders, as this collective buy-in will be crucial for driving meaningful and lasting change.",2.2123557146671518,1.000002935475157,1.1103522285813036e-05,,,1.0,"I appreciate your acknowledgment of the need for balance in our discussions; it truly is a challenging yet vital endeavor. Engaging diverse stakeholders not only fosters innovation but also enhances the legitimacy of the solutions we put forward, as buy-in from various groups can significantly amplify the impact of climate action. Ultimately, we must remain steadfast in our commitment to evidence-based strategies that resonate with all, ensuring that every voice contributes to a united front against climate change for the benefit of our planet and future generations.",2.1337171888539337,1.0000003505796249,1.5119000636270847e-06,,
260.0,disc,3.0,"I completely agree that involving a wide range of stakeholders not only enhances the legitimacy of our solutions but also strengthens the overall effectiveness of our climate action initiatives. By fostering this united front, we can create an atmosphere of collaboration that encourages shared responsibility and collective accountability. This approach not only amplifies the impact of our efforts but also ensures that we are genuinely addressing the diverse needs and concerns of all communities affected by climate change, ultimately benefiting both our planet and future generations.",1.8976112146632902,1.0000010805006054,4.367875607104666e-06,,,1.0,"Your points highlight the necessity of shared responsibility and collaboration in our fight against climate change, which is crucial for engaging communities effectively. By creating an atmosphere of inclusivity and accountability, we can ensure that our climate initiatives are not only impactful but also equitable, addressing the unique challenges faced by different groups. It is through this collective effort that we can forge a sustainable path forward, protecting our planet for future generations while fostering resilience in our communities.",2.089562520629253,1.0000000119998673,6.187331015898613e-08,,
260.0,disc,3.0,"You’ve captured the essence of what makes our collective efforts so important—shared responsibility and collaboration are indeed fundamental to achieving equitable climate solutions. By ensuring that our initiatives are inclusive and tailored to the unique challenges faced by various groups, we can create a more resilient framework that empowers all communities. This holistic approach not only strengthens our efforts to protect the planet but also promotes social equity, ultimately leading to a more sustainable future for everyone.",1.8827821870918433,1.000000580350876,2.469188696968911e-06,,,1.0,"You've articulated a vital point about the importance of tailoring our initiatives to the unique challenges faced by different communities, which is essential for fostering resilience. A holistic approach that intertwines environmental protection with social equity indeed lays the foundation for sustainable solutions that benefit everyone. As we work towards a more inclusive framework, we must remain vigilant in ensuring that no community is left behind in the fight against climate change, as true sustainability can only be achieved when all voices are heard and empowered.",1.7830860330747131,1.0000000030332485,1.6688395300607398e-08,,
