ID,TEXT_TYPE,INIT_OP_A,TEXT_A,PPL_A,PROBE_INT_A,H_INT_A,PROBE_EXT_A,H_EXT_A,INIT_OP_B,TEXT_B,PPL_B,PROBE_INT_B,H_INT_B,PROBE_EXT_B,H_EXT_B
263.0,tot,3.0,"Climate change is a complex issue that prompts a wide range of opinions and perspectives. On one hand, there are compelling arguments about the environmental impacts and potential risks to ecosystems and human health. On the other hand, some people raise questions about the effectiveness of proposed solutions and the economic ramifications. It's important to consider multiple viewpoints and the nuances involved in discussions surrounding this topic. Awareness and dialogue may help in addressing the various challenges associated with climate change, regardless of individual stance.",1.0957855068503676e+47,1.0000001030477403,1.5903243231242291e-06,,,1.0,"Climate change is one of the most pressing issues of our time, affecting not only the environment but also public health, economies, and social equity. The evidence is undeniable—rising temperatures, extreme weather events, and melting ice caps are all consequences of human activity. Urgent action is needed, not just from governments but also from individuals and businesses to reduce carbon emissions, invest in renewable energy, and promote sustainable practices. Addressing climate change is crucial for ensuring a habitable planet for future generations. We must act now to mitigate its impacts and adapt to the changes already underway.",1.666344559646882,1.0000000782564167,3.6681852802231594e-07,,
263.0,disc,3.0,"Climate change is an intricate issue that invites a diverse array of opinions, making it essential to engage in open dialogue. While the urgent need to address the environmental impacts is widely recognized, it's also important to critically examine the effectiveness of various proposed solutions and their economic implications. By fostering awareness and encouraging a multifaceted discussion, we can better navigate the challenges that climate change presents to both ecosystems and human society.",1.7821367981125615,1.000000000256136,2.724639157586892e-09,,,1.0,"I completely agree that open dialogue is essential when addressing the multifaceted issue of climate change. However, while examining proposed solutions and their economic implications is important, we must not lose sight of the urgency of action; the longer we delay, the more severe the consequences will be for ecosystems and human society. A proactive approach that prioritizes both immediate action and thoughtful discussions will help us navigate these challenges more effectively and create sustainable pathways for the future.",1.7252251950882855,1.0000020174103001,7.817630848447353e-06,,
263.0,disc,3.0,"You raise an excellent point about the urgency of taking action against climate change; it is indeed a pressing issue that requires immediate attention. Balancing proactive measures with thoughtful dialogue is crucial, as it ensures that our solutions are not only effective in the short term but also sustainable in the long run. By fostering collaboration and innovation, we can work towards solutions that address both the immediate threats and the underlying complexities of climate change.",1.545478364630306,1.0000000044929438,2.579596187125497e-08,,,1.0,"I appreciate your acknowledgment of the urgency and the need for a balanced approach to addressing climate change. Collaboration and innovation are indeed key components in developing effective long-term solutions, as they can lead to breakthroughs in technology and sustainable practices. By working together across sectors and engaging diverse perspectives, we can more effectively tackle both immediate challenges and the deeper systemic issues contributing to climate change.",1.8437848365292433,1.000000003037584,1.6705571857828964e-08,,
263.0,disc,3.0,"Absolutely, collaboration across sectors can be a powerful catalyst for innovation and progress in addressing climate change. Engaging diverse perspectives not only enriches the conversation but also helps to identify solutions that are culturally and socially sensitive, increasing their likelihood of success. By fostering an inclusive approach, we can address both the urgent challenges and the complex systemic issues, ultimately paving the way for a more sustainable future for all.",2.1329982946826638,1.0000042711116883,1.575510675552181e-05,,,1.0,"I wholeheartedly agree that an inclusive approach is vital for creating solutions that resonate with various communities and cultures, enhancing their effectiveness. By valuing diverse perspectives, we not only enrich the conversation but also empower marginalized voices that are often disproportionately affected by climate change. This collaborative and culturally sensitive strategy is essential for fostering true sustainability and achieving equitable outcomes for all, ensuring a resilient future for our planet.",4.118429007147674e+56,1.0000000004654994,2.7872049167498093e-09,,
263.0,disc,3.0,"You make a crucial point about the importance of empowering marginalized voices in the climate conversation, as they often experience the impacts of climate change first-hand. An inclusive approach not only enhances the effectiveness of our solutions but also ensures that we address issues of equity and social justice, which are integral to fostering true sustainability. By actively seeking out and incorporating these diverse perspectives, we can build a more resilient future that is considerate of the needs and challenges faced by all communities.",1.8400536556675586,1.0000000136132778,7.01822902847183e-08,,,1.0,"I appreciate your emphasis on the intersection of climate action, equity, and social justice, as this connection is vital for creating truly sustainable solutions. Empowering marginalized communities is not just a moral imperative; it's also essential for developing strategies that are effective and relevant to those most affected by climate change. By prioritizing inclusivity in our efforts, we can create solutions that not only address environmental challenges but also foster social resilience, ensuring that all communities can thrive in a changing world.",1.970532126104823,1.0000000056688758,3.029244536761843e-08,,
263.0,disc,3.0,"I completely agree that recognizing the intersection of climate action, equity, and social justice is fundamental for developing impactful solutions. Prioritizing inclusivity not only helps in creating strategies that are relevant and effective but also fosters a sense of community ownership over those solutions. By ensuring that all voices are heard and valued, we can create a more holistic approach to climate change that strengthens both the environment and the social fabric of our communities.",1.8550091750481403,1.0000000691218716,3.2792627624265296e-07,,,1.0,"You're absolutely right—community ownership is a powerful motivator and can lead to more sustained engagement and commitment to climate solutions. When we prioritize inclusivity, we empower individuals to take part in the decision-making processes that affect their lives, which cultivates a shared sense of responsibility and accountability. This holistic approach not only strengthens our environmental efforts but also reinforces social cohesion, ultimately leading to more resilient and adaptable communities in the face of climate change.",1.9740332580988975,1.0000000026775224,1.4830659258025417e-08,,
