ID,TEXT_TYPE,INIT_OP_A,TEXT_A,PPL_A,PROBE_INT_A,H_INT_A,PROBE_EXT_A,H_EXT_A,INIT_OP_B,TEXT_B,PPL_B,PROBE_INT_B,H_INT_B,PROBE_EXT_B,H_EXT_B
268.0,tot,3.0,"Climate change is a complex issue that prompts a wide range of opinions and perspectives. On one hand, there are compelling arguments about the environmental impacts and potential risks to ecosystems and human health. On the other hand, some people raise questions about the effectiveness of proposed solutions and the economic ramifications. It's important to consider multiple viewpoints and the nuances involved in discussions surrounding this topic. Awareness and dialogue may help in addressing the various challenges associated with climate change, regardless of individual stance.",1.1075066731848722e+47,1.0000079367221986,0.00010081665726910075,,,1.0,"Climate change is one of the most pressing issues of our time, affecting not only the environment but also public health, economies, and social equity. The evidence is undeniable—rising temperatures, extreme weather events, and melting ice caps are all consequences of human activity. Urgent action is needed, not just from governments but also from individuals and businesses to reduce carbon emissions and shift towards sustainable practices. The time to act is now, as the longer we wait, the more severe the repercussions will be for future generations. It's essential to foster awareness and advocate for policies that prioritize the planet's health. Every action counts.",1.8558392699921116,1.0000000326156007,1.6001841119060397e-07,,
268.0,disc,3.0,"Climate change is an intricate issue that invites a diverse array of opinions, and it's crucial we explore these perspectives to gain a fuller understanding of the challenges we face. While the scientific consensus highlights significant environmental impacts and health risks, we also need to critically examine the proposed solutions and their economic implications. By fostering open dialogue, we can better navigate the complexities of climate change and work towards effective strategies that take all viewpoints into account.",1.8225126786109132,1.0000000025858302,4.290695387836082e-08,,,1.0,"While it's important to acknowledge a diversity of opinions, we must prioritize the overwhelming scientific consensus that climate change poses dire risks to our planet and future generations. Open dialogue is essential, but it should be framed around actionable solutions rooted in evidence that effectively reduce carbon emissions and promote sustainability. As we navigate these complexities, we cannot lose sight of the urgency to act; every moment we delay jeopardizes both the environment and public health.",1.0256931088741079e+52,1.0000000782293574,3.6669845491712024e-07,,
268.0,disc,3.0,"I completely agree that the scientific consensus on climate change is critical and underscores the urgency of the situation we face. It’s important, however, to ensure that the dialogue around actionable solutions is inclusive of various voices, as this can foster broader support and innovative ideas. By balancing urgency with inclusivity, we may not only expedite meaningful action but also increase the likelihood of long-term commitment across different sectors of society.",2.1860026080183537,1.0000000288564512,1.4402217660757747e-07,,,1.0,"I appreciate your emphasis on inclusivity in the dialogue surrounding climate action, as a diverse set of voices can indeed lead to innovative solutions. However, we must be careful to ensure that this inclusivity does not dilute the urgency and scientific basis of our response to the crisis. Balancing urgency with broader engagement is key, but we cannot lose sight of the fact that immediate, science-based actions are necessary to combat the escalating impacts of climate change effectively.",2.0436269033939696,1.0000000001938947,1.1997237372057754e-09,,
268.0,disc,3.0,"You make an excellent point about the need to maintain a strong foundation in scientific evidence while fostering inclusive dialogue. The urgency of immediate action cannot be overstated, and we must ensure that all discussions remain focused on credible, science-based solutions that yield tangible results. In navigating this balance, we can empower diverse perspectives to contribute meaningfully to our collective response, enhancing both the effectiveness and the reach of our climate initiatives.",2.2048145083756,1.0000000909735498,4.6147599068116684e-07,,,1.0,"I'm glad to see a shared commitment to grounding our discussions in scientific evidence while also welcoming diverse perspectives. Empowering varied voices is crucial, as it can lead to more innovative and widespread community engagement in climate initiatives. Ultimately, our goal should be to unite around credible, actionable strategies that not only address the immediate challenges but also foster resilience for future generations.",2.1533904056065897e+62,1.0000000056699865,3.029810191366205e-08,,
268.0,disc,3.0,"I wholeheartedly agree that uniting around credible and actionable strategies is essential for both immediate climate challenges and long-term resilience. By harnessing the innovative ideas that diverse perspectives offer, we can create comprehensive solutions that resonate with various communities and stakeholders. Ultimately, our collective effort will be strengthened when we not only prioritize scientific evidence but also embrace the unique contributions of all voices involved in this crucial dialogue.",2.1555941895974335,1.0000002741274252,1.2183386429141227e-06,,,1.0,"I completely agree that leveraging innovative ideas from diverse perspectives can enrich our approach to tackling climate change and enhance our collective efforts. Ensuring that solutions resonate with various communities is vital, as it fosters greater buy-in and participation in sustainable practices. By combining the rigor of scientific evidence with the unique contributions of all voices, we can create a more inclusive and effective movement toward a healthier planet.",1.8442458765344547,1.0000000369543582,1.801513565567903e-07,,
268.0,disc,3.0,"It's encouraging to see such strong agreement on the importance of inclusivity and innovation in our climate efforts. Engaging communities in ways that resonate with their needs and values not only enhances participation but also builds a sense of ownership over sustainability initiatives. By intertwining scientific rigor with diverse perspectives, we can cultivate a robust movement that not only addresses current challenges but also fosters a collective commitment to a healthier planet for future generations.",1.7503425906626224,1.000000742339875,3.0654264841343435e-06,,,1.0,"Absolutely, cultivating a sense of ownership within communities is crucial for driving meaningful and lasting change in sustainability initiatives. When individuals feel a personal connection to the solutions, they're more likely to actively participate and advocate for the necessary actions. Ultimately, infusing our climate efforts with both scientific rigor and community-driven insights will empower us to create a movement that truly represents the collective will to safeguard our planet for future generations.",3.934414141619246e+54,1.0000003093820793,1.343877103546687e-06,,
