ID,TEXT_TYPE,INIT_OP_A,TEXT_A,PPL_A,PROBE_INT_A,H_INT_A,PROBE_EXT_A,H_EXT_A,INIT_OP_B,TEXT_B,PPL_B,PROBE_INT_B,H_INT_B,PROBE_EXT_B,H_EXT_B
277.0,tot,3.0,"Climate change is a complex issue that prompts a wide range of opinions and perspectives. On one hand, there are compelling arguments about the environmental impacts and potential risks to ecosystems and human health. On the other hand, some people raise questions about the effectiveness of proposed solutions and the economic ramifications. It's important to consider multiple viewpoints and the nuances involved in discussions surrounding this topic. Awareness and dialogue may help in addressing the various dimensions of climate change.",1.7442624613357323e+50,1.000001925949282,2.583020004243244e-05,,,2.0,"Climate change is one of the most pressing issues of our time, posing serious threats to ecosystems, economies, and human health. The scientific consensus is clear: human activities, particularly the burning of fossil fuels, are driving unprecedented changes in our climate. These changes result in extreme weather events, rising sea levels, and altered agricultural patterns, impacting food security and biodiversity. 

Addressing climate change requires urgent collective action, including reducing greenhouse gas emissions, transitioning to renewable energy, and promoting sustainable practices. Furthermore, it necessitates global cooperation and equitable solutions to support vulnerable communities most affected by climate impacts. The longer we delay, the more severe the consequences will be, making it imperative for individuals, governments, and organizations to work together towards a sustainable future.",1.605380318459727,1.0000000197799557,9.951736454246069e-08,,
277.0,disc,3.0,"Climate change is undoubtedly a multifaceted issue that affects not only our environment but also our economies and societies. While there are urgent calls for action and innovative solutions, it’s crucial to examine the diverse perspectives and potential consequences associated with these approaches. Engaging in open dialogue about both the environmental risks and the economic implications can help us navigate this complex challenge more effectively.",1.696014215377151,1.000000025674147,1.3259817797712918e-07,,,2.0,"I completely agree that climate change is a complex issue that intersects with various aspects of our lives. However, it’s essential to recognize that while exploring diverse perspectives is important, it should not hinder the urgency of implementing necessary solutions to reduce greenhouse gas emissions and transition to renewable energy. Open dialogue must lead to actionable strategies that prioritize environmental sustainability and equity, particularly for those communities most vulnerable to the impacts of climate change.",1.8036681018776264,1.0000000064260794,3.4137254117968765e-08,,
277.0,disc,3.0,"You raise a valuable point about the urgency of implementing solutions to combat climate change, especially considering the disproportionate effects on vulnerable communities. While dialogue and exploration of diverse perspectives are vital, I agree that they should be coupled with actionable strategies that drive progress toward sustainability and equity. Balancing immediate action with a comprehensive understanding of the complexities involved can help us design more effective and inclusive solutions.",1.9541333588999503,1.000000000281953,2.8775145082586847e-09,,,2.0,Thank you for your thoughtful response; I appreciate your recognition of the need for urgent action alongside comprehensive dialogue. Balancing immediate action with a nuanced understanding is indeed crucial to developing effective climate solutions that address both environmental and social dimensions. We must ensure that these inclusive strategies not only mitigate climate impacts but also empower the most affected communities to actively participate in building a sustainable future.,2.0631808844637063,1.0000000254010555,1.2621003019160832e-07,,
277.0,disc,3.0,"I'm glad to hear that you resonate with the importance of inclusive strategies in the fight against climate change. Empowering affected communities to actively participate in the decision-making process can lead to more equitable and effective solutions that truly reflect their needs and challenges. By fostering collaboration and giving a voice to those most impacted, we can create not only a sustainable future but also one that is just and resilient.",1.850762786147924,1.0000000026888907,1.5125324005179678e-08,,,2.0,"Absolutely, empowering affected communities is a fundamental aspect of creating equitable climate solutions that truly reflect their needs. By prioritizing collaboration and inclusive decision-making, we can harness local knowledge and perspectives, which are crucial for developing effective strategies tailored to specific contexts. This approach not only enhances the effectiveness of our climate action but also fosters resilience and social justice, ultimately benefiting both the environment and the communities involved.",2.1178588612114084,1.0000000038976142,2.1192492969397408e-08,,
277.0,disc,3.0,"You bring up an essential point about the value of local knowledge and perspectives in shaping effective climate strategies. Incorporating these insights can truly enhance our climate action efforts while reinforcing resilience and social justice within communities. Ultimately, a collaborative approach not only benefits the environment but also empowers individuals, creating a sense of ownership and commitment to sustainable practices.",2.01852923236438,1.000000008262447,4.3743412163055486e-08,,,2.0,"I completely agree that integrating local knowledge is crucial for developing strategies that are not only effective but also culturally relevant and sustainable. When individuals feel a sense of ownership and agency in climate action, it fosters a deeper commitment to sustainable practices and community resilience. This collaborative approach has the potential to create a powerful movement where environmental stewardship is championed at the grassroots level, driving meaningful change for both people and the planet.",6.825025308556691e+53,1.0000000609289,2.8944479400687807e-07,,
277.0,disc,3.0,"You've highlighted an important aspect of grassroots movements in climate action; when communities feel a sense of ownership, it can lead to transformative change. This empowerment not only promotes the adoption of sustainable practices but also nurtures a culture of environmental stewardship that can influence broader societal norms. By fostering local engagement and collaboration, we can create a ripple effect that inspires collective action for the benefit of both people and the planet.",3.310161513673096e+54,1.0000000418791517,2.0305765803095794e-07,,,2.0,"Absolutely, grassroots movements play a pivotal role in transforming societal norms around environmental stewardship and sustainability. When communities are empowered to engage actively in climate action, they become powerful advocates for change, inspiring others and amplifying efforts beyond their immediate surroundings. This ripple effect can mobilize collective action on a larger scale, ultimately contributing to a more sustainable future that benefits both individuals and the planet as a whole.",1.8662239584824827,1.000000006421451,3.412684693137954e-08,,
