ID,TEXT_TYPE,INIT_OP_A,TEXT_A,PPL_A,PROBE_INT_A,H_INT_A,PROBE_EXT_A,H_EXT_A,INIT_OP_B,TEXT_B,PPL_B,PROBE_INT_B,H_INT_B,PROBE_EXT_B,H_EXT_B
302.0,tot,3.0,"Climate change is a complex issue that elicits a range of opinions and perspectives. On one hand, there are compelling arguments and scientific evidence highlighting significant environmental changes and potential impacts on ecosystems, weather patterns, and human health. On the other hand, there are discussions around the economic, social, and political implications of addressing climate change. It’s essential to consider all sides and foster dialogue about sustainable practices and policies, recognizing that the way forward may involve a blend of innovation, adaptation, and cooperation across different sectors. Ultimately, the path taken will likely shape future generations.",2.1829829034894765,1.0000000279298227,2.5949046953305706e-07,,,3.0,"Climate change is a complex issue that elicits a range of opinions and perspectives. On one hand, there are compelling arguments about the environmental impacts and potential risks to ecosystems and human health. On the other hand, some people raise questions about the effectiveness of proposed solutions and the economic ramifications. It's important to consider multiple viewpoints and the nuances involved in discussions surrounding this topic. Awareness and dialogue may help in addressing the various dimensions of climate change.",1.7111748647576687e+50,1.0000080769229318,0.00010142686835585543,,
302.0,disc,3.0,"As we delve into the multifaceted issue of climate change, it's important to acknowledge the robust scientific evidence that illustrates its profound effects on our planet and its ecosystems. However, while we explore potential solutions, we must also consider the economic and social ramifications they may have on different communities. By fostering an open dialogue that embraces innovation and collaboration across sectors, we can work towards sustainable practices that benefit both the environment and society as a whole.",1.7307459887508871,1.0000000031356429,1.9144484014382108e-08,,,3.0,"I agree that acknowledging the scientific consensus on climate change is crucial as it guides our understanding of its impacts. However, it's equally important to critically evaluate the potential economic and social consequences of the solutions we propose, ensuring they are equitable and don't disproportionately burden vulnerable communities. By fostering inclusive discussions that prioritize diverse perspectives, we can work towards innovative strategies that genuinely address both environmental sustainability and social well-being.",2.3185845385130217,1.0000000034134422,5.9397791187404726e-08,,
302.0,disc,3.0,"I completely concur with your emphasis on the need for equitable solutions in the fight against climate change, as it's essential that our strategies do not exacerbate existing inequalities. Engaging diverse perspectives not only enriches our understanding but also enables us to craft more effective and inclusive policies that reflect the needs of all communities. Ultimately, by prioritizing collaboration across sectors and ensuring marginalized voices are heard, we can create a sustainable future that is both environmentally sound and socially just.",1.9490294375114159,1.0000000254003094,1.263203469391947e-07,,,3.0,"I appreciate your insightful response and wholeheartedly agree that inclusivity is vital in shaping effective climate policies. By actively involving marginalized voices, we can better understand the unique challenges they face and develop solutions that truly address their needs. Through collaborative efforts that recognize the interconnectedness of environmental and social justice, we can pave the way for a more equitable and sustainable future for everyone.",3.3101924007893546e+60,1.0000000065256516,4.907537726938916e-08,,
302.0,disc,3.0,"Thank you for your thoughtful input; I share your belief in the importance of acknowledging the interconnectedness of environmental and social justice. By actively seeking out and incorporating the experiences of marginalized communities, we can uncover innovative solutions that resonate on multiple levels. This collaborative approach not only helps us tackle the climate crisis more effectively but also fosters a sense of shared responsibility, ultimately leading to a more just and sustainable future for all.",1.8868729687617916,1.000000273072643,1.1956804534636169e-06,,,3.0,"Thank you for your kind words—it's encouraging to see others recognize the critical link between environmental and social justice. Indeed, uncovering innovative solutions requires us to listen actively to those most affected by climate change, as their experiences can inform more comprehensive strategies. By fostering a collective sense of responsibility, we not only enhance our ability to combat the climate crisis but also build stronger, more resilient communities that prioritize the well-being of everyone.",1.9100595933007232,1.0000000011479226,1.1466699409667815e-08,,
302.0,disc,3.0,"I appreciate your enthusiasm for this important dialogue, as it truly underscores the necessity of listening to those directly impacted by climate change. By integrating their lived experiences into our strategies, we can create more nuanced and effective approaches that not only mitigate environmental issues but also empower communities. Building stronger, resilient communities should indeed be at the forefront of our efforts, allowing us to tackle the climate crisis in a way that uplifts and supports everyone involved.",1.938483036124698,1.0000003094146637,1.3447997342797239e-06,,,3.0,"I'm glad you resonate with the importance of integrating lived experiences into our climate strategies. This approach not only leads to more effective solutions but also fosters agency and empowerment within communities, ensuring that they have a voice in their own futures. By prioritizing resilience and collaboration, we pave the way for a more inclusive response to the climate crisis that uplifts every community and encourages collective progress.",2.1423194354139725,1.0000000902431851,4.4683158301608284e-07,,
302.0,disc,3.0,"You've articulated an essential aspect of our climate response—empowering communities to have a voice in shaping their futures. By prioritizing agency and resilience, we not only enhance the effectiveness of our strategies but also foster a sense of ownership and accountability within those communities. This inclusive approach not only strengthens our collective efforts against climate change but also reinforces the idea that everyone has a role to play in achieving sustainable progress.",1.8472837039956134,1.0000000690797843,3.269412215344312e-07,,,3.0,"Thank you for your thoughtful reflections; empowering communities indeed lays the foundation for a more sustainable and impactful climate response. By fostering ownership and accountability, we cultivate a sense of shared responsibility that can drive meaningful change at all levels. Acknowledging that everyone has a role to play not only motivates individuals but also amplifies our collective efforts in addressing the complexities of climate change, ultimately leading to a more unified and resilient societal response.",2.2779710984855366,1.0000000026782099,2.0369817719798303e-08,,
