ID,TEXT_TYPE,INIT_OP_A,TEXT_A,PPL_A,PROBE_INT_A,H_INT_A,PROBE_EXT_A,H_EXT_A,INIT_OP_B,TEXT_B,PPL_B,PROBE_INT_B,H_INT_B,PROBE_EXT_B,H_EXT_B
304.0,tot,3.0,"Climate change is a complex issue that elicits a range of opinions and perspectives. On one hand, there are compelling arguments about the environmental impacts and potential risks to ecosystems and human health. On the other hand, some people raise concerns about economic implications, energy policies, and technological feasibility. It's important to consider multiple viewpoints and the interplay of scientific data, societal values, and policy decisions in addressing this multifaceted topic. Ultimately, further dialogue and research are crucial for informed decision-making.",1.9645817914889794,1.0000031149516586,4.085046540134027e-05,,,3.0,"Climate change is a complex issue that prompts a wide range of opinions and perspectives. On one hand, there are compelling arguments about the environmental impacts and potential risks to ecosystems and human health. On the other hand, some people raise questions about the effectiveness of proposed solutions and the economic ramifications. It's important to consider multiple viewpoints and the nuances involved in discussions surrounding this topic. Awareness and dialogue may help in addressing the various challenges associated with climate change, regardless of individual stance.",1.105180612728867e+47,1.0000000589092564,9.004246173504558e-07,,
304.0,disc,3.0,"Climate change is a pressing global issue that encompasses a wide array of environmental, economic, and social dimensions. It's essential that we engage in an open dialogue that considers the scientific evidence while also addressing the diverse viewpoints surrounding energy policies and technological solutions. By collaborating and sharing insights, we can work towards more informed and effective strategies to tackle this complex challenge.",1.8895769546233196,1.0000000006721466,1.2604319075755851e-08,,,3.0,"I completely agree that climate change is a multifaceted issue that requires thoughtful discourse. Engaging with scientific evidence while respecting diverse perspectives on energy policies and solutions is crucial for fostering collaboration. By sharing insights and finding common ground, we can develop strategies that are not only effective but also inclusive of the various interests at stake.",1.5039704740993544e+69,1.0000000065199115,1.2724650122537479e-07,,
304.0,disc,3.0,"Thank you for your thoughtful response; I appreciate your emphasis on the importance of inclusivity in our discussions. It’s vital to recognize that varying interests can actually strengthen our approach if we find ways to integrate them into our strategies. By fostering an environment where all voices are heard, we can enhance collaboration and drive more holistic solutions to the challenges posed by climate change.",1.834256002921946,1.0000000064586636,3.505487966267865e-08,,,3.0,"Thank you for your kind words; I share your belief in the power of inclusivity. Integrating diverse interests can indeed create a more comprehensive understanding of climate challenges, allowing us to address these issues from multiple angles. By ensuring that all voices contribute to the conversation, we can enhance our ability to innovate and develop solutions that resonate with a broader range of stakeholders.",2.1261380648293278,1.000000002532396,3.6695789359005096e-08,,
304.0,disc,3.0,"I appreciate your agreement and insight into the benefits of integrating diverse interests. It's clear that a multifaceted approach not only enriches our understanding but also fosters creativity in the solutions we develop. As we continue to encourage participation from all stakeholders, we can harness this collective knowledge to craft strategies that are not only effective but also widely supported and relevant to varied communities.",2.3101768653938675,1.000000399308963,1.7440013983183829e-06,,,3.0,"Absolutely, the richness of diverse perspectives can lead to innovative solutions that might not emerge in a more homogeneous setting. By actively encouraging participation from all stakeholders, we create an environment where collective knowledge truly flourishes. This collaborative spirit will not only enhance the effectiveness of our strategies but also ensure they are more widely accepted and applicable across different communities.",1.6783886308411398,1.0000000046527362,3.785786857392784e-08,,
304.0,disc,3.0,"I couldn't agree more; the innovation that arises from a blend of perspectives is one of the most promising aspects of collaborative dialogue. By fostering an inclusive environment, we indeed elevate the dialogue and lay the groundwork for strategies that resonate with a wider audience. As we navigate the complexities of climate change, embracing this collaborative spirit will be essential in ensuring our approaches are both effective and adaptable to the diverse needs of society.",9.21201548066389e+53,1.0000001138618628,5.240299803130632e-07,,,3.0,"I'm glad to hear that you feel the same way about the potential for innovation through collaboration. Embracing an inclusive environment not only enriches our discussions but also enables us to build strategies that can adapt to the evolving challenges posed by climate change. By maintaining this collaborative spirit, we can ensure that our solutions are not only effective but also responsive to the unique needs of various communities.",1.597629352043987,1.0000000996741956,1.7029019506162054e-06,,
304.0,disc,3.0,"Thank you for your insights; it’s wonderful to see our shared enthusiasm for fostering collaboration to tackle climate change. Your point about adaptability is particularly important, as the landscape of environmental issues is constantly evolving, and our strategies must reflect that dynamism. By staying engaged with diverse communities and listening to their needs, we can develop solutions that are both impactful and resilient in the face of future challenges.",2.2928986453045557,1.0000000475067214,2.2985147562960866e-07,,,3.0,"Thank you for your thoughtful response; it’s encouraging to find common ground in our commitment to collaboration. I wholeheartedly agree that adaptability is crucial, especially as environmental challenges continue to shift and transform. By remaining attentive to the needs of diverse communities, we not only enhance the relevance of our solutions but also build resilience that can withstand future uncertainties.",1.5415101335194643,1.0000000211791418,3.7585171359876816e-07,,
