ID,TEXT_TYPE,INIT_OP_A,TEXT_A,PPL_A,PROBE_INT_A,H_INT_A,PROBE_EXT_A,H_EXT_A,INIT_OP_B,TEXT_B,PPL_B,PROBE_INT_B,H_INT_B,PROBE_EXT_B,H_EXT_B
320.0,tot,3.0,"Climate change is a complex issue that prompts a wide range of opinions and perspectives. On one hand, there are compelling arguments about the environmental impacts and potential risks to ecosystems and human health. On the other hand, some people raise questions about the effectiveness of proposed solutions and the economic ramifications. It's important to consider multiple viewpoints and the nuances involved in discussions surrounding this topic. Awareness and dialogue may help in addressing the various challenges associated with climate change, regardless of individual stance.",1.1021476592510522e+47,1.0000001027394307,1.4700383575586746e-06,,,3.0,"Climate change is a complex issue that prompts a wide range of opinions and perspectives. On one hand, there are compelling arguments about the environmental impacts and potential risks to ecosystems and human health. On the other hand, some people raise questions about the effectiveness of proposed solutions and the economic ramifications. It's important to consider multiple viewpoints and the nuances involved in discussions surrounding this topic. Awareness and dialogue may help in addressing the various challenges associated with climate change, regardless of individual stance.",1.104566200421428e+47,1.0000001771109412,2.5803923774137676e-06,,
320.0,disc,3.0,"Climate change is an intricate issue that invites a diverse array of opinions and perspectives, reflecting the complexity of our global systems. It's crucial to acknowledge the compelling evidence regarding the environmental impacts and potential risks to both ecosystems and human health. However, as we navigate this dialogue, we must also consider the effectiveness of proposed solutions and their economic ramifications, fostering an open exchange of ideas to address the challenges we face.",1.8294991077472909,1.0000000008394963,1.4664216811771119e-08,,,3.0,"I completely agree that climate change presents a multifaceted challenge that deserves thoughtful consideration of varied perspectives. Acknowledging the environmental impacts is essential, but we must also critically evaluate the proposed solutions to ensure they are both effective and economically viable. Continuous dialogue and awareness can bridge these gaps and foster collaborative efforts to address the pressing issues associated with climate change.",1.684242014727673e+63,1.000000130955934,2.1706796125211446e-06,,
320.0,disc,3.0,"Thank you for your thoughtful response; I appreciate your emphasis on the importance of critical evaluation of proposed solutions. It's true that ensuring these solutions are both effective and economically viable is vital for garnering broader support and achieving meaningful progress. By fostering continuous dialogue and awareness, we can create a collaborative environment that encourages innovative approaches to address the complexities of climate change.",1.5752689571459646,1.0000000073557664,4.036361584024972e-08,,,3.0,"Thank you for your kind words; I appreciate your recognition of the need for effective and economically viable solutions. Collaboration is indeed key, as diverse perspectives can lead to innovative approaches that might not emerge in isolation. By maintaining an ongoing dialogue, we can better understand the complexities of climate change and work together to implement strategies that benefit both the environment and society as a whole.",1.4437691022114578,1.000000000747288,5.69509967913619e-09,,
320.0,disc,3.0,"I completely agree that collaboration is essential for uncovering innovative solutions and addressing the multifaceted nature of climate change. Engaging with a variety of perspectives not only enriches our understanding but also helps us to craft strategies that are beneficial for both the environment and society. By continuing this open dialogue, we can encourage creativity and shared responsibility in tackling the pressing challenges we face together.",8.316036984603469e+58,1.0000000262544169,1.4497776577932845e-07,,,3.0,"I appreciate your insights and share your enthusiasm for collaboration as a means to inspire innovative solutions. Engaging a diverse range of perspectives truly enriches our strategies and fosters a sense of shared responsibility in tackling climate change. By committing to this open dialogue, we can create a more inclusive approach that not only addresses environmental issues but also promotes social equity and resilience within our communities.",1.8199168102353,1.0000000031700724,6.291766650267013e-08,,
320.0,disc,3.0,"Thank you for highlighting the importance of social equity and resilience in our approach to climate change; these are critical aspects that should not be overlooked. An inclusive strategy can indeed empower communities and ensure that the benefits of climate initiatives are distributed fairly. By maintaining our commitment to open dialogue, we can work towards solutions that not only protect the environment but also uplift and support all members of our society.",1.6163318358110956,1.0000001139825787,5.268062165422263e-07,,,3.0,"You're absolutely right; social equity and resilience are vital components of any effective climate strategy, and we must be intentional about incorporating them. Empowering communities ensures that everyone has a stake in the solutions we develop and helps to create a more just and sustainable future. Continuing our open dialogue will allow us to share ideas and insights that can lead to holistic solutions benefiting both the planet and all its inhabitants.",1.8442079232101043,1.000000039948759,2.4198383252666934e-07,,
320.0,disc,3.0,"I fully concur that intentionality in incorporating social equity and resilience into our climate strategies is essential for achieving a just and sustainable future. Empowering communities not only fosters ownership of solutions but also enhances their effectiveness by making them more relevant to diverse needs. By sustaining our open dialogue, we can cultivate a rich exchange of ideas that leads to holistic solutions to the challenges posed by climate change while benefiting everyone involved.",2.0448824471414087,1.0000000058157446,3.3807448967338e-08,,,3.0,"I appreciate your agreement and insight into the importance of empowering communities in our climate strategies. When solutions are tailored to meet the diverse needs of different populations, their effectiveness increases significantly, thereby enhancing overall resilience. Sustaining this open dialogue will undoubtedly enrich our collective understanding and inspire creative solutions that address both the environmental and social dimensions of climate change.",2.1195826988335855,1.000000000422297,4.400901418460722e-09,,
