ID,TEXT_TYPE,INIT_OP_A,TEXT_A,PPL_A,PROBE_INT_A,H_INT_A,PROBE_EXT_A,H_EXT_A,INIT_OP_B,TEXT_B,PPL_B,PROBE_INT_B,H_INT_B,PROBE_EXT_B,H_EXT_B
346.0,tot,3.0,"Climate change is a complex issue that prompts a wide range of opinions and perspectives. On one hand, there are compelling arguments about the environmental impacts and potential risks to ecosystems and human health. On the other hand, some people raise questions about the effectiveness of proposed solutions and the economic ramifications. It's important to consider multiple viewpoints and the nuances involved in discussions surrounding this topic. Awareness and dialogue may help in addressing the various dimensions of climate change, but consensus on its significance and the best course of action remains elusive.",2.034094286540945e+43,1.0000017739416445,2.5154631123714166e-05,,,4.0,"I believe that while environmental issues are important, the emphasis on climate change often overshadows other pressing concerns that deserve equal attention. There are natural climate fluctuations that have occurred throughout Earth's history, and many argue that humanity's ability to adapt is significant. Rather than focusing solely on climate change, we should prioritize economic development, technological innovation, and improving living standards globally, which can also contribute to better environmental stewardship. Addressing immediate human needs can lead to more sustainable long-term solutions without the alarmism often tied to climate narratives.",2.186957045330012,3.860914048942235,0.3277673555127108,,
346.0,disc,3.0,"Climate change is an intricate issue that affects not only our environment but also our economies and societies in profound ways. While many agree on the urgency of addressing climate change, the debate often hinges on which solutions are most effective and feasible. Engaging in open dialogue about diverse perspectives can help us navigate the complexities and seek common ground for meaningful action.",1.7704453670240463,1.0000001283880435,2.156935171465582e-06,,,4.0,"I agree that climate change is a complex issue that intersects with various aspects of our lives, including the economy and society. However, it's essential not to lose sight of other urgent concerns that require our attention, such as poverty alleviation and economic development, which can also foster environmental improvements. Engaging in dialogue is crucial, but we must ensure that it encompasses a broader range of issues, allowing us to find solutions that address immediate human needs while considering long-term sustainability.",1.7675592956150032,3.119130666178456,0.36602282303920164,,
346.0,disc,3.0,"You've raised an important point about the interconnectedness of climate change with other pressing issues like poverty and economic development. It’s vital that our discussions encompass these dimensions, as addressing immediate human needs can indeed complement efforts toward long-term sustainability. Balancing these priorities may be challenging, but fostering a holistic approach could lead to more effective and inclusive solutions that benefit both people and the planet.",1.5549417245086758,1.001501370306351,0.011260840471606477,,,4.0,"I appreciate your acknowledgment of the interconnectedness of these issues; it's crucial to approach them holistically. However, I believe that while we strive for balance, it's important to recognize that not every aspect of climate change should overshadow developmental priorities. By focusing on economic growth and technological innovation, we can create pathways that enhance living standards and, in turn, promote better environmental stewardship without the urgency that often leads to alarmist narratives.",2.0411038145554206,2.329749715487433,0.7139603263391521,,
346.0,disc,3.0,"I see your perspective on the need for a balanced approach that prioritizes economic growth and innovation alongside environmental considerations. It’s indeed possible that fostering technological advancements can lead to integrated solutions that improve living standards and promote sustainable practices. However, while maintaining a sense of urgency is important, ensuring that our dialogues remain constructive and grounded in practical solutions without resorting to alarmism can help us engage a wider audience in meaningful action.",4.5287116075921437e+52,1.0066933585155415,0.04018174803097241,,,4.0,"You bring up a valid point about the importance of constructive dialogue and practical solutions. I agree that fostering technological advancements can play a significant role in tackling both economic and environmental challenges without creating undue alarm. However, I still maintain that we must prioritize immediate human needs and emphasize economic progress as a foundation for any long-term environmental strategy, allowing innovation to flourish naturally rather than as a response to climate alerts.",2.7220382852295285e+55,3.0136360728542595,0.07764595156321115,,
346.0,disc,3.0,"I appreciate your emphasis on prioritizing immediate human needs as a foundation for long-term environmental strategies. It’s true that ensuring economic progress can create a fertile ground for innovation, which may lead to more sustainable practices without the pressure of alarmist narratives. By framing our discussions around the idea that economic improvement and environmental stewardship can coexist, we might foster an environment where both can thrive harmoniously.",1.8659405520588483,1.000158473301578,0.0015449472840011165,,,4.0,"I’m glad to see agreement on the idea that economic improvement and environmental stewardship can coexist. By promoting strategies that elevate living standards, we can create a supportive environment for innovation and sustainable practices without the constraints of urgency-driven alarmism. This balanced approach not only addresses pressing human needs but also encourages a more optimistic view of our ability to care for the planet while advancing society.",2.16144217937302,3.022950523270235,0.10978571539260164,,
346.0,disc,3.0,"I’m encouraged by your optimistic perspective on the potential for a harmonious relationship between economic growth and environmental care. By focusing on strategies that uplift living standards, we can indeed inspire a mindset that fosters innovation as a natural progression rather than a reaction to crisis. This balanced outlook not only empowers communities but also reinforces the message that we can actively pursue sustainability while ensuring a better quality of life for all.",2.257691232603701,1.000430798220068,0.0037685314514375526,,,4.0,"I appreciate your encouragement and share your optimism about the potential for a harmonious relationship between economic and environmental goals. By prioritizing community upliftment, we can cultivate a proactive mindset that views innovation not as a reaction to crisis but as a driving force for progress. This perspective not only enhances quality of life but also strengthens the narrative that sustainable development and economic well-being can go hand in hand, ultimately benefiting both people and the planet.",2.051366184975421,3.001646451456934,0.013327700359551713,,
