ID,TEXT_TYPE,INIT_OP_A,TEXT_A,PPL_A,PROBE_INT_A,H_INT_A,PROBE_EXT_A,H_EXT_A,INIT_OP_B,TEXT_B,PPL_B,PROBE_INT_B,H_INT_B,PROBE_EXT_B,H_EXT_B
348.0,tot,3.0,"Climate change is a complex issue that prompts a wide range of opinions and perspectives. On one hand, there are compelling arguments about the environmental impacts and potential risks to ecosystems and human health. On the other hand, some people raise economic and social considerations, emphasizing the need for balance in addressing such concerns. Ultimately, the discourse around climate change involves assessing various factors and prioritizing actions based on a multitude of viewpoints. It's important to engage in informed discussions to understand the implications fully.",2.225133087310737,1.000000158091103,2.4900064986720045e-06,,,4.0,"I believe that while environmental issues are important, the emphasis on climate change often overshadows other pressing concerns that deserve equal attention. There are natural climate fluctuations that have occurred throughout Earth's history, and many argue that humanity's ability to adapt is significant. Rather than focusing solely on climate change, we should prioritize economic development, technological innovation, and improving living standards globally, which can also contribute to better environmental stewardship. Addressing immediate human needs can lead to more sustainable long-term solutions without the alarmism often tied to climate narratives.",2.182909525011784,3.801460703871651,0.43109601856817925,,
348.0,disc,3.0,"Climate change presents us with a multifaceted challenge that intertwines environmental, economic, and social issues. As we navigate this complex discourse, it's crucial to consider the scientific evidence regarding its impacts while also acknowledging the diverse viewpoints that inform our responses. Engaging in informed discussions can help us strike a balance between urgent action and sustainable solutions that take into account the needs of both the planet and its inhabitants.",1.7863512711628071,1.0005527844584914,0.004698803568997098,,,4.0,"While I understand the importance of addressing climate change as part of a broader conversation, I believe that we should not overlook other urgent issues that also demand our attention and resources. Historically, the Earth has experienced natural climate fluctuations, and humanity has continually demonstrated an impressive capacity to adapt. Rather than focusing solely on climate change, we should prioritize economic development and technological innovation to enhance living standards, which can simultaneously encourage better environmental practices without the alarmism often associated with climate narratives.",1.959584837145451,3.9983741635504457,0.008694348327853646,,
348.0,disc,3.0,"You raise valid points regarding the importance of addressing a range of urgent issues, including economic development and technological innovation. However, it's crucial to recognize that climate change is not just a historical phenomenon; the current rate of change poses significant risks that can undermine many of the advancements we strive for. Striking a balance between economic priorities and proactive climate action can lead to innovative solutions that enhance living standards while also preserving the environment for future generations.",1.8693929667773017,1.0000376424510882,0.00040654775782247377,,,4.0,"I appreciate your acknowledgment of the need for diverse priorities, but I still maintain that focusing excessively on climate change may detract from pressing global needs. While the current rate of change is concerning, we must also recognize that humanity’s ability to innovate and adapt has historically helped mitigate many challenges we face. By prioritizing economic growth and technological advancements, we can create conditions for sustainable practices to emerge organically, without getting caught in the cycle of alarmism that can stifle progress in other critical areas.",2.3545256619773673,3.9194015150541706,0.1974769330448826,,
348.0,disc,3.0,"Your perspective on innovation and adaptation is indeed important and highlights humanity's resilience in the face of various challenges. However, it’s also essential to consider that while economic growth can drive positive change, unchecked growth can exacerbate environmental degradation and climate impact, which in turn affects global stability. Striking a harmonious balance requires us to integrate climate considerations into our development strategies, ensuring that sustainable practices are not just an afterthought but a fundamental part of our progress.",2.2327504591733165,1.0005530201282753,0.004699839563434042,,,4.0,"I agree that unchecked growth can lead to environmental degradation, but I believe that integrating climate considerations into development strategies should not be the sole focus of our efforts. Emphasizing economic development and innovation can create a foundation for sustainable practices to take root naturally, without forcing them into our agenda. By addressing immediate human needs and advancing living standards, we lay the groundwork for a healthier environment, fostering stewardship without the urgency that can often lead to counterproductive measures.",2.1543367838873917,3.005075426122876,0.03426154084172063,,
348.0,disc,3.0,"You raise an important point about the value of prioritizing immediate human needs and fostering economic growth as a means to achieve sustainable practices. However, it’s worth noting that integrating climate considerations into our frameworks can enhance the resilience of both economies and ecosystems, preventing future crises that could undermine our progress. Ultimately, a proactive approach to addressing climate change alongside economic development may lead to a more robust and sustainable future, ensuring that stewardship becomes an integral part of our societal evolution rather than an afterthought.",2.4728171129031224,1.002473701119416,0.01731577545972842,,,4.0,"I appreciate your view on the potential benefits of integrating climate considerations into economic frameworks, yet I remain cautious about prioritizing climate action at the expense of immediate human needs. History shows that when economic stability is prioritized first, it creates a more solid foundation for sustainable practices to develop organically over time. By focusing on improving living standards and empowering innovation, we can foster resilience in both our economies and ecosystems without the constraint of alarmism, which can often hinder pragmatic solutions.",3.726904748343744e+47,3.9570323650948205,0.13499130658949204,,
348.0,disc,3.0,"Your perspective on the importance of prioritizing economic stability is certainly valid and reflects a common desire for gradual, organic development. However, it's essential to recognize that the impacts of climate change are not a distant threat; they are already affecting livelihoods and ecosystems today, and addressing them proactively can prevent more significant future disruptions. By creating frameworks that prioritize both economic development and immediate action on climate change, we can cultivate a holistic approach that supports resilience in both human and environmental spheres, ensuring that we are not merely reactive, but also forward-thinking.",2.9300767581233886,1.0000363092801805,0.0004016309280921951,,,4.0,"I understand your concerns about the immediate impacts of climate change and the importance of being proactive, but I believe that a reactive approach to climate action can often lead to hasty decisions that overlook broader economic implications. Focusing on economic stability and development can create the necessary momentum for lasting environmental stewardship that reflects the realities of human needs. By prioritizing human progress, we can cultivate innovation and resilience in a way that not only addresses climate challenges but also enhances overall societal well-being.",3.731885564740381e+46,3.8950634276932616,0.2578153689867874,,
