ID,TEXT_TYPE,INIT_OP_A,TEXT_A,PPL_A,PROBE_INT_A,H_INT_A,PROBE_EXT_A,H_EXT_A,INIT_OP_B,TEXT_B,PPL_B,PROBE_INT_B,H_INT_B,PROBE_EXT_B,H_EXT_B
355.0,tot,3.0,"Climate change is a complex issue that prompts a wide range of opinions and perspectives. On one hand, there are compelling arguments about the environmental impacts and potential risks to ecosystems and human health. On the other hand, some people raise questions about the effectiveness of proposed solutions and the economic ramifications. It's important to consider multiple viewpoints and the nuances involved in discussions surrounding this topic. Awareness and dialogue may help in addressing the various challenges associated with climate change, regardless of individual stance.",1.1077684904045092e+47,1.0000000259778132,4.007978800725303e-07,,,5.0,"I believe that the focus on climate change has been exaggerated and often distracts from more immediate and pressing issues facing humanity, such as poverty, healthcare, and education. Many proposed solutions, like drastic emissions cuts or transitioning to renewable energy, can have significant economic repercussions and may not effectively address the problem at hand. Instead of prioritizing climate change, we should be investing in technology and innovation that can improve our quality of life without imposing heavy regulations that could hinder development and progress.",1.7968866497657503,4.000138454259115,0.0013964212229409703,,
355.0,disc,3.0,"Climate change is an intricate issue that invites a diverse array of opinions and perspectives, reflecting the complexity of our global systems. It's crucial to acknowledge the compelling evidence regarding environmental impacts and health risks while also considering the economic implications of various proposed solutions. Engaging in thoughtful dialogue that incorporates multiple viewpoints will be essential for navigating the challenges posed by climate change effectively.",2.0054025039552537,1.0040701423904157,0.026464227496861698,,,5.0,"While I appreciate the acknowledgment of diverse opinions, I believe the focus on climate change often overshadows more immediate concerns like poverty and healthcare that affect millions today. The potential economic ramifications of drastic climate solutions cannot be overlooked, as they may hinder progress and development where it is needed most. Instead, we should prioritize innovation and technology that can address many of our pressing issues without imposing heavy regulations that stifle growth.",1.6542416626192786e+53,4.000049768155449,0.0005799482756539351,,
355.0,disc,3.0,"You raise an important point about the need to balance immediate concerns, such as poverty and healthcare, alongside the long-term challenges posed by climate change. It’s essential to explore innovative solutions that can address multiple issues simultaneously, ensuring that economic growth and environmental sustainability are not mutually exclusive. Ultimately, fostering open dialogue about how we can harness technology and creativity may lead us to more equitable and effective strategies for both climate action and social progress.",1.7080704946335377,1.0085775547848388,0.049357871750843135,,,5.0,"I agree that exploring innovative solutions that can tackle both immediate and long-term challenges is essential, but we must be cautious about prioritizing climate action over pressing social issues. While fostering dialogue is important, we should ensure that proposed solutions do not impose heavy regulatory burdens that could stifle economic growth and development. The focus should be on leveraging technology in ways that enhance our quality of life without diverting resources from critical areas like healthcare and education.",1.7067698443942334,4.000504148105529,0.005201241609085965,,
355.0,disc,3.0,"Absolutely, the caution you emphasize regarding the prioritization of climate action over urgent social issues is vital for a holistic approach. Balancing regulatory measures with economic growth is crucial, and we must strive to implement solutions that enhance both environmental sustainability and quality of life without draining resources from healthcare or education. By leveraging technology and fostering collaboration across sectors, we can seek innovative pathways that address various challenges concurrently, ensuring that no issue is sidelined in the pursuit of progress.",2.3959357682327624,1.0179867872343844,0.09009723385658291,,,5.0,"I appreciate the recognition of the need for a balanced approach, but we must remain vigilant against proposals that prioritize climate initiatives at the expense of essential services like healthcare and education. While collaboration and technology are key, we should ensure that the solutions we pursue do not come with prohibitive costs that could slow economic growth. Ultimately, our focus should be on advancements that directly improve people's lives, rather than getting caught up in climate initiatives that may not provide immediate benefits.",2.0331047674944434,4.000133805077429,0.0023784889676769843,,
355.0,disc,3.0,"Your concern about ensuring that climate initiatives do not come at the expense of essential services is both valid and necessary for meaningful progress. It's crucial that the solutions we advocate for are designed with the intent to deliver immediate benefits to people’s lives while also considering environmental sustainability. By remaining vigilant and prioritizing initiatives that integrate both social and environmental advancements, we can foster a future that supports all facets of human well-being without sacrificing one for the other.",1.728423727708646e+50,1.0229820816041781,0.10942787353502052,,,5.0,"While the intention to integrate social and environmental advancements is commendable, we must be realistic about the feasibility of such initiatives in practice. Often, the push for environmental sustainability can lead to regulations that may inadvertently restrict economic opportunities and divert resources away from pressing needs. It is essential to prioritize immediate improvements in quality of life first, ensuring that any environmental considerations do not compromise our ability to address the urgent issues facing society.",2.2017598320046274,4.001166261504361,0.011185262083030608,,
355.0,disc,3.0,"You bring up an important concern regarding the practical feasibility of integrating social and environmental initiatives, and it’s vital that we approach these discussions with a realistic outlook. The risk of regulations unintentionally hindering economic opportunities is something we should strive to mitigate, ensuring that our efforts truly enhance quality of life. By prioritizing immediate benefits while also incorporating thoughtful environmental considerations, we can work towards a balanced approach that addresses urgent needs without neglecting the health of our planet for future generations.",3.480974355463251e+46,1.0002038772939397,0.001934492833270691,,,5.0,"I appreciate your acknowledgment of the challenges in integrating these initiatives and the importance of a realistic approach. However, it’s crucial to recognize that even well-intentioned policies can have unintended consequences that may exacerbate the very issues we seek to address, especially in the economic realm. We should focus on immediate, tangible benefits for society first, and only consider environmental measures that don’t impose heavy costs or regulations that could disrupt economic growth and progress.",2.5067666654083594,4.04732138166327,0.19162941531146185,,
