ID,TEXT_TYPE,INIT_OP_A,TEXT_A,PPL_A,PROBE_INT_A,H_INT_A,PROBE_EXT_A,H_EXT_A,INIT_OP_B,TEXT_B,PPL_B,PROBE_INT_B,H_INT_B,PROBE_EXT_B,H_EXT_B
365.0,tot,3.0,"Climate change is a complex issue that elicits a wide range of opinions and perspectives. On one hand, there is significant scientific evidence suggesting changes in climate patterns and potential impacts on ecosystems, weather events, and human health. On the other hand, the approaches to address these changes, the economic implications, and the effectiveness of proposed solutions are subjects of ongoing debate. The discussion around climate change involves not just environmental aspects, but also social, political, and economic dimensions that make it a multifaceted topic. It's essential to consider all viewpoints and data when exploring this issue.",1.7405375913257974,1.0000000100158206,1.3591383951595409e-07,,,5.0,"I believe that the focus on climate change has been exaggerated and often distracts from more pressing and immediate issues facing humanity, such as poverty, healthcare, and education. Many proposed solutions, like drastic policy changes and economic upheaval, could harm economies and livelihoods without guaranteeing significant impact on climate. Instead of prioritizing climate alarmism, we should invest in innovation and technology that can address environmental concerns without sacrificing progress and development. It's important to critically assess the data and consider the broader picture of human welfare rather than focusing solely on climate narratives.",8.424784182525457e+40,3.9990210703113025,0.02153857033492191,,
365.0,disc,3.0,"Climate change is undeniably one of the most pressing challenges we face today, with scientific evidence increasingly pointing to the significant impact human activities have on our planet's climate systems. However, the conversation about how to effectively address these changes must encompass not only environmental solutions but also social and economic implications that affect various communities differently. As we engage in this discussion, it's crucial that we remain open to diverse perspectives and robust data to foster a well-rounded understanding of the issues at hand.",9.519473596014106e+46,1.0000078923111668,0.00010060501497814086,,,5.0,"While I understand the concern regarding climate change, I believe that the urgency surrounding it can often overshadow other critical issues like poverty, healthcare, and education that require immediate attention. Additionally, proposed environmental solutions can sometimes lead to economic disruption without ensuring real benefits, making it essential to assess the broader implications of any climate policies. We should emphasize technological innovation and pragmatism rather than alarmism, fostering sustainable progress that addresses multiple human welfare needs simultaneously.",5.335197922331723e+49,4.000257422273807,0.002459027767380764,,
365.0,disc,3.0,"I appreciate your perspective on the need to balance climate change with other pressing issues like poverty, healthcare, and education; these are indeed interconnected challenges that deserve our attention. It's important to recognize that addressing climate change can, in many cases, create opportunities for technological innovation and economic growth, potentially alleviating some of the very issues you mentioned. By taking a pragmatic approach that considers the broader social implications of climate policies, we can strive for solutions that not only mitigate environmental impacts but also promote overall human welfare.",1.587198608880716,1.0040706472150287,0.02646635946132645,,,5.0,"While I acknowledge that tackling climate change could spur some technological innovations, I remain cautious about the potential economic upheaval that many climate policies may entail. The focus should be on fostering a stable economy and improving immediate human welfare through sound investments in healthcare, education, and poverty reduction without compromising livelihoods. Ultimately, we must prioritize solutions that align with advancing human progress and well-being rather than getting caught in the climate alarmism narrative that can divert resources from these more pressing concerns.",6.41760632110496e+93,4.000119418066735,0.002491165971395366,,
365.0,disc,3.0,"Your concern about potential economic upheaval from climate policies is valid and highlights the need for a careful consideration of how we implement these solutions. However, it's essential to recognize that investing in sustainable practices and technologies can also lead to long-term economic stability, creating new industries and job opportunities that can enhance human welfare. Striving for a balance that includes both immediate priorities and environmental stewardship allows us to create a more resilient future that addresses the interconnectedness of all these critical issues.",2.459677230582357,1.0000101837888136,0.00012688241885796197,,,5.0,"I agree that careful implementation of any policies is vital, but we must remember that many proposed climate initiatives carry a risk of short-term disruption that can adversely affect communities reliant on traditional industries. The promise of job creation in green sectors is appealing, but the transition must be practical and gradual to avoid significant economic fallout for those currently employed in those sectors. Ultimately, rather than relying solely on environmental stewardship, we should foster innovation that transcends climate discussions, focusing on immediate human welfare and stable economic growth as a priority.",1.2383429968350947e+43,3.9986094708277022,0.014241652768249846,,
365.0,disc,3.0,"You raise an important point about the potential short-term disruptions that climate initiatives may pose to communities dependent on traditional industries, and a gradual transition is indeed crucial to mitigate those impacts. Emphasizing practical solutions that support both innovation and the needs of current workers can help ensure that no one is left behind during this shift. By integrating efforts to advance human welfare and economic stability with responsible environmental practices, we can create a more sustainable future that values both people and the planet.",1.8291527153655174,1.000006541477902,8.157566124388509e-05,,,5.0,"I appreciate the recognition of the need for a gradual transition, but I remain skeptical about the feasibility of balancing immediate worker needs with ambitious climate goals without risking economic stability. The urgency often associated with climate initiatives can overshadow the critical need for a strategic approach that prioritizes existing livelihoods and sound economic policies. Rather than pushing for rapid environmental changes, we should focus on fostering innovation that improves human welfare while ensuring that any environmental efforts genuinely complement, rather than disrupt, economic progress.",5.678621765029713e+93,4.00032073190018,0.015259342725022287,,
365.0,disc,3.0,"Your skepticism about balancing worker needs with ambitious climate goals is a legitimate concern and underscores the importance of strategic planning in this transition. A well-thought-out approach that prioritizes both existing livelihoods and sustainable practices can indeed pave the way for innovations that enhance human welfare while mitigating environmental impacts. Engaging in collaborative dialogue that includes input from affected communities can help us design solutions that ensure economic stability while progressing towards essential climate objectives, ultimately benefiting both people and the planet.",2.2357364387938694,1.0000041767930128,5.222292418183124e-05,,,5.0,"While I see the value in collaborative dialogue and strategic planning, I am concerned that the focus on ambitious climate objectives can sometimes lead to hasty decisions that overlook immediate human needs. It’s crucial that any proposed solutions prioritize practical benefits such as job security and economic stability over abstract environmental goals that may not show immediate results. Ultimately, we should redirect our energies toward innovations that address pressing social issues directly, fostering a more sustainable future without compromising the livelihoods of those directly impacted.",2.738333230597671,4.005452878072239,0.04676353394055679,,
