ID,TEXT_TYPE,INIT_OP_A,TEXT_A,PPL_A,PROBE_INT_A,H_INT_A,PROBE_EXT_A,H_EXT_A,INIT_OP_B,TEXT_B,PPL_B,PROBE_INT_B,H_INT_B,PROBE_EXT_B,H_EXT_B
378.0,tot,4.0,"I believe that while environmental issues are important, the emphasis on climate change often overshadows other pressing concerns that deserve equal attention. There are natural climate fluctuations that have occurred throughout Earth's history, and many argue that humanity's ability to adapt is significant. Rather than focusing solely on climate change, we should prioritize economic development, technological innovation, and improving living standards globally, which can also contribute to better environmental stewardship. Addressing immediate human needs can lead to more sustainable long-term solutions without the alarmism often tied to climate narratives.",2.1750663053311254,3.9755955138044814,0.09459612121663731,,,1.0,"Climate change is one of the most pressing issues of our time, affecting not only the environment but also public health, economies, and social equity. The evidence is undeniable—rising temperatures, extreme weather events, and melting ice caps are all consequences of human activity. Urgent action is needed, not just from governments but also from individuals and businesses to reduce carbon emissions and shift towards sustainable practices. The time to act is now, as the longer we wait, the more severe the repercussions will be for future generations. It's essential to foster awareness and advocate for policies that prioritize the planet's health. Every step towards sustainability is a step towards a viable future.",1.8924349448496236,1.0000000105921496,5.494531202072477e-08,,
378.0,disc,4.0,"While climate change is an important topic, I believe we must also consider a broader range of pressing global issues that deserve our attention. Historical climate fluctuations demonstrate that humanity has a remarkable ability to adapt, and we should focus on economic development and technological innovation to address immediate human needs. By prioritizing these areas, we can foster sustainable solutions that improve living standards and enhance environmental stewardship without falling into alarmist narratives.",1.5970752895912164,3.9996903877916474,0.00601025263894446,,,1.0,"I agree that addressing immediate human needs and fostering economic development are crucial; however, we must recognize that climate change is fundamentally intertwined with these issues. Historical climate fluctuations do not negate the current, unprecedented rate of change driven by human activity, which poses significant risks to both our environment and societal stability. Emphasizing technological innovation is vital, but it should be coupled with urgent action to mitigate climate change, as sustainable solutions cannot be pursued effectively in a deteriorating environment.",1.846166750038321,1.000000047450335,2.283532741565826e-07,,
378.0,disc,4.0,"I appreciate your perspective and agree that climate change is interconnected with various global challenges. However, I argue that a balanced approach is essential; prioritizing immediate human needs and driving economic development can also create the conditions necessary for sustainable solutions. By addressing issues like poverty and lack of access to resources, we can empower communities to engage in environmental stewardship without succumbing to fear-based narratives that may hinder progress.",2.1932845971962287,2.5640882797556364,0.7672489432773325,,,1.0,"I wholeheartedly agree that a balanced approach is vital and that addressing poverty and resource access can facilitate community engagement in environmental stewardship. However, we must recognize that climate change disproportionately affects the most vulnerable populations, and failing to address it urgently could exacerbate existing challenges like poverty and inequality. It's essential to pursue solutions that marry immediate human needs with proactive climate action, ensuring that we don't sidestep the pressing realities of our environmental crises while working towards a sustainable future.",1.2997592604175335e+48,1.0000010798675703,4.353648457177685e-06,,
378.0,disc,4.0,"You're absolutely right that climate change disproportionately impacts vulnerable populations, and that is a critical aspect we must consider. My intention is not to sidestep the urgency of climate action, but to highlight that addressing immediate human needs can provide a more solid foundation for community resilience in the face of environmental challenges. By integrating climate strategies with economic development and technological advancements, we can create a holistic approach that meets both current humanitarian needs and long-term sustainability goals, ultimately benefiting all communities.",1.0903740485761538e+47,2.0032381905731826,0.013528947939493944,,,1.0,"I appreciate your emphasis on creating a holistic approach that integrates climate strategies with economic development and technological advancements, as this is indeed vital for fostering resilience. However, it's crucial that we prioritize swift action on climate change as a foundational element of that resilience, rather than viewing it as a secondary concern. By aligning climate solutions with immediate human needs, we can ensure that communities not only withstand environmental challenges but also thrive sustainably in the long run.",1.9432949656186969,1.0000000326121068,1.6000214256920822e-07,,
378.0,disc,4.0,"I understand the importance of prioritizing swift action on climate change, and I agree it should be a key component of building resilience in communities. However, I maintain that quick fixes in climate policy without addressing fundamental issues like poverty and inequality may not yield the sustainable outcomes we desire. By focusing on holistic solutions that marry climate strategies with economic empowerment, we can create a more resilient framework that not only responds to environmental challenges but also enhances the overall well-being of communities, leading to a more sustainable future for all.",2.0169894648320242e+43,2.0393854816730164,0.14883426001791705,,,1.0,"I completely agree that addressing fundamental issues like poverty and inequality is essential for achieving long-term sustainability and community resilience. However, we must ensure that climate action is not treated as an afterthought but rather as a parallel and integral part of these holistic solutions, as the effects of climate change are already being felt and will intensify quickly. By embedding climate considerations into economic empowerment efforts, we can strive for a future where communities are not only resilient to environmental challenges but also equitable and thriving.",3.442530153249968e+45,1.0000025903959633,9.876000371922638e-06,,
378.0,disc,4.0,"I appreciate your emphasis on embedding climate considerations into economic empowerment efforts, and I agree that integrating these aspects is crucial for fostering resilience. My viewpoint is that while climate action should be prioritized, we must also ensure that it is pursued in a way that doesn't overshadow other urgent human needs that can impede progress if left unaddressed. By fostering an environment where communities have access to resources and opportunities, we can create a strong foundation for both immediate and long-term climate solutions, ensuring that all aspects of well-being are addressed concurrently.",1.1043254543713716e+42,2.0799671853927446,0.19311077809195754,,,1.0,"I appreciate your recognition of the need for integrating climate action with addressing urgent human needs, as both are critical for fostering genuine resilience in communities. It's important to remember that climate change is not a separate issue but is deeply connected to many of those urgent needs; therefore, addressing it alongside social and economic challenges can create synergies that enhance overall well-being. By adopting a comprehensive approach that values both immediate and long-term climate solutions, we can empower communities to thrive in a sustainable manner without sacrificing either aspect.",2.2202735390322825,1.0000001656060917,7.452891895808749e-07,,
