ID,TEXT_TYPE,INIT_OP_A,TEXT_A,PPL_A,PROBE_INT_A,H_INT_A,PROBE_EXT_A,H_EXT_A,INIT_OP_B,TEXT_B,PPL_B,PROBE_INT_B,H_INT_B,PROBE_EXT_B,H_EXT_B
38.0,tot,1.0,"Climate change is one of the most pressing issues of our time, affecting not only the environment but also public health, economies, and social equity. The evidence is undeniable—rising temperatures, extreme weather events, and melting ice caps are all consequences of human activity. Urgent action is needed, not just from governments but also from individuals and businesses to reduce carbon emissions and shift towards sustainable practices. The time to act is now, as the longer we wait, the more severe the repercussions will be for future generations. It's essential to foster awareness and advocate for policies that prioritize the planet's health. Every action counts.",1.8617958512718065,1.0000000369607371,1.8018085830857975e-07,,,2.0,"Climate change is one of the most pressing issues of our time, posing serious threats to ecosystems, economies, and human health. The scientific consensus is clear: human activities, particularly the burning of fossil fuels, are driving unprecedented changes in our climate. These changes result in extreme weather events, rising sea levels, and altered agricultural patterns, impacting food security and biodiversity. 

Addressing climate change requires urgent collective action, including transitioning to renewable energy sources, improving energy efficiency, and promoting sustainable practices. Furthermore, equitable policy solutions are essential to support vulnerable communities and nations disproportionately affected by climate impacts. It’s vital to raise awareness, foster collaboration, and implement strategies that mitigate these effects for a sustainable future.",1.8811982436525967,1.0000000082486387,4.330434642073019e-08,,
38.0,disc,1.0,"Climate change is a critical challenge that we cannot afford to ignore, as it threatens our ecosystems, public health, and economic stability. The alarming rise in global temperatures and the frequency of extreme weather events are clear signs that immediate action is essential. I believe we must work together—individuals, businesses, and governments alike—to implement sustainable practices and advocate for policies that prioritize the health of our planet for the sake of current and future generations.",1.7036138551912603,1.0000000005270606,3.1294220393759048e-09,,,2.0,"I completely agree that climate change is a critical challenge that demands our urgent attention and collective action. The rising global temperatures and increased frequency of extreme weather events highlight the necessity for immediate and comprehensive strategies to mitigate these impacts. By collaborating across all sectors—individuals, businesses, and governments—we can implement sustainable practices and create equitable policies that protect our planet and ensure a healthier future for generations to come.",1.4781445612621142,1.0000000005292145,3.1416717546794245e-09,,
38.0,disc,1.0,"I’m glad to hear that you share my concern about the urgency of addressing climate change. Collaboration is indeed key, as it empowers us to leverage the strengths of various sectors to drive impactful change. Together, we can foster innovative solutions that not only mitigate the effects of climate change but also promote social equity and economic resilience, ensuring a sustainable future for all.",1.6203606996425897,1.0000000050006115,2.6878286599737128e-08,,,2.0,"Absolutely, collaboration is essential, and leveraging the strengths of various sectors is crucial for driving meaningful change. By fostering innovative solutions that both address climate change and promote social equity, we can create a more resilient and inclusive society. It's imperative that we keep this momentum going and engage diverse stakeholders to ensure that our approaches benefit everyone and protect our planet for the long term.",2.0112713376219107,1.0000000003622431,2.184778473748553e-09,,
38.0,disc,1.0,"I completely agree that engaging diverse stakeholders is vital for creating inclusive and effective climate strategies. By bringing together voices from different communities, we can ensure that our solutions not only address environmental challenges but also uplift those most affected by these issues. Let’s continue to amplify these conversations and seek out partnerships that focus on sustainability and equity, as this is the path toward a healthier planet and a fairer society.",1.7547217265284078e+55,1.0000003093878511,1.3439007312206292e-06,,,2.0,"You're absolutely right; engaging diverse voices is essential for developing comprehensive climate strategies that truly reflect the needs of all communities. By prioritizing the perspectives of those most affected by climate change, we can create solutions that are not only effective but also equitable, ensuring that no one is left behind. Continuing to amplify these conversations and seeking partnerships focused on sustainability and equity will be key in our collective journey toward a healthier planet and a more just society.",1.4847415480869857,1.0000000038954862,2.1205033622871558e-08,,
38.0,disc,1.0,"I appreciate your emphasis on prioritizing the voices of those most impacted by climate change; it's crucial for fostering solutions that are genuinely representative and effective. Ensuring that every community has a seat at the table will help us craft policies that address the unique challenges they face while promoting resilience and equity. As we move forward, let’s remain committed to open dialogue and collaboration, so we can collectively advance the fight against climate change and create a future that benefits all.",1.938932401543313,1.0000000782238627,3.66701503205107e-07,,,2.0,"Thank you for emphasizing the importance of inclusion in our approach to climate change; it truly is essential for achieving meaningful solutions. By ensuring every community is represented, we can craft policies that not only address their unique challenges but also enhance resilience and promote equity for all. Committing to open dialogue and collaboration will empower us to tackle this pressing issue together and build a sustainable future that benefits everyone involved.",2.053556928248339,1.000000013595837,6.967797305559054e-08,,
38.0,disc,1.0,"I’m glad we share this understanding of the critical role inclusion plays in developing effective climate solutions. By actively involving diverse communities in the conversation, we can better understand their specific needs and create strategies that empower everyone to thrive. Let’s strive to maintain this momentum of collaboration and commitment, as it will be essential for overcoming the challenges ahead and ensuring a sustainable and equitable future for all.",2.180173449392854,1.0000017803526562,6.954582836447208e-06,,,2.0,"I wholeheartedly agree; fostering inclusion is key to understanding the unique needs of diverse communities and creating effective climate solutions. By actively engaging these voices, we can develop strategies that not only empower individuals but also cultivate a sense of shared responsibility towards our environment. Maintaining our momentum of collaboration and commitment will undoubtedly be vital in overcoming future challenges and achieving a sustainable and equitable future for all.",1.8666926896674396,1.0000000034390206,1.8806605358359623e-08,,
