ID,TEXT_TYPE,INIT_OP_A,TEXT_A,PPL_A,PROBE_INT_A,H_INT_A,PROBE_EXT_A,H_EXT_A,INIT_OP_B,TEXT_B,PPL_B,PROBE_INT_B,H_INT_B,PROBE_EXT_B,H_EXT_B
395.0,tot,4.0,"I believe that while environmental issues are important, the emphasis on climate change often overshadows other pressing concerns that deserve equal attention. The notion that climate change is the most urgent problem can lead to ineffective policies that prioritize it over critical economic, social, and infrastructural challenges. Moreover, many predictions about climate impacts are based on models with inherent uncertainties. It’s crucial to strike a balance in our approach, ensuring we address a wider range of issues without disproportionate focus on climate change alone.",4.288902126639324e+44,3.0001498250679677,0.7214142492926249,,,1.0,"Climate change is one of the most pressing issues of our time, affecting not only the environment but also public health, economies, and social equity. The evidence is undeniable—rising temperatures, extreme weather events, and melting ice caps are all consequences of human activity. Urgent action is needed, not just from governments but also from individuals and businesses to reduce carbon emissions and shift towards sustainable practices. The time to act is now, as the longer we wait, the more severe the repercussions will be for future generations. It's essential to foster awareness and advocate for policies that prioritize the planet's health. Every step towards sustainability is a step towards a viable future.",1.882586643769717,1.0000000224197048,1.1209639364985533e-07,,
395.0,disc,4.0,"I appreciate the opportunity to discuss climate change, but I want to emphasize that while it's a significant concern, it shouldn't overshadow the multitude of pressing issues we face, such as poverty, healthcare, and education. Focusing exclusively on climate change might lead to policies that overlook these critical areas and could ultimately hinder overall progress. We need a balanced approach that considers the complexities of various challenges and seeks to address them collectively rather than prioritizing one over the others.",2.0925795461520895,3.243883077900891,0.6982090710245539,,,1.0,"I completely understand your perspective, and I agree that issues like poverty, healthcare, and education are equally important. However, it's crucial to recognize that climate change exacerbates many of these challenges; for instance, extreme weather can displace communities, compromise food security, and strain healthcare systems. By addressing climate change, we can create a more sustainable framework that benefits all of these interconnected issues, ultimately fostering long-term progress for society as a whole.",1.7436654764762023,1.0000002126344976,9.436370514240956e-07,,
395.0,disc,4.0,"Your points about the interconnectedness of climate change with other societal issues are valid, and I acknowledge that extreme weather can indeed have ripple effects on communities and resources. However, I believe it's important to ensure that our solutions to climate change do not inadvertently overlook or deprioritize immediate social and economic needs that many people are currently facing. A comprehensive strategy that addresses climate change alongside urgent economic and social concerns may lead to more effective outcomes, rather than a singular focus that could neglect those who are suffering in the present.",2.2358109063803,2.0226743016784976,0.09896874276702759,,,1.0,"I appreciate your emphasis on the need for a comprehensive strategy that balances immediate social and economic needs with climate action. It’s essential to design solutions that are both environmentally sustainable and socially equitable, ensuring that no one is left behind during the transition. By integrating climate initiatives with efforts to alleviate poverty and improve healthcare, we can create a more resilient society that meets the urgent needs of today while safeguarding the planet for future generations.",1.5249077254792127,1.0000001461489367,6.622349564242809e-07,,
395.0,disc,4.0,"I completely agree that a strategy which integrates climate initiatives with social equity and immediate needs is crucial to creating a resilient society. However, we must also be cautious that the pursuit of environmental sustainability doesn't unintentionally impose a heavier burden on those who are already vulnerable, potentially exacerbating existing inequalities. Striking this balance requires transparent dialogue and policies that genuinely reflect the diverse needs of all communities, rather than a one-size-fits-all approach that prioritizes climate action above other critical issues.",1.1045317082960864e+46,2.024284289690967,0.10587921510398784,,,1.0,"Your concerns about the potential unintended consequences of climate initiatives on vulnerable populations are valid and warrant serious consideration. It's vital that we engage in transparent dialogue and collaborate with communities directly affected by both climate change and social inequities to ensure that our policies are inclusive and equitable. By actively involving diverse voices in the decision-making process, we can develop tailored solutions that uplift all communities while effectively addressing the urgent challenge of climate change.",1.623727068049718,1.0000005100954688,2.152174311183842e-06,,
395.0,disc,4.0,"I appreciate your emphasis on the importance of involving affected communities in the decision-making process, as their insights are essential to crafting effective policies. Ensuring that diverse voices are heard will not only lead to more equitable solutions but also help us identify potential trade-offs and consequences in our approaches. However, we should remain vigilant about the potential for climate-focused initiatives to dominate the agenda, risking the marginalization of pressing social issues that also need urgent attention and resources.",2.2798750245425103,2.0005133615550896,0.0038252267016375746,,,1.0,"I completely agree that vigilance is necessary to prevent climate initiatives from overshadowing other urgent social issues. It’s essential to maintain a holistic view that recognizes the interdependence of these challenges, ensuring that policies are not only climate-focused but also address pressing social needs. By fostering a multi-faceted approach that values the equally urgent nature of economic, health, and educational concerns, we can create a more inclusive framework that benefits all aspects of society while also tackling the climate crisis head-on.",3.086410765305102e+45,1.0000000224182322,1.1213309859089017e-07,,
395.0,disc,4.0,"I appreciate your agreement on the need for a holistic approach that acknowledges the interdependence of climate and social issues. It’s vital that we prioritize policies that consider the broader context, not just climate impacts in isolation, as this will lead to more comprehensive solutions. By fostering collaboration across sectors, we can ensure that we address both immediate social needs and the long-term challenge of climate change without losing sight of the other critical issues that deserve equal attention.",7.775708719324288e+97,2.0002825040492547,0.003130613672273694,,,1.0,"Absolutely, prioritizing collaboration across sectors is key to developing comprehensive solutions that address both immediate social needs and long-term climate challenges. By fostering partnerships between governments, businesses, and communities, we can create innovative approaches that leverage resources and expertise from all areas. This multipronged strategy not only enriches our response to climate change but also strengthens social equity, ensuring that we create a sustainable future where everyone can thrive.",1.521170112788327e+53,1.000000053768934,2.571440454066023e-07,,
