ID,TEXT_TYPE,INIT_OP_A,TEXT_A,PPL_A,PROBE_INT_A,H_INT_A,PROBE_EXT_A,H_EXT_A,INIT_OP_B,TEXT_B,PPL_B,PROBE_INT_B,H_INT_B,PROBE_EXT_B,H_EXT_B
402.0,tot,4.0,"I believe that while environmental issues are important, the emphasis on climate change often overshadows other pressing concerns that need immediate attention. There are numerous factors affecting our planet, such as pollution, deforestation, and resource depletion, that deserve equal focus. Additionally, the economic implications of drastic policy changes aimed at combating climate change could have significant negative effects on jobs and livelihoods. It is important to take a balanced approach that considers economic stability and the broader context of environmental issues, rather than prioritizing climate change above all else.",1.8882296014127247,2.5725655724582186,0.8039015570734981,,,2.0,"Climate change is one of the most pressing issues of our time, posing serious threats to ecosystems, economies, and human health. The scientific consensus is clear: human activities, particularly the burning of fossil fuels, are driving unprecedented changes in our climate. These changes result in extreme weather events, rising sea levels, and altered agricultural patterns, impacting food security and biodiversity. 

Addressing climate change requires urgent collective action, including reducing greenhouse gas emissions, transitioning to renewable energy, and promoting sustainable practices. Furthermore, it necessitates global cooperation and equitable solutions to support vulnerable communities most affected by climate impacts. The longer we delay, the more severe the consequences will be, making it imperative for individuals, governments, and organizations to work together towards a sustainable future.",1.6028730537277767,1.0000001461516785,6.622466948049272e-07,,
402.0,disc,4.0,"While addressing climate change is undoubtedly important, we must not forget the myriad of other environmental issues that also require our urgent attention, such as pollution and deforestation. It's crucial to take a balanced approach that integrates economic considerations, as drastic policy changes could jeopardize jobs and livelihoods. By broadening our focus, we can develop more holistic solutions that protect both the environment and the economy.",1.7336770074034002,3.1246051491875564,0.7139552085553851,,,2.0,"While I appreciate the recognition of other environmental issues like pollution and deforestation, it's essential to understand that climate change acts as a ""threat multiplier,"" exacerbating these problems and demanding urgent attention. A balanced approach is vital, but it should not come at the expense of addressing the root causes of climate change, particularly the burning of fossil fuels. By prioritizing sustainable solutions that simultaneously tackle climate change and economic concerns, we can foster a resilient future for both our planet and our communities.",1.726903555594377,1.0000000030388794,1.6712370887647016e-08,,
402.0,disc,4.0,"I agree that climate change can exacerbate various environmental issues, making it imperative that we address it effectively. However, my concern lies in how an overemphasis on climate change can distract us from immediate problems, such as pollution control and resource management, which require urgent action. We should aim for integrated solutions that address climate change alongside other pressing environmental issues, ensuring that economic stability and job security remain a central focus in our strategies.",2.305042924760578,2.006967960679611,0.026716428750740633,,,2.0,"I completely agree that integrated solutions are essential and that immediate problems like pollution control and resource management should also be prioritized. However, it’s important to recognize that the impacts of climate change are already manifesting and will increasingly complicate our ability to tackle these other issues effectively. By addressing climate change head-on, we not only mitigate its far-reaching effects but also create opportunities for innovation and green job growth, ultimately supporting both a sustainable environment and economic stability.",1.86558197952177,1.0000054838554797,1.9879165183479258e-05,,
402.0,disc,4.0,"I understand your point about the urgency of addressing climate change and how it can complicate our efforts to tackle other environmental problems. However, we must also be cautious about how we approach these issues, as some drastic measures to combat climate change could hinder existing jobs and economic growth. Striking a balance that promotes innovation and green job creation while simultaneously ensuring that we don't lose sight of more immediate environmental and economic challenges is key to achieving lasting solutions for both people and the planet.",2.5522915726849438,2.0195489430874547,0.0929529512244301,,,2.0,"I appreciate your emphasis on the need for careful consideration in our approach to addressing climate change, as protecting jobs and economic growth is indeed crucial. However, I believe that investing in green technology and sustainable practices can actually drive economic growth and create new job opportunities in emerging industries rather than hindering them. By embracing innovation and prioritizing a transition to a low-carbon economy, we can tackle immediate environmental challenges while also laying the groundwork for a more resilient and sustainable future for all.",1.8659580953841297,1.0000012236313458,4.894794050026721e-06,,
402.0,disc,4.0,"I appreciate your perspective on the potential for green technology to drive economic growth and create new job opportunities. However, we must remain vigilant about the transition process, ensuring that it includes support for workers in industries that may be negatively impacted. By fostering innovation in a way that also safeguards existing jobs and addresses immediate environmental concerns, we can create a more comprehensive strategy that benefits both the economy and our planet in the long term.",1.6919766358687516,1.9998736905078844,0.0024554306566297226,,,2.0,"You raise an important point about the need for a just transition that supports workers in industries that could be adversely affected by the shift to a green economy. It’s crucial that we implement policies that provide retraining and support, ensuring that no one is left behind as we move forward. By prioritizing inclusivity and resilience in our strategies, we can successfully navigate the challenges of the transition while fostering both economic stability and a healthy, sustainable environment for future generations.",1.874957553683282,1.000006214112312,2.2334056720852793e-05,,
402.0,disc,4.0,"I fully agree that a just transition is essential to ensure that workers are supported as we shift towards a greener economy. Providing retraining and support not only helps those affected but also strengthens the overall workforce, making it more adaptable to new industries. By prioritizing inclusivity, we can create a more equitable approach that allows everyone to contribute to and benefit from the transition towards a sustainable and resilient future.",1.8058228552150404,1.991423119432531,0.04936154241515805,,,2.0,"I'm glad to see our agreement on the importance of a just transition, as it truly is a cornerstone of building a sustainable future. By investing in retraining and support systems, we can empower workers to thrive in new green industries, ultimately fostering a more dynamic and resilient economy. This inclusive model not only addresses the needs of those affected but also harnesses the potential of all individuals to contribute to the collective effort in combating climate change and protecting our planet.",1.8757855016332705,1.0000002409502804,1.061749519045598e-06,,
