ID,TEXT_TYPE,INIT_OP_A,TEXT_A,PPL_A,PROBE_INT_A,H_INT_A,PROBE_EXT_A,H_EXT_A,INIT_OP_B,TEXT_B,PPL_B,PROBE_INT_B,H_INT_B,PROBE_EXT_B,H_EXT_B
430.0,tot,4.0,"I believe that while environmental issues are important, the emphasis on climate change often overshadows other pressing concerns that deserve equal attention. There are natural climate fluctuations that have occurred throughout Earth's history, and many argue that humanity's ability to adapt is significant. Rather than focusing solely on climate change, we should prioritize economic development, technological innovation, and improving living standards globally, which can also contribute to better environmental stewardship. Addressing immediate human needs can lead to more sustainable long-term solutions without the alarmism often tied to climate narratives.",2.1788670268251007,3.8424249937804857,0.4170525938691778,,,3.0,"Climate change is a complex issue that elicits a wide range of opinions and perspectives. On one hand, there are significant concerns about environmental impacts, economic implications, and social justice related to climate effects. On the other hand, the debate includes discussions about the effectiveness of various policy responses and the balance between economic development and environmental sustainability. Ultimately, the conversation around climate change involves weighing scientific evidence, economic considerations, and societal values, making it a multifaceted topic that requires thoughtful consideration from all sides.",1.8814037347164014,1.0000000390396413,5.777466566596433e-07,,
430.0,disc,4.0,"While climate change is an important topic, I believe we must also consider a broader range of pressing global issues that deserve our attention. Historical climate fluctuations demonstrate that humanity has a remarkable ability to adapt, and we should focus on economic development and technological innovation to address immediate human needs. By prioritizing these areas, we can foster sustainable solutions that improve living standards and enhance environmental stewardship without falling into alarmist narratives.",1.5999439932927606,3.8968207508130535,0.24238029785839194,,,3.0,"I appreciate your perspective on the need to prioritize economic development and technological innovation; these are indeed crucial for addressing immediate human needs. However, it's essential to recognize that climate change is interconnected with many of these pressing issues and can exacerbate existing challenges, particularly for vulnerable populations. A balanced approach that includes proactive climate strategies alongside economic growth can lead to sustainable solutions that benefit both people and the planet.",1.4902116258807236,1.0000000176126853,1.7397840390480415e-07,,
430.0,disc,4.0,"I understand the concern regarding the interconnectedness of climate change and other issues, particularly for vulnerable populations. However, I believe that in order to effectively address these challenges, we should focus on enhancing economic resilience and technological advancements that can lift people out of poverty and improve living standards, which in turn may lead to more effective environmental stewardship. By tackling immediate human needs first, we can create a solid foundation that allows for more sustainable and balanced approaches to environmental issues in the long run.",9.489634393239849e+45,3.9946143053183607,0.03326278774018766,,,3.0,"Your point about enhancing economic resilience and technological advancements as a means to lift people out of poverty is well taken and certainly a vital component of any sustainable strategy. However, it’s important to consider that neglecting the urgency of climate change could undermine those advancements, as extreme weather events and environmental degradation can disproportionately impact already vulnerable communities. By integrating immediate human needs with proactive environmental policies, we can create a holistic approach that safeguards both economic growth and ecological health for future generations.",1.9720399206409231,1.0000000050035547,3.699721305080993e-08,,
430.0,disc,4.0,"I appreciate your emphasis on the urgency of climate change and the potential risks it poses to vulnerable communities. However, I believe that by placing our primary focus on economic growth and technological progress, we can create the necessary resources and innovations to effectively manage environmental challenges as they arise. A solutions-oriented approach that prioritizes human development can better equip us to tackle not only climate issues but also a range of other pressing global concerns, ultimately benefiting both society and the environment.",4.8599692555408564e+95,3.84286837020273,0.45090061178907676,,,3.0,"I recognize the value in a solutions-oriented approach that prioritizes economic growth and technological progress, as these can indeed generate resources for tackling environmental challenges. However, it’s crucial to ensure that this growth is environmentally sustainable and inclusive, as unchecked economic development can lead to further environmental degradation and social inequality. By integrating climate considerations into our development strategies from the outset, we can create resilient systems that not only foster human advancement but also protect our planet for future generations.",1.5987554176789711,1.000000202876528,1.1279151159701362e-06,,
430.0,disc,4.0,"I completely agree that a balance between economic growth and environmental sustainability is essential for long-term resilience. However, I still believe that tackling immediate human needs through economic development can lay the groundwork for more sustainable practices; when people are lifted out of poverty, they are often in a better position to value and protect their environments. By fostering innovation and addressing economic disparities first, we can naturally incorporate more sustainable practices as we advance, ultimately leading to both human and ecological progress.",3.5552241247243e+47,3.9597117401259037,0.1698084673070423,,,3.0,"Your argument highlights an important connection between alleviating poverty and fostering environmental stewardship, and I agree that addressing immediate human needs can empower individuals to engage in sustainable practices. Nevertheless, while economic development can indeed provide a platform for advancing sustainability, the urgency of climate change demands that we simultaneously prioritize environmental considerations to prevent exacerbating existing vulnerabilities. By integrating sustainable practices into our economic development framework from the outset, we can ensure that progress enhances, rather than undermines, both human wellbeing and ecological integrity in the long run.",2.3598195153841752,1.000000040760103,3.1996680802225165e-07,,
430.0,disc,4.0,"I appreciate your recognition of the link between poverty alleviation and environmental stewardship, and I share your concern about the urgency of addressing climate change. That said, I believe that the prioritization of immediate human needs, through economic development, offers us an opportunity to empower communities to engage in environmental practices more readily. By focusing first on lifting people out of poverty, we create a base that can naturally support sustainable initiatives, ultimately achieving a balance where both human well-being and ecological integrity can thrive.",2.6877207297323875,3.2380603901486507,0.780413966970881,,,3.0,"I value your perspective on how prioritizing immediate human needs can empower communities and facilitate engagement with sustainability initiatives. However, it’s essential to recognize that climate change poses immediate threats that can hinder economic development, especially for the most vulnerable populations. By integrating climate action with poverty alleviation, we can create a proactive approach that ensures communities are resilient and capable of thriving in an increasingly uncertain environmental landscape, ultimately benefiting both humanity and the planet.",2.088704956350763,1.000002293195258,8.928901285866147e-06,,
