ID,TEXT_TYPE,INIT_OP_A,TEXT_A,PPL_A,PROBE_INT_A,H_INT_A,PROBE_EXT_A,H_EXT_A,INIT_OP_B,TEXT_B,PPL_B,PROBE_INT_B,H_INT_B,PROBE_EXT_B,H_EXT_B
458.0,tot,4.0,"I believe that while environmental issues are important, the emphasis on climate change often overshadows other pressing concerns that deserve equal attention. There are natural climate fluctuations that have occurred throughout Earth's history, and many argue that humanity's ability to adapt is significant. Rather than focusing solely on climate change, we should prioritize economic development, technological innovation, and improving living standards globally, which can also contribute to better environmental stewardship. Addressing immediate human needs can lead to more sustainable long-term solutions without the alarmism often tied to climate narratives.",2.184078534812237,3.852546550443637,0.3601513964496418,,,4.0,"I believe that while environmental issues are important, the emphasis on climate change often overshadows other pressing concerns that deserve equal attention. There are natural climate fluctuations that have occurred throughout Earth's history, and many argue that humanity's ability to adapt is significant. Rather than focusing solely on climate change, we should prioritize economic development, technological innovation, and improving living standards globally, which can also contribute to better environmental stewardship. Addressing immediate human needs can lead to more sustainable long-term solutions without the alarmism often tied to climate narratives.",2.1833517221974685,3.717701941925156,0.49270262408045706,,
458.0,disc,4.0,"While climate change is an important topic, I believe we must also consider a broader range of pressing global issues that deserve our attention. Historical climate fluctuations demonstrate that humanity has a remarkable ability to adapt, and we should focus on economic development and technological innovation to address immediate human needs. By prioritizing these areas, we can foster sustainable solutions that improve living standards and enhance environmental stewardship without falling into alarmist narratives.",1.5925654369890183,2.2038916570773397,0.39290096983662437,,,4.0,"I completely agree with your perspective that while climate change is significant, it's essential not to lose sight of other urgent global challenges that require our focus. Emphasizing economic development and technological innovation can indeed lead to better living standards, which indirectly promotes more effective environmental stewardship. By approaching these issues with a balanced mindset, we can foster sustainable solutions that avoid the pitfalls of alarmism while genuinely addressing human needs.",1.919707481999691,3.147044913763754,0.4260591266928435,,
458.0,disc,4.0,"I'm glad to see we share a similar viewpoint on the need for a balanced approach to global challenges. It's crucial to recognize that investing in economic development and innovative technologies not only improves living standards but can also create pathways for more effective environmental practices. By shifting our focus, we can cultivate a more constructive narrative that emphasizes collaboration and progress rather than fear and alarmism, ultimately benefiting both people and the planet.",1.9639263311915474,2.1831992913671403,0.4688443937741679,,,4.0,"Absolutely, your emphasis on collaboration and progress is spot on. When we work towards innovative solutions that address immediate human needs, we can create a win-win scenario where both people and the environment benefit. This constructive narrative allows us to build a more hopeful future, where sustainable practices emerge from advancements rather than fear-driven reactions to climate change.",2.444494539223946,3.0048411275896365,0.035991919238876,,
458.0,disc,4.0,"I appreciate your insights on creating that win-win scenario; it's encouraging to think about the positive outcomes that can arise from prioritizing human needs alongside environmental considerations. By fostering innovative solutions that emerge from collaboration rather than fear, we can inspire more people to engage in sustainable practices and contribute to meaningful change. Ultimately, this hopeful narrative can lead to a more resilient society, one that not only addresses current challenges but also prepares us for the uncertainties of the future.",1.9684229789070695,2.3573211652855686,0.7586105729662992,,,4.0,"Thank you for your thoughtful response; it's refreshing to focus on the potential for positive change. By inspiring collective action and creating a narrative of hope, we can indeed mobilize more individuals to get involved in sustainable practices. This resilience will not only help us navigate current challenges but also empower future generations to adapt to whatever uncertainties may come their way.",1.3691836553907865e+64,3.057983922405369,0.2419041977794097,,
458.0,disc,4.0,"I'm glad you found the perspective refreshing; it's vital to harness that sense of hope to inspire collective action. By fostering a narrative that encourages participation in sustainable practices, we can empower individuals and communities to become proactive stewards of both their environments and their futures. Ultimately, this focus on resilience and adaptability will equip future generations with the tools they need to face unforeseen challenges, ensuring a better quality of life for all.",1.9019779125894958,2.3689269692983905,0.7088794930575654,,,4.0,"I couldn't agree more; empowering individuals and communities is crucial for fostering a culture of environmental stewardship. When people feel inspired to participate in sustainable practices, they contribute not just to their own well-being but to the health of their local environments and societies as a whole. By equipping future generations with adaptable tools and a proactive mindset, we lay the groundwork for a brighter and more resilient future for everyone.",2.05894019552452,3.8147809707419538,0.5377645156409687,,
458.0,disc,4.0,"You make an excellent point about the importance of cultivating a culture of environmental stewardship within communities. When individuals feel empowered and connected to their local environments, they are more likely to take meaningful action that benefits both themselves and society at large. By instilling a proactive mindset in future generations, we can create a ripple effect of positive change that reinforces the value of sustainability and cooperation for years to come.",1.6699356220289658,3.216042590730032,0.9581913950086756,,,4.0,"Thank you for highlighting that connection; it truly underscores the importance of grassroots engagement in fostering environmental stewardship. When people recognize their role in the well-being of their local ecosystems, they're more likely to advocate for sustainable practices and collaborate with others. This ripple effect of empowerment not only strengthens communities but also establishes a legacy of sustainability and cooperation that can transcend generations.",2.1637561492578983,2.6804905904134753,0.9039976339988937,,
