ID,TEXT_TYPE,INIT_OP_A,TEXT_A,PPL_A,PROBE_INT_A,H_INT_A,PROBE_EXT_A,H_EXT_A,INIT_OP_B,TEXT_B,PPL_B,PROBE_INT_B,H_INT_B,PROBE_EXT_B,H_EXT_B
464.0,tot,4.0,"I believe that while environmental issues are important, the emphasis on climate change often overshadows other pressing concerns that deserve equal attention. The notion that climate change is the most urgent problem can lead to ineffective policies that prioritize emissions reduction over economic development and social needs. Many regions still face poverty, health crises, and infrastructure challenges that are immediate and require resources. Additionally, the Earth's climate has always been subject to natural changes, and history shows that societies have adapted to these changes over time. Instead of focusing exclusively on climate change, we should adopt a more balanced approach that addresses a range of environmental and societal issues simultaneously.",4.3733013969217265e+35,3.0008364397964105,0.8036189693583494,,,4.0,"I believe that while environmental issues are important, the emphasis on climate change often overshadows other pressing concerns that need immediate attention. There are natural climate fluctuations that have occurred throughout Earth's history, and many argue that humanity's ability to adapt is significant. Rather than focusing solely on climate change, we should prioritize economic development, technological innovation, and improving living standards globally, which can also contribute to better environmental stewardship. Addressing a wider range of issues may lead to more effective solutions without the alarmism often tied to climate narratives.",2.2269986450738157,3.9877112605303435,0.06334751251602744,,
464.0,disc,4.0,"While climate change is a significant issue, it's crucial to recognize that there are numerous pressing concerns that demand our attention as well. We must consider the broader context of poverty, health crises, and infrastructure challenges that many communities face today. By adopting a more balanced approach to environmental policy, we can address both climate change and these immediate societal needs effectively.",1.6755160867996095,2.004963537799485,0.017571188511276172,,,4.0,"I completely agree that while climate change is indeed significant, we must acknowledge the multitude of pressing issues like poverty and health crises that require our urgent attention. A more balanced approach that encompasses economic development, technological advancements, and improving living standards will ultimately lead to better environmental stewardship. By addressing these immediate societal needs alongside climate concerns, we can foster sustainable solutions without falling into the trap of alarmism often associated with climate narratives.",1.8109561692208045,3.3283717048425654,0.8645910585189159,,
464.0,disc,4.0,"I appreciate your perspective and wholeheartedly agree that integrating economic development and technological advancements into our approach can lead to more effective solutions. It's essential to create policies that address both environmental and societal needs without succumbing to alarmism, which can hinder progress. By fostering collaboration between various sectors, we can ensure that our efforts support sustainable practices while also improving overall living standards.",2.100584008293763,2.0110561612517803,0.037885801424635226,,,4.0,"I'm glad to hear you share the sentiment that collaboration across various sectors is key to creating effective solutions. By focusing on a holistic approach that integrates economic development and environmental sustainability, we can tackle both immediate societal needs and long-term challenges. Prioritizing practical, innovative solutions will empower communities to thrive while also promoting responsible stewardship of our planet.",2.160653747185865,3.0108308760300875,0.06202676295270928,,
464.0,disc,4.0,"Absolutely, a holistic approach that integrates the needs of communities with environmental sustainability is essential for fostering resilience. By prioritizing practical and innovative solutions, we can create pathways for economic growth that also respect and preserve our natural resources. This balance not only empowers communities but also encourages them to become active participants in both their development and the stewardship of the environment.",1.9038515073325346,2.1070057097235058,0.25958437302160786,,,4.0,"I appreciate your emphasis on resilience and the idea that communities can be both economically empowered and responsible stewards of the environment. Engaging communities in the process encourages a sense of ownership and accountability, which can lead to innovative local solutions. Ultimately, by fostering this balance, we can create a more sustainable future that respects both human development and our planet's resources.",2.1796842572398982,3.0218217808871466,0.11825623695373713,,
464.0,disc,4.0,"I completely agree that community engagement is vital for fostering a sense of ownership and accountability in addressing both economic and environmental challenges. When local solutions emerge from within communities, they are often more innovative and tailored to the specific needs and circumstances of that area. By championing this collaborative spirit, we can indeed pave the way for a sustainable future that honors both human development and the responsible use of our planet's resources.",1.3840585855370553,2.0021470682989357,0.011010947305898165,,,4.0,"You've made an excellent point about the empowerment that comes from local solutions. When communities are actively involved, the resulting initiatives are more likely to be effective and sustainable, as they are grounded in the unique context of those they serve. By championing this collaborative spirit, we not only promote innovation but also create a stronger foundation for addressing both economic and environmental challenges together.",3.721451960227464e+60,3.1231467017966588,0.5192345091168715,,
464.0,disc,4.0,"Thank you for your thoughtful response; I couldn't agree more about the effectiveness of local initiatives grounded in their unique contexts. This approach not only fosters innovation but also builds trust and cooperation within communities, which is essential for long-term success. By working together to address both economic and environmental challenges, we can create a more resilient society that can adapt to the evolving needs of our world.",1.6900132365199072,2.01491760372488,0.06564449976236332,,,4.0,"I appreciate your insights on the importance of trust and cooperation within communities; they are indeed crucial for sustainable progress. When people feel connected and engaged in the decision-making process, it enhances both their commitment and adaptability to changing circumstances. By nurturing these connections, we can cultivate resilience that equips communities to tackle both economic and environmental challenges effectively.",2.2132701179956498,3.0069461927774808,0.06212096497373254,,
