ID,TEXT_TYPE,INIT_OP_A,TEXT_A,PPL_A,PROBE_INT_A,H_INT_A,PROBE_EXT_A,H_EXT_A,INIT_OP_B,TEXT_B,PPL_B,PROBE_INT_B,H_INT_B,PROBE_EXT_B,H_EXT_B
498.0,tot,4.0,"I believe that while environmental issues are important, the emphasis on climate change often overshadows other pressing concerns that deserve equal attention. There are natural climate fluctuations that have occurred throughout Earth's history, and many argue that humanity's ability to adapt is significant. Rather than focusing solely on climate change, we should prioritize economic development, technological innovation, and improving living standards globally, which can also contribute to better environmental stewardship. Addressing immediate human needs can lead to more sustainable long-term solutions without the alarmism often tied to climate narratives.",2.168718331504843,3.9856631121036257,0.062111810530173985,,,5.0,"I believe that the focus on climate change has been exaggerated and often distracts from more pressing and immediate issues facing humanity, such as poverty, healthcare, and education. Many proposed solutions, like drastic policy changes and economic upheaval, could harm economies and livelihoods without guaranteeing significant impact on climate. Instead of prioritizing climate change, we should concentrate on practical advancements in technology and infrastructure that enhance our resilience and adaptability to environmental changes, without crippling economic growth.",2.214017803782927,4.00019944950323,0.0019777286466231606,,
498.0,disc,4.0,"While climate change is an important topic, I believe we must also consider a broader range of pressing global issues that deserve our attention. Historical climate fluctuations demonstrate that humanity has a remarkable ability to adapt, and we should focus on economic development and technological innovation to address immediate human needs. By prioritizing these areas, we can foster sustainable solutions that improve living standards and enhance environmental stewardship without falling into alarmist narratives.",1.6034918307629369,3.7744440929093455,0.4791003527154236,,,5.0,"I completely agree that while climate change is often highlighted, it's imperative to consider a wider array of urgent global issues. Our history shows that humanity is adept at adapting to environmental shifts, and our resources should be channeled into economic development and technological advancements that directly improve lives. By focusing on practical solutions for immediate human concerns, we can encourage resilience and sustainable practices without succumbing to alarmist narratives about climate change.",2.3846973296705016,4.000229599396579,0.002761138516207038,,
498.0,disc,4.0,"I'm glad to see we share a similar perspective on the importance of addressing a range of global issues beyond climate change. By investing in economic development and technological innovation, we not only improve quality of life but also create opportunities for more sustainable practices to emerge organically. Ultimately, a balanced approach that addresses immediate human needs while fostering resilience can lead to more effective environmental stewardship without the sensationalism that often accompanies climate discussions.",6.880552228401566e+53,3.073013879338986,0.6334268702298478,,,5.0,"Absolutely, it's encouraging to find common ground on this important topic. By prioritizing economic growth and technological advancements, we pave the way for innovative solutions that can enhance both human well-being and environmental sustainability. A measured and pragmatic approach allows us to tackle pressing issues head-on, fostering resilience without the distraction of sensationalist narratives that can undermine our progress.",2.040125328001879,3.9988415830333874,0.009815105814227365,,
498.0,disc,4.0,"I appreciate your insights and fully agree that a proactive and pragmatic approach is essential for meaningful progress. By fostering an environment where economic growth and technological advancements can thrive, we create not only a better quality of life but also the potential for innovative environmental solutions to arise naturally. Together, we can work toward a balanced dialogue that prioritizes real-world challenges without being sidetracked by sensationalism.",2.4975339410069193,3.8341675470023553,0.3487829961060933,,,5.0,"Thank you for your thoughtful response; I appreciate your emphasis on creating a conducive environment for growth and innovation. It's clear that when we focus on real-world challenges, we open the door for solutions that not only improve lives but also promote sustainable practices. By maintaining this balanced dialogue, we can collaborate effectively on addressing urgent issues while avoiding the pitfalls of unnecessary alarmism.",3.840699726522436e+60,3.9995961120761843,0.004567919869139875,,
498.0,disc,4.0,"Thank you for your kind words; I genuinely believe that collaboration is key to tackling the complex challenges we face. By maintaining our focus on practical solutions and fostering a culture of innovation, we can create significant progress in both improving lives and promoting sustainability. It’s crucial that we continue to engage in constructive dialogue that prioritizes effective responses over alarmist narratives, ensuring that our efforts lead to meaningful outcomes.",2.07107684958808,3.000036949562198,1.0745977390576882,,,5.0,"I wholeheartedly agree that collaboration is vital in addressing the multifaceted challenges before us. By prioritizing practical solutions and fostering a culture of innovation, we can achieve meaningful progress that benefits both people and the planet. Continuing to engage in constructive dialogue will enable us to stay focused on effective responses, steering clear of alarmist narratives that can detract from our mission to improve lives and promote sustainability.",1.484567018285056,4.000241856332378,0.01207813936687715,,
498.0,disc,4.0,"I appreciate your enthusiasm for collaboration as a cornerstone of our approach to these challenges. By working together and sharing innovative ideas, we can create a strong foundation for practical solutions that truly make a difference for individuals and the environment alike. Let’s remain committed to this constructive dialogue, as it will empower us to drive impactful change while keeping our focus on the real issues at hand.",1.9479448486295419,2.594484645800443,0.9703796388169462,,,5.0,"Thank you for reinforcing the importance of collaboration in our efforts to tackle these challenges together. By sharing innovative ideas and maintaining a commitment to practical solutions, we can indeed build a solid foundation for meaningful change that benefits both individuals and the environment. Staying focused on constructive dialogue will empower us to address the pressing issues effectively, ensuring that our efforts are impactful and relevant.",1.6957852611474804,4.0009544967695065,0.019513433402969852,,
