ID,TEXT_TYPE,INIT_OP_A,TEXT_A,PPL_A,PROBE_INT_A,H_INT_A,PROBE_EXT_A,H_EXT_A,INIT_OP_B,TEXT_B,PPL_B,PROBE_INT_B,H_INT_B,PROBE_EXT_B,H_EXT_B
49.0,tot,1.0,"Climate change is one of the most pressing issues of our time, affecting not only the environment but also public health, economies, and social equity. The evidence is undeniable—rising temperatures, extreme weather events, and melting ice caps are all consequences of human activity. Urgent action is needed, not just from governments but also from individuals and businesses to reduce carbon emissions and shift towards sustainable practices. The time to act is now, as the longer we wait, the more severe the repercussions will be for future generations. It's essential to foster awareness and advocate for policies that prioritize the planet's health. Every action counts.",1.864046380170875,1.0000000197844368,9.953878773864175e-08,,,2.0,"Climate change is one of the most pressing issues of our time, posing serious threats to ecosystems, economies, and human health. The scientific consensus is clear: human activities, particularly the burning of fossil fuels, are driving unprecedented changes in our climate. These changes result in extreme weather events, rising sea levels, and altered agricultural patterns, impacting food security and biodiversity. 

Addressing climate change requires urgent collective action, including reducing greenhouse gas emissions, transitioning to renewable energy, and promoting sustainable practices. Furthermore, it necessitates global cooperation and equitable solutions to support vulnerable communities most affected by climate impacts. The longer we delay, the more severe the consequences will be, making it imperative for individuals, governments, and organizations to work together towards a sustainable future.",1.6022721237071913,1.0000003972709675,1.700810525184243e-06,,
49.0,disc,1.0,"Climate change is a critical challenge that we cannot afford to ignore, as it threatens our ecosystems, public health, and economic stability. The alarming rise in global temperatures and the frequency of extreme weather events are clear signs that immediate action is essential. I believe we must work together—individuals, businesses, and governments alike—to implement sustainable practices and advocate for policies that prioritize the health of our planet for the sake of current and future generations.",1.7172620675805945,1.000000003896381,2.1186096344503132e-08,,,2.0,"I completely agree with your sentiments—climate change is indeed a critical challenge that demands our immediate attention and collective action. It is essential for individuals, businesses, and governments to unite in implementing sustainable practices and advocating for policies that not only mitigate climate impacts but also promote equity for vulnerable communities. By prioritizing the health of our planet, we lay the groundwork for a more resilient future for all generations to come.",1.7026093905757624,1.0000000038954862,2.1205033622847322e-08,,
49.0,disc,1.0,"I'm glad to hear that we share the same perspective on the urgent need for collective action against climate change. It's vital that as we implement sustainable practices, we also ensure that the voices of vulnerable communities are heard and uplifted, as they are often the most affected by environmental issues. By fostering an inclusive approach that addresses both climate resilience and social equity, we can create a more fair and sustainable future for everyone.",1.8226702674182265,1.0000000000381801,2.5175029259636364e-10,,,2.0,"Absolutely, it's crucial that we prioritize inclusivity and ensure that the voices of vulnerable communities are not only heard but actively engaged in the decision-making process. By addressing both climate resilience and social equity, we can develop solutions that are not only effective but also just, ensuring that no one is left behind. Together, we can create a future that supports both the health of our planet and the well-being of all its inhabitants.",1.3980753378701654,1.0000000000140457,9.612517162216628e-11,,
49.0,disc,1.0,"You're spot on—engaging vulnerable communities in decision-making is essential to crafting solutions that truly reflect their needs and experiences. When we integrate social equity into our climate strategies, we not only enhance the effectiveness of our initiatives but also build a sense of solidarity and shared responsibility. Together, we have the opportunity to foster a brighter, more equitable future that honors both our planet and the diverse communities that inhabit it.",1.7307991897675465,1.0000000050006115,2.6878286599724214e-08,,,2.0,"I couldn't agree more—integrating social equity into our climate strategies is pivotal for creating effective and meaningful solutions. By fostering a sense of solidarity and shared responsibility, we not only empower communities but also enrich our collective efforts to combat climate change. This collaborative approach will ultimately lead us toward a brighter, more equitable future, where both our planet and its diverse inhabitants can thrive.",1.527746362848561,1.0000000119969832,6.188605662594466e-08,,
49.0,disc,1.0,"Absolutely! A collaborative approach not only strengthens our resolve but also enhances the innovative solutions we can develop to tackle climate challenges. By empowering communities and ensuring their needs are prioritized, we lay the foundation for long-lasting change that benefits everyone. Together, we can cultivate an environment where both the planet and its diverse populations can thrive for generations to come.",2.079470854440423,1.0000000537674942,2.570743678095272e-07,,,2.0,"You make an excellent point—collaboration truly is the key to unlocking innovative solutions for the complex challenges posed by climate change. By prioritizing the needs of communities and empowering them, we not only foster resilience but also ensure that the changes we implement are sustainable and impactful for the long term. Together, we can build a future where both our planet and its diverse populations flourish, creating a legacy of hope and prosperity for generations to come.",1.5139599214371435,1.000000005001303,2.68983383669038e-08,,
49.0,disc,1.0,"Thank you for your thoughtful response! Building a legacy of hope and prosperity requires us to be steadfast in our commitment to equitable solutions, ensuring that everyone has the opportunity to thrive in the face of climate change. By investing in community-led initiatives and sharing knowledge across diverse populations, we can create a sustainable future that honors our shared responsibility to both people and the planet.",4.840687021207847e+60,1.0000013865386015,5.5028231057882585e-06,,,2.0,"Thank you for your insightful reply! Investing in community-led initiatives and fostering knowledge-sharing are indeed vital steps toward achieving equitable and sustainable solutions. By ensuring that everyone has a seat at the table, we can collaborate effectively and strengthen our collective commitment to a future that respects both our planet and the diverse communities that inhabit it.",1.5129469136412753e+69,1.000000047451111,2.2839148691113085e-07,,
