ID,TEXT_TYPE,INIT_OP_A,TEXT_A,PPL_A,PROBE_INT_A,H_INT_A,PROBE_EXT_A,H_EXT_A,INIT_OP_B,TEXT_B,PPL_B,PROBE_INT_B,H_INT_B,PROBE_EXT_B,H_EXT_B
4.0,tot,1.0,"Climate change is one of the most pressing issues of our time, affecting not only the environment but also public health, economies, and social equity. The evidence is undeniable—rising temperatures, extreme weather events, and melting ice caps are all consequences of human activity. Urgent action is needed, not just from governments but also from individuals and businesses to reduce carbon emissions, invest in renewable energy, and promote sustainable practices. Addressing climate change is crucial for ensuring a habitable planet for future generations. We must act decisively and collaboratively to mitigate its impacts and foster a resilient, sustainable future.",1.6812229044965286,1.0000007421706851,3.061450524133074e-06,,,1.0,"Climate change is one of the most pressing issues of our time, affecting ecosystems, human health, and global economies. The overwhelming scientific consensus shows that human activities, particularly the burning of fossil fuels and deforestation, are the primary drivers of this crisis. Immediate and collective action is essential to mitigate its impacts, transition to renewable energy sources, and promote sustainable practices. Addressing climate change not only protects the planet but also fosters economic growth and social equity. Every effort counts, and we must work together to ensure a livable future for generations to come.",1.497353420185735,1.0000004501839992,1.9132711643466927e-06,,
4.0,disc,1.0,"Climate change is an urgent crisis that impacts every facet of our lives, from the air we breathe to the economies we depend on. The scientific consensus is clear: human activities are the primary drivers of rising global temperatures and increasingly severe weather patterns. As we gather today, it's vital that we explore actionable strategies that individuals, communities, and policymakers can adopt to combat this global threat and ensure a sustainable future for generations to come.",1.7847505952767375,1.0000000005270606,3.1294220393770413e-09,,,1.0,"I wholeheartedly agree that climate change is an urgent crisis affecting all aspects of life, and the scientific consensus leaves no room for doubt about the role of human activities in driving this issue. We must focus on actionable strategies that not only involve transitioning to renewable energy and reducing carbon emissions but also emphasize the importance of education and community engagement in fostering sustainable practices. By coming together in solidarity, we can create meaningful change that ensures a healthier planet and a more equitable society for future generations.",1.9099494675088513,1.0000000174566146,8.83734204423091e-08,,
4.0,disc,1.0,"Absolutely, education and community engagement are crucial components in our fight against climate change. By empowering individuals with knowledge and resources, we can inspire collective action that amplifies the impact of our efforts toward sustainability. Together, we can build a culture of environmental responsibility that not only addresses climate issues but also champions social equity and resilience in our communities.",1.5792833127082568,1.0000000026766345,1.4805134114975156e-08,,,1.0,"I completely agree that empowering individuals through education and providing resources is key to inspiring collective action. A culture of environmental responsibility not only encourages sustainable practices but also strengthens social equity and resilience, enabling communities to adapt to the impacts of climate change. As we work together to foster this culture, we can create a ripple effect that motivates everyone to contribute to a more sustainable and just future.",1.884044602198596,1.000000000676759,3.9759600985501e-09,,
4.0,disc,1.0,"You're right; cultivating a culture of environmental responsibility can indeed have a transformative ripple effect throughout society. As more individuals and communities embrace sustainable practices, we can collectively shift norms and expectations, making sustainability a fundamental aspect of our everyday lives. This not only addresses the immediate challenges of climate change but also lays the groundwork for a more just and equitable future, where everyone has the opportunity to thrive in harmony with our planet.",1.7686386650808221,1.0000090413136942,3.1644637618053805e-05,,,1.0,"Absolutely, the transformation of societal norms towards sustainability is vital in creating lasting change. By integrating sustainable practices into our daily lives, we not only tackle the immediate effects of climate change but also promote a future where equality and harmony with the planet are prioritized. This collective shift can empower marginalized communities, ensuring that everyone has a stake in and benefits from a sustainable future, ultimately leading to a more resilient society overall.",1.9005428910512525,1.0000000002491902,1.5316778207887341e-09,,
4.0,disc,1.0,"You've highlighted an essential aspect of our climate strategy—ensuring that marginalized communities are not only included in the conversation but are also active participants in the transition to sustainability. Inclusion fosters equity, allowing diverse voices and perspectives to drive innovative solutions that meet the unique needs of all communities. By prioritizing equity alongside environmental initiatives, we can build a more resilient society that uplifts everyone while effectively combating climate change.",3.5596163630067196e+54,1.0000001461438432,6.622131499577552e-07,,,1.0,"I completely agree that prioritizing equity in our climate strategy is essential for fostering inclusive solutions that resonate with the diverse needs of all communities. When marginalized voices are not just heard but actively involved in the transition to sustainability, we unlock innovative approaches that can effectively address the distinct challenges they face. By embracing this inclusivity, we empower communities to thrive, ultimately strengthening our collective efforts against climate change and creating a resilient, equitable future for all.",2.167422446184506,1.0000000072775055,3.847221586853452e-08,,
4.0,disc,1.0,"Absolutely, when we elevate marginalized voices in the conversation around sustainability, we tap into a wealth of knowledge and creativity that can lead to groundbreaking solutions. This not only addresses the immediate challenges these communities face but also fosters a sense of ownership and agency in the climate movement. As we integrate diverse perspectives, we build a stronger, more effective coalition to combat climate change and pave the way for a just and resilient future for everyone.",1.0103845641707901e+52,1.000000001623461,9.182700339297016e-09,,,1.0,"I couldn't agree more; elevating marginalized voices not only enriches our discussions but also cultivates a sense of empowerment that is crucial for fostering meaningful change. When communities feel a sense of ownership in the climate movement, they are more likely to engage actively and innovatively, driving solutions that reflect their unique experiences and needs. This inclusive approach not only strengthens our coalition against climate change but also ensures that our efforts lead to a just and resilient future that benefits everyone.",1.6078016790393463,1.0000000012643526,7.230516223793026e-09,,
