ID,TEXT_TYPE,INIT_OP_A,TEXT_A,PPL_A,PROBE_INT_A,H_INT_A,PROBE_EXT_A,H_EXT_A,INIT_OP_B,TEXT_B,PPL_B,PROBE_INT_B,H_INT_B,PROBE_EXT_B,H_EXT_B
501.0,tot,5.0,"I believe that the focus on climate change has been exaggerated and often distracts from more pressing and immediate issues facing humanity, such as poverty, healthcare, and education. Many proposed solutions, like drastic policy changes and economic upheaval, could harm economies and livelihoods without guaranteeing significant impact on climate. Instead of prioritizing climate change, we should concentrate on practical advancements in technology and infrastructure that enhance our resilience to natural changes, rather than imposing heavy regulations that could stifle growth and innovation. Furthermore, the climate has always changed naturally over millennia, and it's important to recognize that not all environmental changes are attributable to human activity. Balancing economic development and environmental stewardship is crucial without overemphasizing climate change as a singular priority.",2.2562373154376854,4.000077346801913,0.0009492425489272926,,,1.0,"Climate change is one of the most pressing issues of our time, affecting not only the environment but also public health, economies, and social equity. The evidence is undeniable—rising temperatures, extreme weather events, and melting ice caps are all consequences of human activity. Urgent action is needed, not just from governments but also from individuals and businesses to reduce carbon emissions and shift towards sustainable practices. The time to act is now, as the longer we wait, the more severe the repercussions will be for future generations. It's essential to foster awareness and advocate for policies that prioritize the planet's health. Every action counts.",1.862369923483582,1.000000017457873,8.837947634385368e-08,,
501.0,disc,5.0,"While climate change is a topic of considerable attention, it's essential to recognize that there are many pressing issues, such as poverty and access to healthcare, that need our immediate focus. Instead of solely prioritizing climate change, we should explore technological advancements and infrastructure improvements that increase our resilience to natural variations. It's crucial to have a balanced perspective that considers both economic development and environmental stewardship, rather than imposing heavy regulations that could hinder growth and innovation.",2.054038879704624,4.005185794315947,0.03299559978422959,,,1.0,"While I understand the importance of addressing issues like poverty and healthcare, it's crucial to recognize that climate change exacerbates these very problems. A stable environment is foundational for economic development and public health, making it imperative to integrate climate action into our strategies for tackling societal challenges. By investing in sustainable practices and technology now, we can create a robust framework for resilience that benefits both our planet and our communities in the long run.",1.9861585929502519,1.0000000072768527,3.845436346406362e-08,,
501.0,disc,5.0,"I appreciate your perspective, but it's important to remember that climate change has been a natural occurrence throughout history, and attributing all environmental challenges solely to human activity can oversimplify complex issues. Investing in sustainable practices is certainly valuable, but we need to ensure that proposed solutions do not come at the cost of economic stability or hinder efforts to address immediate human needs like poverty and healthcare. Ultimately, a balanced approach that prioritizes practical technological advancements and long-term resilience, rather than overemphasizing climate change as an overriding priority, will yield the best outcomes for society as a whole.",5.259236517782602e+37,4.0018929108334955,0.014343382865255782,,,1.0,"While natural climate variations have occurred throughout history, current changes in our climate are markedly accelerated by human activities, leading to unprecedented challenges that we cannot afford to ignore. Addressing climate change does not have to come at the expense of economic stability; in fact, transitioning to sustainable practices can drive innovation, create jobs, and enhance resilience in the face of environmental shifts. A balanced approach should incorporate robust climate action as an essential component of our overall strategy to improve human well-being, as the health of our planet is intrinsically linked to the health of our economies and societies.",1.9297682629735542,1.0000000008725274,5.070675091835748e-09,,
501.0,disc,5.0,"I acknowledge that climate change has brought about challenges that require attention, but I still maintain that the proposed drastic measures often overlook immediate issues that affect human well-being, such as poverty and healthcare. While there may be opportunities for innovation and job creation in sustainable practices, we must carefully evaluate the potential economic repercussions and ensure these transitions do not disrupt livelihoods or lead to unwarranted burdens on industries. Ultimately, it is vital to strike a balance that fosters economic growth and technological advancement while recognizing that our priorities should also address pressing social issues that affect people's day-to-day lives.",7.310315205721098e+38,4.000044464235193,0.0037506706227731224,,,1.0,"I completely agree that immediate issues like poverty and healthcare are critical, but it’s essential to highlight that these challenges are often intertwined with environmental degradation and climate change. By implementing sustainable practices, we can create economic opportunities that not only help combat climate change but also alleviate poverty and improve health outcomes in communities. Striking that balance means proactively integrating climate solutions into our broader socioeconomic framework, ensuring that no one is left behind as we work toward a more sustainable and equitable future.",2.177178116321248,1.0000001289852978,5.888732472433086e-07,,
501.0,disc,5.0,"I understand your point about the interconnectedness of environmental issues and societal challenges, but I believe we need to be cautious about placing too much emphasis on climate solutions to the detriment of addressing immediate human needs. While sustainable practices can create opportunities, it's crucial to ensure that these initiatives don't come with high costs that could harm economic stability or disproportionately impact vulnerable populations. A practical approach that prioritizes immediate improvements in health, education, and poverty alleviation, while still considering environmental stewardship, will better serve our communities without compromising their well-being.",2.0621410608237847,4.000689779227463,0.006086751467583052,,,1.0,"I appreciate your concerns about ensuring that climate solutions do not negatively impact vulnerable populations; however, it is important to recognize that the costs of inaction on climate change will far outweigh the investments needed for sustainable practices. When we prioritize environmental stewardship alongside immediate human needs, we can develop initiatives that are both equitable and beneficial for communities, ultimately fostering resilience against future crises. A practical approach should integrate sustainability into all aspects of development, ensuring that our pursuit of economic stability goes hand in hand with a commitment to safeguarding our planet for generations to come.",2.1208740415598273,1.0000002409568736,1.0620161071691462e-06,,
501.0,disc,5.0,"I see your point about the potential costs of inaction; however, we should be cautious about predicting the future impacts of climate change and ensure that we are not basing our policies on uncertain projections. Integrating sustainability is important, but we must also recognize that heavy regulations and rapid transitions can lead to unintended economic consequences that might exacerbate the very issues we seek to resolve. A focus on innovation and incremental improvements in technology and infrastructure can enhance resilience without imposing significant burdens on our economies or compromising immediate human needs.",2.3269265125037055,4.006508199770643,0.04192481075524807,,,1.0,"It's true that predicting the future can be complex, but the overwhelming scientific consensus indicates that the impacts of climate change are already being felt and will only intensify without decisive action. While I agree that innovation and incremental improvements are important, we must also recognize that waiting for gradual changes could lead to irreversible damage that ultimately harms economies and society at large. Balanced and thoughtfully designed regulations can stimulate innovation, creating a pathway to sustainable growth that addresses both current needs and the looming threats of climate change, ultimately allowing us to create a resilient future for everyone.",3.8046971735425713e+40,1.0000001138218126,5.230534784305584e-07,,
