ID,TEXT_TYPE,INIT_OP_A,TEXT_A,PPL_A,PROBE_INT_A,H_INT_A,PROBE_EXT_A,H_EXT_A,INIT_OP_B,TEXT_B,PPL_B,PROBE_INT_B,H_INT_B,PROBE_EXT_B,H_EXT_B
514.0,tot,5.0,"I believe that the focus on climate change has been exaggerated and often distracts from more immediate and pressing issues facing humanity, such as poverty, healthcare, and education. Many climate models are speculative, and the economic impact of drastic measures to combat climate change can be detrimental. We should prioritize innovation and adaptation rather than imposing regulations that might hinder growth and development. Ultimately, it's crucial to maintain a balanced perspective on environmental issues without sacrificing progress in other vital areas.",1.7681429930606305,3.9999377106977665,0.005264328792697804,,,1.0,"Climate change is one of the most pressing issues of our time, affecting not only the environment but also public health, economies, and social equity. The evidence is undeniable—rising temperatures, extreme weather events, and melting ice caps are all consequences of human activity. Urgent action is needed, not just from governments but also from individuals and businesses to reduce carbon emissions and shift towards sustainable practices. The time to act is now, as the longer we wait, the more severe the repercussions will be for future generations. It's essential to foster awareness and advocate for policies that prioritize the planet's health. Every action counts.",1.872089917303278,1.000000053772578,2.570974029833349e-07,,
514.0,disc,5.0,"While climate change is certainly an important topic, I believe the focus on it sometimes overshadows more immediate challenges like poverty and education that demand our attention. It's crucial to recognize that many climate models are based on assumptions that may not fully reflect reality, leading to potentially misguided policies. Instead of imposing stringent regulations, we should prioritize innovative solutions and adaptive measures that can support both environmental sustainability and economic growth.",1.9124600110993637,4.000504540588149,0.005216328062361008,,,1.0,"While I understand the concern about immediate challenges like poverty and education, it's essential to recognize that climate change exacerbates these issues, leading to increased inequality and heightened vulnerabilities. The scientific consensus on climate models is strong, indicating that we cannot dismiss their findings; they provide critical insights necessary for informed policy-making. By integrating innovative solutions with urgent climate action, we can tackle both environmental sustainability and social equity simultaneously, ensuring a healthier planet for all.",1.592091639983735e+50,1.0000001656071553,7.452297864152073e-07,,
514.0,disc,5.0,"I appreciate your perspective, but I remain concerned that an overemphasis on climate change can divert resources and attention from tackling poverty and education, which are pressing issues that affect millions daily. While there is a scientific consensus, it's important to critically evaluate the assumptions behind climate models to ensure that we don’t implement policies that could have unintended negative consequences on economic growth and development. I firmly believe that we can foster innovation and adaptation in a way that addresses both environmental and social needs without imposing heavy-handed regulations that might hinder progress in crucial areas.",1.9635085712475917,4.000694467526426,0.006023173119891782,,,1.0,"I appreciate your concerns and fully acknowledge that poverty and education are urgent issues; however, climate change and its impacts are inextricably linked to these challenges and must be addressed simultaneously to create lasting solutions. Critical evaluation of climate models is indeed necessary, but we must also rely on the robust evidence supporting their predictions to guide us in crafting effective policies that can drive both economic growth and environmental protection. By fostering innovation and adaptation through proactive climate policies, we can unlock new opportunities that uplift communities while ensuring a sustainable future for everyone.",2.208424171200918,1.0000000093475392,4.8781178327380175e-08,,
514.0,disc,5.0,"I understand that climate change intersects with issues like poverty and education, but I still feel that our immediate focus should be on direct solutions that improve living conditions today. Relying on the predictions of climate models carries risks, especially when those predictions are uncertain; we should prioritize initiatives that boost economic growth and provide immediate benefits to communities without imposing burdensome regulations. Let's explore paths that harness innovation and adaptation without sidelining the critical needs of those who are struggling to meet their basic needs in the present.",2.0821276054025023e+44,4.001157668458007,0.009209126290630991,,,1.0,"I completely agree that improving living conditions today is vital, and that's precisely why addressing climate change is so critical—it directly impacts the health, safety, and economic stability of vulnerable communities. While it's true that some predictions may carry uncertainty, the overarching trends show a clear and urgent need for action, and failing to address climate change now will only exacerbate the challenges faced by those struggling today. By creatively integrating climate solutions with immediate economic initiatives, we can enhance community resilience and ensure that the needs of the present are met while safeguarding our future.",1.9620865433283634,1.000016891895897,5.649219350802046e-05,,
514.0,disc,5.0,"I see your point about the potential impacts of climate change on vulnerable communities, but I remain cautious about the speed and scale of the actions proposed to address it, as they can risk stifling economic growth and job creation in the short term. We need to remember that for many communities, immediate access to healthcare, education, and economic opportunities are crucial to their survival, and these needs should take precedence. Rather than rushing into sweeping climate policies, let's focus on fostering local innovations and sustainable practices that can simultaneously improve living conditions and gradually build resilience without sacrificing the present for an uncertain future.",2.5713303952445163,4.000234236041517,0.004792863783303179,,,1.0,"I understand your caution regarding the pace of climate action, but it's essential to recognize that many climate solutions can actually drive economic growth and job creation, especially in emerging green industries. By prioritizing local innovations and sustainable practices, we can create a pathway that meets immediate community needs while simultaneously building resilience against the inevitable impacts of climate change. It’s not about sacrificing the present for an uncertain future, but rather about making informed choices that ensure a safe and prosperous environment for future generations while uplifting those who are struggling today.",1.934312807089494,1.0000008409844432,3.4430196611318877e-06,,
514.0,disc,5.0,"I appreciate your optimism about the potential for green industries to drive economic growth, but I worry that the transition could disproportionately impact traditional sectors and the workers who rely on them until new opportunities become widespread. While promoting local innovations and sustainable practices is a commendable approach, we must ensure that these initiatives do not impose excessive costs or regulatory burdens that could further strain those already facing economic challenges. Finding a balanced strategy that prioritizes immediate needs, supports existing jobs, and cautiously integrates sustainability seems to be the most pragmatic way forward, rather than pushing for rapid transitions that may leave many behind.",2.6150142131221186,4.000676979555884,0.013296016882151825,,,1.0,"Your concerns about the impact on traditional sectors and workers are valid, and it’s crucial to ensure that any transition to green industries is equitable and inclusive. We must approach this transition thoughtfully, providing support and retraining for workers in at-risk sectors while fostering the growth of sustainable practices that create new jobs and opportunities. By collaborating with communities, businesses, and policymakers, we can develop a balanced strategy that addresses immediate needs and facilitates a just transition towards a sustainable economy, ensuring that no one is left behind in the process.",1.7271390013769383,1.0000000038972459,2.11905828453271e-08,,
