ID,TEXT_TYPE,INIT_OP_A,TEXT_A,PPL_A,PROBE_INT_A,H_INT_A,PROBE_EXT_A,H_EXT_A,INIT_OP_B,TEXT_B,PPL_B,PROBE_INT_B,H_INT_B,PROBE_EXT_B,H_EXT_B
525.0,tot,5.0,"I believe that the focus on climate change has been exaggerated and often distracts from more pressing and immediate issues facing humanity, such as poverty, healthcare, and education. Many proposed solutions, like drastic emissions cuts or transitioning to renewable energy, can have significant economic repercussions and may not effectively address the problem at hand. Instead of prioritizing climate change over other critical needs, we should take a more balanced approach that addresses a broader range of societal challenges without crippling development or progress.",2.448755030914577,4.00026181340922,0.0029974952240348117,,,2.0,"Climate change is one of the most pressing issues of our time, posing serious threats to ecosystems, economies, and human health. The scientific consensus is clear: human activities, particularly the burning of fossil fuels, are driving unprecedented changes in our climate. These changes result in extreme weather events, rising sea levels, and altered agricultural patterns, impacting food security and biodiversity. 

Addressing climate change requires urgent collective action, including reducing greenhouse gas emissions, transitioning to renewable energy, and promoting sustainable practices. Furthermore, it necessitates global cooperation and equitable solutions to support vulnerable communities most affected by climate impacts. The longer we delay, the more severe the consequences will be, making it imperative for individuals, governments, and organizations to work together towards a sustainable future.",1.6010339521372476,1.0000000174560029,8.837047621078127e-08,,
525.0,disc,5.0,"While I understand the urgency surrounding climate change, it's important to recognize that there are equally pressing issues like poverty, healthcare, and education that demand our attention and resources. Drastic measures to combat climate change, such as severe emissions cuts, could potentially hinder economic growth and development, disproportionately affecting vulnerable populations. Instead of placing climate change at the forefront, we should advocate for a balanced approach that addresses multiple societal challenges simultaneously, fostering a more holistic solution for humanity.",1.7868066227190569,4.000415917601106,0.003938473923140524,,,2.0,"I completely agree that poverty, healthcare, and education are critical issues that deserve our attention. However, we must understand that climate change exacerbates these challenges; for instance, extreme weather events can disrupt food supply and healthcare access, further entrenching poverty. By addressing climate change with urgency, we can create sustainable solutions that benefit both the environment and vulnerable populations, ultimately leading to a more equitable future for all.",1.6018930756927674,1.0000003094031955,1.3442677802300027e-06,,
525.0,disc,5.0,"While I acknowledge that climate change can have cascading effects on issues like food security and healthcare, I worry that an excessive focus on climate initiatives might divert resources from addressing these fundamental problems directly. It's crucial to ensure that any efforts to tackle climate change also consider the economic impacts on vulnerable communities, as well as the unintended consequences of implementing rapid changes. Ultimately, we should prioritize a balanced approach that seeks to alleviate poverty and improve healthcare and education while still being mindful of environmental concerns, rather than prioritizing one issue over the others.",2.2775147973870986,3.9995742348459933,0.007585534948821209,,,2.0,"I appreciate your concerns about the potential diversion of resources and the need for a balanced approach. However, it’s important to recognize that neglecting climate action now will lead to far greater economic disruption in the future, particularly for vulnerable communities that are often the most affected by climate-related disasters. By integrating climate initiatives with strategies to alleviate poverty and improve healthcare and education, we can create a comprehensive framework that not only addresses immediate needs but also ensures long-term sustainability and resilience for all communities.",1.639562776254876,1.000000952979591,3.871818828881175e-06,,
525.0,disc,5.0,"I see your point about the long-term repercussions of inaction on climate change, especially for vulnerable communities, but I remain concerned that the current push for aggressive climate initiatives may prioritize environmental goals at the expense of immediate human needs. A comprehensive framework is certainly desirable, but we must critically evaluate whether policies aimed at combatting climate change are truly effective or if they may inadvertently impose burdens on those who are already struggling. It’s essential that any integrated approach prioritizes both immediate relief and sustainable development without compromising the economic progress that communities need to thrive.",2.411166817952198,3.9995278309369566,0.01498703950249151,,,2.0,"Your concerns are valid, and it’s crucial to ensure that climate policies are designed thoughtfully to support rather than hinder communities. Effective climate initiatives should be rooted in equity, focusing on providing immediate relief while also building long-term resilience against climate impacts—this can include job creation in the green economy and greater access to renewable energy. By engaging communities in the decision-making process and prioritizing their needs, we can develop solutions that balance environmental goals with economic progress, ultimately fostering a sustainable and equitable future for all.",5.175461817828008e+43,1.0000003506077173,1.5127767486163373e-06,,
525.0,disc,5.0,"I appreciate the emphasis on equity and community engagement in developing climate initiatives, as these elements are vital for ensuring that policies truly reflect the needs of those most affected. However, I remain cautious about the assumption that transitioning to a green economy will automatically create enough jobs and opportunities to offset the economic challenges that arise from sudden shifts in policy. It’s essential that we not only focus on creating sustainable solutions but also ensure that there is a clear understanding of the potential trade-offs involved, so that communities can grow and thrive without jeopardizing their stability during this transition.",2.094936953335144,4.002209706762125,0.01973019441996106,,,2.0,"I share your caution regarding the transition to a green economy, and it's essential to approach this shift with careful planning and foresight. While the potential for job creation in renewable energy and sustainable practices is significant, we must also implement training programs, support communities through the transition, and ensure that no one is left behind economically. By fostering transparency and actively involving those affected in the development of these initiatives, we can create policies that not only address environmental concerns but also prioritize economic stability and growth for all communities.",5.274514554704727e+43,1.0000001289732547,5.885696500054654e-07,,
525.0,disc,5.0,"I agree that careful planning and community support are critical to a successful transition towards a green economy, and I appreciate the focus on inclusivity and job training. However, we must remain vigilant about the economic implications of this transition, as well as the potential for unforeseen consequences that could arise from rapid policy changes. It's essential to establish a robust framework that prioritizes immediate needs and ensures that any climate strategies implemented don't inadvertently create additional burdens on already vulnerable populations.",2.597449908336073,4.002417423734894,0.02750865725751283,,,2.0,"I completely agree that vigilance is necessary to navigate the complexities of transitioning to a green economy, and we must anticipate and mitigate any potential unintended consequences. This transition affords us the opportunity to create resilient systems that prioritize immediate community needs while paving the way for sustainable futures. By investing in research, continuous dialogue with affected communities, and adaptive policies that can evolve based on feedback, we can work towards climate strategies that uplift vulnerable populations rather than overwhelm them.",4.944276639389719e+49,1.0000405200491933,0.0001266267000748169,,
