ID,TEXT_TYPE,INIT_OP_A,TEXT_A,PPL_A,PROBE_INT_A,H_INT_A,PROBE_EXT_A,H_EXT_A,INIT_OP_B,TEXT_B,PPL_B,PROBE_INT_B,H_INT_B,PROBE_EXT_B,H_EXT_B
538.0,tot,5.0,"I believe that the focus on climate change has been exaggerated and often distracts from more immediate and pressing issues facing humanity, such as poverty, healthcare, and education. Many proposed solutions, like drastic emissions cuts or the shift to renewable energy, can have significant economic repercussions without necessarily solving the problem. It's important to prioritize practical, balanced approaches that consider economic growth and development instead of adhering strictly to climate change agendas. We should also be cautious about the uncertainties in climate models and the potential for overregulation, which can stifle innovation and progress.",2.1681622725980834,3.9987385614790645,0.012813642633894161,,,2.0,"Climate change is one of the most pressing issues of our time, posing serious threats to ecosystems, economies, and human health. The scientific consensus is clear: human activities, particularly the burning of fossil fuels, are driving unprecedented changes in our climate. These changes result in extreme weather events, rising sea levels, and altered agricultural patterns, impacting food security and biodiversity. 

Addressing climate change requires urgent collective action, including transitioning to renewable energy sources, improving energy efficiency, and promoting sustainable practices. Furthermore, equitable policy-making is essential to support vulnerable communities and ensure a just transition. By prioritizing environmental stewardship and fostering innovation, we can mitigate the impacts of climate change and create a more sustainable future for all.",1.6906390591521265,1.0000000537740343,2.571040026266262e-07,,
538.0,disc,5.0,"While climate change is certainly a topic of concern, I believe we must not lose sight of the more immediate issues that affect our daily lives, like poverty and healthcare. It’s essential to strike a balance between environmental efforts and economic growth to ensure we’re not hindering development with overly ambitious climate agendas. Additionally, I think we should be cautious about the certainty we place in climate models, as overregulation can stifle innovation and distract us from pressing challenges.",2.1881361881480013,4.000409410449823,0.004007961881984745,,,2.0,"I appreciate your perspective on the importance of addressing immediate issues like poverty and healthcare, but it's crucial to recognize that climate change is intricately linked to these challenges. Environmental degradation disproportionately affects vulnerable communities, exacerbating poverty and health crises; thus, a holistic approach that integrates climate action with social equity is essential. By investing in sustainable solutions, we can stimulate economic growth while simultaneously safeguarding our planet and creating opportunities for future generations.",1.769951795059716,1.0000002409587228,1.062062218180107e-06,,
538.0,disc,5.0,"I understand that climate change can have profound implications for vulnerable communities, but I believe that the most effective way to tackle poverty and healthcare is to prioritize direct solutions to those issues first. While sustainable solutions are important, we must be wary of implementing policies that burden industries and economies, potentially leading to job losses or reduced growth in essential sectors. Balancing environmental concerns with economic development will be critical to ensuring that we create lasting opportunities without sacrificing the economic stability needed to address immediate social challenges.",3.1115596762096085,3.9999550560046013,0.0009809118872233793,,,2.0,"While I agree that addressing poverty and healthcare is vital, we must consider that climate change poses a direct threat to economic stability and job security in the long run. Ignoring the environmental crisis can lead to increased costs and disruptions across industries, particularly in sectors like agriculture and healthcare that are already being affected by extreme weather events. By pursuing sustainable development alongside economic growth, we can create jobs in emerging green industries and ensure that our solutions to social challenges are resilient and forward-thinking.",2.0203924277489134,1.000000840999929,3.4431099205620306e-06,,
538.0,disc,5.0,"I see your point about the potential long-term threats of climate change to economic stability, but I still believe that we should focus on immediate economic growth and stability as a priority. While green industries can create jobs, we must ensure that transitions to these sectors don't come at the cost of existing jobs or the economic livelihoods of those currently in traditional roles. A careful, balanced approach is necessary to foster innovation without unnecessarily disrupting the economic foundation that supports our current social challenges.",3.683299209186414e+47,4.000227483770645,0.0027890156517491804,,,2.0,"I completely understand your concern about protecting existing jobs and the economic livelihoods of those in traditional industries; it's a critical consideration in the transition to a sustainable economy. However, a balanced approach can—and must—include support for workers in traditional roles, such as retraining and reskilling programs, to ensure they can thrive in a green economy without being left behind. By collaboratively investing in both immediate economic growth and sustainable transitions, we can create a future where innovation drives prosperity while safeguarding jobs for the workforce of today.",3.333450700215465e+85,1.0000168915166197,5.648403740168148e-05,,
538.0,disc,5.0,"I appreciate the idea of retraining and reskilling programs for workers in traditional roles; however, we must carefully evaluate the financial implications of implementing such initiatives. It’s essential to ensure that the investments in these programs do not detract from funding other urgent social issues that require immediate attention, like healthcare and education. While a future with sustainable innovation is appealing, we cannot overlook the economic realities of today, and any transitions must be pragmatic to avoid creating further strain on the economy and vulnerable populations.",2.5279064319070246,4.000246079206618,0.006440506285583682,,,2.0,"Your concern about the financial implications of retraining and reskilling programs is valid, and it's important to prioritize efficient use of resources in addressing urgent social issues. However, investing in a sustainable workforce not only prepares individuals for future job markets but can also yield long-term economic benefits that ultimately strengthen our healthcare and education systems by reducing climate-related costs and disruptions. A pragmatic approach would involve integrating these initiatives into broader economic planning, ensuring that all aspects of social and environmental well-being are addressed concurrently to create a resilient and equitable future.",1.9502280619951313,1.0000520286570944,0.00015934056993407438,,
538.0,disc,5.0,"I recognize the potential long-term benefits of investing in a sustainable workforce, but we need to proceed with caution to ensure that we do not overextend our resources or create a financial burden in the process. While interconnectedness between climate action and social issues is clear, we should prioritize those immediate challenges that directly impact people's lives right now, rather than committing significant funds to initiatives that might yield benefits further down the line. A resilient future requires us to keep a sharp focus on economic stability and growth in the present, ensuring that we are not sacrificing current well-being for uncertain future gains.",2.4044219277722108,4.000164861304656,0.010383324433902684,,,2.0,"I understand the need for caution in how we allocate resources, but it’s essential to recognize that many of our immediate challenges, such as health crises and economic instability, are already exacerbated by climate change and environmental degradation. By failing to invest in a sustainable workforce and green initiatives now, we risk facing greater financial burdens in the future as the impacts of climate change intensify, affecting both livelihoods and health. A proactive approach that addresses today’s urgent needs while strategically investing in sustainable solutions can lead to a more robust economy and ensure long-term resilience for our communities.",2.2270776140031128,1.0000000886463805,4.1294370989088273e-07,,
