ID,TEXT_TYPE,INIT_OP_A,TEXT_A,PPL_A,PROBE_INT_A,H_INT_A,PROBE_EXT_A,H_EXT_A,INIT_OP_B,TEXT_B,PPL_B,PROBE_INT_B,H_INT_B,PROBE_EXT_B,H_EXT_B
540.0,tot,5.0,"I believe that the focus on climate change has been exaggerated and often misrepresented. While environmental issues are important, I argue that the emphasis on climate change distracts from more immediate concerns, such as economic stability and technological advancement. Many claims about the impacts of climate change are speculative and often lack concrete evidence. Furthermore, prioritizing policies to combat climate change can lead to unnecessary economic burdens and job losses. Instead, we should concentrate on practical solutions that promote growth and improve quality of life without unnecessary alarmism about the climate.",1.170554840154961e+42,4.00042636201563,0.0038144829100154732,,,2.0,"Climate change is one of the most pressing issues of our time, posing serious threats to ecosystems, economies, and human health. The scientific consensus is clear: human activities, particularly the burning of fossil fuels, are driving unprecedented changes in our climate. These changes result in extreme weather events, rising sea levels, and altered agricultural patterns, impacting food security and biodiversity. 

Addressing climate change requires urgent collective action, including a transition to renewable energy, sustainable transportation, and effective conservation strategies. It’s essential for individuals, governments, and businesses to adopt sustainable practices and advocate for policies that mitigate its effects. By fostering innovation and investing in green technologies, we can work towards a more resilient and sustainable future for our planet.",1.736969896615519,1.0000000224235808,1.1211480481153705e-07,,
540.0,disc,5.0,"While I acknowledge that environmental issues are important, I believe the focus on climate change has been exaggerated to the detriment of more pressing concerns like economic stability and technological advancement. It's crucial to recognize that many claims about climate impacts lack solid evidence and can often veer into speculative territory. Instead of prioritizing climate policies that may burden the economy, we should be seeking practical solutions that foster growth and enhance quality of life without succumbing to unnecessary alarmism.",1.6608174432918228,4.014061195898131,0.07396435376538084,,,2.0,"I appreciate your perspective, but it's important to recognize that the scientific consensus on climate change is based on extensive research and evidence. The impacts of climate change are not speculative; they are already being felt through extreme weather events, food security challenges, and threats to public health. Prioritizing climate action is not only a means to protect our environment but also an opportunity to drive economic growth through innovation and the transition to a sustainable, resilient economy.",1.5278836210462763,1.000000010597324,5.5049648026049876e-08,,
540.0,disc,5.0,"I understand that there is a scientific consensus on climate change, but I believe we should critically examine how that consensus is presented and whether the urgency aligns with the evidence available. While some extreme weather events may have been attributed to climate change, attributing these occurrences solely to that factor oversimplifies complex environmental systems. Instead of emphasizing an alarmist approach to climate action, we should focus on robust technological innovation and economic strategies that address immediate challenges without incurring unnecessary costs or job losses.",6.66879764222429e+90,4.060078967458988,0.22729434813081228,,,2.0,"I agree that critical examination is vital in any scientific discourse; however, the body of evidence linking climate change to the increasing frequency and intensity of extreme weather events is robust and well-documented. Addressing climate change does not have to be alarmist; it can integrate pragmatic solutions that foster technological innovation while ensuring economic stability. By investing in green technologies and sustainable practices, we can address immediate challenges and create jobs, all while working towards a healthier planet for future generations.",8.496556229862509e+46,1.0000000609257074,2.8952519980449853e-07,,
540.0,disc,5.0,"I appreciate your point about the importance of pragmatic solutions, but I remain concerned that the current focus on green technologies often comes with significant economic burdens and potential job losses in traditional sectors. While investing in innovation is crucial, we must ensure that these transitions are not only environmentally beneficial but also economically viable and inclusive for all workers. Instead of pursuing aggressive climate policies that may disrupt economic stability, we should prioritize solutions that enhance our quality of life and economic growth without imposing undue hardships.",1.970243896868775,4.006623355039483,0.04089750362522005,,,2.0,"Your concerns about economic burdens and job losses in traditional sectors are valid and must be addressed as we pursue climate action. Transitioning to a green economy can be done in a manner that is equitable and inclusive, providing support and retraining for workers in affected industries. By strategically investing in sustainable practices and technologies, we can create new job opportunities and stimulate economic growth while ensuring that our approach to climate change is both effective and just for all communities.",1.7218500044941818,1.0000000254092787,1.2639336274658765e-07,,
540.0,disc,5.0,"While I agree that addressing the transition's impacts on workers is important, I worry that the pace and scale of these changes may outstrip our ability to manage them effectively. Often, the rhetoric around a ""green economy"" overlooks the realities of existing job markets and fails to recognize that not all regions or workers have the same capacity to adapt to such swift shifts. We should focus on fostering economic strategies that promote growth and technological advancements without imposing drastic regulatory measures, which could inadvertently provoke greater economic instability and inequality.",2.8722234804839947e+43,4.00146560156434,0.01473066264212829,,,2.0,"I understand your concerns about the pace of change and its effects on various job markets and communities, which is why a just transition is essential in our approach to climate action. It’s crucial that we implement policies that are flexible and region-specific, allowing for a tailored transition that considers local economic contexts and worker needs. By fostering cooperation between governments, industries, and communities, we can develop balanced strategies that promote both sustainable growth and economic resilience without sacrificing the necessary action required to combat climate change.",2.177803791077849,1.0000005101105227,2.1524577927460725e-06,,
540.0,disc,5.0,"I appreciate the emphasis on a just transition and the need for tailored policies, but I remain skeptical about the feasibility of achieving such a delicate balance in practice. Often, the implementation of these policies can be plagued by bureaucratic inefficiencies and varying local interests, which may hinder effective action and lead to unintended consequences. Instead of relying heavily on government-led initiatives, we should encourage voluntary market-driven solutions that empower individuals and businesses to innovate and adapt without the weight of excessive regulations that could stifle growth and economic resilience.",6.690023296075364e+42,4.00172186913743,0.015907548396685737,,,2.0,"Your skepticism about the challenges of implementing effective policies is understandable, and it highlights the need for a collaborative approach that includes diverse stakeholders. While voluntary market-driven solutions can certainly play a role, we must recognize that coordinated efforts are often necessary to address the scale and urgency of the climate crisis effectively. Striking a balance between innovation and regulation can foster an environment where both the market and government initiatives work together to drive sustainable change while ensuring that communities can adapt and thrive in this transition.",1.9184496277702037,1.0000005780298782,2.421285797105897e-06,,
