ID,TEXT_TYPE,INIT_OP_A,TEXT_A,PPL_A,PROBE_INT_A,H_INT_A,PROBE_EXT_A,H_EXT_A,INIT_OP_B,TEXT_B,PPL_B,PROBE_INT_B,H_INT_B,PROBE_EXT_B,H_EXT_B
548.0,tot,5.0,"I believe that the focus on climate change has been exaggerated and often distracts from more pressing and immediate issues facing humanity, such as poverty, healthcare, and education. Many proposed solutions, like drastic emissions cuts or the shift to renewable energy, can have significant economic ramifications that might harm communities, particularly those that rely on fossil fuel industries. Additionally, the science is not as settled as often portrayed; there is ongoing debate about climate models and predictions. Ultimately, we should prioritize balancing economic growth and environmental stewardship, rather than jumping into sweeping changes based on uncertain future scenarios.",6.815760324931934e+38,4.000116452030141,0.003975514909184857,,,2.0,"Climate change is one of the most pressing issues of our time, posing serious threats to ecosystems, economies, and human health. The scientific consensus is clear: human activities, particularly the burning of fossil fuels, are driving unprecedented changes in our climate. These changes result in extreme weather events, rising sea levels, and altered agricultural patterns, impacting food security and biodiversity. 

Addressing climate change requires urgent collective action, including reducing greenhouse gas emissions, transitioning to renewable energy, and promoting sustainable practices. Furthermore, it necessitates global cooperation and equitable solutions to support vulnerable communities most affected by climate impacts. The longer we delay, the more severe the consequences will be, making it imperative for individuals, governments, and organizations to work together towards a sustainable future.",1.5989203234784621,1.0000000174560029,8.837047621078127e-08,,
548.0,disc,5.0,"While it's crucial to address environmental concerns, we must not lose sight of the more immediate issues that affect people's daily lives, like poverty and access to healthcare. The proposals for drastic emissions cuts and a rapid shift to renewable energy can have unintended economic consequences that could undermine communities relying on traditional energy sources. It's essential to foster a balanced approach that promotes both economic growth and environmental stewardship, rather than rushing into potentially harmful policies based on projections that are still up for debate.",2.033195988947769,4.000425342193897,0.003833931526393905,,,2.0,"While it’s important to recognize the immediate challenges many communities face, we cannot afford to ignore the urgent threat posed by climate change, which exacerbates issues like poverty and health crises. Transitioning to renewable energy and reducing emissions is not only vital for the environment but also presents economic opportunities, such as job creation in sustainable industries. A balanced approach must simultaneously prioritize both economic growth and environmental stewardship, ensuring that the transition is just and equitable for all communities affected.",9.172842376940289e+47,1.0000000690340454,3.258170438718811e-07,,
548.0,disc,5.0,"I understand the concern about climate change and its potential to exacerbate existing issues, but we must carefully evaluate the economic implications of transitioning too rapidly to renewable energy. While renewable industries may create jobs, we must also consider the livelihoods of those in fossil fuel sectors who could face significant displacement without adequate support. It's essential to adopt a more nuanced approach that prioritizes pragmatic solutions for both the economy and the environment, rather than making sweeping changes based on projections that remain uncertain.",2.213975543471124,3.9996780299998984,0.0038032480538285787,,,2.0,"You raise a valid point about the importance of supporting workers in fossil fuel sectors during the transition to renewable energy; a just transition is essential to ensure that no one is left behind. However, the scientific evidence overwhelmingly supports the need for urgent action against climate change, and delaying this transition could result in far greater economic and social instability down the line. Crafting targeted policies that provide training, resources, and opportunities for displaced workers can facilitate this necessary shift while safeguarding both our planet and our economy.",2.1293820537638606,1.0000005100828304,2.1520597340921224e-06,,
548.0,disc,5.0,"I appreciate the emphasis on a just transition for workers, and targeted policies for training and resources are certainly important. However, I am still concerned that the urgency around climate action may lead to hasty policies that overlook the needs and realities of communities dependent on fossil fuels, potentially resulting in negative economic consequences. We must ensure that our approach is not only environmentally sound but also economically viable, taking into account the complexity of the situation and fostering an inclusive dialogue that considers all perspectives.",2.498266532217931,3.998737159654968,0.017029043950681902,,,2.0,"I completely agree that fostering inclusive dialogue is crucial to creating effective solutions for both our environment and economy. It’s essential to engage with communities dependent on fossil fuels, ensuring their voices are heard in the transition process, so we can develop policies that are equitable and cognizant of local realities. By integrating environmental goals with economic viability in a thoughtful manner, we can pursue ambitious climate action while also providing the necessary support for communities to thrive in a sustainable future.",1.1708417563337708e+48,1.0000033261406873,1.2473467855601092e-05,,
548.0,disc,5.0,"It’s encouraging to see the emphasis on engaging communities in the transition process; their insights and experiences will be invaluable in shaping policies that are truly effective and fair. However, we need to be cautious about defining what constitutes ""ambitious climate action,"" as that term can sometimes lead to aggressive policies that may do more harm than good for certain regions. Balancing environmental goals with the economic realities faced by these communities is essential, but we must remain vigilant about not imposing solutions that could compromise their livelihoods or lead to unintended consequences.",2.6330515015812597,3.95842447298696,0.17932773056406415,,,2.0,"I appreciate your perspective on the need for caution in defining ""ambitious climate action,"" as it's essential to ensure that our policies are both effective and sensitive to the diverse realities across different regions. This is why incorporating local knowledge and fostering ongoing dialogue with impacted communities is critical; it enables us to identify tailored solutions that support both environmental and economic goals. By prioritizing a collaborative approach, we can develop strategies that are ambitious yet pragmatic, ultimately enhancing resilience and creating a more sustainable future without jeopardizing livelihoods.",2.3263071206605352,1.0000191404416392,6.340404275688171e-05,,
548.0,disc,5.0,"I completely agree that incorporating local knowledge and fostering ongoing dialogue is vital for crafting policies that are both effective and considerate of regional differences. However, we should remain cautious that this collaborative approach doesn't inadvertently push communities toward solutions that could impose significant economic burdens in the name of environmental goals. Ultimately, it's crucial to strike a balance that respects the complexities of local economies while still addressing environmental concerns, ensuring that no community is disproportionately impacted by these necessary changes.",2.2586907880753544,3.9611713031038542,0.17349342192057834,,,2.0,"Your emphasis on caution in the collaborative approach is important; we must ensure that solutions do not inadvertently create economic burdens on communities already facing challenges. Striking a balance between environmental goals and the economic realities of local economies is indeed critical, and this requires a careful evaluation of each proposed policy's impact. By prioritizing community input and applying a thorough assessment of potential consequences, we can work together to develop fair, effective, and sustainable solutions that respect both the environment and the livelihoods of all affected communities.",1.4666340870410438e+44,1.0000002126607996,9.442942034755007e-07,,
