ID,TEXT_TYPE,INIT_OP_A,TEXT_A,PPL_A,PROBE_INT_A,H_INT_A,PROBE_EXT_A,H_EXT_A,INIT_OP_B,TEXT_B,PPL_B,PROBE_INT_B,H_INT_B,PROBE_EXT_B,H_EXT_B
553.0,tot,5.0,"I believe that the focus on climate change has been exaggerated and often distracts from more immediate and pressing issues facing humanity, such as poverty, healthcare, and education. Many proposed solutions, like drastic emissions cuts or transitioning to renewable energy, can have significant economic repercussions and may not effectively address the problem at hand. Instead of prioritizing climate change, we should be investing in technology and innovation that can improve our quality of life without imposing heavy regulations that could hinder development and progress.",1.8120396923562936,4.000293609337445,0.0027270243194239645,,,3.0,"Climate change is a complex issue that prompts a wide range of opinions and perspectives. On one hand, there are compelling arguments about the environmental impacts and potential risks to ecosystems and human health. On the other hand, some people raise questions about the effectiveness of proposed solutions and the economic ramifications. It's important to consider multiple viewpoints and the nuances involved in discussions surrounding this topic. Awareness and dialogue may help in addressing the various challenges associated with climate change, regardless of individual stance.",1.1067680474827828e+47,1.000000362040565,5.581320970188488e-06,,
553.0,disc,5.0,"While I understand that climate change is a topic of concern for many, I believe we must critically assess whether the focus on it diverts attention from more immediate issues like poverty, healthcare, and education that impact countless lives every day. Additionally, some proposed solutions, such as drastic emissions cuts, could have harmful economic repercussions and might not effectively solve the underlying problems. Instead, we should emphasize investing in technology and innovation that can enhance our quality of life without imposing heavy regulations that could stifle development and hamper progress.",6.884214177322107e+42,4.005161981829322,0.03323904868983549,,,3.0,"You raise valid points about the importance of addressing immediate issues like poverty and healthcare, which are indeed critical to improving quality of life for many. However, it’s worth considering that climate change intersects with these concerns, as environmental degradation can exacerbate poverty and health issues, making it a multifaceted problem. Emphasizing innovation and technology is essential, but we should also explore how sustainable practices can work alongside economic growth to tackle both climate change and social challenges.",1.912136272636034,1.000001213302921,1.7713086825263794e-05,,
553.0,disc,5.0,"I appreciate your perspective on the intersection between climate change and pressing social issues like poverty and healthcare. However, I still believe that focusing heavily on climate change can lead to policies that may limit economic growth and innovation, which are crucial for addressing those very issues. Instead of prioritizing sustainability measures that can burden industries and consumers, we should explore how to foster technological advancements that improve living standards without imposing additional costs or regulations that could hinder development.",2.097646365471715,4.002457227406269,0.017494387070963034,,,3.0,"I understand your concern about the potential economic implications of stringent climate policies, and it's essential to strike a balance between sustainability and economic growth. However, embracing innovation for green technologies can actually spur economic development by creating new industries and job opportunities that align with both environmental and social goals. Furthermore, investing in sustainable practices might lead to long-term savings and resilience against climate impacts, ultimately benefiting both the economy and communities facing immediate challenges.",2.0088763489874695,1.000002931088603,4.004888008577229e-05,,
553.0,disc,5.0,"While I acknowledge that green technologies can create new job opportunities, I remain concerned that the transition to these industries can be disruptive and may not yield immediate benefits for those most in need. The potential long-term savings associated with sustainable practices are important to consider, but we must also weigh them against the short-term economic impacts and job losses that might arise as industries shift. Ultimately, I believe our focus should be on fostering broad innovation that improves quality of life across various sectors, rather than prioritizing sustainable practices that could inadvertently stifle other forms of economic progress.",2.0677738506950445,4.000698903953909,0.0059864516640883636,,,3.0,"Your concerns about the transitional disruptions and short-term job losses are certainly valid, and it's crucial to approach the shift to green technologies thoughtfully and equitably. It may be beneficial to implement strategies that support workers in traditional industries during this transition, such as retraining programs and transitional assistance, to minimize the negative impacts. Balancing a focus on innovation across all sectors with a commitment to sustainability can create a more holistic approach that ultimately enhances quality of life for a broader population while still addressing climate change.",2.0616711954689677,1.000002630312621,3.586352491192033e-05,,
553.0,disc,5.0,"I appreciate your emphasis on supporting workers during the transition to green technologies, as it's vital to ensure that no one is left behind. However, I'm still wary that the push for sustainability can overshadow the need for immediate solutions to pressing social issues, which require urgent attention and resources. Rather than prioritizing climate initiatives, we should invest in solutions that can directly elevate living standards and improve access to essential services, thereby addressing the immediate needs of our communities while fostering economic growth across various sectors.",2.1207796934330347,4.047414250508751,0.19100002815516823,,,3.0,"I completely understand your perspective on prioritizing immediate solutions for pressing social issues, as these are fundamental to improving lives right now. It’s important to recognize that addressing climate change and social needs does not have to be mutually exclusive; in fact, sustainable development can enhance access to essential services and elevate living standards in the long run. By integrating sustainability with immediate community needs, we can create a comprehensive approach that promotes both social equity and environmental responsibility, ultimately benefiting everyone.",1.751338715833468,1.0000037490501967,5.0421690429772386e-05,,
553.0,disc,5.0,"I see your point about the possibility of integrating sustainability with immediate community needs, and I agree that it's essential to strive for solutions that benefit both social equity and environmental responsibility. However, my concern lies in the fact that sometimes the advocacy for sustainability can overshadow urgent issues that require immediate action and investment. Instead of focusing on climate initiatives that could potentially divert resources and attention away from addressing poverty, healthcare, and education, we should prioritize solutions that directly improve lives in the present and establish a strong foundation for future advancements.",2.9600663436810324e+85,4.002445893191691,0.017610246071371034,,,3.0,"I appreciate your emphasis on the urgency of addressing immediate social issues, as they significantly impact many lives every day. It’s essential to advocate for a balanced approach where resources are allocated wisely, ensuring that we tackle pressing challenges without losing sight of the long-term implications of climate change. By fostering collaboration among sectors focused on immediate relief and those dedicated to sustainability, we can create a synergistic strategy that improves present conditions while also paving the way for a more resilient and equitable future.",2.0908231532072135,1.000000625261922,9.043864952253318e-06,,
