ID,TEXT_TYPE,INIT_OP_A,TEXT_A,PPL_A,PROBE_INT_A,H_INT_A,PROBE_EXT_A,H_EXT_A,INIT_OP_B,TEXT_B,PPL_B,PROBE_INT_B,H_INT_B,PROBE_EXT_B,H_EXT_B
559.0,tot,5.0,"I believe that the focus on climate change has been exaggerated and often distracts from more immediate and pressing issues facing humanity, such as poverty, healthcare, and education. Many proposed solutions, like drastic emissions cuts or transitioning to renewable energy, can have significant economic repercussions and may not effectively address the problem at hand. Instead of prioritizing climate change, we should be investing in technology and innovation that can improve our quality of life without imposing heavy regulations or crippling economic growth. It’s important to consider the broader picture rather than getting caught up in alarmist rhetoric.",1.986432448678849,4.00010733792398,0.0013886891862673685,,,3.0,"Climate change is a complex issue that prompts a wide range of opinions and perspectives. On one hand, there are compelling arguments about the environmental impacts and potential risks to ecosystems and human health. On the other hand, some people raise questions about the effectiveness of proposed solutions and the economic ramifications. It's important to consider multiple viewpoints and the nuances involved in discussions surrounding this topic. Awareness and dialogue may help in addressing the various challenges associated with climate change, regardless of individual stance.",1.1055945323075214e+47,1.0000003586334407,5.564715673979583e-06,,
559.0,disc,5.0,"I believe it's crucial to approach the topic of climate change with a balanced perspective, recognizing that while it's important, it shouldn't overshadow more immediate concerns like poverty and healthcare. We need to be wary of alarmist rhetoric that could lead to hasty policies, which may inadvertently harm our economies and hinder innovation. Instead, let's focus on investing in technology and solutions that improve our quality of life without imposing heavy regulations on industries.",1.8620320420576102,3.9745134492328447,0.09826137122210843,,,3.0,"I appreciate your perspective on the need for a balanced approach to climate change discussions, especially when considering immediate concerns like poverty and healthcare. It’s true that alarmist rhetoric can lead to hasty decisions; thus, fostering a measured dialogue is important. Investing in innovative technologies can indeed provide a pathway toward addressing environmental challenges while supporting economic growth and improving overall quality of life.",2.0172151828797533,1.005220173027504,0.0326396872756546,,
559.0,disc,5.0,"Thank you for acknowledging the importance of a balanced approach; it’s refreshing to see that we can agree on fostering a measured dialogue. I believe that by prioritizing investments in innovative technologies, we can tackle a range of issues simultaneously—improving our environment while also addressing economic growth and social welfare. Ultimately, we should focus on solutions that uplift communities rather than impose burdens through stringent regulations that can harm livelihoods.",2.3421558056332463,3.556146745691233,0.7916640021821492,,,3.0,"I completely agree that prioritizing investments in innovative technologies can create a win-win situation, benefiting both the environment and communities. Focusing on solutions that uplift people and provide economic opportunities is essential in ensuring broad support for climate action. It’s encouraging to see a shared commitment to finding pathways that promote sustainability while also enhancing social welfare and economic resilience.",1.7816652664398585,1.0001584419399276,0.0015447965656002762,,
559.0,disc,5.0,"I'm glad to hear we’re on the same page regarding the importance of both environmental sustainability and social welfare. When we frame climate action as an opportunity for economic growth and community empowerment, we can inspire more people to get on board with meaningful solutions. By collaborating on technology-driven initiatives, we can find ways to address environmental challenges without sacrificing the progress we need in other vital areas like healthcare and education.",1.9798512179388796e+55,3.4312902929529954,0.9423916504225088,,,3.0,"I wholeheartedly agree that framing climate action as an opportunity for economic growth and community empowerment can galvanize broader support for solutions. Collaboration on technology-driven initiatives is key to achieving progress in both environmental sustainability and essential services like healthcare and education. By creating a narrative that highlights mutual benefits, we can inspire collective action that addresses climate challenges while enhancing overall quality of life.",1.9429400392812592,1.0005527983924642,0.004698870859680562,,
559.0,disc,5.0,"It's encouraging to see such strong agreement on the potential for a positive narrative around climate action and its synergy with economic growth. By emphasizing the mutual benefits of collaborative, technology-driven solutions, we can create a compelling case for action that resonates with diverse stakeholders. Ultimately, if we can unite efforts to address environmental challenges alongside critical issues like healthcare and education, we can foster a more resilient and equitable society for everyone.",7.549189880845977e+53,3.3097194152743734,0.6716351486618729,,,3.0,"I couldn't agree more; uniting efforts to tackle environmental challenges alongside pressing societal issues can lead to a more resilient and equitable future. A compelling narrative that highlights the interconnections between climate action and improvements in healthcare and education will certainly resonate with a broader audience. By fostering collaboration among diverse stakeholders, we can create sustainable solutions that benefit both the planet and the communities we are part of.",1.883397713033632,1.0000010715975487,1.576979692822111e-05,,
559.0,disc,5.0,"I appreciate your insight into the power of a compelling narrative that connects climate action with advancements in healthcare and education. By showcasing these interconnections, we can not only engage a wider audience but also galvanize collective action that addresses multiple facets of human well-being. Let's continue to advocate for collaboration among diverse stakeholders, as this is essential for developing sustainable, multifaceted solutions that truly uplift both our planet and our communities.",1.8887173977860618,2.927301235263898,0.6349997612896631,,,3.0,"Thank you for highlighting the importance of showcasing the connections between climate action and human well-being; it truly can inspire a broader movement. By continuing to advocate for collaboration among diverse stakeholders, we can harness a wealth of perspectives and expertise, enhancing the effectiveness of our solutions. Together, we can create sustainable initiatives that uplift not only our planet but also the communities that inhabit it, fostering a more equitable future for all.",1.8618027456273996,1.000002261443986,3.165101252516501e-05,,
