ID,TEXT_TYPE,INIT_OP_A,TEXT_A,PPL_A,PROBE_INT_A,H_INT_A,PROBE_EXT_A,H_EXT_A,INIT_OP_B,TEXT_B,PPL_B,PROBE_INT_B,H_INT_B,PROBE_EXT_B,H_EXT_B
565.0,tot,5.0,"I believe that the focus on climate change has been exaggerated and often distracts from more pressing and immediate issues facing humanity, such as poverty, healthcare, and education. Many climate models are speculative, and the economic impact of drastic measures to combat climate change can be detrimental. We should prioritize innovation and adaptation rather than imposing regulations that might hinder growth and development. Ultimately, it's crucial to maintain a balanced perspective on environmental issues without sacrificing progress in other vital areas.",1.8964120750237863,3.9999651961732505,0.009219162799457448,,,3.0,"Climate change is a complex issue that prompts a wide range of opinions and perspectives. On one hand, there are compelling arguments about the environmental impacts and potential risks to ecosystems and human health. On the other hand, some people raise questions about the effectiveness of proposed solutions and the economic ramifications. It's important to consider multiple viewpoints and the nuances involved in discussions surrounding this topic. Awareness and dialogue may help in addressing the various challenges associated with climate change, regardless of individual stance.",1.1005667946216573e+47,1.0000000370095292,4.550291204285535e-07,,
565.0,disc,5.0,"While climate change is certainly an important issue, I believe the focus on it sometimes overshadows more immediate challenges like poverty and education that demand our attention. It's crucial to recognize that many climate models are based on assumptions that may not fully reflect reality, leading to potentially misguided policies. Instead of imposing stringent regulations, we should prioritize innovative solutions and adaptive measures that can support both environmental sustainability and economic growth.",1.9004073060084845,3.9584712559512134,0.12568604488810278,,,3.0,"You raise valid points about the need to balance immediate challenges like poverty and education with the long-term impacts of climate change. It's true that the assumptions underlying climate models can be debated, and that dialogue on their effectiveness and reliability is essential in shaping appropriate policies. Prioritizing innovative solutions and adaptive measures is a constructive approach, as it allows for both environmental sustainability and economic growth, while acknowledging the complexities of the situation.",2.1428450977949702,1.0000130105718024,0.0001593562997061414,,
565.0,disc,5.0,"I appreciate your acknowledgment of the need for a balanced approach to these critical issues. However, I still believe that the urgency surrounding climate change often leads to hasty decisions that can detract from advancements in areas like healthcare and education. By fostering dialogue and focusing on innovation, we can find pragmatic solutions that address environmental concerns without sacrificing progress in other vital sectors.",2.3278691996004468e+61,3.9821543770376913,0.06984879522481345,,,3.0,"I completely understand your concerns about the potential for hasty decisions driven by urgency, which can indeed overshadow progress in essential areas like healthcare and education. Striking a balance between addressing climate change and advancing other critical sectors is vital, and fostering dialogue can help ensure that all perspectives are considered. By promoting innovation and collaboration across various fields, we can develop long-term solutions that not only benefit the environment but also enhance overall societal well-being.",4.981993619336798e+50,1.0001234019139635,0.0012339924130677258,,
565.0,disc,5.0,"I'm glad to hear we agree on the importance of dialogue and collaboration in finding balanced solutions. It's crucial that we approach environmental issues with an emphasis on practical innovation that aligns with economic growth, ensuring we don't inadvertently hinder advancements in healthcare or education. Ultimately, by focusing on holistic strategies that integrate diverse perspectives, we can address climate challenges while still prioritizing the immediate needs of society.",2.218200787165234,3.9193438958890616,0.2632321582246398,,,3.0,"I fully agree that emphasizing practical innovation is key to addressing environmental issues without hindering advancements in other critical areas. Holistic strategies that integrate diverse perspectives allow us to tackle climate challenges in a way that considers the broader context of societal needs. By working collaboratively across sectors, we can create sustainable solutions that not only protect the environment but also enhance the quality of life for all.",1.7885395656719214,1.0052201362908348,0.03263951363215883,,
565.0,disc,5.0,"I'm glad to see our ideas align on the importance of collaboration across sectors for sustainable solutions. However, it's essential to remain cautious about imposing policies that could stifle innovation and economic growth in the name of environmental protection. We should focus on evidence-based approaches that promote adaptability and resilience, ensuring that all sectors can thrive while addressing climate issues effectively.",1.5153313646811538e+64,3.947846426514849,0.1485383110801309,,,3.0,"You're right to emphasize the need for caution in policy-making, as we must ensure that environmental protections do not inadvertently stifle innovation and economic growth. Evidence-based approaches are vital for creating adaptable and resilient solutions that benefit all sectors. By prioritizing flexibility in our strategies, we can tackle climate issues effectively while fostering an environment where innovation and economic prosperity can flourish simultaneously.",1.822430442323759,1.0002034558518107,0.0019327200170661505,,
565.0,disc,5.0,"I appreciate your emphasis on the importance of flexibility in our strategies, as it's crucial for navigating the complexities of both environmental and economic challenges. It’s clear that fostering an environment conducive to innovation will allow us to address climate change without compromising progress in other vital areas. Ultimately, a practical and measured approach will help us create solutions that not only protect the environment but also enhance the overall quality of life for society at large.",2.092598841633709,3.99031308008221,0.0505563988622826,,,3.0,"I’m glad we share a belief in the significance of flexibility for navigating the intricate relationship between environmental and economic challenges. A practical and measured approach will indeed be essential in crafting solutions that protect our planet while supporting advancements in quality of life. By focusing on collaboration and innovation, we can create a future where sustainability and progress go hand in hand, benefiting both the environment and society as a whole.",1.8842306858601743,1.0000000698795033,1.2036634306887963e-06,,
