ID,TEXT_TYPE,INIT_OP_A,TEXT_A,PPL_A,PROBE_INT_A,H_INT_A,PROBE_EXT_A,H_EXT_A,INIT_OP_B,TEXT_B,PPL_B,PROBE_INT_B,H_INT_B,PROBE_EXT_B,H_EXT_B
586.0,tot,5.0,"I believe that the focus on climate change has been exaggerated and often distracts from more immediate and pressing issues facing humanity, such as poverty, healthcare, and education. Many proposed solutions, like drastic emissions cuts or transitioning to renewable energy, can have significant economic repercussions and may not effectively address the problem at hand. Instead of prioritizing climate change over other critical needs, we should take a more balanced approach that addresses a range of global challenges without sacrificing economic growth and development.",1.9280434254402001,4.00011402889281,0.0016210728824081293,,,4.0,"I believe that while environmental issues are important, the narrative around climate change often exaggerates the urgency and impact. Many natural climate fluctuations have occurred throughout Earth's history without human influence. Economic growth, technological advancement, and human ingenuity are crucial in addressing various challenges. Instead of focusing solely on climate change, we should prioritize a balanced approach that considers economic stability, energy needs, and innovation alongside environmental stewardship.",1.780980864439979,3.250143775793953,0.9981947836484365,,
586.0,disc,5.0,"While climate change is often highlighted as a pressing global issue, we must consider the broader context of human challenges such as poverty, healthcare, and education that require immediate attention. Drastic measures to combat climate change, like extreme emissions cuts, could inadvertently hinder economic growth and development, impacting the very communities we aim to help. It’s crucial that we adopt a balanced approach that addresses multiple urgent issues without overshadowing the essential needs of humanity.",1.8818258437038327,3.9915159343694744,0.049325197919566535,,,4.0,"I completely agree with this perspective. Prioritizing immediate human challenges such as poverty, healthcare, and education is essential, and we must be cautious about implementing drastic measures that could stifle economic growth. A balanced approach that integrates environmental stewardship with economic and social needs will ultimately lead to more sustainable and effective solutions for everyone involved.",1.5080371642431845,3.7168746270864688,0.5761218536537844,,
586.0,disc,5.0,"I'm glad to hear that you share this perspective, as it's vital to recognize that an integrated approach can lead to more effective solutions. By focusing on economic growth alongside addressing immediate human needs, we can lay the groundwork for a future where environmental stewardship is also a priority without sacrificing development. Ultimately, fostering dialogue that includes a range of perspectives will help us create a more equitable and sustainable path forward.",2.518754272562329,3.9856625500889176,0.07609636234105051,,,4.0,"Absolutely, fostering a dialogue that incorporates diverse perspectives is key to navigating these complex issues. By recognizing that economic growth and environmental stewardship are not mutually exclusive, we can explore innovative solutions that benefit both people and the planet. This holistic approach allows us to ensure that development aligns with sustainability, ultimately leading to better outcomes for communities worldwide.",1.2711035525512643e+67,3.01001616899896,0.09992862915917962,,
586.0,disc,5.0,"I completely agree that acknowledging the interconnection between economic growth and environmental stewardship is essential for finding effective solutions. It’s encouraging to think about how innovative strategies can emerge when we bring together various viewpoints, ultimately leading to more equitable and sustainable outcomes for all communities. A collaborative effort in addressing these issues can help us navigate the complexities while ensuring that no vital human need is overlooked in the process.",2.5118745700323415,3.982795372537316,0.09289981926530015,,,4.0,"You're right; collaboration is crucial for navigating the complexities of economic and environmental challenges. When we combine our ideas and expertise, we can indeed uncover innovative strategies that prioritize both human needs and sustainability. This collective effort can help ensure a more equitable future where development and environmental stewardship go hand in hand, benefiting communities around the world.",2.5445858757319275,3.025042246981009,0.1621134757886822,,
586.0,disc,5.0,"Absolutely, collaboration is the cornerstone of creating effective and innovative solutions that serve both human and environmental needs. By pooling our ideas and expertise, we stand a much better chance of finding common ground that leads to a sustainable future without compromising economic growth. It’s essential that we continue to foster this spirit of cooperation, as it can help bridge the gap between various priorities and ultimately benefit communities across the globe.",2.109100643009843,3.970556627347854,0.1685617920106252,,,4.0,"I wholeheartedly agree that cooperation is vital in addressing the multifaceted challenges we face. By fostering an environment where diverse ideas can coexist, we can indeed strike a balance that promotes both economic growth and environmental well-being. This spirit of collaboration not only enhances our problem-solving capacity but also ensures that we prioritize the needs of all communities, paving the way for a more sustainable future.",1.8961380327492054,3.0065880180346394,0.043048341564137116,,
586.0,disc,5.0,"I appreciate your emphasis on the importance of cooperation in tackling these multifaceted challenges; it’s truly the only way to create meaningful solutions. By embracing diverse ideas and perspectives, we empower ourselves to develop strategies that are not only effective but also equitable for all communities. This collaborative spirit can indeed pave the way for a future where the needs of people and the planet are aligned, fostering a more sustainable and just world for everyone.",2.100260278565065,4.001961075361853,0.11096128982741678,,,4.0,"Thank you for recognizing the value of collaboration in creating meaningful solutions. Embracing diverse perspectives truly equips us to innovate in ways that are equitable and beneficial for all communities, which is essential for lasting change. By aligning the needs of people and the planet, we can work towards a future that is not only sustainable but also just, ensuring that everyone's voice is heard and considered.",1.9939973137285594,3.8688353099934387,0.5148959880899603,,
