ID,TEXT_TYPE,INIT_OP_A,TEXT_A,PPL_A,PROBE_INT_A,H_INT_A,PROBE_EXT_A,H_EXT_A,INIT_OP_B,TEXT_B,PPL_B,PROBE_INT_B,H_INT_B,PROBE_EXT_B,H_EXT_B
588.0,tot,5.0,"I believe that the focus on climate change has been exaggerated and often distracts from more immediate and pressing issues facing humanity, such as poverty, healthcare, and education. Many proposed solutions, like drastic emissions cuts or transitioning to renewable energy, can have significant economic repercussions and may not effectively address the problem at hand. Instead of prioritizing climate change over other critical needs, we should take a more balanced approach that addresses a range of global challenges without sacrificing economic growth and development.",1.9295102076406534,4.00011402889281,0.0016210728824081293,,,4.0,"I believe that while environmental issues are important, the emphasis on climate change often overshadows other pressing concerns that deserve equal attention. There are natural climate fluctuations that have occurred throughout Earth's history, and many argue that humanity's ability to adapt is significant. Rather than focusing solely on climate change, we should prioritize economic development, technological innovation, and improving living standards globally, which can also contribute to better environmental stewardship. Addressing immediate human needs can lead to more sustainable long-term solutions without the alarmism often tied to climate narratives.",2.2018481171831237,3.860914048942235,0.3277673555127108,,
588.0,disc,5.0,"While climate change is often highlighted as a pressing global issue, we must consider the broader context of human challenges such as poverty, healthcare, and education that require immediate attention and resources. Many proposed solutions to combat climate change, like drastic emissions cuts, can hinder economic growth and may not provide the most effective means to address the overall health of our society. It's crucial to adopt a balanced approach that recognizes the interconnection of various global challenges without sidelining economic development.",2.0539858064760947,4.000497081127164,0.021535698468293736,,,4.0,"I completely agree that addressing climate change should not come at the expense of tackling immediate human challenges like poverty, healthcare, and education. A balanced approach that prioritizes economic development and technological innovation can yield more sustainable solutions for both societal health and environmental stewardship. By focusing on improving living standards globally, we can create a framework where humans are better equipped to adapt to whatever climate fluctuations may arise.",3.981258815438793e+56,3.5670327514180977,0.831078250013564,,
588.0,disc,5.0,"I appreciate your acknowledgment of the need for a balanced approach that does not compromise economic development. Emphasizing technological innovation is indeed a key factor, as it offers the potential to address both societal and environmental issues without sacrificing progress in other critical areas. By focusing on uplifting living standards, we can foster a resilient population that is more capable of facing a variety of challenges, including those related to climate change.",2.249084985486451,3.9886105111072836,0.0631685765175906,,,4.0,"Thank you for your thoughtful response; it’s encouraging to see a shared understanding of the importance of both economic development and technological innovation. By fostering innovations that target societal advancements, we can create solutions that not only uplift communities but also promote environmental sustainability. Ultimately, a resilient population is better equipped to tackle diverse challenges, and our focus should be on creating a more prosperous and adaptable world for everyone.",1.12215767381904e+56,3.126121601293245,0.8698358381012987,,
588.0,disc,5.0,"I completely agree that fostering innovations aimed at societal advancements can lead to meaningful progress for both communities and the environment. It’s vital that our approaches to development and sustainability are integrated, ensuring that we create solutions that provide tangible benefits to people while also addressing environmental concerns. By prioritizing prosperity and adaptability, we can build a world where individuals are empowered to face various challenges, ultimately leading to a more resilient society overall.",1.8969294442186744,3.986280165536933,0.09401154995647637,,,4.0,"I appreciate your agreement and emphasis on the integration of development and sustainability, as it's essential for creating holistic solutions to our global challenges. By prioritizing prosperity, we not only enhance individual well-being but also lay the groundwork for a more environmentally conscious society. Empowering individuals to thrive in this context serves to create the resilience we need to navigate both present and future challenges effectively.",9.916597599763383e+58,3.003157857218993,0.021765379256471647,,
588.0,disc,5.0,"I share your appreciation for the importance of integrating development and sustainability, as this holistic approach is essential for achieving lasting solutions. By fostering prosperity, we're not only improving individual well-being but also cultivating a greater awareness of environmental issues that can drive responsible actions. Ultimately, when empowerment and resilience go hand in hand, we can better equip individuals and communities to tackle the multifaceted challenges that lie ahead.",2.584018713461126,3.9876973767377324,0.10869288484861314,,,4.0,"Absolutely, your perspective highlights the interconnectedness of prosperity and environmental awareness in driving responsible actions. When individuals are empowered through economic growth and improved living standards, they are more likely to engage in sustainable practices that contribute to a healthier planet. By pursuing a holistic approach, we can create communities that are not only resilient but also proactive in addressing the various challenges we face together.",5.378913663228194e+59,3.1477725275778443,0.43066335927871,,
588.0,disc,5.0,"Exactly, the interconnectedness you've highlighted is crucial, as empowered individuals can indeed become champions of sustainable practices. When economic growth and improved living standards are achieved, people are more motivated to take actions that benefit both themselves and the environment. A holistic approach enables us to cultivate communities that are proactive, engaging in solutions that address not just climate-related challenges, but the broader range of issues we collectively face.",2.4440202891345795e+55,3.9616572061441033,0.24436732837288921,,,4.0,"I couldn't agree more; empowered individuals can truly be at the forefront of driving change in both their communities and the environment. By fostering an environment where economic growth leads to a sense of responsibility, we encourage a culture of sustainability that benefits everyone. This holistic approach not only addresses climate-related challenges but also strengthens our collective capacity to confront the diverse issues that affect our societies.",1.97846460352523,3.0019902683287976,0.015385620907959599,,
