ID,TEXT_TYPE,INIT_OP_A,TEXT_A,PPL_A,PROBE_INT_A,H_INT_A,PROBE_EXT_A,H_EXT_A,INIT_OP_B,TEXT_B,PPL_B,PROBE_INT_B,H_INT_B,PROBE_EXT_B,H_EXT_B
606.0,tot,5.0,"I believe that the focus on climate change has been exaggerated and often distracts from more immediate and pressing issues facing humanity, such as poverty, healthcare, and education. Many proposed solutions, like drastic emissions cuts or transitioning to renewable energy, can have significant economic repercussions and may not effectively address the problem at hand. Instead of prioritizing climate change over other critical needs, we should take a more balanced approach that addresses a broader range of societal challenges. Ultimately, the climate has always changed throughout Earth’s history, and it's essential to consider whether the current narratives truly reflect the complexity of the issue.",2.1662034957017955,4.00010397575992,0.0014537182801534223,,,5.0,"I believe that the focus on climate change has been exaggerated and often distracts from more immediate and pressing issues facing humanity, such as poverty, healthcare, and education. Many proposed solutions, like drastic policy changes and economic upheaval, could harm economies and livelihoods without guaranteeing significant impact on climate. Instead of prioritizing climate alarmism, we should invest in innovation and technology that can address environmental issues without sacrificing progress and development. It's important to critically evaluate the narratives surrounding climate change and consider a balanced approach to environmental stewardship.",2.7452601420735606e+42,4.00012442227732,0.0036392421886806657,,
606.0,disc,5.0,"While climate change is undeniably a crucial topic, it's important to consider whether it has become an overly exaggerated focus that detracts from more immediate issues like poverty and healthcare that affect millions daily. Instead of solely emphasizing drastic emissions cuts or transitions to renewable energy, we should adopt a more balanced approach that addresses a wider range of societal challenges. After all, the climate has undergone changes throughout Earth's history, and we must critically evaluate the narratives surrounding today's climate discourse and how they influence our priorities.",2.267082894957548,3.962817457397105,0.10041963894245631,,,5.0,"I completely agree that while climate change is an important issue, the emphasis on it can sometimes overshadow other pressing challenges like poverty, healthcare, and education that affect millions of people daily. Adopting a balanced approach that considers these immediate needs is crucial, as many of the proposed drastic measures to combat climate change could inadvertently harm economies and livelihoods. It’s essential for us to critically evaluate the narratives surrounding climate discourse to ensure we are prioritizing solutions that foster both environmental sustainability and human progress.",1.8218644895932203,3.9987088136715676,0.014027233213134507,,
606.0,disc,5.0,"I appreciate your agreement on the need for a balanced approach, as it’s vital to ensure that our responses to climate change do not inadvertently compromise economic stability or worsen existing inequalities. Addressing poverty, healthcare, and education should be at the forefront of our agenda, as these issues are interconnected with how we tackle climate challenges. By focusing on holistic solutions that promote human progress while considering environmental sustainability, we can create a more equitable future for all.",1.7868699991179169,3.6676541093663735,0.6019084191622033,,,5.0,"I’m glad to see we share a common understanding about the interconnectedness of these issues. Prioritizing holistic solutions that address poverty, healthcare, and education alongside environmental sustainability allows us to create a more comprehensive framework for progress. It’s essential that our efforts in tackling climate change do not just address environmental concerns in isolation, but instead integrate broader societal needs to ensure an equitable future for everyone.",9.849666946741284e+55,3.771094089602834,0.5534852642176692,,
606.0,disc,5.0,"It's encouraging to find common ground on the interconnectedness of these critical issues, as an integrated approach can lead to more effective and sustainable solutions. By aligning our climate efforts with broader societal needs, we enhance the potential for impactful change that benefits both the environment and human well-being. Ultimately, fostering this comprehensive framework will enable us to tackle the root causes of inequality while addressing the complex challenges posed by climate change.",1.9032175205737425,3.9385236779911517,0.1835059746345683,,,5.0,"Absolutely, an integrated approach is key to fostering impactful change that serves both environmental and societal goals. By aligning our climate initiatives with the pressing needs of communities, we can tackle the root causes of inequality while effectively addressing the complexities of climate change. This comprehensive framework allows us to create solutions that not only mitigate environmental challenges but also uplift and empower individuals and communities in the process.",1.7636750736314089,3.8380741470549133,0.47299437264377203,,
606.0,disc,5.0,"I couldn’t agree more; a comprehensive framework that aligns climate initiatives with community needs is crucial for driving meaningful progress. By empowering individuals and addressing the root causes of inequality, we can ensure that our solutions are not only environmentally sound but also socially just. This holistic approach not only benefits the planet but also enhances the resilience of communities, fostering a healthier and more equitable society for all.",1.8618226332776797,2.451837734098373,0.587703072370593,,,5.0,"You're spot on; empowering individuals and addressing inequality are fundamental components of effective climate solutions. This holistic approach not only safeguards the environment but also strengthens communities, enabling them to adapt and thrive in the face of various challenges. Ultimately, creating a resilient and equitable society benefits everyone and leads us toward a sustainable future that embraces both environmental stewardship and social justice.",1.879852806057711e+63,3.9133150736691045,0.35366165618865175,,
606.0,disc,5.0,"Thank you for emphasizing the importance of empowering individuals and addressing inequality in our climate solutions, as these aspects truly are intertwined with long-term sustainability. When communities are strong and resilient, they are better equipped to handle environmental changes and challenges, contributing to a more stable society overall. By fostering both environmental stewardship and social justice, we can pave the way for a future where both people and the planet can flourish together.",2.027709227174615,2.32575984807665,0.580235732602936,,,5.0,"I appreciate your insights on the interconnection between community strength and environmental resilience; it's a vital aspect of achieving long-term sustainability. When we focus on empowering individuals, we not only enhance their capacity to address environmental challenges but also build a foundation for a more stable and just society. By prioritizing both environmental stewardship and social equity, we truly create a path for a future where both people and the planet thrive in harmony.",1.6733858181058985,4.029546188294964,0.20159224489995162,,
