ID,TEXT_TYPE,INIT_OP_A,TEXT_A,PPL_A,PROBE_INT_A,H_INT_A,PROBE_EXT_A,H_EXT_A,INIT_OP_B,TEXT_B,PPL_B,PROBE_INT_B,H_INT_B,PROBE_EXT_B,H_EXT_B
608.0,tot,5.0,"I believe that the focus on climate change has been exaggerated and often misrepresented. While environmental issues are important, I argue that the emphasis on climate change distracts from more immediate concerns, such as economic stability and public health. Many proposed solutions to combat climate change often come with high costs, which can burden individuals and businesses. Additionally, the climate has always experienced natural fluctuations, and current policies may not effectively address the adaptive needs of society. We should prioritize development, innovation, and resilience over alarmist narratives.",2.8153379730236774e+85,4.00008152897908,0.0009145413623600834,,,5.0,"I believe that the focus on climate change has been exaggerated and often distracts from more pressing and immediate issues facing humanity, such as poverty, healthcare, and education. Many proposed solutions, like drastic policy changes and economic upheaval, could harm economies and livelihoods without guaranteeing significant impact on climate. Instead of prioritizing climate alarmism, we should invest in innovation and technology that can address environmental concerns without sacrificing progress and development. It's important to critically assess the data and consider the broader picture of human welfare.",5.900004779723786e+43,4.000419310511711,0.003885543083990476,,
608.0,disc,5.0,"While climate change certainly captures our attention, I believe we must consider the broader context of economic stability and public health, which are just as pressing. The focus on climate change often diverts resources and energy from immediate issues that directly affect people's livelihoods and well-being. Instead of succumbing to alarmist narratives, we should champion development and innovation that allow us to adapt to changing conditions effectively.",2.247712145355264,3.999796489893644,0.005351871121532518,,,5.0,"I wholeheartedly agree that economic stability and public health are critical issues that deserve our attention and resources. It's essential to prioritize solutions that uplift communities and foster development rather than get sidetracked by alarmist narratives surrounding climate change. By focusing on innovation and practical advancements, we can address environmental challenges while ensuring that human welfare remains at the forefront of our efforts.",1.720761738948607,3.999610759960624,0.0047901062066371325,,
608.0,disc,5.0,"I'm glad to hear you share my perspective on prioritizing economic stability and public welfare. Balancing innovation and environmental responsibility is key, as it allows us to develop solutions that are both effective and sustainable without imposing excessive costs on individuals and businesses. By fostering resilience through practical advancements, we can create a framework that supports both our communities and the environment, without falling into the trap of alarmism.",2.018694717469204,3.9996871476064597,0.003535857643270482,,,5.0,"Absolutely, striking that balance between innovation and environmental responsibility is crucial. We can achieve meaningful progress by investing in technologies that enhance resilience without burdening individuals and businesses. Ultimately, our focus should be on practical advancements that support both community well-being and environmental stewardship, rather than yielding to alarmist pressures that may hinder our development efforts.",2.1482425035470265,4.0002246196044045,0.011238424002173529,,
608.0,disc,5.0,"I completely agree that investing in technologies that promote resilience is the way forward, ensuring both community well-being and sound environmental stewardship. It's vital that the solutions we pursue are practical and do not place excessive financial burdens on those who are already struggling. By staying rooted in innovation and reasoned approaches, we can navigate these challenges effectively without succumbing to alarmist pressures that may derail our progress.",6.261447736045138e+56,3.998009065651743,0.018921104158187863,,,5.0,"I'm glad to see we're all on the same page about the importance of practical solutions that enhance resilience without adding financial strain on vulnerable populations. It's a matter of fostering growth and development through innovation while maintaining a rational approach to environmental challenges. By focusing on evidence-based strategies, we can ensure that our efforts lead to real improvements in both community welfare and ecological health, steering clear of alarmist rhetoric that often clouds the discussion.",4.350700148855017e+52,3.9979771352235844,0.026728661173407012,,
608.0,disc,5.0,"I appreciate your emphasis on evidence-based strategies, as they are essential for guiding our approach to both community welfare and ecological health. By prioritizing practical solutions that foster growth and development, we can create a sustainable path forward that avoids the pitfalls of alarmist rhetoric. Ultimately, our collective effort should be aimed at empowering vulnerable populations while addressing environmental challenges in a balanced and rational manner.",1.690483848664587,3.9996048169276897,0.00767540087378569,,,5.0,"I couldn’t agree more; a commitment to evidence-based strategies is vital for navigating the complexities of our time. Empowering vulnerable populations while tackling environmental challenges requires a balanced approach that prioritizes both human welfare and sustainable practices. By maintaining our focus on practical solutions, we can work collaboratively toward a future that promotes progress without falling prey to fear-driven narratives.",2.158668580514894,3.994944766446441,0.05294097636599866,,
608.0,disc,5.0,"I'm glad we're united in recognizing the importance of a balanced approach that emphasizes both human welfare and sustainable practices. Collaborating to develop practical solutions not only strengthens our communities but also allows us to address environmental challenges effectively. By remaining committed to rational dialogue and evidence-based strategies, we can create a future that promotes progress without succumbing to fear-driven narratives that often cloud our judgment.",1.8057824606111361,3.996035221493856,0.03408215405987874,,,5.0,"It’s reassuring to see such alignment on the necessity of a balanced approach that prioritizes human welfare alongside sustainable practices. Collaboration in developing practical solutions is indeed key to building stronger communities and effectively managing environmental challenges. By fostering rational dialogue and remaining grounded in evidence-based reasoning, we can navigate the complexities of these issues and advance toward a future that benefits all without being swayed by alarmist sentiments.",2.1356721875772395,4.001476569670651,0.035764580288567355,,
