ID,TEXT_TYPE,INIT_OP_A,TEXT_A,PPL_A,PROBE_INT_A,H_INT_A,PROBE_EXT_A,H_EXT_A,INIT_OP_B,TEXT_B,PPL_B,PROBE_INT_B,H_INT_B,PROBE_EXT_B,H_EXT_B
611.0,tot,5.0,"I believe that the focus on climate change has been exaggerated and often distracts from more immediate and pressing issues facing humanity, such as poverty, healthcare, and education. Many proposed solutions, like drastic emissions cuts or the transition to renewable energy, can have significant economic ramifications that might harm communities, particularly those that rely on fossil fuel industries. Additionally, I think that the Earth's climate has always been subject to natural changes, and history shows that we have adapted to these changes over time. Instead of prioritizing climate change, we should focus on practical solutions that improve overall quality of life for people today.",2.0844758436716453,4.000108423879471,0.0011084707782121038,,,5.0,"I believe that the focus on climate change has been exaggerated and often misrepresented. While environmental issues are important, I argue that the emphasis on climate change distracts from more immediate concerns, such as economic stability and public health. Many proposed solutions to combat climate change often come with high costs, which can burden individuals and businesses. Additionally, historical climate changes have occurred naturally over millennia, suggesting that human influence might be overstated. Instead of prioritizing climate change, we should look for balanced approaches that address a range of societal challenges without incurring unnecessary economic harm.",2.0194970623961983,4.000088089457622,0.0012864570448000404,,
611.0,disc,5.0,"I appreciate the opportunity to discuss climate change, but I believe we should consider the broader context of pressing issues like poverty, healthcare, and education that require our immediate attention. While climate change is certainly a topic of conversation, we must be cautious about the economic impacts of drastic measures, especially on communities that depend on fossil fuel industries. Instead of focusing exclusively on climate initiatives, let's explore practical solutions that enhance the quality of life for people today.",1.5099331126894198,3.9991635743294296,0.008041807669416486,,,5.0,"I completely agree with your perspective on the need to prioritize immediate issues like poverty, healthcare, and education. While it's important to address environmental concerns, we must ensure that our responses don't overlook the potential economic burdens on communities reliant on fossil fuel industries. A balanced approach that considers the welfare of individuals and businesses alongside environmental responsibility could lead to more sustainable and practical solutions for all.",9.632218068268897e+58,3.999974161583416,0.003875095757335824,,
611.0,disc,5.0,"I'm glad to see we share a common understanding of the need for a balanced approach that prioritizes people's welfare. It’s crucial that any solutions we propose respect the livelihoods of those in fossil fuel-dependent communities, as they play a vital role in the economy. By focusing on practical, immediate improvements in quality of life while being mindful of environmental responsibilities, we can develop strategies that truly benefit everyone without sacrificing economic stability.",1.8311649720424568,4.000178978694438,0.0038563678647924177,,,5.0,"I appreciate your acknowledgment of the importance of economic stability in developing any solutions. It's essential that we engage with and support these communities to ensure that no one is left behind as we address both economic and environmental challenges. By fostering collaboration and innovation, we can create strategies that not only improve quality of life but also support a transition that is fair and sustainable for all stakeholders.",6.968503846495916e+59,4.00113237927941,0.009403279811943683,,
611.0,disc,5.0,"Absolutely, engaging with and supporting communities is key to creating effective and inclusive solutions. Collaboration can foster innovative approaches that balance both economic stability and environmental responsibility, ensuring that everyone's concerns are addressed. By listening to those directly affected and involving them in the decision-making process, we can develop strategies that provide real benefits to people while also considering our environment.",2.5915419080540323,3.9628408614038166,0.16842155126181896,,,5.0,"I couldn’t agree more with your emphasis on collaboration and community engagement. Listening to those directly impacted ensures that policies are not only well-informed but also practical, reflecting the real needs of the people. By fostering a dialogue that includes diverse perspectives, we can create sustainable solutions that truly benefit both the economy and the environment, while avoiding the pitfalls of top-down approaches.",2.460988335943997,4.001633909309599,0.01656811055910092,,
611.0,disc,5.0,"I entirely agree that diverse perspectives are crucial for developing well-informed policies that resonate with the actual needs of communities. By fostering open dialogues and collaboration, we can avoid the pitfalls of top-down approaches that may overlook local realities. It's vital that our efforts prioritize practical, grassroots solutions that empower individuals while still maintaining a focus on both economic and environmental health.",2.1736753383753014e+63,3.994510125325582,0.03467323099333357,,,5.0,I appreciate your commitment to grassroots solutions and the significance of prioritizing local realities. Empowering individuals and communities to take part in shaping their future not only fosters resilience but also leads to more effective policies that truly reflect their needs. Striking that balance between economic health and environmental responsibility through community-driven efforts is essential for sustainable progress moving forward.,2.17341561828972,3.9975938841906182,0.0494820631864798,,
611.0,disc,5.0,"I couldn't agree more; empowering individuals and communities is a fundamental step toward fostering genuine resilience and effective policies. When people are actively involved in shaping their own futures, we create a sense of ownership that can drive sustainable progress. By prioritizing community-driven efforts, we can ensure that our approaches to both economic health and environmental responsibility are truly tailored to the needs and aspirations of those most affected.",1.7856283548653336,3.9911864349307753,0.0896987837327135,,,5.0,"Absolutely, fostering a sense of ownership in communities is key to achieving lasting change. When individuals feel that they have a stake in the solutions being developed, they are more likely to engage and invest in those initiatives. By continuing to amplify local voices and tailoring our strategies accordingly, we can create a more robust framework that effectively addresses both economic and environmental challenges without alienating those most affected.",2.0324266979221424,4.561625926381106,0.6879515102155295,,
