ID,TEXT_TYPE,INIT_OP_A,TEXT_A,PPL_A,PROBE_INT_A,H_INT_A,PROBE_EXT_A,H_EXT_A,INIT_OP_B,TEXT_B,PPL_B,PROBE_INT_B,H_INT_B,PROBE_EXT_B,H_EXT_B
612.0,tot,5.0,"I believe that the focus on climate change has been exaggerated and often distracts from more immediate and pressing issues facing humanity, such as poverty, healthcare, and education. Many proposed solutions, like drastic emissions cuts or transitioning to renewable energy, can have significant economic repercussions and may not effectively address the problem at hand. Instead of prioritizing climate change over other critical needs, we should take a more balanced approach that addresses a range of global challenges without sacrificing economic growth and development.",1.9298848849730832,4.000117839432522,0.0019597541853429777,,,5.0,"I believe that the focus on climate change has been exaggerated and often distracts from more immediate and pressing issues. There are many factors that contribute to changes in the environment, and not all of them are driven by human activity. Moreover, the economic implications of drastic climate policies can harm communities, particularly those that rely on fossil fuels for their livelihoods. It’s important to seek a balanced approach that considers a range of environmental, economic, and social factors, rather than prioritizing climate change above all else.",1.6734861303250903,3.997103736305233,0.01648657252317067,,
612.0,disc,5.0,"While climate change is often highlighted as a pressing global issue, we must consider the broader context of human challenges such as poverty, healthcare, and education, which require immediate attention. It’s important to recognize that drastic measures for emissions cuts and a rapid transition to renewable energy can have unforeseen economic consequences that may further exacerbate existing inequalities. A more balanced approach that addresses multiple global challenges simultaneously can lead to sustainable progress without compromising economic growth.",1.9119606400406395,3.975653887541364,0.09515856925516265,,,5.0,"I completely agree that while climate change is frequently emphasized, we shouldn't lose sight of other critical human challenges like poverty and education that demand our immediate attention. The consequences of drastic climate policies can indeed harm communities reliant on fossil fuels, and we need to be cautious about the potential for worsening inequalities. An integrated approach that tackles various issues concurrently is essential for creating sustainable progress and ensuring economic stability.",2.457026463769141,3.9868122249889777,0.048463972730897496,,
612.0,disc,5.0,"I appreciate your agreement on the need to prioritize multiple critical issues and the potential negative impact of drastic climate policies on vulnerable communities. It’s crucial that we communicate the importance of simultaneously addressing poverty, education, and healthcare while considering climate action, as failing to do so can undermine both social equity and economic stability. Ultimately, fostering a dialogue that promotes sustainable solutions across all these areas will ensure a more holistic and effective path forward for humanity.",1.938505391599011e+101,3.9932586186036834,0.03989870742044902,,,5.0,"I appreciate your perspective on the importance of fostering dialogue that encompasses all critical issues, including climate action, poverty, education, and healthcare. It’s essential to create solutions that do not compromise the economic well-being of vulnerable communities while addressing these interconnected challenges. By prioritizing a holistic approach, we can work towards sustainable outcomes that promote both social equity and economic growth without losing sight of the diverse factors influencing our environment.",1.7401526250698856,3.997911713135026,0.01607947463723094,,
612.0,disc,5.0,"I’m glad we’re on the same page regarding the necessity for holistic solutions that consider the complex interconnections between various global challenges. Prioritizing economic well-being while addressing issues like climate action will help ensure that vulnerable communities are not left behind in the pursuit of sustainability. By fostering collaboration across sectors, we can develop innovative strategies that promote both social equity and environmental responsibility in a way that enhances, rather than hinders, economic growth.",2.135324104878092,3.9730661306629926,0.1450719260818142,,,5.0,"I completely agree that collaboration across sectors is vital for designing innovative strategies that address both social equity and environmental responsibility. By prioritizing economic well-being, we can create pathways for sustainability that empower vulnerable communities rather than marginalizing them. It’s crucial that our approach not only recognizes the complexity of these interconnected challenges but also actively seeks solutions that enhance economic growth while addressing environmental concerns.",1.9563902655359102,3.848682571286988,0.4335143073570684,,
612.0,disc,5.0,"I appreciate your emphasis on empowerment and the importance of creating pathways that support vulnerable communities as we pursue sustainability. Acknowledging the complexity of our interconnected challenges will enable us to craft tailored solutions that resonate with local needs while driving economic growth. By maintaining a focus on collaborative efforts, we can ensure that environmental responsibility goes hand in hand with promoting social equity and economic stability for all.",2.1370723160369955,3.882735916007736,0.38859482212323077,,,5.0,"Thank you for highlighting the importance of tailoring solutions to meet local needs while pursuing sustainability. I wholeheartedly agree that empowering vulnerable communities is key to ensuring that environmental efforts do not overlook economic stability and social equity. By emphasizing collaboration and local engagement, we can create effective strategies that benefit everyone without sacrificing the economic foundation that many rely on.",2.2585439997914674,3.3208940011663617,0.6290588498852264,,
612.0,disc,5.0,"I’m glad we share the belief that local engagement is essential for crafting effective strategies that truly benefit communities. Empowering vulnerable populations not only fosters resilience but also builds a stronger economic foundation that can support sustainable initiatives in the long run. By continuing to prioritize collaboration and tailored solutions, we can navigate the complexities of both environmental and social challenges in a way that uplifts everyone involved.",1.6681199239208504,3.437607276312466,0.7198429719454414,,,5.0,"I appreciate your recognition of the role that local engagement plays in building effective strategies for our communities. Empowering vulnerable populations indeed strengthens the economic foundation needed to support sustainable initiatives, ensuring broader participation in the process. By maintaining our focus on collaboration and tailored solutions, we can navigate the intricate connections between environmental and social challenges while uplifting everyone involved in the journey toward sustainability.",1.9830204864791434,4.007092529597172,0.11451641086426656,,
