ID,TEXT_TYPE,INIT_OP_A,TEXT_A,PPL_A,PROBE_INT_A,H_INT_A,PROBE_EXT_A,H_EXT_A,INIT_OP_B,TEXT_B,PPL_B,PROBE_INT_B,H_INT_B,PROBE_EXT_B,H_EXT_B
614.0,tot,5.0,"I believe that the focus on climate change has been exaggerated and often distracts from more pressing and immediate issues facing humanity, such as poverty, healthcare, and education. Many proposed solutions, like drastic policy changes and economic upheaval, could harm economies and livelihoods without guaranteeing significant impact on climate. Instead of prioritizing climate alarmism, we should invest in innovation and technology that can address environmental issues without sacrificing progress and development. It's important to critically assess the data and consider the broader picture of human welfare rather than focusing solely on climate narratives.",8.681949480479982e+40,4.001164794289028,0.011248724027755416,,,5.0,"I believe that the focus on climate change has been exaggerated and often distracts from more pressing and immediate issues facing humanity, such as poverty, healthcare, and education. Many proposed solutions, like drastic emissions cuts or the shift to renewable energy, can have significant economic repercussions without necessarily solving the underlying problems. Furthermore, climate has always varied over time; it's part of the Earth's natural cycles. Instead of panicking over climate change, we should prioritize adaptability and resilience while focusing on sustainable development that addresses the diverse needs of populations around the world.",2.3046288447093195,4.000057354465049,0.0006393378787588335,,
614.0,disc,5.0,"While it's important to acknowledge the conversation around climate change, we must be cautious not to let it overshadow other critical issues like poverty, healthcare, and education that need immediate attention. The proposed solutions often come with drastic policy changes that could harm economies and livelihoods without guaranteeing true environmental impact. Instead, we should focus on fostering innovation and technology that can address these environmental challenges in a way that aligns with human progress and development.",3.4434482217313533e+52,3.9938037138946667,0.030351680453078202,,,5.0,"I completely agree with your perspective; it’s crucial that we don’t allow the climate change narrative to sideline pressing issues like poverty, healthcare, and education that require our immediate attention. The push for drastic policy changes often overlooks the potential economic repercussions, jeopardizing livelihoods without ensuring effective environmental solutions. By prioritizing innovation and technology, we can find ways to address environmental challenges that also promote human progress and sustainable development for all.",1.7337096396636056,4.000171326143079,0.0018269578032282267,,
614.0,disc,5.0,"I'm glad to see you share this perspective, as it highlights the need for a balanced approach to progress. It's essential that we engage in discussions that prioritize practical solutions while considering the interconnectedness of various global challenges. Fostering innovation and technology can lead to effective environmental strategies that ultimately enhance human welfare without imposing unnecessary economic burdens.",2.406081763960505,3.934794228802799,0.24418590154883005,,,5.0,"Absolutely, the interconnectedness of global challenges is a vital aspect of any discussion on progress. It's encouraging to see a focus on practical solutions that can harness innovation and technology to create a win-win scenario for both the environment and human welfare. By embracing a balanced approach, we can tackle long-standing issues while also addressing environmental concerns without compromising economic stability and growth.",2.636065046380866e+61,4.0000260001259464,0.0012899177442844975,,
614.0,disc,5.0,"I completely agree; a balanced approach is essential for sustainable progress. By leveraging innovation, we can develop solutions that not only protect our environment but also enhance economic stability and growth. It's about finding that synergy where advancements in technology lead to improved quality of life while responsibly addressing environmental issues.",1.7630170018081441,3.9601950402963566,0.18117370115369108,,,5.0,"You're spot on; finding that synergy is key to achieving sustainable progress without sacrificing economic stability. By investing in innovative technologies, we can create solutions that simultaneously uplift communities and protect our environment. This dual focus will not only improve quality of life but also ensure that we address environmental concerns in a responsible and economically viable manner.",1.8166985694204865,4.000041041766177,0.014182860199933235,,
614.0,disc,5.0,"Absolutely, the dual focus on uplifting communities while addressing environmental concerns is a wise approach. Investing in innovative technologies can indeed drive progress and create new opportunities that benefit both people and the planet. It’s essential that our efforts to tackle environmental challenges are not just well-intentioned but also yield tangible benefits that contribute to long-term stability and well-being for all.",3.7221904079124655e+61,3.8476200200127444,0.4757761278747986,,,5.0,"I couldn't agree more; our efforts must lead to tangible benefits that support both people and the planet. By prioritizing investments in innovative technologies, we can create opportunities that enhance quality of life while effectively addressing environmental challenges. Ultimately, a thoughtful approach that combines social and environmental considerations will pave the way for long-term stability and well-being for everyone involved.",1.718262336641982,4.016074532530124,0.10294532135409161,,
614.0,disc,5.0,"You’ve articulated this perfectly; a thoughtful approach is indeed crucial for fostering lasting change. By emphasizing investments in innovative technologies, we can harness creativity and entrepreneurship to tackle environmental challenges while simultaneously improving living standards. It’s about striking the right balance, ensuring that our solutions are practical and beneficial for both society and the environment.",2.1732709641786547,3.947457680449388,0.2310267708959048,,,5.0,"Thank you; I appreciate your recognition of the importance of a thoughtful approach to driving lasting change. By fostering creativity and entrepreneurship, we not only spark innovation but also empower communities to actively participate in both environmental and social progress. Striking the right balance will enable us to develop practical solutions that truly benefit society while respecting and protecting our environment.",1.1441931796048916e+65,4.006509363570449,0.041796928746317255,,
