ID,TEXT_TYPE,INIT_OP_A,TEXT_A,PPL_A,PROBE_INT_A,H_INT_A,PROBE_EXT_A,H_EXT_A,INIT_OP_B,TEXT_B,PPL_B,PROBE_INT_B,H_INT_B,PROBE_EXT_B,H_EXT_B
615.0,tot,5.0,"I believe that the focus on climate change has been exaggerated and often distracts from more pressing and immediate issues facing society, such as poverty, healthcare, and education. Many climate models are speculative, and the economic impact of drastic measures to combat climate change can be detrimental. We should prioritize innovation and adaptation rather than imposing regulations that might hinder growth and development. Ultimately, it's crucial to maintain a balanced perspective on environmental issues without sacrificing economic stability and individual freedoms.",1.8766579144278903,4.000612691843216,0.01068605052560468,,,5.0,"I believe that the focus on climate change has been exaggerated and often distracts from more immediate and pressing issues facing humanity, such as poverty, healthcare, and education. Many proposed solutions, like drastic emissions cuts or transitioning to renewable energy, can have significant economic repercussions and may not effectively address the problem at hand. Instead of prioritizing climate change over other critical needs, we should take a more balanced approach that addresses a range of global challenges without sacrificing economic growth and development.",1.9218358943645373,4.000138592773273,0.0017483722703342391,,
615.0,disc,5.0,"While climate change is certainly an important topic, I believe the focus on it sometimes overshadows more immediate challenges like poverty and education that demand our attention. It's crucial to critically assess the economic implications of drastic climate measures, as they can inadvertently hinder growth and development. Instead of strict regulations, we should emphasize innovation and adaptation to address environmental issues without compromising our economic stability and individual freedoms.",1.782578518081723,3.7850246128320895,0.4403781756206721,,,5.0,"I completely agree with your perspective that while climate change is indeed important, it should not distract us from urgent issues like poverty and education that require immediate attention. The potential economic repercussions of strict climate measures are significant, and we must find ways to innovate and adapt without stifling growth or infringing on individual freedoms. A balanced approach that considers various global challenges is essential for sustainable progress, ensuring we address climate concerns without sacrificing our economic well-being.",1.857857258127092,4.0002398504118695,0.006399229736278799,,
615.0,disc,5.0,"I appreciate your agreement on the need for a balanced approach to tackle various global challenges without sacrificing economic stability. It’s essential to foster an environment where innovation thrives, allowing us to find practical solutions to environmental issues without imposing burdensome regulations. By prioritizing our immediate societal needs while adapting thoughtfully to climate concerns, we can create a sustainable path forward that benefits everyone.",3.845269964722948e+60,3.8300224209629703,0.4326843603885476,,,5.0,"Thank you for your thoughtful response; I share your enthusiasm for fostering an environment conducive to innovation. By focusing on immediate societal needs, we can work towards solutions that address climate concerns in a way that is economically viable and beneficial to all. It's crucial that we engage in dialogue that emphasizes practical approaches, enabling us to tackle multiple challenges simultaneously while ensuring that our economy remains strong and resilient.",2.8204601616970813e+57,3.948714609140382,0.20720748623105634,,
615.0,disc,5.0,"I’m glad to hear that you resonate with the importance of practical approaches to the interconnected challenges we face. Engaging in constructive dialogue allows us to explore innovative solutions that not only address climate concerns but also enhance economic resilience and growth. By collaborating on integrated strategies, we can create a future that prioritizes both societal well-being and environmental sustainability without compromising our economic foundation.",1.465708536036198e+119,3.7744897254030003,0.47944466512638545,,,5.0,"I appreciate your emphasis on collaboration and constructive dialogue as essential components in finding integrated strategies. It’s vital that we harness innovation in a way that promotes economic resilience while addressing environmental sustainability. By working together and prioritizing practical solutions, we can create a future where societal well-being and economic growth coexist without one overshadowing the other.",1.9585478981437519,3.853381272524134,0.437846575185562,,
615.0,disc,5.0,"I couldn't agree more; collaboration is key to creating strategies that genuinely work for both society and the economy. By fostering partnerships across sectors, we can tap into diverse perspectives and drive innovative solutions that seamlessly integrate environmental goals with economic growth. Ultimately, our shared commitment to practical and balanced approaches will lay the groundwork for a sustainable future that uplifts everyone without sacrificing our priorities.",7.039868809736082e+59,3.286876328529776,1.0032757308091114,,,5.0,"Absolutely, your point about fostering partnerships across sectors is crucial for driving the innovative solutions we need. By leveraging diverse perspectives, we can ensure that our strategies are not only effective but also considerate of all stakeholders involved. A shared commitment to practical and balanced approaches is the only way to establish a sustainable future that truly benefits society while maintaining economic priorities.",1.93480752678698,3.979378668239051,0.15774290948951283,,
615.0,disc,5.0,"I'm glad we agree on the importance of leveraging diverse perspectives to create effective solutions that benefit all stakeholders. It’s through these partnerships that we can harness the full potential of innovation while ensuring our strategies remain practical and inclusive. By maintaining a strong focus on both societal and economic priorities, we can pave the way for a sustainable future that uplifts everyone involved.",1.9252411168545212,3.9471618922884626,0.2114225230620457,,,5.0,"I wholeheartedly concur that leveraging diverse perspectives is vital for crafting inclusive solutions that truly benefit all stakeholders. Innovation thrives in collaborative environments, allowing us to balance our societal and economic priorities effectively. By continuing to prioritize these partnerships, we can indeed pave the way for a sustainable future that uplifts everyone without compromising our collective goals.",1.7001692910830488,4.0315052914902125,0.3872924090267178,,
