ID,TEXT_TYPE,INIT_OP_A,TEXT_A,PPL_A,PROBE_INT_A,H_INT_A,PROBE_EXT_A,H_EXT_A,INIT_OP_B,TEXT_B,PPL_B,PROBE_INT_B,H_INT_B,PROBE_EXT_B,H_EXT_B
623.0,tot,5.0,"I believe that the focus on climate change has been exaggerated and often distracts from more immediate and pressing issues facing humanity, such as poverty, healthcare, and education. Many proposed solutions, like drastic policy changes and economic upheaval, could harm economies without solving the problem effectively. Furthermore, there are natural climate cycles that have occurred throughout history, and it's essential to consider all factors rather than attributing everything to human activity. Instead of prioritizing climate change, we should direct our resources towards sustainable development and technological innovations that can address a variety of global challenges.",1.906975393670429,4.000327454711131,0.0031053882137258384,,,5.0,"I believe that the focus on climate change has been exaggerated and often distracts from more pressing and immediate issues facing humanity, such as poverty, healthcare, and education. Many proposed solutions, like drastic policy changes and economic upheaval, could harm economies without solving the problem effectively. Furthermore, there are natural climate cycles that have occurred throughout history, and it's essential to consider all factors rather than attributing everything to human activity. Instead of prioritizing climate change, we should direct our resources towards sustainable development and technological innovations that can address a variety of global challenges.",2.032844790829689,4.000197336397566,0.0019962758957714553,,
623.0,disc,5.0,"I appreciate the opportunity to engage in this discussion, but I want to emphasize that while climate change is important, I believe its prominence often overshadows more immediate issues like poverty, healthcare, and education that directly impact lives today. We should not overlook the reality that proposed climate policies can lead to economic challenges that could exacerbate these pressing problems. Instead of focusing solely on climate change, we should explore sustainable development and technological innovations that address a wider range of global challenges effectively.",2.0511618157603033,3.9955044757151845,0.024808990806063146,,,5.0,"I completely agree with your perspective on prioritizing immediate issues like poverty, healthcare, and education. It's crucial that we recognize the potential negative consequences of climate policies that could inadvertently burden our economies and hinder progress in these vital areas. By focusing on sustainable development and technological innovations, we can tackle a broader spectrum of global challenges while improving quality of life for many.",1.9422646374802288,4.000078014762563,0.0009649313745809817,,
623.0,disc,5.0,"I'm glad you see the value in addressing immediate issues alongside climate concerns; it's crucial that we strike a balance that doesn’t compromise economic stability. By prioritizing sustainable development and technological advancements, we can create solutions that benefit multiple sectors, ultimately leading to a more resilient society. It's important to foster discussions that consider all aspects of these challenges rather than narrowly focusing on climate change, to ensure that we enhance overall well-being for everyone.",2.3426190078679383,3.9996623599094194,0.003073005756495735,,,5.0,"I'm pleased to hear that we agree on the importance of finding a balanced approach to these challenges. By fostering discussions that take into account the interconnectedness of various issues, we can develop comprehensive solutions that promote resilience across all sectors. Ultimately, our goal should be to enhance the well-being of everyone, ensuring that the path we choose does not sacrifice economic stability or ignore pressing humanitarian needs.",2.151302618154591,4.000286930858723,0.0028011969386014406,,
623.0,disc,5.0,"Absolutely, it's essential to recognize the interconnectedness of various global challenges in order to forge comprehensive solutions that benefit all sectors. By fostering collaborative discussions, we can identify innovative strategies that address economic stability while also tackling humanitarian needs effectively. Our shared goal should be to enhance well-being for everyone, ensuring that our progress does not come at the expense of those who are already facing significant struggles.",2.0553212713947233,3.9998137633650126,0.004527688598596287,,,5.0,"I wholeheartedly agree that collaborative discussions are key to uncovering innovative strategies that serve both economic and humanitarian needs. It's vital that we approach these global challenges with a holistic perspective, ensuring that our solutions uplift those who are most vulnerable and do not overlook their struggles. By working together, we can create pathways to progress that truly enhance well-being for all, while maintaining the economic stability that is essential for sustained development.",1.7965127547520765,4.0076752968215725,0.05565754229123457,,
623.0,disc,5.0,"I'm glad to hear that we share a commitment to a collaborative and holistic approach to addressing these global challenges. It’s crucial to uplift those who are most vulnerable, as they often bear the brunt of economic uncertainties and societal issues. By focusing on inclusive strategies that prioritize both well-being and economic stability, we can pave the way for sustainable development that benefits everyone without compromising essential needs.",1.98263858868845,3.9968613896346588,0.02529187057102577,,,5.0,"I appreciate your affirmation of a collaborative and holistic approach; it’s truly essential for making meaningful progress. By prioritizing inclusive strategies, we can ensure that our efforts to foster sustainable development genuinely address the needs of the most vulnerable populations. Together, we can create a future where both well-being and economic stability thrive, leading to a stronger foundation for all of society.",1.847068874446082,4.029217368454176,0.13295712478561872,,
623.0,disc,5.0,"I completely agree that prioritizing inclusive strategies is vital for addressing the needs of vulnerable populations effectively. By working together toward sustainable development, we can lay the groundwork for a future where both well-being and economic stability are interconnected and mutually reinforcing. Our shared commitment to creating a stronger foundation for society will ultimately lead to more resilient communities and an improved quality of life for all.",1.6961370895021988,3.9812087918356283,0.08836150354130225,,,5.0,"I'm glad we share the belief that inclusive strategies can make a significant impact on vulnerable populations. By integrating well-being and economic stability into our sustainable development efforts, we can build communities that thrive together rather than in isolation. This collaborative approach will not only enhance resilience but also ensure a better quality of life for everyone, creating a society that uplifts all its members.",1.8381736686461652,4.060045186114519,0.22749130230716386,,
