ID,TEXT_TYPE,INIT_OP_A,TEXT_A,PPL_A,PROBE_INT_A,H_INT_A,PROBE_EXT_A,H_EXT_A,INIT_OP_B,TEXT_B,PPL_B,PROBE_INT_B,H_INT_B,PROBE_EXT_B,H_EXT_B
71.0,tot,1.0,"Climate change is one of the most pressing issues of our time, affecting not only the environment but also public health, economies, and social equity. The evidence is undeniable—rising temperatures, extreme weather events, and melting ice caps are all consequences of human activity. Urgent action is needed, not just from governments but also from individuals and businesses to reduce carbon emissions and shift towards sustainable practices. The time to act is now, as the longer we wait, the more severe the repercussions will be for future generations. It's essential to foster awareness and advocate for policies that prioritize the planet's health. Every action counts.",1.8655340429205929,1.0000000154114868,7.850013037510697e-08,,,3.0,"Climate change is a complex issue that prompts a wide range of opinions and perspectives. On one hand, there are compelling arguments about the environmental impacts and potential risks to ecosystems and human health. On the other hand, some people raise questions about the effectiveness of proposed solutions and the economic ramifications. It's important to consider multiple viewpoints and the nuances involved in discussions surrounding this topic. Awareness and dialogue may help in addressing the various challenges associated with climate change, regardless of individual stance.",1.1100240629689261e+47,1.0000000370095292,4.550291204285535e-07,,
71.0,disc,1.0,"Climate change is a critical challenge that we cannot afford to ignore, as it threatens not only our environment but also our health and economic stability. Every year, we witness more extreme weather events and shifts in ecosystems, reinforcing the need for urgent action from all sectors of society. I believe that fostering awareness and encouraging sustainable practices at both individual and collective levels are essential steps toward mitigating this global crisis.",2.1671498338238644,1.0000000782246024,3.6672164022640043e-07,,,3.0,"I completely agree that climate change poses significant threats to our environment, health, and economic stability. It's vital to foster awareness and promote sustainable practices, as they can play a crucial role in mitigating its impact. However, I also think it's important to engage in open dialogue about the effectiveness of various solutions and consider the many perspectives involved in addressing this complex issue.",2.2166238746956043e+61,1.0000000476785067,8.430269187777974e-07,,
71.0,disc,1.0,"I appreciate your acknowledgment of the multifaceted nature of climate change and the importance of fostering awareness and sustainable practices. Engaging in open dialogue is indeed crucial, as it allows us to explore the effectiveness of various solutions and understand the diverse perspectives that shape our approach to this global challenge. By collaborating and incorporating a wide range of voices, we can develop more comprehensive strategies that not only address climate change but also promote social equity and resilience in our communities.",1.4251300688646864,1.0000000072758468,3.8425565544987106e-08,,,3.0,"Thank you for your thoughtful response; I wholeheartedly agree that collaboration and inclusivity are essential in developing effective strategies for addressing climate change. Incorporating diverse voices not only enriches our understanding of the issue but also emphasizes the importance of social equity and resilience in our communities. As we move forward, it will be crucial to balance environmental solutions with considerations of economic and social impacts to create a more holistic approach.",1.5965952260376828,1.0000000288155904,5.250150351143118e-07,,
71.0,disc,1.0,"Thank you for your insightful contribution; I completely agree that balancing environmental solutions with economic and social considerations is vital for creating sustainable and equitable outcomes. A holistic approach ensures that we address the root causes of climate change while also supporting the communities disproportionately affected by its impacts. By fostering collaboration that prioritizes inclusivity and a comprehensive understanding of the interconnections between these factors, we can work towards achieving lasting change that benefits both the planet and its people.",4.171152771089797e+49,1.0000116092799483,3.990734942141263e-05,,,3.0,"I appreciate your agreement on the importance of a holistic approach in tackling climate change and its associated challenges. Addressing the root causes and supporting those communities most affected is essential for creating sustainable solutions that genuinely make a difference. By continuing to prioritize inclusivity and collaboration, we can ensure that our strategies not only mitigate environmental impacts but also enhance the resilience and well-being of all communities involved.",1.8248035934924427,1.000000022588705,3.833506457936039e-07,,
71.0,disc,1.0,"Absolutely, your emphasis on supporting the communities most affected by climate change resonates deeply with me. It is crucial that our strategies not only focus on mitigation but also foster resilience and well-being for everyone, particularly those who have been marginalized in the discourse. By maintaining a clear commitment to inclusivity and collaboration, we can create solutions that are truly transformative and equitable, benefiting the planet and all its inhabitants in the process.",2.077196280082145,1.0000062140057169,2.2331639478421757e-05,,,3.0,"I'm glad to hear that you share this commitment to supporting marginalized communities in our climate strategies. Recognizing the need for resilience and well-being alongside mitigation efforts is fundamental to achieving equitable outcomes. Through sustained collaboration and a focus on inclusivity, we can indeed develop transformative solutions that honor the interconnectedness of our planet and its people, ultimately leading to a more just and sustainable future.",1.7037513537450342,1.0000000036122745,4.001758785148009e-08,,
71.0,disc,1.0,"Thank you for highlighting the interconnectedness of our efforts; it serves as a powerful reminder that our approach to climate action must be both inclusive and equitable. By prioritizing the well-being of marginalized communities, we not only strengthen our climate strategies but also cultivate a sense of shared responsibility among all stakeholders. Together, through continuous dialogue and collaboration, we can pave the way for a future that honors both the health of our planet and the rights and needs of its people.",1.8820557758628305,1.0000000026766345,1.4805134114979858e-08,,,3.0,"I appreciate your emphasis on shared responsibility and the importance of prioritizing the well-being of marginalized communities in our climate action efforts. By fostering continuous dialogue and collaboration, we can create a collective movement that not only protects our planet but also uplifts those who have been historically overlooked. This holistic approach will be essential in ensuring that our climate strategies yield benefits for both the environment and the diverse populations that inhabit it.",1.7273608920459071,1.0000000013358632,2.336101417366727e-08,,
