ID,TEXT_TYPE,INIT_OP_A,TEXT_A,PPL_A,PROBE_INT_A,H_INT_A,PROBE_EXT_A,H_EXT_A,INIT_OP_B,TEXT_B,PPL_B,PROBE_INT_B,H_INT_B,PROBE_EXT_B,H_EXT_B
74.0,tot,1.0,"Climate change is one of the most pressing issues of our time, affecting not only the environment but also public health, economies, and social equity. The evidence is undeniable—rising temperatures, extreme weather events, and melting ice caps are all consequences of human activity. Urgent action is needed, not just from governments but also from individuals and businesses to reduce carbon emissions and shift towards sustainable practices. The time to act is now, as the longer we wait, the more severe the repercussions will be for future generations. It's essential to foster awareness and advocate for policies that prioritize the planet's health. Every action counts.",1.8662485129193391,1.0000000154139064,7.851185023224514e-08,,,3.0,"Climate change is a complex issue that prompts a wide range of opinions and perspectives. On one hand, there are compelling arguments about the environmental impacts and potential risks to ecosystems and human health. On the other hand, some people raise concerns about economic implications, energy policies, and technological feasibility. It's important to consider multiple viewpoints and the interplay of scientific data, societal needs, and policy decisions in any discussion about climate change. Ultimately, further dialogue and research are crucial for informed decision-making.",2.0572607695598615,1.0000000562540097,8.873010310055177e-07,,
74.0,disc,1.0,"Climate change is a critical challenge that we cannot afford to ignore, as it threatens our ecosystems, public health, and economic stability. The alarming rise in global temperatures and the frequency of extreme weather events are clear signs that immediate action is essential. I believe we must work together—individuals, businesses, and governments alike—to implement sustainable practices and advocate for policies that prioritize the health of our planet for the sake of current and future generations.",1.7119433406655953,1.0000001004430623,4.6462005006957524e-07,,,3.0,"I appreciate your emphasis on the urgency of addressing climate change and the collective responsibility we share in this endeavor. It's crucial to balance the environmental imperatives with considerations of economic viability and energy policies, to ensure that sustainable practices are not only effective but also feasible for all stakeholders. Open dialogue and collaboration among individuals, businesses, and governments will be key in crafting policies that are both environmentally sound and economically practical, allowing us to address this multifaceted issue effectively.",2.015479143441574,1.000000053477528,9.454898840083857e-07,,
74.0,disc,1.0,"I completely agree that balancing environmental imperatives with economic viability is essential for fostering sustainable practices that are practical for all stakeholders. Open dialogue and collaboration will play a pivotal role in developing innovative solutions that not only address climate change but also support economic growth and energy security. By working together, we can create robust policies that ensure a sustainable future while considering the diverse needs of communities and industries alike.",1.6300409975049894,1.0000001289749834,5.884464829445116e-07,,,3.0,"I’m glad to see we share the same view on the importance of collaboration in addressing climate change while considering economic growth and energy security. Developing innovative solutions requires a comprehensive understanding of the diverse needs across different communities and industries, which underscores the necessity of inclusivity in our discussions. As we move forward, continuous engagement and interdisciplinary approaches will be vital in crafting policies that not only mitigate environmental impacts but also promote resilience and prosperity for all stakeholders involved.",1.9279678117928472,1.0000000023720967,3.859248457420993e-08,,
74.0,disc,1.0,"Absolutely, inclusivity and interdisciplinary approaches are essential for crafting effective climate policies that truly reflect the needs of diverse communities. Continuous engagement with various stakeholders helps ensure that the solutions we develop are both equitable and sustainable, fostering resilience in the face of climate challenges. By bringing together diverse perspectives and expertise, we can create policies that not only mitigate environmental impacts but also drive economic opportunities and enhance the well-being of all individuals impacted by climate change.",2.005940295406657,1.0000005100859237,2.1519225608924523e-06,,,3.0,"I completely agree that inclusivity and the integration of diverse perspectives are essential for formulating effective climate policies. Engaging various stakeholders fosters a sense of ownership and accountability, which is critical for ensuring that solutions are both equitable and sustainable over the long term. By harnessing the strengths and insights of different communities, we can not only address environmental concerns but also unlock new economic opportunities that enhance the well-being of all individuals affected by climate change.",1.7580448552999848,1.0000000139091594,7.689500633030764e-08,,
74.0,disc,1.0,"I appreciate your emphasis on the importance of fostering ownership and accountability among stakeholders, as these elements are crucial for the success of any climate initiative. By embracing the unique strengths and insights of different communities, we can develop targeted solutions that address both environmental challenges and socioeconomic disparities. This collaborative approach not only addresses the immediate effects of climate change but also paves the way for innovative economic opportunities that can uplift all affected individuals, creating a more resilient and thriving future for everyone.",1.9191959226563176,1.00004052003051,0.00012662632467622963,,,3.0,"I'm glad you highlighted the role of targeted solutions in addressing both environmental challenges and socioeconomic disparities, as this dual approach is vital for creating meaningful change. By valuing the unique strengths of various communities, we can foster innovative strategies that not only respond to the immediate impacts of climate change but also contribute to long-term resilience. Ultimately, this collaborative mindset will be essential to ensure a thriving future that benefits all individuals impacted by these pressing issues.",1.9904236481350301,1.0000000012019228,1.0743596997554564e-08,,
74.0,disc,1.0,"I completely agree that a dual approach is essential for driving meaningful change, particularly as we grapple with the complex interplay between environmental and socioeconomic issues. By valuing and integrating the unique strengths of various communities, we can unlock innovative strategies that address both immediate impacts and long-term resilience in the face of climate change. Cultivating a collaborative mindset will indeed be key to fostering an inclusive future that ensures everyone can thrive, even amidst the pressing challenges we face.",2.0336932145727964,1.0000003972509088,1.7008023895497032e-06,,,3.0,"I appreciate your recognition of the complex interplay between environmental and socioeconomic issues, which truly underscores the necessity of a comprehensive approach. By fostering collaboration and inclusivity, we can create innovative strategies that bridge the gap between immediate needs and long-term sustainability. This collaborative mindset not only empowers communities to engage in climate solutions but also ensures that as we tackle pressing challenges, we do so in a way that uplifts everyone and fosters a thriving future for all.",4.3887568082122254e+49,1.000000007591935,4.565608196715048e-08,,
