ID,TEXT_TYPE,INIT_OP_A,TEXT_A,PPL_A,PROBE_INT_A,H_INT_A,PROBE_EXT_A,H_EXT_A,INIT_OP_B,TEXT_B,PPL_B,PROBE_INT_B,H_INT_B,PROBE_EXT_B,H_EXT_B
77.0,tot,1.0,"Climate change is one of the most pressing issues of our time, affecting not only the environment but also public health, economies, and social equity. The evidence is undeniable—rising temperatures, extreme weather events, and melting ice caps are all consequences of human activity. Urgent action is needed, not just from governments but also from individuals and businesses to reduce carbon emissions and shift towards sustainable practices. The time to act is now, as the longer we wait, the more severe the repercussions will be for future generations. It's essential to foster awareness and advocate for policies that prioritize the planet's health. Every action counts.",1.8634017659075162,1.0000000224187036,1.1209163888081362e-07,,,4.0,"I believe that while environmental issues are important, the emphasis on climate change often overshadows other pressing concerns that deserve equal attention. The notion that climate change is the most urgent problem can lead to ineffective policies that prioritize emissions reduction over economic development and social needs. Many regions still face poverty, health crises, and infrastructure challenges that are immediate and require resources. Additionally, the Earth's climate has always been subject to natural changes, and history shows that societies have adapted to these changes over time. Instead of focusing exclusively on climate change, we should adopt a more balanced approach that addresses a range of environmental and societal issues simultaneously.",4.365924917520292e+35,2.8782711981487608,0.7675617889949767,,
77.0,disc,1.0,"Climate change is a critical challenge that we cannot afford to ignore, as it threatens our ecosystems, public health, and economic stability. The alarming rise in global temperatures and the frequency of extreme weather events are clear signs that immediate action is essential. I believe we must work together—individuals, businesses, and governments alike—to implement sustainable practices and advocate for policies that prioritize the health of our planet for the sake of current and future generations.",1.7065388193347224,1.0000004507379003,1.9262639498945325e-06,,,4.0,"While I acknowledge that climate change poses significant challenges, I believe it's important to also consider the pressing issues of poverty, health crises, and infrastructure that many communities currently face. An emphasis solely on climate action may divert necessary resources from addressing these immediate societal needs. A more balanced approach would allow us to tackle environmental concerns alongside other critical priorities, ultimately benefiting both the planet and humanity.",2.0898654500969287,2.7591662363340608,0.735806016001227,,
77.0,disc,1.0,"I completely agree that issues like poverty, health crises, and infrastructure are extremely important and require our attention; however, we must recognize that these problems are often interconnected with climate change. Climate action can play a vital role in alleviating these societal challenges—investing in sustainable infrastructure not only reduces emissions but also creates jobs and improves public health outcomes. By adopting a holistic approach that integrates climate solutions with social equity initiatives, we can create resilient communities that thrive in harmony with the environment.",1.86672532043004,1.0000033261488461,1.2473616906308693e-05,,,4.0,"I appreciate your perspective on the interconnectedness of climate change and societal issues, and I agree that sustainable infrastructure can have multiple benefits. However, I caution against prioritizing climate action to the extent that it overshadows the immediate needs of those struggling with poverty and health crises. It's crucial to ensure that our policies address these urgent social challenges directly, rather than assuming that climate solutions alone will resolve them.",1.4705145367428198,3.5226880351124357,0.8540843302515044,,
77.0,disc,1.0,"I understand your concern and wholeheartedly agree that we must prioritize direct support for those facing poverty and health crises while also incorporating climate action into our strategies. It’s essential to create policies that explicitly address the immediate needs of vulnerable communities and ensure that climate solutions are equitable and inclusive. By fostering a dialogue that brings together diverse perspectives, we can design comprehensive approaches that address both urgent social challenges and long-term environmental sustainability, ultimately leading to a healthier and more equitable future for all.",1.9189784254058317,1.0000054838643713,1.9879816770890607e-05,,,4.0,"I appreciate your emphasis on creating equitable and inclusive policies that directly support vulnerable communities while considering climate action. However, there is a risk that the push for climate initiatives could still eclipse the urgent needs of those who are struggling today if not carefully balanced. We must ensure that any dialogue around sustainability incorporates a broader range of issues and doesn't allow climate priorities to dominate discussions about immediate social challenges.",2.771748201600192,3.2328123843088803,0.8320487058012863,,
77.0,disc,1.0,"You raise an important point about the need for balance in our discussions and priorities. It is crucial that we create a space where the voices of those facing immediate hardships are central to the dialogue, ensuring that climate initiatives do not overshadow pressing social issues. By actively involving affected communities in the decision-making process, we can develop integrated solutions that address both their immediate needs and the long-term health of our planet, fostering a truly sustainable and just future for everyone.",1.6239174612823228,1.0000062140366934,2.2332328214599707e-05,,,4.0,"I completely agree that involving affected communities in the decision-making process is essential for creating effective and equitable solutions. It's important that their voices are not only heard but prioritized to ensure that policies reflect their immediate needs without being overshadowed by climate initiatives. By fostering this inclusive approach, we can work towards a future that addresses both social and environmental challenges, establishing a more just society for all.",2.1328369949815083e+57,3.1497099880699535,0.7271414527996908,,
77.0,disc,1.0,"I’m glad to hear we are on the same page about the necessity of prioritizing the voices of affected communities in our policymaking. An inclusive approach not only enriches our understanding of the needs at hand but also empowers those most impacted to play an active role in shaping their futures. Ultimately, by collaboratively addressing both social and environmental challenges, we can establish a more just society that protects vulnerable populations while also ensuring the long-term health of our planet.",3.4490195298199634e+48,1.0000006550206313,2.7236938255119618e-06,,,4.0,"I appreciate your enthusiasm for an inclusive approach, and I agree that empowering affected communities is vital for effective policymaking. However, it's essential that we remain cautious about how much emphasis we place on climate initiatives within these discussions, ensuring that the immediate social concerns take precedence. A balanced strategy must be maintained to truly create meaningful change that addresses both current hardships and future environmental challenges without compromising one for the other.",2.4110987789619474,2.449850988037876,0.5719503437972471,,
