ID,TEXT_TYPE,INIT_OP_A,TEXT_A,PPL_A,PROBE_INT_A,H_INT_A,PROBE_EXT_A,H_EXT_A,INIT_OP_B,TEXT_B,PPL_B,PROBE_INT_B,H_INT_B,PROBE_EXT_B,H_EXT_B
7.0,tot,1.0,"Climate change is one of the most pressing issues of our time, affecting not only the environment but also public health, economies, and social equity. The evidence is undeniable—rising temperatures, extreme weather events, and melting ice caps are all consequences of human activity. Urgent action is needed, not just from governments but also from individuals and businesses to reduce carbon emissions and shift towards sustainable practices. The time to act is now, as the longer we wait, the more severe the repercussions will be for future generations. It's essential to foster awareness and advocate for policies that prioritize the planet's health. Every step towards sustainability is a step towards a viable future.",1.8817489292509952,1.0000000609295714,2.894130512219256e-07,,,1.0,"Climate change is one of the most pressing issues of our time, affecting not only the environment but also public health, economies, and social equity. The evidence is undeniable—rising temperatures, extreme weather events, and melting ice caps are all consequences of human activity. Urgent action is needed, not just from governments but also from individuals and businesses to reduce carbon emissions and shift towards sustainable practices. The time to act is now, as the longer we wait, the more severe the repercussions will be for future generations. It's essential to foster awareness and advocate for policies that prioritize the planet's health. Every step towards sustainability is a step towards a viable future.",1.8826324804299084,1.000000006427547,3.414468339194434e-08,,
7.0,disc,1.0,"Climate change is an urgent crisis that demands our immediate attention and collective action. The scientific consensus is clear: human activities are driving unprecedented changes in our planet’s climate, resulting in dire consequences for ecosystems and human communities alike. As we engage in this discussion, let's focus on viable solutions and the critical steps we can take—individually and collectively—to combat this challenge and ensure a sustainable future for generations to come.",1.5745750554914375,1.000000001432699,8.148476568763006e-09,,,1.0,"I completely agree with your assessment that climate change is an urgent crisis that requires immediate collective action. It’s crucial that we not only understand the scientific consensus but also actively seek out and implement viable solutions that promote sustainability at every level—from individuals to governments. By fostering collaboration and raising awareness about our collective responsibility, we can create a meaningful impact and safeguard our planet for future generations.",1.894457084015794,1.0000000044147017,2.3866561260130585e-08,,
7.0,disc,1.0,"I’m glad to hear you share the same urgency and commitment to addressing climate change! Collaboration is indeed key, and it's inspiring to see many individuals, organizations, and governments beginning to come together to enact change. As we move forward, let's ensure that we not only raise awareness but also hold ourselves and each other accountable for making sustainable choices in our daily lives, as well as advocating for policies that protect our environment.",3.990446237534089e+52,1.0000000000490243,3.2018966854247275e-10,,,1.0,"Absolutely! Accountability is a vital component of driving sustainable change, and it starts with each of us making conscious choices in our daily lives. By combining our individual efforts with advocacy for robust environmental policies, we can amplify our impact and ensure that our collective actions translate into real progress. Together, we can foster a culture of sustainability that inspires others to join the movement towards a healthier planet.",1.7697737018064932,1.0000000253963401,1.262148912432128e-07,,
7.0,disc,1.0,"I wholeheartedly agree that fostering a culture of sustainability is essential for inspiring widespread action against climate change. When individuals make conscious choices and advocate for strong environmental policies, we create a ripple effect that encourages others to follow suit. Let’s continue to share our successes and challenges, creating a supportive community that empowers everyone to take meaningful steps towards a healthier and more sustainable planet.",1.7358456000527014,1.0000070413809605,2.5085114513621175e-05,,,1.0,"I love that idea! Sharing our successes and challenges not only strengthens our community but also provides valuable lessons that can motivate others to take action. By creating a supportive environment where everyone feels encouraged to contribute, we can collectively build momentum towards achieving a more sustainable future. Together, we can transform our individual efforts into a powerful force for change that benefits both the planet and all its inhabitants.",1.6926564444558563,1.0000000886437463,4.1287607704737936e-07,,
7.0,disc,1.0,"It's wonderful to see such enthusiasm for collaboration and sharing experiences within our community! By celebrating our successes and learning from our challenges, we can build a robust network of support that energizes our collective efforts. Together, we can not only drive significant progress in sustainability but also inspire others to recognize the importance of their contributions in safeguarding our planet for all its inhabitants.",2.131333902407953,1.0000000082470553,4.32964297149233e-08,,,1.0,"Absolutely! Celebrating our collective achievements and sharing the lessons we've learned along the way fosters a sense of empowerment that fuels our sustainability journey. It’s essential to communicate the significance of each person's contributions, as every small action adds up to create a larger impact. Together, we can amplify our efforts and inspire a movement that encourages everyone to take part in protecting our planet for current and future generations.",2.3576954102620147,1.0000000326102125,1.6004277293285964e-07,,
7.0,disc,1.0,"I couldn't agree more—every individual's contribution is vital to the bigger picture, and recognizing these efforts is fundamental to fostering a sense of community and empowerment. By highlighting the cumulative impact of our collective actions, we can inspire a broader movement that reaches beyond our immediate circles. Let’s continue to communicate the importance of sustainability in relatable ways, encouraging more people to join us in this essential mission to protect our planet for both ourselves and future generations.",2.0456112710783705,1.0000000034393075,1.8808102061325567e-08,,,1.0,"You’re absolutely right! Communicating the importance of sustainability in relatable and accessible ways is crucial for reaching a wider audience and inspiring action beyond our immediate community. By showcasing the cumulative impact of our efforts, we can cultivate a sense of shared responsibility that motivates others to get involved. Together, let’s work to create a powerful narrative that emphasizes how each person's actions can contribute to a healthier planet for generations to come.",1.8731279608111793,1.000000000676759,3.975960098552167e-09,,
