ID,TEXT_TYPE,INIT_OP_A,TEXT_A,PPL_A,PROBE_INT_A,H_INT_A,PROBE_EXT_A,H_EXT_A,INIT_OP_B,TEXT_B,PPL_B,PROBE_INT_B,H_INT_B,PROBE_EXT_B,H_EXT_B
87.0,tot,1.0,"Climate change is one of the most pressing issues of our time, affecting not only the environment but also public health, economies, and social equity. The evidence is undeniable—rising temperatures, extreme weather events, and melting ice caps are all consequences of human activity. Urgent action is needed, not just from governments but also from individuals and businesses to reduce carbon emissions, invest in renewable energy, and promote sustainable practices. Addressing climate change is crucial for ensuring a habitable planet for future generations. We must act now to mitigate its impacts and adapt to the changes already underway.",1.6663081893857699,1.0000003093854313,1.343890825851465e-06,,,4.0,"I believe that while environmental issues are important, the emphasis on climate change often overshadows other pressing concerns that deserve equal attention. There are many factors influencing our planet's health, and the focus on CO2 emissions and temperature rises can sometimes lead to misguided policies. Instead of drastic measures, we should prioritize a balanced approach that considers economic growth, energy security, and technological innovation alongside environmental stewardship.",1.9787441364248823,2.197743100630796,0.4899048020229138,,
87.0,disc,1.0,"Climate change is a pressing challenge that demands our immediate attention and collective action. As we witness the tangible effects of rising temperatures and extreme weather, it becomes clear that we cannot afford to delay our response any longer. It’s crucial for us to explore innovative solutions and engage in meaningful conversations about how we can reduce carbon emissions and transition to sustainable practices in our daily lives and industries.",1.8756563794428018,1.0000001005104926,4.662539717992329e-07,,,4.0,"While I acknowledge the urgency surrounding climate change, I think it's essential to remember that other pressing issues also require our attention, such as global poverty, public health, and economic stability. A singular focus on carbon emissions can lead to policies that overlook the broader implications for energy security and economic growth. We should strive for a balanced approach that encourages technological innovation and sustainable development, allowing us to address environmental challenges without compromising our overall societal progress.",1.9009212894760106,2.3843174899451762,0.6871465098642195,,
87.0,disc,1.0,"I completely agree that tackling climate change must be part of a broader strategy that considers global poverty, public health, and economic stability. However, failing to address the urgency of climate change risks exacerbating many of those very issues, as extreme weather events and environmental degradation disproportionately affect vulnerable populations. By integrating sustainable practices and promoting renewable energy alongside technological innovation, we can create solutions that not only reduce carbon emissions but also enhance economic growth and improve public health outcomes for all.",1.9639709698908794,1.0000000197843621,9.968255125946747e-08,,,4.0,"I appreciate your perspective and agree that addressing climate change can have interconnected benefits for various social issues. However, I believe it's important to ensure that our strategies do not come at the cost of economic viability or energy security, particularly in regions that rely heavily on traditional energy sources for growth. If we promote renewable energy and sustainable practices, we must do so in a way that supports innovation while also considering the economic implications for those directly dependent on current industries.",2.3677722450399274,2.0025751212840586,0.01787236675007274,,
87.0,disc,1.0,"You're absolutely right that transitioning to renewable energy must be approached thoughtfully, especially in regions that rely on traditional energy sources for their economic stability. It's crucial to create a just transition that supports workers and communities as we shift towards more sustainable practices, ensuring that no one is left behind in this transition. By investing in retraining programs, fostering innovation, and promoting new job opportunities in emerging industries, we can build a resilient economy that addresses climate change while preserving energy security and economic viability for all.",1.8384428906484624,1.0000002730389317,1.1946584955936639e-06,,,4.0,"I completely agree that a just transition is vital to ensure that workers and communities are supported during this shift to renewable energy. However, we must also recognize that the pace and scale of this transition should not disproportionately burden those already facing economic challenges. By focusing on balanced policies that nurture both innovation and economic growth, we can create a more resilient society that addresses various issues without placing undue stress on vulnerable populations.",2.3486538741110037,2.003578421152808,0.023385388267014723,,
87.0,disc,1.0,"I appreciate your emphasis on ensuring that the transition to renewable energy is both equitable and inclusive, particularly for those already facing economic hardships. It's essential that we design policies that not only accelerate the transition but also prioritize the needs of vulnerable populations, allowing them to adapt and thrive during this shift. By fostering collaboration between stakeholders—governments, businesses, and communities—we can create comprehensive strategies that promote sustainable development while safeguarding economic stability for all.",1.7574523495963017,1.0000012236579099,4.895637383475395e-06,,,4.0,"I agree that collaboration among governments, businesses, and communities is critical for creating effective strategies that benefit everyone during the transition to renewable energy. However, it's essential that we approach these collaborations with a clear understanding of the potential trade-offs involved, particularly regarding energy costs and overall economic impact. By maintaining a focus on innovation and ensuring that policies incentivize rather than hinder growth, we can achieve sustainable development that genuinely supports the needs of all populations involved.",2.2565104610174838,2.000953431885917,0.007664760640864008,,
87.0,disc,1.0,"You raise an important point about the need to carefully assess potential trade-offs as we pursue collaboration in our transition to renewable energy. A thoughtful approach that balances innovation with cost-effectiveness will be essential to ensuring that energy remains accessible and affordable for all communities. By incorporating diverse perspectives in the policy-making process, we can design incentives that promote sustainable development while fostering economic growth and minimizing any negative impacts on both consumers and industries.",1.9737149002307446,1.0000002730316029,1.194678651450989e-06,,,4.0,"I appreciate your emphasis on inclusivity in the policy-making process, as incorporating diverse perspectives is crucial for creating effective solutions. However, it's important to remain vigilant about how quickly we move towards renewable energy, as overly aggressive policies can disrupt existing industries and the livelihoods that depend on them. By prioritizing a cautious and balanced transition, we can better safeguard economic stability while still encouraging innovation and sustainable practices that serve the long-term health of our planet.",2.1568839095603503,2.500329663029177,0.6952437978600777,,
