ID,TEXT_TYPE,INIT_OP_A,TEXT_A,PPL_A,PROBE_INT_A,H_INT_A,PROBE_EXT_A,H_EXT_A,INIT_OP_B,TEXT_B,PPL_B,PROBE_INT_B,H_INT_B,PROBE_EXT_B,H_EXT_B
103.0,tot,1.0,"I believe that the focus on climate change has been exaggerated and often distracts from more immediate and pressing issues facing humanity, such as poverty, healthcare, and education. Many climate models are speculative, and the economic impact of drastic measures to combat climate change could outweigh the perceived benefits. Additionally, the Earth's climate has always been subject to natural fluctuations over time. I think it's crucial to prioritize policies that promote economic growth and technological innovation without crippling industries in the name of climate goals.",2.168181076519513,1.9933071525182102,0.04017968399719213,,,5.0,"Climate change is one of the most pressing issues of our time, affecting not only the environment but also public health, economies, and social equity. The evidence is undeniable—rising temperatures, extreme weather events, and melting ice caps are all consequences of human activity. Urgent action is needed, not just from governments but also from individuals and businesses to reduce carbon emissions, invest in renewable energy, and promote sustainable practices. Addressing climate change is crucial for ensuring a habitable planet for future generations. We must act decisively and collaboratively to mitigate its impacts and foster a resilient, sustainable future.",1.6826771767965893,4.999999999998121,5.262677460473206e-11,,
103.0,disc,1.0,"While climate change is often portrayed as an urgent crisis, I believe the focus on it can overshadow more immediate issues like poverty, healthcare, and education that need our attention and resources. Furthermore, many climate models are based on speculative projections that may not account for natural fluctuations in the Earth's climate over time. Therefore, we should prioritize policies that foster economic growth and technological innovation without unnecessarily hindering industries in the name of climate goals.",1.6647671169885419,1.9992903305182161,0.005855051084207427,,,5.0,"While it's important to address immediate issues like poverty, healthcare, and education, we cannot ignore that climate change exacerbates these very problems, leading to increased health risks and economic instability. The evidence surrounding climate change is robust, with many scientific studies confirming that human activities significantly drive recent changes in our climate. Prioritizing sustainable policies and investments in renewable energy not only tackles climate change but can also stimulate economic growth, create jobs, and improve public health, making it a win-win for society as a whole.",1.9581841796884332,4.999999999974054,6.583821993149323e-10,,
103.0,disc,1.0,"I appreciate your perspective, but I still hold that the focus on climate change can detract from addressing the most pressing issues that people face today, such as poverty and healthcare. While there are studies linking climate change to certain problems, the economic costs of implementing drastic climate measures must be weighed carefully against these potential benefits. Instead of prioritizing sustainable policies that may limit industrial growth, let's focus on technological innovation and economic development that can lead to real, tangible improvements for people's lives.",2.5940054131414088,1.9999921225960726,0.00010081648178402156,,,5.0,"I understand your concerns about balancing urgent social issues with climate action; however, it's crucial to recognize that climate change will inevitably worsen poverty and healthcare challenges if left unaddressed. Investing in sustainable technologies can drive innovation and economic development, resulting in long-term benefits both for the environment and for communities. A collaborative approach that integrates climate resilience with social equity can create a more integrated and prosperous future for all, ultimately benefiting both the planet and its inhabitants.",1.3955514122476723e+49,4.999999999974054,6.583821993108914e-10,,
103.0,disc,1.0,"I see your point about the potential long-term impacts of climate change on social issues, but I still believe that current evidence often struggles to provide a clear causal link between the two. Investing in sustainable technologies is important, but we must ensure that these investments do not come at the expense of traditional industries and jobs that support families today. A more effective strategy might involve fostering innovation in a broader sense, one that promotes economic growth without imposing rigid climate regulations that could stifle development and exacerbate current inequalities.",1.5107397894449268e+87,1.9999885986142982,0.00014339419487758206,,,5.0,"It's true that establishing direct causal links can be complex; however, numerous studies have shown that climate change impacts—such as extreme weather and resource scarcity—directly contribute to social and economic challenges, particularly for vulnerable communities. Transitioning to sustainable technologies doesn't have to mean sacrificing traditional industries; rather, it can create new jobs and opportunities while modernizing the economy for a sustainable future. By fostering innovation that embraces sustainability, we can build a more equitable economy that not only addresses current inequalities but also prepares us for the challenges of tomorrow.",1.8033107337023289,4.9999999999705995,7.423695558360143e-10,,
103.0,disc,1.0,"While I acknowledge that extreme weather and resource scarcity can create challenges, I still believe that the narrative around climate change often oversimplifies complex socio-economic dynamics and their myriad causes. Transitioning to sustainable technologies should indeed be approached carefully to ensure it doesn’t come at the cost of job losses in traditional industries, and we should be mindful of how such transitions can disproportionately impact those at the lower end of the economic spectrum. Ultimately, fostering economic growth through diverse avenues, including but not limited to sustainable technology, may be a more balanced approach to building resilience and addressing inequalities without imposing undue burdens on any sector.",3.812130567065913e+36,1.9999992352310727,2.4648876453520788e-05,,,5.0,"I agree that the socio-economic dynamics surrounding climate change are complex and multi-faceted, which is why a nuanced approach is essential in addressing these challenges. However, ensuring a just transition to sustainable technologies can actually enhance resilience and provide equitable opportunities for all, particularly for those disproportionately affected by climate change and economic shifts. By integrating sustainable practices within a broader economic strategy, we can create a balanced environment that promotes growth and innovation while safeguarding jobs and livelihoods across all sectors.",3.152159433056385e+47,4.999999999979793,5.178002487878608e-10,,
103.0,disc,1.0,"I appreciate your emphasis on a nuanced approach, but I remain cautious about the assumption that a just transition to sustainable technologies will automatically enhance resilience and provide equitable opportunities for everyone. The reality is that the shift can lead to dislocations in established industries, potentially leaving many workers without viable alternatives if not managed carefully. Instead of focusing primarily on sustainability as the central pillar, I advocate for a broader economic strategy that prioritizes innovation and job creation in a diverse array of sectors, allowing for more flexibility and resilience in the face of change.",2.059198395529615,1.9999998892889082,2.648886135159608e-05,,,5.0,"Your caution is valid, as any transition must be thoughtfully managed to prevent job dislocation and ensure that workers are supported. However, emphasizing sustainability doesn't mean neglecting innovation or economic diversity; rather, it involves integrating these elements to create a robust and future-ready workforce across all sectors. By fostering a multifaceted economic strategy that prioritizes sustainable growth alongside innovation, we can promote resilience and ensure that no community is left behind during this critical transformation.",2.4655758783183583,4.999999999990455,2.517502925930655e-10,,
