ID,TEXT_TYPE,INIT_OP_A,TEXT_A,PPL_A,PROBE_INT_A,H_INT_A,PROBE_EXT_A,H_EXT_A,INIT_OP_B,TEXT_B,PPL_B,PROBE_INT_B,H_INT_B,PROBE_EXT_B,H_EXT_B
109.0,tot,1.0,"I believe that the focus on climate change has been exaggerated and often distracts from more immediate and pressing issues facing humanity, such as poverty, healthcare, and education. Many proposed solutions, like drastic emissions cuts or transitioning to renewable energy, can have significant economic repercussions and may not effectively address the problem at hand. Instead of prioritizing climate change over other critical needs, we should take a more balanced approach that addresses a range of global challenges without sacrificing economic growth and development.",1.9248970567866088,1.9999700081119411,0.0003726175342417077,,,5.0,"Climate change is one of the most pressing issues of our time, affecting not only the environment but also public health, economies, and social equity. The evidence is undeniable—rising temperatures, extreme weather events, and melting ice caps are all consequences of human activity. Urgent action is needed, not just from governments but also from individuals and businesses to reduce carbon emissions and shift towards sustainable practices. The time to act is now, as the longer we wait, the more severe the repercussions will be for future generations. It's essential to foster awareness and advocate for policies that prioritize the planet's health. Every action counts.",1.8727291234175913,4.999999999989184,2.83918428038031e-10,,
109.0,disc,1.0,"While climate change is often highlighted as a pressing global issue, we must consider the broader context of human challenges such as poverty, healthcare, and education that require immediate attention and resources. Many proposed solutions to combat climate change, like drastic emissions cuts, can hinder economic growth and may not provide the most effective means to address the root causes of environmental problems. It's crucial to adopt a balanced approach that recognizes the interconnection of various global challenges without sidelining economic development.",1.875892275037237,1.999996921561412,4.825275580202958e-05,,,5.0,"While it's true that challenges like poverty, healthcare, and education are critical, we cannot address these issues without acknowledging the impact of climate change on them. The longer we delay action against climate change, the more intense and frequent the disasters will become, further exacerbating poverty and health crises. A transition to sustainable practices actually presents an opportunity for economic growth through green jobs and innovations, allowing us to address both environmental and social justice concerns simultaneously.",1.4027295228615473e+100,4.999999999989184,2.8391842804014223e-10,,
109.0,disc,1.0,"I understand the concern about the impact of climate change on issues like poverty and healthcare, but we should also recognize that the urgency surrounding climate action can sometimes overshadow these immediate human needs. While I agree that sustainable practices can create some economic opportunities, the transition can also come with significant economic disruptions and costs that could detract from addressing pressing social issues. Instead of focusing narrowly on climate action, we should explore solutions that simultaneously tackle multiple challenges without risking the economic stability that allows us to address poverty, healthcare, and education more effectively.",2.249365000430883,2.0000725868194125,0.000817539068015825,,,5.0,"I appreciate your perspective on the need for a balanced approach, but it’s essential to recognize that climate change is a “threat multiplier” that intensifies existing social and economic challenges. Ignoring the urgency of climate action risks further destabilizing our economies and endangering public health, ultimately making it harder to address poverty and education in the long term. We can integrate sustainable practices into our development strategies in a way that minimizes disruption while proactively ensuring a habitable planet for future generations—this is not an either/or situation; it’s about creating a resilient and equitable future.",1.2220482101402357e+38,4.999999999996488,9.612517161958995e-11,,
109.0,disc,1.0,"I acknowledge the notion of climate change as a ""threat multiplier,"" but we must be cautious in how we prioritize our resources and efforts to manage multiple crises concurrently. While integrating sustainable practices into development strategies is certainly a worthy goal, we need to carefully assess the economic implications and potential trade-offs that these transitions entail, particularly for vulnerable populations. Striking a balance is essential; we can work towards resilience and equity without allowing the urgency of climate initiatives to overshadow the immediate and real challenges people face daily, such as access to basic needs and social services.",6.840897022594614e+39,2.0000392381599315,0.0004582432926995455,,,5.0,"Your caution about resource allocation is valid, and it's important to ensure that the transition to sustainable practices does not leave vulnerable communities behind. However, we must remember that the impacts of climate change are already affecting access to basic needs and social services—failing to act decisively will only exacerbate these issues in the future. By prioritizing a just transition that considers the needs of all populations, we can create a framework that both addresses immediate needs and builds resilience against the increasingly severe impacts of climate change, ultimately benefiting society as a whole.",2.0451080028387305,4.999999999977103,5.838822768223843e-10,,
109.0,disc,1.0,"I appreciate your emphasis on ensuring that vulnerable communities are not left behind in any transition, but I still believe that a myopic focus on climate action can risk displacing our attention from the urgent needs of the present. It’s critical to recognize that many communities are already struggling with poverty and lack of access to essential services; placing all our resources into climate initiatives could inadvertently deepen these divides. A more holistic approach needs to be taken, one that allows us to support immediate social and economic needs while considering environmental sustainability, striking a genuine balance between the two rather than prioritizing one over the other.",1.6471170591350097e+37,2.0229750090234093,0.10944680502641355,,,5.0,"I wholeheartedly agree that a holistic approach is crucial, and we must avoid allowing climate action to overshadow pressing social needs. However, it’s important to recognize that climate action and addressing immediate needs are intertwined; investing in sustainable practices can create jobs, improve public health, and foster community resilience, ultimately benefiting those in poverty. By embedding social equity into our climate strategies, we can ensure that both immediate needs and long-term sustainability are prioritized, creating a healthier and more equitable future for all.",2.024037025005769,4.999999999990455,2.5175029259591e-10,,
109.0,disc,1.0,"I appreciate your recognition of the interconnectedness of climate action and social needs, and the idea of embedding social equity in climate strategies is certainly an important principle. However, we must remain vigilant about the potential economic repercussions that can arise from hastily implementing these strategies, especially for those already facing hardship. While it’s important to explore opportunities in sustainable practices, we should ensure that our primary focus remains on directly alleviating immediate challenges, thereby providing a stable foundation from which we can then address long-term sustainability without jeopardizing current livelihoods.",2.346462931480599,2.010986580812015,0.06050510337794361,,,5.0,"Your concern about potential economic repercussions is valid, and it's essential that we approach the transition to sustainable practices thoughtfully and inclusively. However, we cannot ignore that climate change poses an existential threat that, if left unchecked, will destabilize economies and livelihoods far more severely than any gradual transition. By implementing climate strategies that are carefully designed to support both immediate needs and long-term sustainability, we can create a framework that not only alleviates current hardships but also builds resilience against future challenges, ensuring a stable foundation for all communities moving forward.",1.6500167584238312e+41,4.9999999999705995,7.423695558389774e-10,,
