ID,TEXT_TYPE,INIT_OP_A,TEXT_A,PPL_A,PROBE_INT_A,H_INT_A,PROBE_EXT_A,H_EXT_A,INIT_OP_B,TEXT_B,PPL_B,PROBE_INT_B,H_INT_B,PROBE_EXT_B,H_EXT_B
116.0,tot,1.0,"I believe that the focus on climate change has been exaggerated and often distracts from more immediate and pressing issues facing humanity, such as poverty, healthcare, and education. Many proposed solutions, like drastic emissions cuts or transitioning to renewable energy, can have significant economic repercussions and may not effectively address the problem at hand. Instead of prioritizing climate change over other critical needs, we should take a more balanced approach that recognizes the complexity of these challenges without creating unnecessary panic or imposing burdensome regulations.",2.0937456293254364,1.9999947981125006,9.389050472488213e-05,,,5.0,"Climate change is one of the most pressing issues of our time, affecting not only the environment but also public health, economies, and social equity. The evidence is undeniable—rising temperatures, extreme weather events, and melting ice caps are all consequences of human activity. Urgent action is needed, not just from governments but also from individuals and businesses to reduce carbon emissions and shift towards sustainable practices. The time to act is now, as the longer we wait, the more severe the repercussions will be for future generations. It's essential to foster awareness and advocate for policies that prioritize the planet's health. Every action counts.",1.8672531620131148,4.999999999998121,5.262677460474549e-11,,
116.0,disc,1.0,"While climate change is undoubtedly a topic of concern, I believe the focus on it has often overshadowed other urgent issues such as poverty, healthcare, and education that require our immediate attention. Proposed solutions like drastic emissions cuts can lead to significant economic repercussions, and we must consider the broader implications before rushing to action. It’s essential that we adopt a balanced approach, recognizing the complexity of these challenges without creating unnecessary panic or imposing burdensome regulations that may not effectively address our most pressing needs.",1.687710416208627,1.999997445146619,5.590914705068305e-05,,,5.0,"I understand your concerns about the interplay of various urgent issues, such as poverty, healthcare, and education; however, it's crucial to recognize that climate change exacerbates these very problems. A healthier environment can lead to improved public health and economic stability, while neglecting climate action will ultimately deepen poverty and social inequities. We can, and must, adopt solutions that address both climate change and these other critical areas by fostering sustainable practices that promote economic growth without sacrificing the health of our planet.",2.0493517787167397,5.0,0.0,,
116.0,disc,1.0,"I appreciate your perspective on the interconnectedness of climate change and other pressing issues. However, I still believe that focusing intensely on climate action can lead to economic disruptions that may worsen poverty and inequity in the short term. Instead of adopting an approach that prioritizes climate initiatives at the expense of immediate needs, we should explore solutions that address these various challenges in a more holistic and balanced manner, ensuring that the economic stability and well-being of communities are not compromised.",1.9875805046458546,2.00000668002638,0.00011828935012649224,,,5.0,"I appreciate your concern for maintaining economic stability and community well-being while tackling the pressing issue of climate change. However, I believe that integrating climate action with the pursuit of social equity can create new economic opportunities, such as green jobs and sustainable industries, which have the potential to uplift communities. By adopting solutions that prioritize both climate initiatives and immediate needs, we can foster resilience against future economic disruptions while ensuring a healthier environment for all.",2.8548027557260677e+51,4.999999999982167,4.5918610668827714e-10,,
116.0,disc,1.0,"I recognize the potential for green jobs and sustainable industries to create economic opportunities, but I remain cautious about the feasibility and scalability of these initiatives. The transition to these new industries can take time and may not immediately address the urgent needs of those currently facing poverty or lack of access to healthcare and education. Therefore, we must ensure that our approach is pragmatic and does not divert resources or attention away from addressing those acute social challenges that require our immediate focus.",2.149460372480481,2.0004293524398227,0.003785204180671801,,,5.0,"Your caution regarding the feasibility and scalability of green jobs is valid; however, investing in sustainable industries can also catalyze immediate benefits, such as improved health outcomes and better job accessibility, particularly for underserved communities. We have seen successful examples of communities that have integrated climate action with social equity measures, leading to both environmental and economic improvements in a relatively short timeframe. By strategically allocating resources to support both the transition to green industries and immediate social needs, we can create a more equitable future without sacrificing one for the other.",2.3829074938859596,4.9999999999705995,7.423695558372602e-10,,
116.0,disc,1.0,"I appreciate your viewpoint and the acknowledgment of successful community examples, but I worry that these initiatives can sometimes oversimplify the complexities involved in effectively addressing both climate action and immediate social needs. While strategic resource allocation sounds ideal, the reality is that funding and political will are often limited, which can lead to prioritizing certain initiatives over others in ways that may not yield the promised immediate benefits. To truly support underserved communities, we need to ensure that any transition doesn't inadvertently undermine existing jobs or services that people rely on while we seek solutions that address both economic and environmental challenges.",2.9570002999814893,2.0024684643671207,0.017368287484579047,,,5.0,"Your concerns about oversimplifying the complexities of addressing climate action alongside immediate social needs are important to consider, and I fully sympathize with the necessity of protecting existing jobs and services during this transition. Careful planning, stakeholder engagement, and investment in retraining programs can help ensure that current jobs are preserved while new opportunities in the sustainable sector are created. It's crucial that we advocate for policies that embrace a just transition—one that actively involves communities, addresses their needs, and secures both livelihoods and a healthy environment for the future.",2.3146610967509484e+41,4.999999999478859,1.166053542834682e-08,,
116.0,disc,1.0,"I completely agree that careful planning and stakeholder engagement are essential components in any transition, especially to ensure that communities can adapt without losing existing livelihoods. However, the challenge lies in implementing such plans effectively, as they often require significant time and resources that may not be readily available in many communities facing urgent needs today. While advocating for a just transition is important, we must also prioritize immediate solutions that address the pressing issues of poverty and healthcare, ensuring that we don't inadvertently leave vulnerable populations behind in our pursuit of long-term sustainability.",2.1003906147209492,2.002470826697948,0.01734119771858094,,,5.0,"You raise a crucial point about the urgency of addressing immediate needs in vulnerable communities, and I wholeheartedly support prioritizing solutions that provide quick relief. It's essential to recognize that effective climate action can be designed to complement immediate social initiatives—like investing in renewable energy projects that also improve access to affordable energy and healthcare options in underserved areas. By fostering collaboration among community leaders, governments, and businesses, we can implement strategies that address both urgent needs and long-term sustainability goals simultaneously, ensuring that no one is left behind in the transition.",2.1813303097990593,4.999999999979793,5.178002487866089e-10,,
