ID,TEXT_TYPE,INIT_OP_A,TEXT_A,PPL_A,PROBE_INT_A,H_INT_A,PROBE_EXT_A,H_EXT_A,INIT_OP_B,TEXT_B,PPL_B,PROBE_INT_B,H_INT_B,PROBE_EXT_B,H_EXT_B
133.0,tot,2.0,"I believe that while environmental issues are important, the emphasis on climate change often overshadows other pressing concerns that deserve equal attention. The notion that climate change is the most urgent problem can lead to ineffective policies that prioritize emissions reduction over economic development and social needs. Many regions still face poverty, health crises, and infrastructure challenges that are immediate and require resources. Additionally, the Earth's climate has always been subject to natural changes, and history shows that societies have adapted to these changes over time. Instead of focusing exclusively on climate change, we should adopt a more balanced approach that addresses a range of environmental and societal issues simultaneously.",4.355264882891281e+35,2.01999495891804,0.09801120073647004,,,1.0,"I believe that the focus on climate change has been exaggerated and often distracts from more immediate and pressing issues facing humanity, such as poverty, healthcare, and education. Many proposed solutions, like drastic policy changes and economic upheaval, could harm economies and livelihoods without guaranteeing significant impact on climate. Instead of prioritizing climate change, we should concentrate on practical advancements in technology and infrastructure that enhance our resilience and quality of life. It's essential to critically evaluate the narratives surrounding climate change and consider a broader perspective on global challenges.",2.7037468769633393e+42,1.9996647492346178,0.003019907229129789,,
133.0,disc,2.0,"While climate change is a significant issue, it's crucial to recognize that there are numerous pressing concerns such as poverty, health crises, and infrastructure that also demand our attention. Focusing solely on emissions reduction can divert resources and policies away from addressing these immediate social needs. I believe a more balanced approach is necessary, one that tackles both environmental and societal challenges simultaneously for sustainable progress.",1.7877564694329757,3.769123049678215,0.5572308207610729,,,1.0,"I wholeheartedly agree that we need to adopt a balanced approach to address the pressing issues of poverty, health crises, and infrastructure alongside climate change. It's important to ensure that resources are allocated in a way that effectively tackles these immediate social needs rather than solely focusing on emissions reduction. By prioritizing technological advancements and practical solutions, we can improve resilience and quality of life while still considering environmental concerns.",1.9728407202986555,2.00000000001909,5.016994355143571e-05,,
133.0,disc,2.0,"I'm glad to see agreement on the importance of a balanced approach, as it reflects the reality that many communities are struggling with immediate challenges. Technological advancements can indeed play a vital role, but we must ensure that these innovations are accessible and affordable, particularly for those who are most affected by social issues. By integrating our efforts across different areas, we can foster resilience and improve quality of life without losing sight of environmental sustainability.",1.9902024313423747,3.1361765108803947,0.6215976880806684,,,1.0,"I appreciate your emphasis on accessibility and affordability when it comes to technological innovations; it's crucial that advancements benefit everyone, especially those facing social challenges. However, I believe we need to be cautious about assuming that integrating efforts will always yield the desired outcomes. It's vital that we focus on practical, immediate solutions that enhance quality of life without compromising economic stability or diverting attention from the pressing issues that directly affect communities today.",2.0749267041258186,2.000708602955881,0.005870767637944696,,
133.0,disc,2.0,"Your point about the need for caution in assuming that integration will always lead to positive outcomes is well taken; we must be strategic in our approach. Prioritizing practical, immediate solutions is essential, particularly in communities facing urgent challenges, and we should evaluate the long-term impacts of our actions as we move forward. By fostering open discussions and collaboration, we can identify solutions that address immediate needs while also laying the groundwork for sustainable economic stability.",2.0224815220417587,2.876304768917582,0.6490040122421109,,,1.0,"I completely agree that strategic thinking is vital in addressing both immediate needs and long-term sustainability. Open discussions and collaboration are essential for identifying solutions that effectively balance economic stability with social progress. However, we must remain mindful of the economic implications of proposed policies and ensure that our focus remains on practical advancements that directly benefit communities, rather than getting sidetracked by broad environmental initiatives that may not deliver tangible results.",2.01816925779691,2.0002014322868997,0.0019607441402277404,,
133.0,disc,2.0,"You raise an important consideration regarding the economic implications of our policies, which must be carefully analyzed to ensure they truly benefit the communities in need. It’s essential that we remain grounded in practical advancements that have clear, tangible outcomes rather than getting swept up in initiatives that prioritize broad environmental goals without addressing immediate realities. By maintaining this focus, we can foster trust and engagement from communities, ensuring that our efforts genuinely improve their quality of life while still being mindful of the broader environmental context.",2.3232501863301,3.3717868280207246,0.6871323980435157,,,1.0,"Absolutely, grounding our efforts in practical advancements that yield clear benefits for communities is essential for fostering trust and engagement. We should always be vigilant against initiatives that, while well-intentioned, may detract from addressing the pressing realities that people face every day. It's crucial that our approach prioritizes the immediate quality of life for individuals while still acknowledging the need for a broader understanding of environmental issues in a way that complements our primary goals.",2.2487265733832364,2.0040668496840204,0.026508761131110035,,
133.0,disc,2.0,"I completely agree that prioritizing immediate quality of life is crucial in our approach, as it fosters trust and shows that we are genuinely invested in the well-being of individuals and communities. Acknowledging the broader environmental context while keeping our primary focus on practical solutions allows us to address urgent needs without losing sight of long-term sustainability. Ultimately, finding that balance will enable us to create a framework that not only responds to today's challenges but also lays the groundwork for a healthier and more resilient future.",1.8901089880486188,3.086842943409885,0.35776285359737314,,,1.0,"I'm glad we are on the same page about the importance of prioritizing immediate quality of life while still considering the broader environmental context. Finding that balance is indeed essential, as it allows us to tackle urgent needs without getting bogged down by abstract sustainability goals that may not have immediate impact. By focusing on practical solutions that directly improve lives today, we can lay a more solid foundation for a healthier and more resilient future for all communities.",1.8098585880624083,2.0040512183079198,0.026687653287859162,,
