ID,TEXT_TYPE,INIT_OP_A,TEXT_A,PPL_A,PROBE_INT_A,H_INT_A,PROBE_EXT_A,H_EXT_A,INIT_OP_B,TEXT_B,PPL_B,PROBE_INT_B,H_INT_B,PROBE_EXT_B,H_EXT_B
13.0,tot,1.0,"I believe that the focus on climate change has been exaggerated and often distracts from more pressing and immediate issues facing humanity, such as poverty, healthcare, and education. Many proposed solutions, like drastic policy changes and economic upheaval, could harm economies and livelihoods without guaranteeing significant impact on climate. Instead of prioritizing climate alarmism, we should invest in innovation and technology that can address environmental issues without sacrificing progress and development. It's important to critically assess the data and consider the broader picture of human welfare rather than focusing solely on climate narratives.",8.66728176552931e+40,1.9999419189931626,0.000630075982512501,,,1.0,"I believe that the focus on climate change has been exaggerated and often distracts from more immediate and pressing issues facing humanity, such as poverty, healthcare, and education. Many climate models are speculative, and the economic impact of drastic measures to combat climate change can be detrimental. We should prioritize innovation and adaptation rather than imposing regulations that might hinder growth and development. Ultimately, it's crucial to maintain a balanced perspective on environmental issues without sacrificing progress in other vital areas.",1.7569406177049696,1.9999945034469095,8.975037827518541e-05,,
13.0,disc,1.0,"While it's important to acknowledge the conversation around climate change, we must be cautious not to let it overshadow other critical issues like poverty, healthcare, and education that need immediate attention. The proposed solutions often come with drastic policy changes that could harm economies and livelihoods without guaranteeing true environmental impact. Instead, we should focus on fostering innovation and technology that can address these environmental challenges in a way that aligns with human progress and development.",3.427592740791168e+52,2.2229384450482965,0.532602264622863,,,1.0,"I completely agree that while climate change is a significant topic, it should not distract us from urgent issues such as poverty, healthcare, and education that directly affect people's lives today. The drastic measures often proposed can have severe economic repercussions, and we need to evaluate their effectiveness carefully before implementation. Emphasizing innovation and adaptation allows us to tackle environmental challenges while still promoting growth and improving livelihoods, which is essential for a balanced approach.",1.9879591996647885,2.000334407884128,0.003032216398251836,,
13.0,disc,1.0,"I'm glad to see you share my perspective that we need to prioritize pressing issues that directly impact people’s lives today. It's crucial that we critically evaluate any drastic measures proposed for climate action and their potential economic repercussions, ensuring that we do not undermine progress in essential areas like healthcare and education. Focusing on innovation and adaptation indeed offers a more balanced approach, allowing us to tackle environmental challenges without sacrificing the growth and livelihoods that are fundamental to human welfare.",2.27633132414078,2.2691661776310803,0.583860387807876,,,1.0,"I'm glad to see we are on the same page about prioritizing the immediate challenges that people face in their daily lives. It's essential to recognize that while addressing climate issues is important, it should be done in a way that does not compromise economic stability or hinder progress in vital sectors like healthcare and education. By championing innovation and practical solutions, we can effectively navigate environmental challenges while fostering the growth and development that supports overall human well-being.",2.1565486716217244,2.0001230020314775,0.0012401414878807535,,
13.0,disc,1.0,"Absolutely, I appreciate your alignment on the need for a balanced approach that safeguards economic stability while addressing climate issues. By prioritizing innovation and practical solutions, we can ensure that environmental initiatives complement rather than compete with the essential services that support human progress. It’s a matter of finding the right synergy—protecting our environment in a way that also enhances healthcare, education, and overall quality of life for everyone.",2.4002383199940245,2.5632393207071753,0.6910680753512849,,,1.0,"I couldn't agree more that finding that synergy is key to addressing both environmental and societal needs. By fostering an environment where innovation thrives, we can create solutions that not only improve our ecological footprint but also enhance healthcare, education, and overall quality of life. Ultimately, a collaborative approach that aligns environmental initiatives with human progress will lead to sustainable outcomes for all.",1.759229841058191,2.9399127371757974,0.22721125921204377,,
13.0,disc,1.0,"I'm glad to see we're on the same wavelength regarding the importance of synergy in our approaches. By creating a collaborative environment that promotes innovation, we can indeed develop solutions that positively impact both our ecological footprint and essential sectors like healthcare and education. Focusing on sustainable outcomes requires us to prioritize human progress alongside environmental initiatives, ensuring a future that benefits everyone.",2.0154911166354523,2.500095142886607,0.6939174454320469,,,1.0,"Absolutely, it’s encouraging to discuss these ideas with someone who understands the importance of collaboration. Prioritizing human progress alongside environmental initiatives allows us to create a holistic approach that addresses the needs of both the planet and its people. As we work towards sustainable outcomes, we must remain committed to exploring innovative solutions that enhance quality of life while protecting our environment.",2.0488143672910475,2.731054778233146,0.5822396994072512,,
13.0,disc,1.0,"I appreciate your enthusiasm for collaboration; it truly is essential for developing effective strategies. Emphasizing a holistic approach will help us navigate the complexities of balancing human needs with environmental goals, ensuring we don't sacrifice one for the other. As we continue this dialogue, it's vital to remain focused on innovative solutions that enhance quality of life while simultaneously safeguarding our planet for future generations.",2.016242708682528,2.5623916573494285,0.687072380266704,,,1.0,"Thank you for highlighting the importance of a holistic approach, as it truly is key to addressing the multifaceted challenges we face. By maintaining a focus on innovative solutions, we can ensure that the advancements we make serve to enhance both human welfare and environmental health. As we move forward in this dialogue, let’s continue to advocate for strategies that prioritize meaningful progress without jeopardizing the future of our planet or its inhabitants.",2.1050558019622896,2.268935001251853,0.5822677172568523,,
