ID,TEXT_TYPE,INIT_OP_A,TEXT_A,PPL_A,PROBE_INT_A,H_INT_A,PROBE_EXT_A,H_EXT_A,INIT_OP_B,TEXT_B,PPL_B,PROBE_INT_B,H_INT_B,PROBE_EXT_B,H_EXT_B
149.0,tot,2.0,"I believe that while environmental issues are important, the emphasis on climate change often overshadows other pressing concerns that deserve equal attention. There are natural climate fluctuations that have occurred throughout Earth's history, and many argue that humanity's ability to adapt is significant. Rather than focusing solely on climate change, we should prioritize economic development, technological innovation, and improving living standards globally, which can also contribute to better environmental stewardship. Addressing immediate human needs can lead to more sustainable long-term solutions without the alarmism often tied to climate narratives.",2.198356716672857,2.0052190524213036,0.032658223043494236,,,1.0,"I believe that the focus on climate change has been exaggerated and often distracts from more pressing and immediate issues facing humanity, such as poverty, healthcare, and education. Many proposed solutions, like drastic policy changes and economic upheaval, could harm economies and livelihoods without guaranteeing significant impact on climate. Instead of prioritizing climate alarmism, we should invest in innovation and technology that can address environmental issues without sacrificing progress and development. It's important to critically assess the data and consider the broader picture of human welfare.",5.990824190992945e+43,1.9999044019802754,0.0009928714968993931,,
149.0,disc,2.0,"While climate change is an important topic, I believe we must also consider a broader range of pressing global issues that deserve our attention. Historical climate fluctuations demonstrate that humanity has a remarkable ability to adapt, and we should focus on economic development and technological innovation to address immediate human needs. By prioritizing these areas, we can foster sustainable solutions that improve living standards and enhance environmental stewardship without falling into alarmist narratives.",1.604655225535891,2.5026976527714986,0.7050968555527717,,,1.0,I completely agree with your perspective on the importance of balancing our focus between climate change and more immediate global issues like economic development and healthcare. Emphasizing technological innovation can lead to sustainable solutions that uplift communities while also addressing environmental concerns. It’s crucial that we avoid alarmist narratives and instead invest in practical strategies that foster progress and improve overall human welfare.,1.7062812167729586,2.0001564419793945,0.0015729391606776983,,
149.0,disc,2.0,"I appreciate your agreement and the emphasis you've placed on practical strategies for progress. It's true that when we invest in technological innovation and economic development, we lay the groundwork for solutions that simultaneously address both human welfare and environmental health. By fostering a collaborative approach that prioritizes immediate needs, we can create a sustainable future that benefits everyone without succumbing to fear-driven narratives.",1.978651732152771,2.7791279348241305,0.5407821561743323,,,1.0,"Thank you for your thoughtful response; I appreciate the emphasis on collaboration in tackling these complex issues. By focusing on immediate needs while leveraging innovative technologies, we can indeed create pathways to a sustainable future that enhances both human welfare and environmental health. It’s imperative that we remain grounded in evidence-based solutions, steering clear of fear-driven narratives that could hinder progress and economic growth.",1.9263837188826767,2.014061071286415,0.07396880291031903,,
149.0,disc,2.0,"Thank you for your kind words; I completely agree that collaboration is key to navigating these complex challenges. Staying grounded in evidence-based solutions not only fosters progress but also creates a more rational discourse around environmental and economic issues. By maintaining this focus, we can inspire meaningful advancements that uplift communities while ensuring that we remain responsible stewards of our planet.",1.9746606135350078,3.0371598162758393,0.32660283268283247,,,1.0,"I appreciate your insights on the importance of rational discourse in addressing these challenges; it truly helps in fostering a more constructive dialogue. By working together and prioritizing a balanced approach, we can indeed inspire advancements that benefit both communities and our planet. It's essential that we keep pushing for policies and innovations that align with this vision, ensuring that human welfare and environmental sustainability go hand in hand.",2.911016589524591e+57,2.010980817362543,0.06056786355984448,,
149.0,disc,2.0,"I'm glad you resonate with the idea of fostering rational discourse, as it is crucial for constructive dialogue on these multifaceted issues. By advocating for policies and innovations that recognize the interconnectedness of human welfare and environmental sustainability, we can drive real change that benefits everyone. Let's continue to collaborate and support solutions that embody this balanced approach, ensuring a brighter future for both communities and the planet.",1.8431839933900886,3.0069990860598463,0.14874261543775422,,,1.0,"I wholeheartedly support the idea of collaboration in crafting policies that highlight the interconnectedness of human welfare and environmental sustainability. It’s refreshing to engage in discussions that prioritize a balanced approach, which is essential for achieving meaningful change. Let’s keep championing innovative solutions that uplift communities without compromising economic growth, as this will ultimately lead to a more sustainable future for all.",2.0903866610941897,2.002464737133502,0.017411677636063057,,
149.0,disc,2.0,"I appreciate your enthusiastic support for collaboration in policy development; it truly is vital for achieving lasting change. By continuing to champion innovative solutions that uplift communities while fostering economic growth, we can pave the way for a more sustainable future that benefits everyone. Together, we have the potential to redefine how we approach these intertwined issues and to create a positive impact that resonates for generations to come.",2.167727393007999,3.3161291668119706,0.6488474644164742,,,1.0,"Thank you for your encouraging words; it’s inspiring to see such a strong commitment to redefining our approach to these crucial issues. By focusing on innovative solutions that align economic growth with community upliftment, we can indeed create a foundation for sustainability that endures over time. Together, we have the opportunity to shape a future that not only addresses current challenges but also enhances the quality of life for future generations.",6.370461823702121e+53,2.0140283418357616,0.07432452108363313,,
