ID,TEXT_TYPE,INIT_OP_A,TEXT_A,PPL_A,PROBE_INT_A,H_INT_A,PROBE_EXT_A,H_EXT_A,INIT_OP_B,TEXT_B,PPL_B,PROBE_INT_B,H_INT_B,PROBE_EXT_B,H_EXT_B
152.0,tot,2.0,"I believe that while environmental issues are important, the emphasis on climate change often overshadows other pressing concerns that deserve equal attention. The notion that climate change is the most urgent problem can lead to ineffective policies that prioritize emissions reduction over economic development and social needs. Many regions still face poverty, health crises, and infrastructure challenges that are immediate and require resources. Additionally, the Earth's climate has always been subject to natural changes, and history shows that societies have adapted to these changes over time. Instead of focusing exclusively on climate change, we should adopt a more balanced approach that addresses a range of environmental and societal issues simultaneously.",4.35518561354069e+35,2.0144147632228875,0.07563311816935692,,,2.0,"I believe that while environmental issues are important, the emphasis on climate change often overshadows other pressing concerns that need immediate attention. There are numerous factors affecting our planet, such as pollution, deforestation, and resource depletion, that deserve equal focus. Additionally, the economic implications of drastic policy changes aimed at combating climate change could have significant negative effects on jobs and livelihoods. It is important to take a balanced approach that considers economic stability and the broader context of environmental issues, rather than prioritizing climate change above all else.",1.8813554648703537,2.061093873955408,0.23154701226148527,,
152.0,disc,2.0,"While climate change is a significant issue, it's crucial to recognize that there are numerous pressing concerns that demand our attention as well, such as poverty and health crises. Focusing solely on emissions reduction can divert resources from addressing these immediate societal needs. I believe we should strive for a balanced approach that tackles both environmental and social challenges simultaneously, ensuring that we do not overlook the complexity of the issues at hand.",1.6655305493568433,3.9957611889283724,0.027342385672884297,,,2.0,"I completely agree with your perspective that a balanced approach is essential when addressing these issues. It's vital to recognize that while climate change is urgent, we must not lose sight of other critical challenges like poverty and health crises that have immediate impacts on people's lives. By integrating our efforts to tackle environmental and social concerns, we can create a more sustainable and equitable future for all.",1.740784305780322,3.763858323424984,0.5707705052585125,,
152.0,disc,2.0,"I'm glad to hear that you share the belief in a balanced approach. It's essential that we work collaboratively to create solutions that not only address climate change but also uplift vulnerable communities grappling with poverty and health issues. By merging our strategies, we can foster a more resilient society that prioritizes both environmental sustainability and human well-being.",1.8970056405808269,3.9997674745705862,0.0021789996749881735,,,2.0,"Absolutely, collaboration is key to developing effective solutions that address both environmental and social challenges. We must ensure that policies prioritize the needs of vulnerable communities without compromising economic stability, as job security and livelihoods are also crucial aspects of resilience. By leveraging our resources and expertise, we can create a comprehensive approach that promotes sustainability while simultaneously uplifting those in need.",2.2720115467573603,3.985789807179359,0.07470495072919064,,
152.0,disc,2.0,"I completely agree that collaboration is vital for crafting policies that serve both environmental and social needs without sacrificing economic stability. Protecting livelihoods and ensuring job security must be central to our strategies, as resilient communities are better equipped to face various challenges, including climate change. By pooling our resources and knowledge, we can design holistic solutions that genuinely uplift vulnerable populations while advancing sustainability goals.",1.9259728982604731,3.9998902335986544,0.0011101178818330771,,,2.0,"I'm glad to see that we are on the same page regarding the importance of securing livelihoods while addressing these issues. It’s crucial that our strategies not only advance sustainability but also empower communities economically, as this interconnected approach can lead to lasting positive change. By focusing on holistic solutions, we can tackle multiple challenges simultaneously and create a robust foundation for both people and the planet.",6.176560445108295e+59,3.9769757238919476,0.1096863768136901,,
152.0,disc,2.0,"I appreciate your emphasis on the interconnectedness of economic empowerment and sustainability, as this is indeed vital for meaningful progress. A holistic approach allows us to address various challenges in a way that strengthens communities and fosters resilience, benefiting both people and the planet. Together, we can champion initiatives that not only protect the environment but also enhance the quality of life for those who are most affected by these issues.",1.6772246656251837,3.9913747336669845,0.04964212744180875,,,2.0,"Thank you for highlighting the importance of interconnectedness; it truly is the cornerstone of meaningful progress. By championing initiatives that benefit both the environment and the communities most affected, we can create a more equitable and sustainable future. It’s essential that we continue to advocate for inclusive strategies that uplift individuals while also addressing the urgent need for environmental protection.",1.8144456724562983,3.9947423820135954,0.03286628599363642,,
152.0,disc,2.0,"You're absolutely right; the principle of interconnectedness is vital for crafting strategies that yield lasting benefits for both the environment and the communities affected by it. Advocating for inclusive policies ensures that no one is left behind in our pursuit of sustainability, creating a just and equitable path forward. By prioritizing these dual objectives, we can foster a future where environmental protection and community empowerment go hand in hand, leading to comprehensive progress.",2.2177549235881537,3.962467516100622,0.16041318713102928,,,2.0,"I appreciate your insights on the importance of inclusive policies that ensure everyone benefits from our sustainability efforts. It's crucial that we maintain a focus on both environmental protection and community empowerment, as they are deeply intertwined goals. By working together to prioritize these dual objectives, we can indeed pave the way for comprehensive progress that uplifts all sectors of society while protecting our planet.",1.5990129689561723,3.939372981159754,0.22972214415092057,,
