ID,TEXT_TYPE,INIT_OP_A,TEXT_A,PPL_A,PROBE_INT_A,H_INT_A,PROBE_EXT_A,H_EXT_A,INIT_OP_B,TEXT_B,PPL_B,PROBE_INT_B,H_INT_B,PROBE_EXT_B,H_EXT_B
155.0,tot,2.0,"I believe that while environmental issues are important, the emphasis on climate change often overshadows other pressing concerns that deserve equal attention. There are natural climate fluctuations that have occurred throughout Earth's history, and many argue that humanity's ability to adapt is significant. Rather than focusing solely on climate change, we should prioritize economic development, technological innovation, and improving living standards globally, which can also contribute to better environmental stewardship. Addressing immediate human needs can lead to more sustainable long-term solutions without the alarmism often tied to climate narratives.",2.1703839334089485,2.008576922815354,0.04936806203248337,,,2.0,"I believe that while environmental issues are important, the emphasis on climate change often overshadows other pressing concerns that deserve equal attention. There are natural climate fluctuations that have occurred throughout Earth's history, and many argue that humanity's ability to adapt is significant. Rather than focusing solely on climate change, we should prioritize economic development, technological innovation, and improving living standards globally, which can also contribute to better environmental stewardship. Addressing immediate human needs can lead to more sustainable long-term solutions without the alarmism often tied to climate narratives.",2.203032792795108,2.005218877361754,0.032660271527106,,
155.0,disc,2.0,"While climate change is an important topic, I believe we must also consider a broader range of pressing global issues that deserve our attention. Historical climate fluctuations demonstrate that humanity has a remarkable ability to adapt, and we should focus on economic development and technological innovation to address immediate human needs. By prioritizing these areas, we can foster sustainable solutions that improve living standards and enhance environmental stewardship without falling into alarmist narratives.",1.6028616404785179,2.9072650225755097,1.0781159208989473,,,2.0,"I completely agree with your perspective that while climate change is significant, it's essential not to lose sight of other urgent global challenges that require our focus. Emphasizing economic development and technological innovation can indeed lead to better living standards, which indirectly promotes more effective environmental stewardship. By approaching these issues with a balanced mindset, we can foster sustainable solutions that avoid the pitfalls of alarmism while genuinely addressing human needs.",1.9255809665092336,2.0476043879764374,0.1917939710540878,,
155.0,disc,2.0,"I'm glad to see we share a similar viewpoint on the need for a balanced approach to global challenges. By focusing on economic growth and technological advances, we can create conditions that not only enhance living standards but also naturally lead to improved environmental outcomes. It's essential to maintain a pragmatic perspective that recognizes the interconnectedness of these issues, allowing us to work toward sustainable solutions that benefit both people and the planet.",1.923654220918252,3.482566592384369,0.748422451240993,,,2.0,"I'm pleased to hear that we see eye to eye on the interconnectedness of economic growth and environmental outcomes. By prioritizing practical solutions that address both human needs and environmental stewardship, we can cultivate a sustainable future that benefits everyone. This pragmatic approach allows us to move forward without being bogged down by alarmist narratives, focusing instead on real progress and innovation.",1.8473306144861672,3.029361866592804,0.7084097897684757,,
155.0,disc,2.0,"Absolutely, it's refreshing to engage with others who understand the importance of practical solutions that merge economic and environmental goals. By fostering innovation and prioritizing human development, we can drive meaningful change that not only meets immediate needs but also lays the groundwork for long-term sustainability. Let’s continue to champion this balanced perspective to inspire collaborative efforts that yield real, lasting benefits for both people and the planet.",4.831424722013513e+56,2.9354632383939756,1.0481353085399083,,,2.0,"I wholeheartedly agree; it's crucial that we champion this balanced perspective in our discussions and advocacy. By fostering collaboration across sectors, we can harness innovative ideas that meet immediate human needs while paving the way for a sustainable future. Together, we can inspire collective action that truly transforms our approach to both economic development and environmental stewardship, leading to lasting benefits for everyone.",2.039642248316776,2.999999898635134,0.052731317137616154,,
155.0,disc,2.0,"I completely agree that fostering collaboration across sectors is key to unlocking innovative solutions that address both human and environmental needs. By working together, we can create a dynamic exchange of ideas that not only enhances economic development but also encourages responsible environmental practices. It's this collective action that will enable us to transform our current approach and achieve sustainable benefits for all, ensuring a healthier planet and improved living standards.",1.8667102493793442,3.8128570358449063,0.49186510086193874,,,2.0,"Absolutely, collaboration across sectors is vital for generating the innovative solutions we need to tackle both human and environmental challenges. By encouraging this dynamic exchange of ideas, we can promote responsible practices that actually elevate economic development while enhancing our environmental efforts. Together, we can create a framework that not only improves living standards but also fosters a healthier planet, ensuring sustainable progress for future generations.",6.045735840631743e+59,2.890375876799915,0.4115081031647303,,
155.0,disc,2.0,"I couldn't agree more; establishing a framework for collaboration is essential to driving meaningful change in both economic and environmental arenas. By actively promoting responsible practices and sharing innovative ideas, we lay the groundwork for a future where progress improves living standards and nurtures the planet simultaneously. This holistic approach not only benefits current generations but also ensures that future ones inherit a more sustainable and equitable world.",8.568925589418514e+58,3.220624473308648,0.5419311208300585,,,2.0,"I appreciate your emphasis on the importance of a collaborative framework for driving meaningful change. By fostering an environment where responsible practices and innovative ideas can thrive, we truly have the potential to create a future that uplifts both people and the planet. Ultimately, this holistic approach will not only enhance the quality of life for today's generations but also ensure a sustainable and equitable world for those yet to come.",1.7238903077819487,2.663863998782015,0.7778948946933189,,
