ID,TEXT_TYPE,INIT_OP_A,TEXT_A,PPL_A,PROBE_INT_A,H_INT_A,PROBE_EXT_A,H_EXT_A,INIT_OP_B,TEXT_B,PPL_B,PROBE_INT_B,H_INT_B,PROBE_EXT_B,H_EXT_B
160.0,tot,2.0,"I believe that while environmental issues are important, the emphasis on climate change often overshadows other pressing concerns that deserve equal attention. There are natural climate fluctuations that have occurred throughout Earth's history, and many argue that humanity's ability to adapt is significant. Rather than focusing solely on climate change, we should prioritize economic development, technological innovation, and improving living standards globally, which can also contribute to better environmental stewardship. Addressing immediate human needs can lead to more sustainable long-term solutions without the alarmism often tied to climate narratives.",2.1819384286624097,2.005219764308906,0.03264711453443141,,,2.0,"I believe that while environmental issues are important, the emphasis on climate change often overshadows other pressing concerns that deserve equal attention. The notion that climate change is the most urgent problem can lead to ineffective policies that prioritize emissions reduction over economic development and social needs. Many regions still face poverty, health crises, and infrastructure challenges that are immediate and require resources. Additionally, the Earth's climate has always been subject to natural changes, and history shows that societies have adapted to these changes over time. Instead of focusing exclusively on climate change, we should adopt a more balanced approach that addresses a range of environmental and societal issues simultaneously.",4.338817282517605e+35,2.0089788545910103,0.051269656667142297,,
160.0,disc,2.0,"While climate change is an important topic, I believe we must also consider a broader range of pressing global issues that deserve our attention. Historical climate fluctuations demonstrate that humanity has a remarkable ability to adapt, and we should focus on economic development and technological innovation to address immediate human needs. By prioritizing these areas, we can foster sustainable solutions that improve living standards and enhance environmental stewardship without falling into alarmist narratives.",1.596019745598285,3.1259053474337195,0.868759878473081,,,2.0,"I completely agree with your perspective that we need to take a broader view of global challenges. While it's essential to address climate change, we must not overlook critical issues such as poverty, healthcare, and infrastructure that require immediate attention and resources. By fostering economic development and embracing technological innovation, we can simultaneously improve living standards and promote sustainable practices without succumbing to alarmist narratives about climate change.",1.8390336883638851,2.2689761281366745,0.5824312025095885,,
160.0,disc,2.0,"I'm glad to see that we share a common understanding of the need for a more comprehensive view of global challenges. By investing in economic development and technological advancements, we can create a positive feedback loop where improved living standards naturally lead to better environmental practices. It's important to remember that addressing urgent human needs can provide the foundation for sustainable solutions that benefit both society and the environment in the long run.",1.8506592355417042,2.9155481764767197,0.3673890309880705,,,2.0,"Absolutely, I appreciate your emphasis on the interconnectedness of economic development and environmental stewardship. When we prioritize urgent human needs, we lay the groundwork for a more resilient society that can tackle various issues, including climate-related ones, in a more effective manner. It’s crucial to recognize that sustainable progress emerges when we balance our approach to human development with environmental considerations rather than viewing them as separate challenges.",2.2629450858726887,2.189280586104075,0.498079177804578,,
160.0,disc,2.0,"You make an excellent point about the interconnectedness of these issues; it's essential to approach them holistically. When we strike a balance between addressing human development and environmental considerations, we not only enhance resilience but also create a more sustainable framework for future generations. By focusing on integrated solutions, we can tackle climate-related challenges more effectively while ensuring that the immediate needs of people are met.",1.7385055937685012,3.424875170751936,0.7306101985678429,,,2.0,"I completely agree that a holistic approach is vital for creating lasting solutions to both human and environmental challenges. By integrating our efforts to address immediate needs with long-term sustainability goals, we can foster resilience in communities while ensuring that no one is left behind. This balanced framework not only empowers individuals but also enhances our ability to adapt and respond to climate-related challenges as they arise.",1.6011568274648005,2.447518493587653,0.7188770174708524,,
160.0,disc,2.0,"I'm glad we’re on the same page about the importance of a holistic approach. By empowering communities through integrated efforts, we not only address immediate needs but also build the resilience required to face future challenges, including climate-related ones. This balanced framework can drive innovation and collaboration, ultimately leading to a more sustainable and equitable future for everyone.",1.7328192106443712,2.999999194635232,0.25799415495864886,,,2.0,"Absolutely, empowering communities is key to fostering resilience and adaptability in the face of future challenges. By promoting innovation and collaboration within this balanced framework, we can harness diverse perspectives and resources to create solutions that are both sustainable and equitable. It's this proactive and inclusive approach that truly holds the potential to benefit society as a whole while addressing the pressing issues we face today.",1.929567175756131,3.0529725456058183,0.365775259783867,,
160.0,disc,2.0,"You’ve articulated a crucial point about the value of inclusive collaboration in addressing our complex challenges. By leveraging diverse perspectives and tapping into local knowledge, we can develop innovative solutions that reflect the needs of all community members. This proactive engagement not only enhances sustainability but also strengthens the social fabric, ensuring that everyone can thrive as we navigate the pressing issues of our time.",2.2633927833217986,3.560256555608308,0.694031739554627,,,2.0,"I couldn't agree more; inclusive collaboration is essential for crafting solutions that truly resonate with the needs of all community members. When we integrate diverse perspectives and local knowledge, we empower individuals and foster a sense of ownership, which further strengthens the community's social fabric. This collective engagement not only enhances our sustainability efforts but also builds a more resilient society capable of facing today's pressing challenges together.",2.0995297568138245,3.543589361379659,0.8250414570416518,,
