ID,TEXT_TYPE,INIT_OP_A,TEXT_A,PPL_A,PROBE_INT_A,H_INT_A,PROBE_EXT_A,H_EXT_A,INIT_OP_B,TEXT_B,PPL_B,PROBE_INT_B,H_INT_B,PROBE_EXT_B,H_EXT_B
166.0,tot,2.0,"I believe that while environmental issues are important, the emphasis on climate change often overshadows other pressing concerns that deserve equal attention. The notion that climate change is the most urgent problem can lead to ineffective policies that prioritize emissions reduction over economic development and social needs. Many regions still face poverty, health crises, and infrastructure challenges that are immediate and require resources. Additionally, the Earth's climate has always been subject to natural changes, and history shows that societies have adapted to these changes over time. Instead of focusing exclusively on climate change, we should adopt a more balanced approach that addresses a range of environmental and societal issues simultaneously.",4.3654815116812345e+35,2.0230762391470822,0.10996050660559785,,,2.0,"I believe that while environmental issues are important, the emphasis on climate change often overshadows other pressing concerns that deserve equal attention. The notion that climate change is the most urgent problem can lead to ineffective policies that prioritize emissions reduction over economic development and social needs. Many regions still face poverty, health crises, and infrastructure challenges that are immediate and require resources. Additionally, the Earth's climate has always been subject to natural changes, and history shows that societies have adapted to these changes over time. Instead of focusing exclusively on climate change, we should adopt a more balanced approach that addresses a range of environmental and societal issues simultaneously.",4.310965473371395e+35,2.01999495891804,0.09801120073647004,,
166.0,disc,2.0,"While climate change is a significant issue, it's crucial to recognize that there are numerous pressing concerns that demand our attention as well. We must consider the broader context of poverty, health crises, and infrastructure challenges that many communities face today. By adopting a more balanced approach to environmental policy, we can address both climate change and these immediate societal needs effectively.",1.6775999585408379,3.9988010922987045,0.009244036746058901,,,2.0,"I completely agree with your sentiments. It's essential that we acknowledge the multitude of urgent issues, such as poverty and health crises, that are impacting communities right now, often overshadowed by the climate change narrative. By adopting a more holistic approach, we can ensure that our policies not only address climate issues but also meet the immediate needs of those facing societal challenges.",2.1054963259042943,2.0809069330033236,0.274331744416892,,
166.0,disc,2.0,"I'm glad to hear that you share this perspective. By integrating climate policies with initiatives that tackle poverty and health crises, we can create solutions that simultaneously uplift communities while addressing environmental concerns. This holistic approach not only fosters resilience but also ensures that we are making progress on multiple fronts, benefiting society as a whole.",2.7146629754388175e+71,3.9874312827043816,0.06691255837194948,,,2.0,"I appreciate your agreement on the importance of a holistic approach. It's crucial that we find ways to weave together environmental policies with social programs to create robust solutions that benefit everyone. Ultimately, by balancing our efforts, we can enhance community resilience and ensure that both environmental protection and social well-being are prioritized.",2.916724438562182,2.5950639752993276,0.8854197115030816,,
166.0,disc,2.0,"Absolutely, finding synergies between environmental policies and social programs is vital for creating impactful solutions. When we prioritize the well-being of communities alongside environmental goals, we empower individuals to thrive in the face of both social and ecological challenges. This integrated strategy not only fosters resilience but also cultivates a more equitable society, ultimately leading to stronger, healthier communities for all.",2.0794062986600985,3.999690222837018,0.002699000544434206,,,2.0,"I wholeheartedly agree that empowering communities is key to fostering resilience against both social and ecological challenges. By ensuring that our approaches are integrated, we can create systems that support both environmental sustainability and social equity. This balanced strategy enables us to build stronger communities, addressing immediate needs while also working towards long-term environmental goals.",2.1729696701987624,3.2474930596642317,0.6580920816925997,,
166.0,disc,2.0,"I'm glad to see such a strong alignment in our views on this issue. Integrating social equity with environmental sustainability not only addresses urgent needs but also lays the groundwork for a more sustainable future. By fostering collaboration among various sectors, we can develop innovative solutions that genuinely strengthen our communities while promoting a healthier planet.",2.0074098975258146,3.993940616158083,0.03700380566108139,,,2.0,"I'm pleased to see our shared alignment on the importance of this integration. Collaboration among various sectors is essential for developing innovative and effective solutions that meet the diverse needs of our communities. By working together, we can create a future that not only addresses immediate challenges but also supports long-term sustainability for both people and the planet.",1.8739643313782883,3.5378218757958377,0.8635578886507175,,
166.0,disc,2.0,"It's encouraging to witness such enthusiasm for collaboration in addressing these complex challenges. Working together across sectors allows us to leverage diverse expertise and resources, ultimately leading to more innovative solutions that can benefit everyone. By fostering partnerships, we can truly create a future where immediate needs are met while ensuring long-term sustainability for both communities and the environment.",1.8579970194482862,3.9980675546236113,0.014012615022613325,,,2.0,"I completely agree that collaboration is key to tackling these multifaceted challenges effectively. By bringing together diverse expertise and resources, we can unlock creative solutions that address both immediate and long-term needs. Fostering partnerships across sectors will not only enhance our ability to meet pressing concerns but also ensure that we create a sustainable future for all communities and the environment.",1.5562527094563687,3.1773737832071993,0.5005964402001192,,
