ID,TEXT_TYPE,INIT_OP_A,TEXT_A,PPL_A,PROBE_INT_A,H_INT_A,PROBE_EXT_A,H_EXT_A,INIT_OP_B,TEXT_B,PPL_B,PROBE_INT_B,H_INT_B,PROBE_EXT_B,H_EXT_B
167.0,tot,2.0,"I believe that while environmental issues are important, the emphasis on climate change often overshadows other pressing concerns that deserve equal attention. There are natural climate fluctuations that have occurred throughout Earth's history, and many argue that humanity's ability to adapt is significant. Rather than focusing solely on climate change, we should prioritize economic development, technological innovation, and improving living standards globally, which can also contribute to better environmental stewardship. Addressing immediate human needs can lead to more sustainable long-term solutions without the alarmism often tied to climate narratives.",2.1758378075616953,2.005219876551899,0.032649372747695755,,,2.0,"I believe that while environmental issues are important, the emphasis on climate change often overshadows other pressing concerns that deserve equal attention. There are natural climate fluctuations that have occurred throughout Earth's history, and many argue that humanity's ability to adapt is significant. Rather than focusing solely on climate change, we should prioritize economic development, technological innovation, and improving living standards globally, which can also contribute to better environmental stewardship. Addressing immediate human needs can lead to more sustainable long-term solutions without the alarmism often tied to climate narratives.",2.1903998893640497,2.00521977551472,0.032647209193110316,,
167.0,disc,2.0,"While climate change is an important topic, I believe we must also consider a broader range of pressing global issues that deserve our attention. Historical climate fluctuations demonstrate that humanity has a remarkable ability to adapt, and we should focus on economic development and technological innovation to address immediate human needs. By prioritizing these areas, we can foster sustainable solutions that improve living standards and enhance environmental stewardship without falling into alarmist narratives.",1.595304470370883,3.340868040417722,0.768006003319528,,,2.0,"I completely agree with your perspective that while climate change is significant, it's essential not to lose sight of other urgent global challenges that require our focus. Emphasizing economic development and technological innovation can indeed lead to practical solutions that improve living standards while fostering a more sustainable relationship with the environment. By addressing immediate human needs first, we can create a more robust foundation for long-term ecological stewardship, free from the alarmism often associated with climate debates.",1.858153332303284,2.9046510335426814,0.3147514464909995,,
167.0,disc,2.0,"I'm glad to see that you share my view on the importance of balancing climate change discussions with other pressing global challenges. Focusing on economic development and technological advancements can create opportunities for people, which in turn can lead to more effective environmental practices. It's crucial that we maintain a pragmatic approach to these issues, recognizing that enhancing human welfare can naturally lead to a more sustainable future.",2.2784191765406314,3.842627639369518,0.4571075765904379,,,2.0,"Absolutely, it's encouraging to find common ground on the need for a balanced perspective. By prioritizing human welfare and practical solutions, we can empower communities to adopt more sustainable practices that align with their economic goals. A pragmatic approach not only addresses immediate human needs but also paves the way for innovative environmental stewardship and resilience in the face of climate fluctuations.",1.984491089697341,2.5174325312668815,0.7484286210208616,,
167.0,disc,2.0,"Absolutely, empowering communities to align their economic goals with sustainable practices is key to fostering genuine environmental stewardship. By focusing on practical solutions that directly improve living conditions, we can encourage a culture of innovation that naturally embraces sustainability. It's important to remember that resilience in the face of climate fluctuations is rooted in strong, adaptable economies that can respond to changing circumstances effectively.",2.252120144317592,3.8470323257584016,0.4487374202209338,,,2.0,"I couldn't agree more; the connection between a strong economy and effective environmental stewardship is undeniable. When communities are equipped to thrive economically, they not only become more resilient but are also better positioned to innovate in sustainable practices. Fostering this culture of adaptability and practical solutions is essential for navigating both current challenges and future climate fluctuations.",2.0259237786766775,2.9959377086457866,0.026564619076354944,,
167.0,disc,2.0,"You're spot on—the link between economic strength and environmental stewardship is indeed crucial for sustainable progress. When communities flourish economically, they gain the resources and motivation needed to develop innovative solutions that benefit both society and the environment. By prioritizing adaptability and practicality, we can build a foundation for thriving communities that can tackle both immediate challenges and long-term sustainability.",2.270694482658379,3.345076332720709,0.7588438891764464,,,2.0,"I completely agree; economic strength serves as a vital catalyst for both community improvement and environmental innovation. When people have the resources to invest in sustainable solutions, they are more likely to engage in practices that benefit both themselves and the environment. By fostering a culture focused on adaptability and practicality, we empower communities to effectively address current challenges while setting the stage for a sustainable future.",2.2219594281371937,2.9628519543446035,0.16100013421691073,,
167.0,disc,2.0,"I appreciate your insights—it's clear that when communities are equipped with economic resources, their ability to invest in sustainable solutions increases significantly. This empowerment not only leads to immediate benefits for individuals but also creates a collective drive toward environmental responsibility. By cultivating a culture of adaptability and practical engagement, we can indeed create a positive feedback loop that addresses pressing issues while laying the groundwork for a more sustainable future.",2.0703766462666806,3.0244741493125575,0.2920793752781528,,,2.0,"Thank you for your thoughtful response—it truly underscores the interconnectedness of economic empowerment and environmental responsibility. By fostering this collective drive, we can create an environment where sustainable practices flourish alongside personal and community growth. Together, through adaptability and practical engagement, we can build a resilient foundation that not only responds to today's challenges but also paves the way for lasting sustainability.",2.354008192360723,2.964170959875127,0.17002976355604968,,
