ID,TEXT_TYPE,INIT_OP_A,TEXT_A,PPL_A,PROBE_INT_A,H_INT_A,PROBE_EXT_A,H_EXT_A,INIT_OP_B,TEXT_B,PPL_B,PROBE_INT_B,H_INT_B,PROBE_EXT_B,H_EXT_B
17.0,tot,1.0,"I believe that the focus on climate change has been exaggerated and often misrepresented. While environmental issues are important, I argue that the emphasis on climate change distracts from more immediate concerns, such as economic stability, poverty alleviation, and technological advancements. Moreover, the narratives surrounding climate policy often appear alarmist and can lead to policies that may negatively impact job growth and energy accessibility. We should prioritize a balanced approach that considers a range of pressing global issues rather than focusing excessively on climate change.",4.6821644752686765e+44,1.9999648294330625,0.0004008217607391863,,,1.0,"I believe that the focus on climate change has been exaggerated and often distracts from more pressing and immediate issues facing humanity, such as poverty, healthcare, and education. Many proposed solutions, like drastic policy changes and economic upheaval, could harm economies and livelihoods without guaranteeing significant impact on climate. Instead of prioritizing climate alarmism, we should invest in innovation and technology that can address environmental concerns without sacrificing progress and development. It's important to critically assess the data and consider the broader picture of human welfare.",2.3421091104221703,1.9999649904176593,0.00040326105399729316,,
17.0,disc,1.0,"I appreciate the opportunity to discuss climate change, but I believe we need to critically examine the narratives surrounding it. While environmental concerns are crucial, we shouldn’t lose sight of urgent issues like economic stability and poverty alleviation that directly affect people’s lives today. A balanced approach that integrates various pressing global challenges will ultimately lead us to more effective and sustainable solutions.",1.9312268090372406,2.0011681329203053,0.009088200448633661,,,1.0,"I completely agree with your perspective on the need for balance in our discussions about climate change. It's vital that we prioritize immediate issues like economic stability and poverty alleviation, as these directly impact people's lives right now, rather than getting lost in alarmist narratives. By focusing on innovation and practical solutions, we can address environmental concerns without compromising human progress and welfare.",1.5557600048698499,2.003168460729136,0.021476885305845725,,
17.0,disc,1.0,"I appreciate your agreement on the importance of balance in our discussions. It’s refreshing to see a focus on innovation and practical solutions that address both environmental and human welfare without resorting to alarmism. By fostering economic growth and technological advancements, we can develop strategies that ensure both progress and a sustainable future.",2.044212565549013,2.000909466843191,0.007315392659662551,,,1.0,"I'm glad we share a common understanding of the need for innovation in tackling both environmental and societal issues. It's essential to recognize that sustainable growth doesn't have to come at the expense of economic vitality; instead, it can thrive when we invest in smart technologies and solutions. By taking a pragmatic approach, we can create a future that enhances human welfare while addressing environmental challenges effectively.",2.110795927812537,2.0293068191369046,0.13241180602425873,,
17.0,disc,1.0,"Absolutely, the intersection of sustainable growth and economic vitality is key to a successful future. It's encouraging to envision a world where smart technologies not only solve environmental challenges but also drive job creation and economic opportunities. A pragmatic approach that harnesses innovation can indeed lead us to solutions that benefit both people and the planet without compromising on either front.",1.9129312753098744,2.0052169334850367,0.03268480000492779,,,1.0,"I wholeheartedly agree that smart technologies can serve as a catalyst for both job creation and sustainable solutions. Emphasizing innovation allows us to discover pathways that uplift economies while addressing environmental issues, leading to a more equitable and prosperous future. By fostering collaboration between industries and governments, we can ensure that progress in one area complements advancements in the other, ultimately benefiting society as a whole.",9.615592097762608e+58,2.00191977561911,0.014060099511552635,,
17.0,disc,1.0,"I completely resonate with your thoughts on the role of smart technologies as a catalyst for positive change. Collaboration between industries and governments is indeed crucial for creating synergies that enhance both economic and environmental outcomes. By prioritizing innovation and cooperative efforts, we can build a future where society thrives holistically, without falling prey to the divisive narratives that often hinder progress.",1.9611303728823135,2.0600846090142366,0.2272371048451896,,,1.0,"I'm glad to hear that you resonate with the idea of smart technologies driving positive change through collaboration. It’s crucial that we steer clear of divisive narratives that only serve to create polarization, as they detract from the real work that needs to be done. By fostering partnerships and focusing on shared goals, we can build a more unified approach to tackling both economic and environmental challenges, ultimately benefiting everyone involved.",1.8074278598449123,2.0179550234543644,0.09044117427468042,,
17.0,disc,1.0,"I completely agree that avoiding divisive narratives is essential for making real progress in addressing both economic and environmental challenges. By concentrating on shared goals and fostering meaningful partnerships, we can create a more unified approach that reflects the interests and needs of all stakeholders. Together, we can work towards solutions that not only uplift the economy but also promote sustainable practices, leading to a brighter future for everyone.",2.4354196310459154e+57,2.06007983969376,0.2272902016331101,,,1.0,"It’s encouraging to see such agreement on the importance of collaboration and unity in addressing these challenges. By establishing meaningful partnerships, we not only amplify our efforts but also ensure that diverse perspectives are taken into account, leading to more comprehensive solutions. A focus on uplifting the economy while promoting sustainable practices will create an environment where all stakeholders can thrive, paving the way for a truly brighter future.",2.6774991383450677e+57,2.0473906230191847,0.19123933702828785,,
