ID,TEXT_TYPE,INIT_OP_A,TEXT_A,PPL_A,PROBE_INT_A,H_INT_A,PROBE_EXT_A,H_EXT_A,INIT_OP_B,TEXT_B,PPL_B,PROBE_INT_B,H_INT_B,PROBE_EXT_B,H_EXT_B
193.0,tot,2.0,"I believe that while environmental issues are important, the emphasis on climate change often overshadows other pressing concerns that deserve equal attention. The notion that climate change is the most urgent problem can lead to ineffective policies that prioritize it over critical economic, social, and infrastructural challenges. Moreover, many predictions about climate impacts are based on models with inherent uncertainties. It’s crucial to strike a balance in our approach, ensuring we address a wider range of issues without disproportionate focus on one narrative.",1.2803705156198148e+45,2.062218965424821,0.23554864728497613,,,3.0,"Climate change is a complex issue that prompts a wide range of opinions and perspectives. On one hand, there are compelling arguments about the environmental impacts and potential risks to ecosystems and human health. On the other hand, some people raise questions about the effectiveness of proposed solutions and the economic ramifications. It's important to consider multiple viewpoints and the nuances involved in discussions surrounding this topic. Awareness and dialogue may help in addressing the various dimensions of climate change.",1.768542147445808e+50,4.962673115789676,0.15935374770519506,,
193.0,disc,2.0,"While climate change undoubtedly poses significant challenges, we must ensure that other critical issues, such as economic stability, public health, and social inequality, receive equal attention in our policy-making efforts. Focusing solely on climate narratives can divert resources and hinder our ability to address a broader spectrum of pressing concerns that impact people's daily lives. It’s essential to foster a balanced dialogue that recognizes the interconnectedness of environmental, social, and economic challenges rather than elevating one over the others.",1.9970334998278803,3.7272890193640733,0.6490461335046764,,,3.0,"I completely agree that addressing climate change should not come at the expense of other critical issues such as economic stability, public health, and social inequality. It's crucial to promote a holistic approach that recognizes the interconnectedness of these challenges, as solutions in one area can often benefit others. By fostering an inclusive dialogue that considers multiple dimensions, we can work towards sustainable policies that benefit both the environment and society as a whole.",1.5391207009702277,4.993307148589764,0.04017960554029785,,
193.0,disc,2.0,"I appreciate your commitment to a holistic approach, as it is indeed vital to recognize the interconnections between climate change and other pressing issues. However, it's important to remain cautious about how much weight we give to climate-focused solutions, ensuring they do not overshadow immediate socio-economic needs that require urgent attention. Balancing these priorities is essential; we must critically evaluate the effectiveness of proposed solutions in addressing multiple dimensions without overextending resources towards a singular narrative.",1.4330107642178974e+49,3.9769349382801256,0.1098956836103483,,,3.0,"You raise a valid point about the need for caution when prioritizing climate-focused solutions, especially in the context of urgent socio-economic needs. It's essential to critically evaluate how resources are allocated to ensure that we’re not neglecting immediate concerns while pursuing long-term climate goals. Striking that balance requires continuous dialogue and collaboration among various stakeholders to create integrated strategies that address the full spectrum of challenges we face.",1.70089152532619,4.999290329658984,0.00585503230670023,,
193.0,disc,2.0,"Absolutely, continuous dialogue and collaboration among stakeholders are fundamental for achieving that delicate balance between addressing immediate socio-economic needs and long-term climate goals. However, we must also be vigilant about ensuring that the urgency surrounding climate initiatives does not inadvertently marginalize other critical issues that communities face right now. By fostering an inclusive decision-making process that honors the complexity of these interconnected challenges, we can develop more effective and equitable strategies that truly serve the diverse needs of society.",1.1916624949663927e+49,3.988995560770635,0.0606019219582238,,,3.0,"I wholeheartedly agree that inclusivity in the decision-making process is essential for addressing the complexities of our interconnected challenges. Vigilance is necessary to ensure that the urgency of climate initiatives does not overshadow pressing issues that communities are currently facing, as each challenge has its own significance. By embracing diverse perspectives and fostering collaboration, we can create more equitable strategies that effectively address both immediate needs and long-term sustainability.",1.7932119471416477,4.999996273360884,5.0309635185123576e-05,,
193.0,disc,2.0,"I'm glad to see we are on the same page regarding the importance of inclusivity and vigilance in our discussions. Embracing diverse perspectives is crucial, as it not only enriches our understanding of these challenges but also ensures that solutions are more comprehensive and equitable. Ultimately, we must remain committed to a balanced approach that addresses the immediate needs of communities while paving the way for sustainable development, without allowing any single narrative to dominate our efforts.",1.9119786955748101,3.982005614441689,0.09015108282371131,,,3.0,"Absolutely, maintaining a balanced approach is key to effectively addressing both immediate and long-term challenges. Embracing diverse perspectives not only enhances our understanding but also leads to solutions that resonate more deeply within communities, making them more likely to succeed. As we move forward, it's crucial to keep the conversation open and adaptable, ensuring that no single narrative overshadows the multifaceted nature of the issues we face.",1.7211611769374362,4.999999789756593,3.44273574271994e-06,,
193.0,disc,2.0,"I completely agree that an open and adaptable conversation is essential for addressing the multifaceted nature of our challenges. By fostering an environment where multiple narratives can coexist, we can better identify innovative solutions that cater to the varied needs of communities. This flexibility will empower us to respond effectively to both current demands and future challenges, ultimately leading to a more resilient and equitable society.",1.7824890940637208,3.9947773508977327,0.032663301611917134,,,3.0,"I appreciate your emphasis on the value of fostering an environment where multiple narratives can thrive, as this is crucial for innovation and inclusivity. By embracing flexibility in our conversations and approaches, we can not only address the immediate needs of communities but also build the resilience necessary to tackle future challenges. Ultimately, this collaborative spirit will enhance our collective ability to create a more equitable society that is responsive to the diverse needs of all its members.",1.7299606328594852,4.999999967758133,5.884140610502936e-07,,
