ID,TEXT_TYPE,INIT_OP_A,TEXT_A,PPL_A,PROBE_INT_A,H_INT_A,PROBE_EXT_A,H_EXT_A,INIT_OP_B,TEXT_B,PPL_B,PROBE_INT_B,H_INT_B,PROBE_EXT_B,H_EXT_B
1.0,tot,1.0,"I believe that the focus on climate change has been exaggerated and often distracts from more pressing and immediate issues facing humanity, such as poverty, healthcare, and education. Many proposed solutions, like drastic policy changes and economic upheaval, could harm economies and livelihoods without guaranteeing significant impact on climate. Instead of prioritizing climate alarmism, we should invest in innovation and technology that can address environmental issues without sacrificing progress and development. It's important to critically assess the data and consider the broader picture of human welfare.",5.972367614660987e+43,1.9999728109608137,0.000322163820840217,,,1.0,"I believe that the focus on climate change has been exaggerated and often distracts from more immediate and pressing issues facing humanity, such as poverty, healthcare, and education. Many proposed solutions, like drastic emissions cuts or transitioning to renewable energy, can have significant economic repercussions and may not effectively address the problem at hand. Instead of prioritizing climate change over other critical needs, we should take a more balanced approach that addresses a range of global challenges without sacrificing economic growth and development.",1.9143109014795696,2.000000818286748,0.00016951473512650793,,
1.0,disc,1.0,"While climate change is often highlighted as a critical threat, we must consider whether this focus is overshadowing more immediate challenges like poverty, healthcare, and education. It's essential to evaluate how drastic policy changes aimed at combating climate change could potentially disrupt economies and livelihoods without guaranteeing a significant impact on the environment. Instead of prioritizing alarmism, we should direct our resources towards innovative technologies that can enhance environmental sustainability while also promoting development and human welfare.",1.8810443908527994,2.0085728242940726,0.04942128843098567,,,1.0,"I completely agree with your perspective on the need for balance in our approach to addressing global challenges. Prioritizing immediate issues like poverty, healthcare, and education, while cautiously evaluating climate change responses, ensures that we do not jeopardize economic stability or the well-being of countless individuals. By investing in innovative technologies that foster both sustainability and development, we can create solutions that effectively address multiple pressing concerns without sacrificing progress.",2.1460024250741943,2.000009925284402,0.00016438107396266147,,
1.0,disc,1.0,"I'm glad to hear we share a commitment to balance in addressing global challenges. It’s crucial that we seek solutions that not only mitigate environmental issues but also enhance economic stability and improve living standards for people around the world. By focusing on innovative technologies, we can create a pathway that empowers communities and drives progress without compromising our ability to respond to immediate human needs.",2.175984037571153,2.0024703681155707,0.01734301258123794,,,1.0,"Absolutely, it’s encouraging to find common ground on this critical issue. Emphasizing innovative technologies is indeed a powerful way to create synergies between environmental sustainability and economic growth, ultimately benefiting communities. By fostering a collaborative approach that addresses these interconnected challenges, we can ensure a more effective use of resources and better outcomes for humanity as a whole.",2.090293611448379,2.0000089201526685,0.00014431925978833452,,
1.0,disc,1.0,"I appreciate your insights and the emphasis on collaboration in tackling these interconnected challenges. Creating synergies between environmental sustainability and economic growth is essential for developing solutions that truly benefit communities. By working together to harness innovative technologies, we can ensure that our efforts lead to more effective resource utilization and improvements in human welfare without falling into the trap of alarmist narratives.",1.8940735053878754,2.00521880616679,0.03265966790581457,,,1.0,"Thank you for your thoughtful response; collaboration is indeed vital in navigating these complex challenges. It's refreshing to see the focus shift towards pragmatic solutions that prioritize real-world benefits for communities rather than succumbing to alarmist perspectives. By fostering dialogue and innovation, we can create a future where both the environment and human welfare are prioritized without compromising each other.",2.107465785747883,2.00025893081108,0.002447684965555606,,
1.0,disc,1.0,"Thank you for acknowledging the importance of collaboration and pragmatic solutions; it’s refreshing to engage in such constructive dialogue. Focusing on real-world benefits allows us to pursue strategies that not only protect the environment but also uplift communities. By continuing to foster innovation and open discussions, we can pave the way for a future where environmental sustainability and human welfare go hand in hand, creating a win-win scenario for all.",1.6020275130897648,2.268936552311043,0.5822674669852516,,,1.0,"I appreciate your continued emphasis on constructive dialogue and the pursuit of real-world benefits. It's clear that by prioritizing innovation and collaboration, we can create solutions that not only address environmental challenges but also enhance the quality of life for communities worldwide. Together, we can indeed establish a future where both sustainability and human welfare thrive, illustrating that progress in one area can elevate the other.",1.9161887191408298,2.0003316237737434,0.0030684935941065034,,
1.0,disc,1.0,"Thank you for your thoughtful response; it’s inspiring to see such enthusiasm for combining innovation with collaboration. When we prioritize actionable solutions that benefit both the environment and communities, we demonstrate that progress is not a zero-sum game. By working together, we can build a future where advancements in sustainability contribute meaningfully to improving the quality of life for people everywhere.",1.8287917183241023,2.222692772474427,0.5305173653054424,,,1.0,"I’m glad to see your enthusiasm for this balanced approach to progress—it truly is inspiring. By recognizing that advancements in sustainability can go hand in hand with community upliftment, we open doors to a future filled with potential. Working together with this mindset will not only foster innovation but also ensure that our collective efforts lead to tangible improvements in the lives of people around the world.",2.0673286299052944,2.000188688813909,0.0021112332836997214,,
