ID,TEXT_TYPE,INIT_OP_A,TEXT_A,PPL_A,PROBE_INT_A,H_INT_A,PROBE_EXT_A,H_EXT_A,INIT_OP_B,TEXT_B,PPL_B,PROBE_INT_B,H_INT_B,PROBE_EXT_B,H_EXT_B
204.0,tot,2.0,"I believe that while environmental issues are important, the emphasis on climate change often overshadows other pressing concerns that need immediate attention. There are natural climate fluctuations that have occurred throughout Earth's history, and many argue that humanity's ability to adapt is significant. Rather than focusing solely on climate change, we should prioritize economic development, technological innovation, and improving living standards globally, which can also contribute to better environmental stewardship. Addressing a wider range of issues may lead to more effective solutions without the alarmism often tied to climate narratives.",2.2421263372324196,2.005219553588253,0.03264994182156323,,,4.0,"Climate change is one of the most pressing issues of our time, posing serious threats to ecosystems, economies, and human health. The scientific consensus is clear: human activities, particularly the burning of fossil fuels, are driving unprecedented changes in our climate. These changes result in extreme weather events, rising sea levels, and altered agricultural patterns, impacting food security and biodiversity. 

Addressing climate change requires urgent collective action, including transitioning to renewable energy sources, improving energy efficiency, and promoting sustainable practices. Furthermore, equitable policy-making is essential to support vulnerable communities and ensure a just transition. By prioritizing environmental stewardship and fostering innovation, we can mitigate the impacts of climate change and create a sustainable future for generations to come. Time is of the essence, and the choices we make today will shape the world of tomorrow.",1.6699273836520867,4.999999999998121,5.2626774604528984e-11,,
204.0,disc,2.0,"While climate change is an important topic, I believe we must also consider a broader array of pressing global issues that deserve our attention. Historical climate fluctuations demonstrate that humanity has a remarkable ability to adapt, and we should focus on fostering economic development and technological advancements to improve living standards worldwide. By addressing a wider range of challenges, we can find more effective solutions without falling into the trap of alarmism that often dominates climate narratives.",1.6956797716276408,2.023161447941746,0.11038662006796819,,,4.0,"I appreciate your perspective, but it's crucial to recognize that climate change is fundamentally interconnected with many of the global issues you mentioned, including economic development and public health. While humanity has shown an impressive ability to adapt, the rapid pace and severity of current climate changes pose unprecedented challenges that could undermine our progress and exacerbate existing inequalities. Instead of viewing climate action as alarmism, we should see it as an opportunity to innovate and collaborate on sustainable solutions that benefit both people and the planet.",1.594829538341924,4.999999999982167,4.591861066779892e-10,,
204.0,disc,2.0,"I understand your points about the interconnectedness of climate change with global issues, and I agree that innovation and collaboration are vital. However, it's important to remember that some perspectives on climate action can create a narrative of urgency that may overshadow other significant challenges we face, such as poverty and health disparities. By prioritizing economic development and sustainable technologies, we can create a holistic approach that addresses both immediate human needs and environmental concerns without succumbing to alarmism.",3.397285724554768e+48,2.689422311979855,0.8250346044808174,,,4.0,"You raise an important point about balancing the urgency of climate action with other pressing global challenges like poverty and health disparities. However, I believe that effectively addressing climate change can actually advance economic development and improve public health, as a healthier environment directly contributes to better living conditions for all. Emphasizing holistic solutions does not mean downplaying the urgency of action; rather, it calls for integrating climate considerations into broader development efforts to ensure that we build resilient communities for a sustainable future.",3.415742221894859e+46,4.999999999962249,9.4378364817964e-10,,
204.0,disc,2.0,"I appreciate your perspective on the potential for climate action to enhance economic development and public health, and I agree that a healthier environment is essential for improving living conditions. However, I still believe that solutions should be prioritized based on immediate needs and capabilities, ensuring that we don’t divert resources away from urgent concerns that affect people's daily lives. By focusing on economic growth and technological innovation, we may find that sustainable practices naturally emerge as part of a broader strategy to uplift communities and enhance resilience, without solely framing it through the lens of climate urgency.",6.855276842557878e+40,2.974754712761208,0.15763082349029048,,,4.0,"I understand your concern about prioritizing immediate needs, and I agree that addressing pressing social issues is essential. However, it’s important to recognize that climate change is not just a future threat; its impacts are already affecting communities today, particularly the most vulnerable. By integrating sustainability into economic growth and innovation efforts, we can create solutions that not only address immediate human needs but also build long-term resilience against the ongoing challenges posed by climate change.",1.7537411940875347,4.999999999982167,4.591861066858253e-10,,
204.0,disc,2.0,"You make a valid point about the current impacts of climate change on vulnerable communities, and I acknowledge that these effects require our attention. However, I still contend that our primary focus should be on addressing immediate social and economic inequalities, as alleviating these issues can create a stronger foundation for any long-term resilience efforts. By concentrating on fostering innovation and economic development first, we can build the capacity to implement sustainable practices more effectively, ultimately benefiting both the immediate needs of people and the environment in a balanced manner.",2.1186314786214715,2.8192165231096955,0.48495011568301405,,,4.0,"I appreciate your emphasis on addressing social and economic inequalities as a foundation for resilience, as these issues are indeed critical. However, I worry that delaying targeted climate action can exacerbate existing inequalities, as the most affected communities often lack the resources to adapt or recover from climate-related impacts. By prioritizing both immediate social needs and proactive climate strategies concurrently, we can create a more equitable and sustainable future, ensuring that we don’t just build capacity for economic development but also safeguard the well-being of those who are most vulnerable in the face of a changing climate.",1.9317960567380545,4.999999999986112,3.610864874547609e-10,,
204.0,disc,2.0,"I recognize your concern about the potential exacerbation of inequalities due to climate impacts, and I agree that vulnerable communities need support. However, I still believe that a focus on immediate social and economic development can empower these communities in ways that climate-specific strategies alone may not. By enhancing local capacities and fostering innovation first, we can create a stronger base that enables communities to better withstand climate challenges and pursue sustainable practices simultaneously, ensuring that we address both current needs and future uncertainties without compromising overall progress.",1.3608484367880256e+45,3.0308283181294224,0.3472353326680428,,,4.0,"I appreciate your insights regarding the importance of enhancing local capacities and fostering innovation to empower communities. However, it’s crucial to understand that climate change is not a separate issue but a multifaceted challenge that directly interacts with social and economic development. By integrating climate-specific strategies with immediate social initiatives, we can create synergies that not only address current needs but also equip communities with the tools and knowledge they need to adapt and thrive in a changing environment, ultimately leading to a more resilient and sustainable future for all.",1.8515969390274674,4.999999999982167,4.5918610668434824e-10,,
