ID,TEXT_TYPE,INIT_OP_A,TEXT_A,PPL_A,PROBE_INT_A,H_INT_A,PROBE_EXT_A,H_EXT_A,INIT_OP_B,TEXT_B,PPL_B,PROBE_INT_B,H_INT_B,PROBE_EXT_B,H_EXT_B
21.0,tot,1.0,"I believe that the focus on climate change has been exaggerated and often distracts from more pressing and immediate issues facing humanity, such as poverty, healthcare, and education. Many proposed solutions, like drastic emissions cuts or the shift to renewable energy, can have significant economic ramifications without necessarily solving the problem. It's important to prioritize practical, balanced approaches that consider economic growth and development instead of adhering strictly to climate change agendas. We should also be cautious about the uncertainties in climate models and the potential for overregulation, which can stifle innovation and progress.",2.3497345558408984,1.9999953115999864,8.22656057112231e-05,,,1.0,"I believe that the focus on climate change has been exaggerated and often distracts from more pressing and immediate issues facing society, such as poverty, healthcare, and education. Many climate models and predictions have been inconsistent, and it's crucial to consider the economic impacts of drastic measures proposed to combat climate change. Balancing environmental concerns with job creation and energy needs is essential, and I think we should prioritize innovation and adaptation over alarmism. Let's focus on practical solutions rather than unfounded fear.",3.4499056510977605e+45,1.9999922744717655,0.00010331027260198883,,
21.0,disc,1.0,"While climate change is often presented as the most urgent crisis we face, I believe we need to refocus our attention on pressing issues like poverty, healthcare, and education that directly impact people's lives today. Many proposed solutions, such as radical emissions cuts and rapid renewable energy transitions, can lead to significant economic challenges without guaranteeing they will effectively address the underlying problem. It’s crucial that we adopt a balanced approach that promotes both environmental stewardship and economic growth, ensuring that innovations are not stifled by overregulation.",2.0039699677696494,2.001924194733539,0.014006329488156836,,,1.0,"I completely agree with your perspective on the need to prioritize immediate issues like poverty, healthcare, and education, which have direct and tangible impacts on people's lives. The proposed drastic emissions cuts and rapid transitions to renewable energy could indeed lead to significant economic challenges, potentially exacerbating existing social issues. We should focus on fostering innovation and practical solutions that balance environmental stewardship with economic growth, rather than succumbing to alarmist narratives that may not adequately address the complexities of these intertwined challenges.",1.7347610943010612,2.0000035895219876,0.00024263597341039916,,
21.0,disc,1.0,"I appreciate your agreement and insight on the importance of prioritizing immediate social challenges while considering the economic implications of climate policies. It’s vital that we encourage innovative solutions that not only address environmental concerns but also support economic growth and enhance quality of life for people. By focusing on practical approaches that foster collaboration across sectors, we can work towards sustainable outcomes that truly benefit society as a whole without falling into the trap of alarmist rhetoric.",1.974176594160775,2.003172326856437,0.021436934835859837,,,1.0,"Thank you for your thoughtful response; I wholeheartedly agree that collaboration across various sectors is essential for achieving long-lasting and effective solutions. Prioritizing practical approaches that encourage innovation can lead to sustainable outcomes that genuinely improve quality of life while managing environmental concerns. By maintaining a focus on balanced strategies, we can ensure that the pursuit of sustainability does not sacrifice economic stability or exacerbate existing societal issues.",5.552344224961338e+56,2.000049447579022,0.0005876096603636254,,
21.0,disc,1.0,"Thank you for your thoughtful reply; it’s encouraging to see that we share a commitment to collaboration and balanced strategies. By fostering innovation and practical solutions that address both environmental and economic needs, we can create a framework that promotes sustainability without compromising stability. Ultimately, our focus should be on integrating diverse perspectives to tackle these multifaceted challenges and ensure a brighter future for everyone.",1.9544181624353356,2.029311233584588,0.13235904476215765,,,1.0,"I appreciate your acknowledgment and share your enthusiasm for integrating diverse perspectives in our approach to these complex challenges. Creating a sustainable framework that prioritizes both environmental and economic needs is essential for fostering stability and resilience in society. By working together and valuing innovative ideas from various sectors, we can pave the way for a future that benefits everyone without resorting to divisive or alarmist narratives.",1.7841227103356898,2.0474216610915423,0.19091822263111186,,
21.0,disc,1.0,"I'm glad to hear you share the enthusiasm for integrating diverse perspectives, as it truly is crucial for navigating these complex issues. Collaborating across sectors and valuing innovative ideas will not only lead us to more effective solutions but also help to build a united front that can address both environmental and social challenges. Together, we can create a future that prioritizes practical approaches and avoids divisive narratives, ultimately benefiting all members of society.",2.2283469774347373,2.148049007040817,0.41934696426030416,,,1.0,"I completely agree that fostering collaboration across sectors will strengthen our ability to tackle both environmental and social challenges effectively. Building a united front is essential for developing practical solutions that resonate with diverse communities and address their specific needs. By emphasizing cooperation and innovative thinking, we can work towards a future that truly benefits society as a whole while steering clear of divisive agendas.",1.862103205503347,2.0953380887310233,0.3148691663431043,,
21.0,disc,1.0,"I appreciate your agreement on the importance of collaboration, and it's heartening to see a shared commitment to engaging with diverse communities to address their unique challenges. Emphasizing cooperation and innovative thinking not only enhances our problem-solving capabilities but also ensures that the solutions we create are relevant and impactful. By remaining focused on practical outcomes and avoiding divisive agendas, we can pave the way for sustainable progress that uplifts society as a whole.",1.8563833377633654,2.0040654176855943,0.02652782972800172,,,1.0,"Thank you for articulating the value of engaging with diverse communities; it is indeed crucial for crafting solutions that resonate and are meaningful. By prioritizing practical outcomes grounded in cooperation and innovation, we can achieve sustainable progress that truly addresses the realities people face. Ultimately, our shared commitment to avoiding divisive agendas will strengthen our efforts and enhance our ability to uplift society collectively.",2.615761186307073,2.0758520819063246,0.2686080443118436,,
