ID,TEXT_TYPE,INIT_OP_A,TEXT_A,PPL_A,PROBE_INT_A,H_INT_A,PROBE_EXT_A,H_EXT_A,INIT_OP_B,TEXT_B,PPL_B,PROBE_INT_B,H_INT_B,PROBE_EXT_B,H_EXT_B
221.0,tot,2.0,"I believe that while environmental issues are important, the emphasis on climate change often overshadows other pressing concerns that deserve equal attention. There are natural climate fluctuations that have occurred throughout Earth's history, and many argue that humanity's ability to adapt is significant. Rather than focusing solely on climate change, we should prioritize economic development, technological innovation, and improving living standards globally, which can also contribute to better environmental stewardship. Addressing immediate human needs can lead to more sustainable long-term solutions without the alarmism often associated with climate change discussions.",2.0209890295696704,2.000552220184059,0.004707679789483576,,,4.0,"Climate change is one of the most pressing issues of our time, posing serious threats to ecosystems, economies, and human health. The scientific consensus is clear: human activities, particularly the burning of fossil fuels, are driving unprecedented changes in our climate. These changes result in extreme weather events, rising sea levels, and altered agricultural patterns, impacting food security and biodiversity. 

Addressing climate change requires urgent collective action, including reducing greenhouse gas emissions, transitioning to renewable energy, and promoting sustainable practices. Furthermore, it necessitates global cooperation and equitable solutions to support vulnerable communities most affected by climate impacts. The longer we delay, the more severe the consequences will be, making it imperative for individuals, governments, and organizations to work together towards a sustainable future.",1.5985421325858582,4.999999999996488,9.612517162191636e-11,,
221.0,disc,2.0,"While climate change is certainly an important issue, we must also recognize that there are numerous pressing concerns that deserve our attention, such as poverty alleviation and economic development. Natural climate fluctuations have always been part of Earth's history, and humanity's resilience and adaptability should not be overlooked. By prioritizing technological innovation and improving living standards globally, we can foster a more sustainable future without falling into the alarmism that often accompanies climate change debates.",1.6420466965095064,2.0015006029040134,0.011272411965595806,,,4.0,"While I certainly acknowledge the importance of poverty alleviation and economic development, it is crucial to understand that climate change is intricately linked to these challenges. Addressing climate change is not about alarmism; it is about recognizing the interconnectedness of our ecosystem, human health, and economic stability, as climate impacts disproportionately affect the poorest and most vulnerable communities. By prioritizing urgent climate action alongside technological innovation, we can create sustainable solutions that enhance resilience and improve living standards for all.",1.9292380956521842,4.99999999999344,1.7548535115693275e-10,,
221.0,disc,2.0,"I appreciate your perspective on the interconnectedness of climate change and socioeconomic issues, and I agree that these challenges are complex. However, I contend that many of the solutions we seek, such as economic development and technological advancement, can be pursued independently of the climate change narrative without the urgency that creates alarmism. By focusing on immediate human needs and leveraging innovation, we can create a more stable foundation that will ultimately facilitate better environmental stewardship in a more balanced manner.",2.26121097029341,2.562570199233173,0.6877383131762108,,,4.0,"I appreciate your thoughtful response, but I must emphasize that addressing climate change is not just a narrative; it is a pressing reality that demands immediate attention alongside socioeconomic development. Delaying action on climate change in favor of focusing solely on immediate human needs can exacerbate existing vulnerabilities and lead to more severe impacts down the line, ultimately undermining the very stability we seek to achieve. Instead, integrating climate action with economic and technological advancement can create synergistic solutions that benefit both people and the planet in the long term.",1.8053924198522795,4.999999999987744,3.201896685359724e-10,,
221.0,disc,2.0,"I understand your urgency regarding climate action, but I believe it’s crucial to evaluate the potential trade-offs of prioritizing a climate-focused agenda over immediate human needs. Focusing solely on climate initiatives can sometimes divert attention and resources away from pressing issues like poverty and access to basic services, which also require urgent action. By fostering economic development and technological innovation first, we can create a stronger foundation to address environmental challenges more effectively in the long run without compromising immediate human welfare.",2.1831893249876644,2.851990974049615,0.4196859339765454,,,4.0,"I appreciate your concern about potential trade-offs, but it's essential to recognize that climate change exacerbates poverty and threatens access to basic services, making it a fundamental issue that cannot be sidelined. Prioritizing climate action does not mean neglecting immediate human needs; rather, it involves creating solutions that address both environmental and social challenges simultaneously. By integrating a climate-focused agenda with efforts to improve living standards and foster innovation, we can establish a more resilient and equitable framework that secures both our present and future well-being.",1.6531064047434256,4.999999999974054,6.583821993093482e-10,,
221.0,disc,2.0,"I see the merit in your argument about the interconnectedness of climate change and social issues, but I remain concerned that an overemphasis on climate action can sometimes overshadow urgent human needs that are equally critical to address. It’s important to remember that economic stability and technological innovation can simultaneously yield environmental benefits without framing them solely within a climate context. By championing solutions that prioritize immediate human welfare first, we can lay the groundwork for a more sustainable future while fostering resilience without the looming urgency that often accompanies climate discussions.",8.805402685114973e+42,2.970866795825792,0.1340057357873684,,,4.0,"I understand your perspective on prioritizing immediate human needs, and I agree that economic stability and technological innovation are vital for a sustainable future. However, it’s crucial to recognize that climate change is already impacting human welfare through extreme weather events, food insecurity, and health crises, and thus must be part of the conversation rather than a separate issue. By framing climate action as integral to our efforts to eliminate poverty and enhance well-being, we can promote solutions that are both humane and environmentally responsible, ensuring that we build a resilient future for all without delaying necessary action.",2.5852120064256568e+39,4.9999999999915765,2.2322180986438917e-10,,
221.0,disc,2.0,"I appreciate your acknowledgment of the importance of economic stability and technology; however, I still believe that addressing immediate human needs must take precedence to ensure we have a strong foundation for tackling climate-related issues down the line. While it's undeniable that climate change has real impacts, the solutions must not neglect the pressing realities of poverty and basic service accessibility that many communities face today. By focusing on immediate improvements in living standards and fostering innovation, we can create a framework that ultimately allows for more effective, targeted climate action in the future without sidestepping other critical challenges.",7.573394828492142e+39,2.9538956299685846,0.20031635799709488,,,4.0,"I completely agree that addressing immediate human needs is essential for building a strong foundation, yet we must also recognize that those very needs can be compromised by the escalating impacts of climate change. Climate change is not a distant issue—it is already affecting food security, health, and access to clean water, particularly for the most vulnerable populations. By adopting an integrated approach that addresses both urgent human welfare and climate action, we can create a sustainable framework that uplifts communities while also safeguarding the planet for future generations.",2.068842745172532,4.999999999977103,5.838822768246156e-10,,
