ID,TEXT_TYPE,INIT_OP_A,TEXT_A,PPL_A,PROBE_INT_A,H_INT_A,PROBE_EXT_A,H_EXT_A,INIT_OP_B,TEXT_B,PPL_B,PROBE_INT_B,H_INT_B,PROBE_EXT_B,H_EXT_B
222.0,tot,2.0,"I believe that while environmental issues are important, the emphasis on climate change often overshadows other pressing concerns that deserve equal attention. The notion that climate change is the most urgent problem can lead to ineffective policies that prioritize emissions reduction over economic development and social needs. Many regions still face poverty, health crises, and infrastructure challenges that are immediate and require resources. Additionally, the Earth's climate has always been subject to natural changes, and history shows that societies have adapted to these changes over time. Instead of focusing exclusively on climate change, we should adopt a more balanced approach that addresses a range of environmental and societal issues simultaneously.",4.3492589687619636e+35,2.029398168836509,0.1328371851234137,,,4.0,"Climate change is one of the most pressing issues of our time, posing serious threats to ecosystems, economies, and human health. The scientific consensus is clear: human activities, particularly the burning of fossil fuels, are driving unprecedented changes in our climate. These changes result in extreme weather events, rising sea levels, and altered agricultural patterns, impacting food security and biodiversity. 

Addressing climate change requires urgent collective action, including reducing greenhouse gas emissions, transitioning to renewable energy, and promoting sustainable practices. Furthermore, it necessitates global cooperation and equitable solutions to support vulnerable communities most affected by climate impacts. The longer we delay, the more severe the consequences will be, making it imperative for individuals, governments, and organizations to work together towards a sustainable future.",1.6033236229582297,4.99999999999787,5.936771729732116e-11,,
222.0,disc,2.0,"While climate change is a significant issue, it's crucial to recognize that there are numerous pressing concerns that demand our attention as well. We must consider the broader context of poverty, health crises, and infrastructure challenges that many communities face today. By adopting a more balanced approach to environmental policy, we can address both climate change and these immediate societal needs effectively.",1.6617735235509288,2.014116815026786,0.07425539468858454,,,4.0,"I agree that issues like poverty, health crises, and infrastructure challenges are undeniably important and interconnected with climate change. However, we cannot overlook that climate change exacerbates many of these challenges, creating a vicious cycle that threatens the most vulnerable communities. Therefore, an integrated approach that addresses both climate action and immediate societal needs is essential to ensure a sustainable and equitable future for all.",1.6964108180499384,4.999999999996901,8.521756168199635e-11,,
222.0,disc,2.0,"I appreciate your perspective on the interconnectedness of climate change and other societal issues, as they certainly reinforce each other in many ways. However, my concern is that prioritizing climate action above all else can sometimes divert needed resources from addressing urgent problems facing vulnerable communities right now. An integrated approach is indeed important, but it should not come at the expense of immediate economic development and health initiatives that are crucial for stability and resilience.",2.083096988288158,2.683319721560631,0.6467278005427244,,,4.0,"I completely understand your concern about resource allocation and the need for immediate economic development and health initiatives. However, it’s important to recognize that addressing climate change can also bring about economic opportunities through the transition to renewable energy and sustainable practices, ultimately benefiting vulnerable communities. Finding synergies between climate action and urgent needs will enable us to foster resilience while ensuring that we do not compromise the future of these communities in our quest for short-term stability.",2.1046194298013905,4.999999999977103,5.838822768233317e-10,,
222.0,disc,2.0,"You're right that transitioning to renewable energy and sustainable practices can create economic opportunities, and these potential benefits should not be overlooked. However, it's crucial to ensure that the focus on these opportunities does not overshadow the urgent needs and immediate challenges that many communities face today, such as access to health care and economic stability. Striking the right balance is essential, and while we pursue synergies, we must remain mindful of the immediate realities that require our attention and resources now.",2.123310557210068,3.111335413736994,0.5474505515918995,,,4.0,"Absolutely, and I appreciate your emphasis on the importance of addressing immediate community needs alongside long-term sustainability efforts. Balancing these priorities is indeed crucial; therefore, we must approach climate action in a way that supports immediate health and economic stability. By integrating climate solutions with urgent community needs, we can create a comprehensive framework that not only addresses pressing issues today but also lays the groundwork for a healthier and more resilient future.",2.1443391949656414,4.999999999951527,1.1997237371794386e-09,,
222.0,disc,2.0,"I'm glad we agree on the importance of addressing immediate community needs alongside long-term climate solutions. Creating a comprehensive framework that intertwines these priorities is a valuable approach, as it allows us to tackle urgent challenges while also considering future sustainability. However, we must remain vigilant to ensure that the proposed climate solutions are not so costly or complex that they inadvertently undermine the economic stability and health initiatives that communities desperately need right now.",2.232751287184585,3.081394834771876,0.3789796336601946,,,4.0,"You raise an important point about the potential cost and complexity of climate solutions, and it is vital that we approach these initiatives with the communities' economic realities in mind. To be effective, climate policies should be designed to be inclusive and accessible, ensuring they can be implemented without jeopardizing ongoing health and economic programs. By focusing on solutions that are both innovative and practical, we can support immediate community needs while fostering a sustainable future that enhances, rather than undermines, overall well-being.",2.2212707649173695,4.999999999883718,2.7762406224621298e-09,,
222.0,disc,2.0,"I completely agree that inclusivity and accessibility in climate policies are essential for ensuring they are beneficial rather than detrimental to ongoing community programs. It's important that any proposed solutions not only consider environmental benefits but also the economic realities of the communities they aim to serve, allowing for a smoother transition. By prioritizing practical and innovative approaches, we can work toward a future that genuinely supports both immediate needs and long-term sustainability, fostering an environment where all citizens can thrive.",2.136463381385706,3.8165196902042253,0.4796842775773228,,,4.0,"I’m encouraged to hear our shared commitment to prioritizing the economic realities of communities in climate policy development. By fostering collaboration between stakeholders, we can co-create solutions that effectively address both immediate needs and long-term sustainability goals. This holistic approach not only empowers communities to thrive now but also ensures we leave a healthier planet for future generations, making it a win-win situation for both people and the environment.",2.1761043017385884,4.999999999997265,7.554604336751391e-11,,
