ID,TEXT_TYPE,INIT_OP_A,TEXT_A,PPL_A,PROBE_INT_A,H_INT_A,PROBE_EXT_A,H_EXT_A,INIT_OP_B,TEXT_B,PPL_B,PROBE_INT_B,H_INT_B,PROBE_EXT_B,H_EXT_B
230.0,tot,2.0,"I believe that while environmental issues are important, the emphasis on climate change often overshadows other pressing concerns that deserve equal attention. There are natural climate fluctuations that have occurred throughout Earth's history, and many argue that humanity's ability to adapt is significant. Rather than focusing solely on climate change, we should prioritize economic development, technological innovation, and improving living standards globally, which can also contribute to better environmental stewardship. Addressing immediate human needs can lead to more sustainable long-term solutions without the alarmism often tied to climate narratives.",2.168177172885748,2.0024720408508796,0.017321859752465103,,,5.0,"Climate change is one of the most pressing issues of our time, affecting not only the environment but also public health, economies, and social equity. The evidence is undeniable—rising temperatures, extreme weather events, and melting ice caps are all consequences of human activity. Urgent action is needed, not just from governments but also from individuals and businesses to reduce carbon emissions, invest in renewable energy, and promote sustainable practices. Addressing climate change is crucial for ensuring a habitable planet for future generations. We must act decisively and collaboratively to mitigate its impacts and foster a resilient, sustainable future.",1.6772567553718234,4.999999999979793,5.178002487826524e-10,,
230.0,disc,2.0,"While climate change is an important topic, I believe we must also consider a broader range of pressing global issues that deserve our attention. Historical climate fluctuations demonstrate that humanity has a remarkable ability to adapt, and we should focus on economic development and technological innovation to address immediate human needs. By prioritizing these areas, we can foster sustainable solutions that improve living standards and enhance environmental stewardship without falling into alarmist narratives.",1.5852215571901005,2.005221293195375,0.03268137083314824,,,5.0,"While it's true that economic development and technological innovation are vital, we cannot overlook the urgent reality of climate change and its far-reaching impacts. Historical climate fluctuations differ significantly from the rapid changes we are witnessing today, which are driven by human activity and threaten livelihoods, ecosystems, and public health. By addressing climate change head-on, we can indeed foster sustainable solutions that enhance living standards while ensuring a habitable planet for future generations.",1.6251663095620896,4.999999999992566,1.9792167650593472e-10,,
230.0,disc,2.0,"I appreciate your points, and I understand the urgency surrounding climate change; however, I believe that the focus should not solely rest on climate change, as other critical issues also demand our attention. Historical context shows us that adaptation has been humanity's strength, and we have the potential to develop innovative solutions that tackle multiple challenges simultaneously. By emphasizing economic growth and technological advancements alongside environmental initiatives, we can create sustainable pathways that enhance living standards while also addressing climate concerns without fear-based rhetoric.",2.4524653197172546,2.9929992731367436,0.14873080377294295,,,5.0,"I appreciate your perspective on the need for a multifaceted approach to global challenges. However, the scale and speed of current climate change demand urgent action and should not be overshadowed by other important issues, as they are interconnected and deeply intertwined. Emphasizing economic growth and technological advancements is crucial, but the solutions we pursue must actively mitigate climate risks to ensure that both environmental and human well-being are safeguarded for the future.",2.827929488929937e+51,4.999999999957222,1.0640996349676856e-09,,
230.0,disc,2.0,"I agree that the interconnectedness of these issues is vital to understand; however, I believe that focusing on immediate human needs can often lead to innovative solutions that inadvertently address climate risks as well. By prioritizing economic growth and technological advancements, we can create a foundation that enables us to invest in sustainable practices without stifling progress or creating alarm. It's essential to strike a balance, ensuring that our approaches to environmental stewardship are grounded in practical, effective solutions that enhance both human and planetary well-being.",2.178326935830833,2.9900054625292465,0.09979209390987688,,,5.0,"I completely agree that addressing immediate human needs can lead to innovative solutions; however, it is crucial that these solutions explicitly incorporate climate considerations to avoid exacerbating existing issues. Prioritizing economic growth without a deliberate focus on sustainability can sometimes lead to short-sighted decisions that worsen climate impacts in the long run. Striking a balance is essential, but it should not come at the expense of addressing the urgent climate crisis we face—integrating sustainable practices from the outset can create a more resilient future for both people and the planet.",1.81813312345747,4.999999999979793,5.178002487794637e-10,,
230.0,disc,2.0,"I understand your concern about ensuring that economic growth incorporates sustainability from the outset, and I agree that foresight is essential in our decisions. However, I still believe that an overly narrow focus on climate can overshadow the opportunity for broader advancements that also lead to environmental benefits. By fostering an environment where innovation and economic development thrive, we can discover organic, resilient solutions that inherently address climate challenges without the need for alarmist narratives that can sometimes hinder progress.",1.5508933803173281e+49,3.08871317446503,0.3498132666437699,,,5.0,"I appreciate your recognition of the importance of fostering innovation and economic development alongside sustainability. However, it is crucial to acknowledge that the impacts of climate change are not just potential threats but real challenges that require immediate and targeted responses to prevent further harm. While I agree that we can discover resilient solutions organically, we must actively engage in proactive measures to ensure that climate considerations are at the forefront of our strategies, rather than relying solely on the hope that innovation will sufficiently address these pressing challenges on its own.",2.2763694633824136,4.9999999999705995,7.423695558353376e-10,,
230.0,disc,2.0,"I appreciate your emphasis on the need for proactive measures, and I fully acknowledge that climate change presents real challenges we must consider. My perspective, however, is that by prioritizing economic development and innovation, we can create a more robust framework that will naturally lead to effective climate solutions without sacrificing urgency. I believe that integrating climate considerations into our strategies is vital, but it should be part of a holistic approach that embraces the strengths of human ingenuity to tackle multiple challenges simultaneously.",1.1047137368108281e+47,3.3756673131184525,0.6722819350986723,,,5.0,"I appreciate your perspective on leveraging economic development and innovation as a framework for addressing climate issues; however, it's vital that we see climate change as an immediate crisis requiring specific, targeted actions. While human ingenuity is indeed remarkable, relying solely on it to yield organic solutions could lead to missed opportunities for decisive action that could mitigate climate risks now. A holistic approach must include urgent climate initiatives to ensure we not only support economic growth but also actively protect the environment, fostering a sustainable future for all.",1.4203888690034671e+45,4.999999999962249,9.437836481614889e-10,,
