ID,TEXT_TYPE,INIT_OP_A,TEXT_A,PPL_A,PROBE_INT_A,H_INT_A,PROBE_EXT_A,H_EXT_A,INIT_OP_B,TEXT_B,PPL_B,PROBE_INT_B,H_INT_B,PROBE_EXT_B,H_EXT_B
252.0,tot,3.0,"Climate change is a complex issue that elicits a wide range of opinions and perspectives. On one hand, there is significant scientific evidence suggesting changes in climate patterns and potential impacts on ecosystems, weather events, and human health. On the other hand, the approaches to address these changes, the economic implications, and the effectiveness of various solutions are subjects of ongoing debate. The discussion around climate change involves not just environmental aspects, but also social, political, and economic dimensions that make it a multifaceted topic. It's essential to consider all viewpoints and data when exploring this issue.",1.7147473765932235,4.880797075764035,0.3653338649874392,,,1.0,"I believe that the focus on climate change has been exaggerated and often distracts from more immediate and pressing issues facing humanity, such as poverty, healthcare, and education. Many climate models are speculative, and the economic impact of drastic measures to combat climate change can be detrimental. We should prioritize innovation and adaptation rather than imposing regulations that might hinder growth and development. Ultimately, it's crucial to maintain a balanced perspective on environmental issues without sacrificing progress in other vital areas.",1.7591840095397082,1.9999949235701209,9.562322384391862e-05,,
252.0,disc,3.0,"Climate change is undeniably one of the most pressing challenges we face today, with scientific evidence increasingly pointing to the significant impact human activities have on our planet's climate systems. However, the conversation about how to effectively address these changes can be quite complex, as it intertwines social, political, and economic factors that vary widely across different regions and communities. As we engage in this discussion, it’s vital to consider diverse perspectives and data to develop comprehensive strategies that are both effective and equitable.",1.9216677333607124,4.119202923302623,0.365333862846475,,,1.0,"While I acknowledge that climate change is a topic of concern, it's essential not to lose sight of other urgent issues, such as poverty and healthcare, which affect millions daily. The complexities of addressing climate change should not overshadow the immediate needs many communities face, as sometimes drastic climate measures can lead to negative economic consequences. We should focus on innovation and adaptation rather than rigid regulations so that we can find balanced solutions that promote progress across all vital areas.",2.4308702896483094,2.000000882179017,1.8810212613033364e-05,,
252.0,disc,3.0,"You raise an important point about the need to prioritize immediate issues like poverty and healthcare, as these also significantly affect people's quality of life. Striking a balance between addressing climate change and meeting urgent societal needs is indeed essential, and innovation and adaptation can play critical roles in that process. It’s crucial, however, to ensure that solutions for climate action are integrated with efforts to alleviate economic hardship, so that progress in one area does not come at the expense of another.",1.814133694825795,4.999964643742472,0.00039775851544852946,,,1.0,"I completely agree that it's vital to integrate solutions for climate action with efforts to alleviate economic hardship. However, we must remain cautious about the potential long-term economic impacts of stringent climate regulations that could unintentionally exacerbate poverty and hinder growth. To genuinely improve quality of life, we should prioritize policies that foster innovation and practical adaptations, allowing us to address both environmental and social challenges without compromising development.",4.213910853514452e+111,2.0000087542213496,0.00011592586109746086,,
252.0,disc,3.0,"Your concerns about the potential long-term economic impacts of stringent climate regulations are valid and highlight the need for thoughtful policy design. Prioritizing innovation and practical adaptations can indeed create a pathway that honors both environmental sustainability and economic growth, ensuring that we do not inadvertently deepen social inequalities. By fostering collaborative approaches that engage various stakeholders and promote green technologies, we can work towards solutions that effectively address both climate change and socio-economic challenges.",8.834782533432216e+51,4.999996273360884,5.030963518507406e-05,,,1.0,"I appreciate your recognition of the need for thoughtful policy design, as it is crucial that we approach climate action in a way that does not harm economic stability. While fostering green technologies can be beneficial, we must ensure that these initiatives are truly viable and accessible, otherwise they may only serve to benefit a select few rather than the broader population. Ultimately, our focus should remain on promoting growth and development, as sustainable solutions that acknowledge economic realities will yield the most impactful results for society as a whole.",4.5768857789845535e+44,2.000004037304777,5.9541918773533434e-05,,
252.0,disc,3.0,"You bring up a key point about the importance of ensuring that green technologies are not only viable but also accessible to all sectors of society, rather than benefiting a limited elite. It’s essential that our climate initiatives are designed with inclusivity in mind, allowing for equitable participation and support for communities disadvantaged by current economic structures. By emphasizing sustainable solutions that align with economic realities, we can create a more comprehensive approach that fosters both environmental resilience and widespread social progress.",3.4574537730071245e+48,4.9999970976878,3.9906796756741286e-05,,,1.0,"I completely agree that inclusivity should be a cornerstone of any climate initiative, as ensuring that disadvantaged communities have access to sustainable solutions is crucial for genuine progress. However, we should also be wary of imposing mandates that can inadvertently create barriers to participation or stifle economic opportunities for those very communities. Our approach must balance the goal of environmental resilience with the need for fostering an environment where innovation and economic growth can flourish, ultimately benefiting everyone without compromising their livelihoods.",2.420851078719428,2.00521929457879,0.03265185138885258,,
252.0,disc,3.0,"You make a valid point about the importance of avoiding mandates that might unintentionally hinder economic opportunities for disadvantaged communities. Striking the right balance between environmental resilience and economic growth is essential, as we want initiatives to empower rather than constrain. By engaging stakeholders from all backgrounds in the development of these initiatives, we can foster an environment where innovation thrives while ensuring that those most affected by climate change are actively included in both the decision-making process and the benefits of sustainable solutions.",2.9877492911092935e+47,4.999999997664407,4.8755504592603597e-08,,,1.0,"Engaging a diverse range of stakeholders in the development of climate initiatives is indeed a critical step towards empowerment and inclusivity. Yet, we must always be cautious to ensure that the driving principles don’t lead to overly burdensome regulations that could hinder growth and access to resources for those communities. Ultimately, fostering innovation while keeping economic opportunities open will be key in crafting solutions that truly benefit everyone, allowing us to tackle both climate and socio-economic challenges effectively.",1.7759443973125528e+49,2.07585642627854,0.2685580680620803,,
