ID,TEXT_TYPE,INIT_OP_A,TEXT_A,PPL_A,PROBE_INT_A,H_INT_A,PROBE_EXT_A,H_EXT_A,INIT_OP_B,TEXT_B,PPL_B,PROBE_INT_B,H_INT_B,PROBE_EXT_B,H_EXT_B
253.0,tot,3.0,"Climate change is a complex issue that elicits a range of opinions and perspectives. On one hand, there are compelling arguments about the environmental impacts and potential risks to ecosystems and human health. On the other hand, some people raise concerns about economic implications, energy policies, and technological feasibility. It's important to consider multiple viewpoints and the interplay of scientific data, societal values, and policy decisions in addressing this multifaceted topic. Ultimately, further dialogue and research are crucial for informed decision-making.",1.9523947339723422,4.622459323804924,0.6628473273606619,,,1.0,"I believe that the focus on climate change has been exaggerated and often distracts from more pressing and immediate issues facing humanity, such as poverty, healthcare, and education. Many proposed solutions, like drastic policy changes and economic upheaval, could harm economies and livelihoods without guaranteeing significant impact on climate. Instead of prioritizing climate alarmism, we should invest in innovation and technology that can address environmental issues without sacrificing progress and development. It's important to critically assess the data and consider the broader picture of human welfare.",5.975082180832374e+43,1.9999786826183452,0.00025413047717077,,
253.0,disc,3.0,"Climate change is a pressing global issue that brings together a myriad of perspectives, from environmental sustainability to economic growth. It's essential to engage in an open dialogue that considers the scientific evidence while also addressing the societal values and trade-offs involved in potential solutions. By fostering a collaborative environment for discussion, we can better navigate the complexities surrounding climate change and work towards informed and effective policy decisions.",1.984785927685972,4.000335349999251,0.0030182081583222968,,,1.0,"While I agree that engaging in open dialogue is important, I think the urgency attributed to climate change can sometimes overshadow more immediate issues like poverty and healthcare that directly affect people's lives today. Moreover, some proposed solutions may not yield the intended results and could disrupt economies, ultimately harming those we are trying to support. It's crucial that our conversations prioritize innovation and technology that can offer practical, sustainable alternatives without compromising economic development and human welfare.",2.9054736248609423,2.0000002084235793,2.5114907479676772e-05,,
253.0,disc,3.0,"You raise an important point about the need to balance the urgency of climate change with immediate societal challenges like poverty and healthcare. It’s vital that our discussions include innovative solutions that can simultaneously address environmental goals and enhance economic development, ensuring that no one is left behind in the transition. By fostering collaboration between environmentalists, economists, and community leaders, we can explore practical approaches that harmonize sustainability with human welfare, creating a more equitable future for all.",1.841410023256604,4.014063627089486,0.07393387622994757,,,1.0,"I appreciate your acknowledgment of the need for balance, but I still believe that the prevailing narrative surrounding climate change often drowns out critical discussions about urgent social issues. While collaboration is important, we must be cautious about implementing policies that could negatively impact livelihoods, especially in vulnerable communities. Instead, our focus should be on leveraging technology and innovation that promote both economic growth and environmental responsibility without imposing drastic changes that could jeopardize well-being.",6.429006241724995e+50,2.0000299920647424,0.0003726158195053142,,
253.0,disc,3.0,"You make a valid point about the potential risks of overshadowing urgent social issues in discussions about climate change. Prioritizing the well-being of vulnerable communities is crucial, and any policies we consider must be carefully evaluated for their socio-economic impacts. By actively involving affected stakeholders in the conversation and emphasizing technology and innovation that provide dual benefits, we can work towards solutions that promote both environmental sustainability and economic resilience.",1.943947684305074,4.995929862219151,0.026464201130706605,,,1.0,"I agree that involving affected stakeholders is vital, and their perspectives should guide our approach to any proposed solutions. However, it's essential that we critically assess whether the technologies and innovations touted as solutions truly deliver tangible benefits without imposing undue burdens on economies and livelihoods. Rather than focusing solely on environmental policies, we should ensure our primary goal is to uplift human welfare across the board, addressing poverty and access to healthcare while exploring environmentally friendly options.",2.6562900877438094,2.000004479215834,6.829721903925887e-05,,
253.0,disc,3.0,"I completely agree that the critical assessment of technologies and innovations is essential to ensure they genuinely contribute to human welfare without adverse economic effects. By prioritizing a holistic approach that integrates environmental objectives with social equity, we can effectively address both poverty and healthcare alongside environmental challenges. This comprehensive framework will allow us to explore and implement solutions that not only protect the planet but also uplift communities, fostering a sustainable future for all.",2.1315727813721614,4.880797076309049,0.3653338594901834,,,1.0,"While I appreciate the emphasis on a holistic approach, I remain concerned that intertwining environmental objectives with social equity can lead to policies that may inadvertently exacerbate economic challenges. Ensuring that solutions protect vulnerable communities should be our priority, and we must be vigilant about adopting strategies that do not impose drastic changes without clear, proven benefits. Ultimately, we should champion innovations that enhance human welfare directly, focusing on practical applications that drive economic stability alongside environmental care.",2.999238195043157,2.000909841460823,0.007306496920350583,,
253.0,disc,3.0,"You raise an important caution about the potential for well-intentioned policies to inadvertently exacerbate economic challenges for vulnerable communities. It’s crucial that we adopt a strategic approach that evaluates the real-world impacts of innovations and solutions before widespread implementation, ensuring that they provide clear benefits for both human welfare and the environment. By prioritizing practical applications that promote economic stability while caring for the planet, we can forge a path that supports both people and the ecosystems on which we all depend.",1.9616313776001424,4.9626731161202695,0.15935374443073475,,,1.0,"I appreciate your recognition of the importance of a strategic approach and the need for thorough evaluation before implementing any policies. However, we must remain skeptical of initiatives that promise environmental benefits at the expense of economic stability, as the interconnectedness of these areas can often be complex. Our focus should remain on fostering innovations that directly improve the quality of life for individuals and communities, ensuring that any environmental goals pursued do not hinder progress in addressing pressing societal needs.",4.451267785045741e+49,2.000044455633053,0.0005133925615895781,,
