ID,TEXT_TYPE,INIT_OP_A,TEXT_A,PPL_A,PROBE_INT_A,H_INT_A,PROBE_EXT_A,H_EXT_A,INIT_OP_B,TEXT_B,PPL_B,PROBE_INT_B,H_INT_B,PROBE_EXT_B,H_EXT_B
255.0,tot,3.0,"Climate change is a complex issue that elicits a wide range of opinions and perspectives. On one hand, there is significant scientific evidence suggesting changes in climate patterns and potential impacts on ecosystems, weather events, and human health. On the other hand, the approaches to address these changes, the economic implications, and the effectiveness of various solutions are subjects of ongoing debate. The discussion around climate change involves not just environmental aspects, but also social, political, and economic dimensions that make it a multifaceted topic. It's essential to consider all viewpoints and data when exploring this issue.",1.7180175639599964,4.880797075764035,0.3653338649874392,,,1.0,"I believe that the focus on climate change has been exaggerated and often distracts from more immediate and pressing issues facing humanity, such as poverty, healthcare, and education. Many climate models are speculative, and the economic impact of drastic measures to combat climate change can be detrimental. We should prioritize innovation and adaptation rather than imposing regulations that might hinder growth and development. Ultimately, it's crucial to maintain a balanced perspective on environmental issues without sacrificing progress in other vital areas.",1.7596296857790277,1.9999889876697,0.00018751311785328322,,
255.0,disc,3.0,"Climate change is undeniably one of the most pressing challenges we face today, with scientific evidence increasingly pointing to the significant impact human activities have on our planet's climate systems. However, the conversation about how to effectively address these changes can be quite complex, as it intertwines social, political, and economic factors that vary widely across different regions and communities. As we engage in this discussion, it’s vital to consider diverse perspectives and data, balancing the urgency of action with the realities of implementation and potential consequences.",2.0397072681670685,4.982013788447639,0.0900947742345592,,,1.0,"I appreciate the acknowledgment of the complexities surrounding climate change discussions, but I would argue that the urgency often overshadows more immediate issues like poverty and healthcare that require our attention. While acknowledging human impact on the planet, I believe that many climate models remain speculative and can lead to misguided policy decisions that may hinder economic growth. Instead of rushing to implement drastic measures, we should emphasize innovation and adaptive strategies that can address both environmental concerns and critical human needs simultaneously.",1.9746551844598776,2.0000018502491432,3.0596124387663686e-05,,
255.0,disc,3.0,"You raise a valid point about the need to balance urgent climate action with pressing social issues like poverty and healthcare, as both require immediate and thoughtful responses. It's true that some climate models can be uncertain, and this underlines the importance of using a variety of data sources and approaches when looking to formulate effective policies. Prioritizing innovation and adaptive strategies can certainly help us find pathways that address environmental concerns while also supporting economic growth and addressing human needs, creating a more holistic approach to tackling both climate change and social challenges.",2.957723273439818e+42,4.999999900688048,1.7007171719880726e-06,,,1.0,"I agree that a holistic approach is essential, and it's important to explore innovative solutions that benefit both the environment and society. However, I remain concerned that the urgency around climate action can lead to policies that prioritize environmental regulations at the expense of sound economic development, which could exacerbate social issues. By focusing on innovation and adaptation without imposing burdensome regulations, we can foster growth that enables us to tackle both climate challenges and pressing human needs more effectively.",1.1610689274975814e+49,2.0000213174691117,0.0002541306999644892,,
255.0,disc,3.0,"I appreciate your emphasis on the importance of maintaining a balance between environmental regulations and economic development, as both are crucial for sustainable progress. It’s essential to engage in ongoing dialogue about how to craft policies that incentivize innovation while also protecting our environment, ensuring that they do not disproportionately impact vulnerable communities. By prioritizing solutions that stimulate economic growth and adapt to climate challenges, we can work towards an integrated approach that uplifts society while addressing the urgent need for climate action.",9.775261519411651e+46,4.999998932296923,1.5748620744847968e-05,,,1.0,"I value the recognition of the need for dialogue and the careful crafting of policies that genuinely consider the implications for various communities. However, I would caution against assuming that all environmental regulations automatically lead to positive outcomes; sometimes they can unintentionally burden the very vulnerable populations we seek to protect. Ultimately, our focus should be on fostering a robust economy through innovation and practical adaptation strategies that empower communities while addressing environmental concerns without sacrificing progress in other crucial areas.",2.338445959893914,2.0003351400947045,0.0030216509141397147,,
255.0,disc,3.0,"You make an important observation about the potential unintended consequences of environmental regulations, especially regarding their impact on vulnerable populations. It highlights the necessity of adopting a more nuanced approach that evaluates not just the intent of regulations, but also their real-world effects on communities and economies. By prioritizing practical adaptation strategies and fostering innovation, we can create an environment where both community empowerment and environmental sustainability can coexist and thrive, ultimately benefiting all aspects of society.",5.889133283724395e+50,4.999999931743958,1.1944807296472865e-06,,,1.0,"I completely agree that a nuanced approach is vital, as it allows us to critically examine the actual outcomes of any regulations we implement. It's crucial that we carefully assess whether our efforts to combat climate change are genuinely beneficial or if they inadvertently harm the very communities we aim to support. By prioritizing practical solutions that encourage innovation, we can strike a balance that not only promotes environmental sustainability but also fosters economic empowerment and addresses immediate social needs effectively.",1.7242921953778617e+50,2.0052192943501312,0.03265184892757852,,
255.0,disc,3.0,"I wholeheartedly concur that a careful assessment of the outcomes of climate policies is essential to ensure they align with our goals of supporting vulnerable communities while promoting sustainability. This critical examination can guide us in identifying practical solutions that genuinely empower people and foster economic development, rather than inflicting unintended hardships. By leveraging innovation within a framework that emphasizes both environmental and social equity, we can create a more inclusive approach to tackling climate change that benefits everyone involved.",1.929650802179069e+101,4.999999977840511,4.12720488088727e-07,,,1.0,"I appreciate your agreement on the need for careful assessments of climate policies and their real-world impacts. It's essential that we don’t lose sight of the broader context, ensuring that our commitment to environmental goals doesn't inadvertently hinder economic opportunities for vulnerable groups. By focusing on inclusive, innovative approaches that prioritize both social and economic growth, we can work towards solutions that truly serve everyone’s interests without sacrificing progress in other critical areas.",2.0121307398579385e+53,2.377538503210939,0.6628694065766089,,
