ID,TEXT_TYPE,INIT_OP_A,TEXT_A,PPL_A,PROBE_INT_A,H_INT_A,PROBE_EXT_A,H_EXT_A,INIT_OP_B,TEXT_B,PPL_B,PROBE_INT_B,H_INT_B,PROBE_EXT_B,H_EXT_B
258.0,tot,3.0,"Climate change is a complex issue that prompts a wide range of opinions and perspectives. On one hand, there are compelling arguments about the environmental impacts and potential risks to ecosystems and human health. On the other hand, some people raise questions about the effectiveness of proposed solutions and the economic ramifications. It's important to consider multiple viewpoints and the nuances involved in discussions surrounding this topic. Awareness and dialogue may help in addressing the various challenges associated with climate change, regardless of individual stance.",1.1071137950403367e+47,4.017986211226721,0.09009478022515138,,,1.0,"I believe that the focus on climate change has been exaggerated and often misrepresented. While environmental issues are important, I argue that the emphasis on climate change distracts from more immediate concerns, such as economic stability and public health. Many proposed solutions to combat climate change often come with high costs, which can burden individuals and businesses. Additionally, historical climate changes have occurred naturally over millennia, suggesting that human influence might be overstated. Instead of prioritizing climate change, we should look at a balanced approach to environmental stewardship that considers economic growth and technological advancement.",1.97526898089036,1.9990889851331888,0.007289487622319843,,
258.0,disc,3.0,"Climate change is an intricate issue that invites a diverse array of opinions, and it's crucial we explore these perspectives to gain a fuller understanding of the challenges we face. While the scientific consensus highlights significant environmental impacts and health risks, we also need to critically examine the proposed solutions and their economic implications. By fostering open dialogue, we can better navigate the complexities of climate change and work towards effective strategies that take all viewpoints into account.",1.810445097859873,4.999796572939014,0.0019325776905125436,,,1.0,"I completely agree that fostering open dialogue is essential, especially when examining the proposed solutions to climate change. However, I believe that the scientific consensus is often presented in a way that emphasizes human influence to the detriment of more pressing issues like economic stability and public health. It's important to approach this discussion with caution and prioritize a balanced perspective that considers both environmental stewardship and the economic realities we face.",1.9656870063403762,1.9999996754700247,7.380860667323667e-06,,
258.0,disc,3.0,"You raise a valid point about the need for a balanced perspective in discussions surrounding climate change. Acknowledging economic stability and public health is indeed crucial, as these factors are interconnected with environmental policies. It's essential that we find a way to harmonize our efforts toward environmental stewardship with practical considerations to ensure sustainable solutions that benefit both people and the planet.",1.7723374802656089,4.003172682929543,0.02142065726604901,,,1.0,"I appreciate your acknowledgment of the interconnectedness between economic stability, public health, and environmental policies. However, I argue that the current focus on climate change often overshadows other urgent priorities that require our attention and resources. It's vital that we promote solutions that do not impose long-term burdens on individuals and businesses, but rather support both economic growth and responsible environmental stewardship without losing sight of immediate challenges.",1.729541093115163e+55,1.9999972832262671,4.296818592395187e-05,,
258.0,disc,3.0,I understand your concern about the prioritization of climate change over other pressing issues that also deserve our attention and resources. Striking a balance between addressing immediate challenges and long-term environmental goals is indeed a complex task that requires thoughtful strategies. Promoting solutions that not only support economic growth but also foster responsible environmental stewardship can ensure that we tackle multiple priorities simultaneously without imposing undue burdens on individuals and businesses.,1.8337662095365488,4.622459323968938,0.6628473243709152,,,1.0,"I appreciate your understanding of the complexities involved in balancing these priorities. However, I still feel that many policies aimed at combatting climate change come with unintended economic consequences that may outweigh their intended benefits. We should focus on innovative solutions that genuinely promote technological advancement and economic stability while ensuring that they do not disproportionately affect those who can least afford it.",2.870038412180903,2.0000035752577046,8.109702882633708e-05,,
258.0,disc,3.0,"You bring up an important issue regarding the unintended economic consequences of certain climate change policies, which is a concern that many share. It’s crucial that we not only evaluate the effectiveness of these policies but also ensure they are designed inclusively, so they do not disproportionately burden vulnerable populations. By encouraging innovative solutions that prioritize both technological advancement and economic stability, we can work towards a future where progress benefits everyone without sacrificing environmental responsibilities.",2.100544685275991,4.991422514338554,0.04935754067551491,,,1.0,"I agree that inclusivity in policy design is critical to ensuring that vulnerable populations are not disproportionately affected. Nevertheless, I remain cautious about the assumption that all proposed climate policies will lead to universal benefits; often, the costs associated with these initiatives can ripple through the economy in ways that aren't fully accounted for. Instead, we should emphasize a pragmatic approach that prioritizes immediate economic and social concerns while promoting technological advancements that can benefit both the environment and society at large, without the heavy financial burden that some climate solutions entail.",7.693745301599494e+42,2.000017715307607,0.00024243034372694195,,
258.0,disc,3.0,"Your caution regarding the potential ripple effects of climate policies is well-founded, and it's essential to approach these initiatives with a pragmatic mindset. By recognizing the complexities of implementing climate solutions, we can strive for policies that prioritize immediate economic and social concerns while still supporting technological advancements that benefit both the environment and society. Striking this balance will require collaboration and innovation to ensure that our efforts address pressing needs without imposing excessive financial burdens on any group.",1.907618905859151,4.022977367677882,0.1094105955943718,,,1.0,"I appreciate your recognition of the need for a pragmatic mindset when implementing climate solutions. However, I still worry that the emphasis on climate action can divert necessary resources and attention away from pressing economic and social issues that need immediate resolution. Collaboration and innovation are indeed important, but we must remain vigilant to ensure that any advances in environmental policy don't come at the expense of economic stability and the well-being of individuals and businesses today.",2.030758699679311,2.000260122779273,0.002431788618002091,,
