ID,TEXT_TYPE,INIT_OP_A,TEXT_A,PPL_A,PROBE_INT_A,H_INT_A,PROBE_EXT_A,H_EXT_A,INIT_OP_B,TEXT_B,PPL_B,PROBE_INT_B,H_INT_B,PROBE_EXT_B,H_EXT_B
259.0,tot,3.0,"Climate change is a complex issue that elicits a wide range of opinions and perspectives. On one hand, there is significant scientific evidence suggesting changes in climate patterns and potential impacts on ecosystems, weather events, and human health. On the other hand, the approaches to address these changes, the economic implications, and the effectiveness of various solutions are subjects of ongoing debate. The discussion around climate change involves not just environmental aspects, but also social, political, and economic dimensions that make it a multifaceted topic. It's essential to consider all viewpoints and data when exploring this issue.",1.7253570120145443,4.880797075702507,0.3653338656972603,,,1.0,"I believe that the focus on climate change has been exaggerated and often distracts from more immediate and pressing issues facing humanity, such as poverty, healthcare, and education. Many proposed solutions, like drastic emissions cuts or transitioning to renewable energy, can have significant economic repercussions and may not effectively address the problem at hand. Instead of prioritizing climate change over other critical needs, we should take a more balanced approach that addresses a range of global challenges without sacrificing economic growth and development.",1.9243887665743304,1.9999939627729133,0.00015277184026099542,,
259.0,disc,3.0,"Climate change is undeniably one of the most pressing challenges we face today, with scientific evidence increasingly pointing to the significant impact human activities have on our planet's climate systems. However, the conversation about how to effectively address these changes can be quite complex, as it intertwines social, political, and economic factors that vary widely across different regions and communities. As we engage in this discussion, it’s vital to consider diverse perspectives and data to develop comprehensive strategies that are both effective and equitable.",1.9229013965711415,4.73105859015671,0.5822030996325808,,,1.0,"While I acknowledge the concerns surrounding climate change, it's essential to remember that there are other urgent issues, such as poverty, healthcare, and education, that require our immediate attention. The complex interplay of social, political, and economic factors means that sometimes the proposed solutions for climate change can exacerbate inequalities and hinder economic growth. A more balanced approach that addresses a variety of challenges could lead to more sustainable progress for all, rather than disproportionately prioritizing climate over pressing human needs.",2.0984287413603138,2.0000143462265947,0.00018489689166489664,,
259.0,disc,3.0,"I appreciate your perspective and fully recognize that issues like poverty, healthcare, and education are critical and interlinked with climate change. It's important to acknowledge that addressing climate change does not have to come at the expense of tackling these urgent concerns; in fact, sustainable solutions can often benefit multiple areas simultaneously. By adopting a holistic approach that aligns climate strategies with economic and social initiatives, we can work toward a future that not only mitigates climate impacts but also promotes equity and well-being for all communities.",1.8724008260926257,4.999088948598342,0.007288826265381649,,,1.0,"I agree that addressing multiple issues simultaneously is important, but I remain concerned about the potential economic repercussions of prioritizing climate strategies too heavily. It's crucial to ensure that any sustainable solutions do not inadvertently divert resources away from more immediate needs like healthcare and education, which are vital for improving people's lives now. A more cautious, balanced approach could allow us to make meaningful progress on various fronts without jeopardizing economic growth or the well-being of vulnerable communities.",2.007972564380268,2.000018578552893,0.00023023940492733025,,
259.0,disc,3.0,"Your concerns about the economic repercussions of prioritizing climate strategies are valid and warrant careful consideration as we move forward. Achieving a balance is indeed key; we must ensure that our initiatives promote immediate human needs while also investing in long-term sustainability that ultimately supports economic stability. By leveraging innovative solutions that align climate action with social and economic benefits, we can develop pathways that enhance resilience and well-being without compromising the progress we seek in other essential areas.",2.5273045512606194,4.999941708723214,0.0006266329133277021,,,1.0,"I appreciate the acknowledgment of the need for balance, but I am still cautious about the assumption that all innovative solutions will effectively marry climate action with immediate human needs. The risks of implementing ambitious climate agendas can sometimes outweigh the benefits, especially when resources are limited, and urgent demands exist in healthcare and education. A more prudent approach might focus on ensuring that basic human needs are met first, while exploring climate solutions that do not place an additional financial burden on communities struggling to thrive.",2.815115640185613,2.000005029468807,7.735342653041143e-05,,
259.0,disc,3.0,"I understand your caution regarding the potential risks associated with ambitious climate agendas, especially in the context of limited resources and pressing human needs. It’s crucial to assess each proposed solution carefully, ensuring that they do not inadvertently create additional burdens for vulnerable communities, and evaluating pilot programs or gradual approaches could help mitigate risks. Prioritizing immediate needs while strategically exploring low-cost, sustainable climate solutions can pave the way for incremental progress that supports both human welfare and environmental stewardship, fostering a more resilient future for all.",1.654334499466826e+44,4.989013057636593,0.06048898554062262,,,1.0,"I appreciate the emphasis on careful assessment and the potential for pilot programs to mitigate risks, but I still question whether the resources dedicated to climate initiatives could be better utilized to address pressing human needs. Incremental progress sounds reasonable in theory, yet the urgency of poverty, healthcare, and education often requires more immediate, large-scale interventions that may not always align with climate agendas. Ultimately, while exploring sustainable options is important, we must prioritize a clear-eyed focus on addressing the most critical human issues first, ensuring that no one is left behind in the process.",2.149640139962992,2.000009718443562,0.00016713444075562516,,
259.0,disc,3.0,"Your concerns about the urgency of addressing critical human issues before fully committing to climate initiatives are completely valid, and I share your commitment to ensuring that no community is left behind. It’s important to navigate this delicate balance by recognizing that immediate interventions in areas like poverty, healthcare, and education can also incorporate sustainability principles to create a multi-faceted approach. By fostering collaboration between sectors, we can identify synergies that allow us to tackle pressing human needs while also laying the groundwork for long-term climate resilience, ultimately benefiting both people and the planet.",6.884284604446729e+40,4.952574124622539,0.19086497783579096,,,1.0,"I appreciate your recognition of the need for collaboration, but I remain skeptical about whether the integration of sustainability principles into urgent human interventions can achieve the desired results without diverting essential resources. There's a risk that the focus on sustainability could undermine immediate efforts to alleviate poverty, improve healthcare, and enhance education, especially in communities that are already struggling. While I support exploring synergies, we must ensure that our primary focus remains firmly on addressing the most critical human issues before investing heavily in climate-related solutions that may not yield immediate benefits.",2.2010982111159896,2.000027090645505,0.0003236154491886518,,
