ID,TEXT_TYPE,INIT_OP_A,TEXT_A,PPL_A,PROBE_INT_A,H_INT_A,PROBE_EXT_A,H_EXT_A,INIT_OP_B,TEXT_B,PPL_B,PROBE_INT_B,H_INT_B,PROBE_EXT_B,H_EXT_B
273.0,tot,3.0,"Climate change is a complex issue that elicits a wide range of opinions and perspectives. On one hand, there is significant scientific evidence suggesting changes in climate patterns and potential impacts on ecosystems, weather events, and human health. On the other hand, the approaches to address these changes, the economic implications, and the effectiveness of various solutions are subjects of ongoing debate. The discussion around climate change involves not just environmental aspects, but also social, political, and economic dimensions that make it a multifaceted topic. It's essential to consider all viewpoints and data when exploring this issue.",1.7193072497111133,4.851952795627566,0.41930676423534546,,,1.0,"I believe that the focus on climate change has been exaggerated and often distracts from more immediate and pressing issues facing humanity, such as poverty, healthcare, and education. Many climate models are speculative, and the economic impact of drastic measures to combat climate change can be detrimental. We should prioritize innovation and adaptation rather than imposing regulations that might hinder growth and development. Addressing real problems should take precedence over what is often portrayed as a looming crisis.",1.8000866392976804,1.9706877949760544,0.13234361979863773,,
273.0,disc,3.0,"Climate change is undeniably one of the most pressing challenges we face today, with scientific evidence increasingly pointing to the significant impact human activities have on our planet's climate systems. However, the conversation about how to effectively address these changes can be quite complex, as it intertwines social, political, and economic factors that vary widely across different regions and communities. As we engage in this discussion, it’s vital to consider diverse perspectives and data to develop comprehensive strategies that are both effective and equitable.",1.9232134012972775,4.182425514185399,0.47505156203533794,,,1.0,"While it's true that climate change is a topic of debate, I believe that the perceived urgency surrounding it often distracts from more immediate humanitarian issues, such as poverty and healthcare, which require our attention and resources. Many of the climate models are speculative at best, and the potential economic burden of drastic measures can hinder growth and innovation, ultimately impacting societal progress. Instead of focusing solely on regulations tied to climate change, we should prioritize adaptive strategies that address pressing problems to better support those in need.",2.5157683199990024,1.9999974539485048,3.582715316108623e-05,,
273.0,disc,3.0,"You raise important points about the need to address immediate humanitarian issues, such as poverty and healthcare, which indeed require urgent attention and resources. However, it's crucial to recognize that these challenges are often interconnected with climate change, as its impacts can exacerbate existing inequalities and hinder progress in various sectors, including health and economic stability. By integrating adaptive strategies that consider both climate resilience and social needs, we can create solutions that not only mitigate climate change but also uplift vulnerable populations and promote sustainable development long-term.",1.1748432455399593e+44,4.037326883787845,0.159353745934385,,,1.0,"I agree that addressing poverty and healthcare is essential, but I maintain that the long-term focus on climate change can often overshadow these urgent needs and complicate the allocation of resources. While interconnectedness is acknowledged, the priority should remain on immediate human challenges rather than imposing potentially burdensome climate initiatives that may not yield the promised benefits. Ultimately, we should invest in innovations and adaptations that directly improve lives and drive economic growth, rather than getting caught up in an increasingly politicized climate agenda.",4.160956809831156e+45,1.999999076794845,1.81689600738261e-05,,
273.0,disc,3.0,"Your perspective highlights a valid concern regarding resource allocation and the need for immediate action on pressing human challenges. However, it is essential to consider that climate change will likely have far-reaching effects on resource availability, health, and economic opportunities, potentially worsening poverty and other social issues in the long run. A balanced approach that brings together innovation and adaptation while also addressing climate impacts can create synergies that directly improve lives, ensuring that neither immediate needs nor long-term sustainability is sidelined in the process.",6.978014984946625e+89,4.880797076391485,0.3653338585291167,,,1.0,"While I appreciate the call for a balanced approach, I believe it’s crucial to recognize that the focus on climate change can detract from addressing pressing needs today, especially when the predicted long-term impacts often remain speculative. The urgency to innovate and adapt should primarily target immediate issues like poverty and healthcare, rather than diverting resources to distant climate scenarios that may or may not materialize as anticipated. By prioritizing real-world challenges, we can create tangible benefits for vulnerable populations, which may ultimately lead to more sustainable and effective solutions in the long run.",1.771382019269386e+40,1.9999885250817673,0.00014212828856446794,,
273.0,disc,3.0,"I understand your concern about the speculation surrounding long-term climate impacts and the need for immediate action on pressing issues like poverty and healthcare. However, it is worth noting that many of the climate-related challenges we face today, such as extreme weather events and food security threats, are not just future scenarios but are already manifesting and affecting vulnerable populations. Focusing on both immediate human needs and long-term climate resilience can create a more holistic strategy, ensuring that we address real-world challenges while also preparing for and mitigating future risks, ultimately leading to a more sustainable and equitable future for everyone.",1.9424513201407545,4.268941409432169,0.5822031009137838,,,1.0,"I acknowledge that some climate-related challenges are indeed already presenting themselves, but I remain concerned that the urgency placed on these issues can overshadow immediate human needs that demand our attention and resources. Instead of a dual focus, we should prioritize tackling pressing issues—like poverty and healthcare—that have clear, direct impacts on people's lives right now. By concentrating our efforts on enhancing innovation and development in these areas, we can create lasting benefits for communities without the potential economic drawbacks imposed by stringent climate policies that may not yield the expected results.",2.3526233228718025,1.9999974989539921,3.659943945336748e-05,,
273.0,disc,3.0,"Your emphasis on prioritizing immediate human needs is certainly valid, especially given the real and pressing challenges many communities face today. However, it’s important to recognize that climate change can exacerbate existing issues like poverty and healthcare—failing to address it could lead to even more severe consequences that ultimately hinder progress in these areas. By finding ways to innovate and enhance development in both immediate needs and climate resilience, we can create a more robust framework that not only supports vulnerable populations now but also protects their future well-being.",1.8364125848191009,4.268941409504849,0.5822030994321103,,,1.0,"I understand the argument that climate change could exacerbate existing issues, but I still believe that the overwhelming focus on future climate scenarios can detract from addressing urgent, present-day challenges that many communities face. Instead of attempting to tackle everything at once, we should concentrate our resources on addressing immediate needs, which can yield direct benefits and improve lives more effectively in the short term. By fostering growth and innovation in essential areas like healthcare and poverty alleviation, we can lay a stronger foundation for future resilience without the risks associated with prioritizing speculative climate strategies.",1.5156090283829538e+40,1.9999930661949032,9.016192324018942e-05,,
