ID,TEXT_TYPE,INIT_OP_A,TEXT_A,PPL_A,PROBE_INT_A,H_INT_A,PROBE_EXT_A,H_EXT_A,INIT_OP_B,TEXT_B,PPL_B,PROBE_INT_B,H_INT_B,PROBE_EXT_B,H_EXT_B
28.0,tot,1.0,"I believe that the focus on climate change has been exaggerated and often distracts from more immediate and pressing issues facing humanity, such as poverty, healthcare, and education. Many proposed solutions, like drastic emissions cuts or the transition to renewable energy, can have significant economic repercussions and impact people's livelihoods, particularly in developing regions. Additionally, the climate has always gone through natural cycles of change, and while we should be good stewards of the environment, the narrative around climate change often seems alarmist and is driven by political agendas rather than balanced scientific discourse. It's crucial to prioritize practical solutions that directly improve human lives over what I see as unfounded fears about the future of our planet.",2.786316597889701e+32,1.9998416239986587,0.0015458277516545646,,,2.0,"I believe that while environmental issues are important, the emphasis on climate change often overshadows other pressing concerns that deserve equal attention. There are natural climate fluctuations that have occurred throughout Earth's history, and many argue that humanity's ability to adapt is significant. Rather than focusing solely on climate change, we should prioritize economic development, technological innovation, and improving living standards globally, which can also contribute to better environmental stewardship. Addressing immediate human needs can lead to more sustainable long-term solutions without the alarmism often tied to climate narratives.",2.157199628290204,2.0052194984934446,0.032651425994395716,,
28.0,disc,1.0,"While the issue of climate change is certainly significant, I believe it's essential to prioritize more immediate challenges like poverty, healthcare, and education, which affect millions of lives today. It's worth considering that the proposed solutions to address climate change, such as drastic emissions cuts and a swift transition to renewable energy, may have economic repercussions that can disproportionately affect vulnerable communities, particularly in developing regions. Rather than focusing solely on climate fear, let's engage in a balanced discussion that considers both environmental stewardship and the pressing needs of humanity.",2.1019336878909294,2.0011663815999245,0.009110501299778974,,,2.0,"I completely agree with your perspective on prioritizing immediate challenges like poverty, healthcare, and education. It's crucial that any solutions we consider for climate change do not overlook the potential economic impacts on vulnerable communities, especially in developing regions, where immediate human needs should take precedence. By fostering economic development and technological innovation, we can create pathways to sustainability that serve to uplift people while also addressing environmental concerns in a more balanced manner.",1.9129634638442994,2.0953525381258045,0.314782184699872,,
28.0,disc,1.0,"I'm glad to hear that we share a common understanding of the importance of prioritizing immediate human needs while addressing climate change. Fostering economic development and technological innovation is indeed a promising approach, as it aligns environmental concerns with the goal of improving livelihoods. By focusing on practical solutions that uplift communities, we can create a more balanced narrative that acknowledges both the challenges of climate change and the pressing issues facing humanity today.",1.6487536742784754,2.0140595238622803,0.07400152870332588,,,2.0,"I'm pleased to see that we are aligned on these critical issues. Emphasizing practical solutions that promote economic growth and innovation not only helps in addressing immediate human needs but also creates a more resilient foundation for tackling environmental challenges. To genuinely achieve a balance, we must encourage discussions that integrate both human and ecological well-being, moving away from alarmist narratives and towards collaborative action that benefits everyone.",6.875596580459469e+56,2.777893742302947,0.5342588834395388,,
28.0,disc,1.0,"I appreciate your emphasis on creating a resilient foundation that addresses both human and ecological well-being. Promoting collaborative action is essential, as it allows us to move beyond alarmist narratives and focus on actionable solutions that can benefit all stakeholders involved. By integrating economic growth with sustainability initiatives, we can pave the way for a future where both people and the planet thrive together.",1.67960661603909,2.029308408771771,0.13242382919600174,,,2.0,"Absolutely, the idea of creating a future where both people and the planet thrive is fundamental to our approach. By integrating economic growth with sustainability initiatives, we not only address the immediate needs of communities but also set the stage for long-lasting environmental stewardship. It's important to foster a dialogue that emphasizes actionable solutions and real-world impacts, ensuring that all stakeholders feel empowered and involved in this vital journey.",5.322667482186931e+56,2.999455030318997,0.004800043119145652,,
28.0,disc,1.0,"I completely agree that fostering a dialogue emphasizing actionable solutions is crucial for ensuring that all stakeholders are engaged in this process. Empowering communities to participate in sustainability initiatives not only addresses their immediate needs but also instills a greater sense of responsibility toward environmental stewardship for the future. By working collaboratively, we can develop strategies that respect human livelihoods while effectively addressing the challenges posed by climate change, creating a win-win scenario for everyone involved.",2.224475514465519,2.006689562904565,0.040265854479255375,,,2.0,"I wholeheartedly agree that empowering communities to take part in sustainability initiatives is key to fostering a sense of responsibility towards the environment. When people feel their immediate needs are being addressed, they are more likely to engage in collaborative efforts that balance economic development with environmental care. By creating strategies that respect and uplift human livelihoods, we truly can work toward a future where solutions to climate challenges also enhance the quality of life for all stakeholders involved.",1.997108162776491,2.9919745934815953,0.053999327449430055,,
28.0,disc,1.0,"It's encouraging to see such strong agreement on the importance of engaging communities in sustainability initiatives, as their involvement is indeed vital for long-term success. When people's immediate needs are prioritized, it fosters a sense of ownership and commitment to protecting the environment, which can lead to innovative and effective solutions. By continuously aligning our strategies with the well-being of human lives, we can construct a future where addressing climate challenges goes hand-in-hand with enhancing quality of life for everyone.",9.24583085004873e+47,2.320817242950988,0.6275782992596886,,,2.0,"I'm glad you see the value in community engagement as a cornerstone for long-term sustainability efforts. Prioritizing people's immediate needs not only cultivates a sense of ownership but also sparks creativity in finding solutions that are both effective and inclusive. By continually aligning our strategies with human well-being, we can genuinely create a future where environmental stewardship complements and enhances the quality of life for everyone, leading to a more harmonious coexistence between people and the planet.",1.783879248284784,2.99108147748034,0.18049875695121248,,
