ID,TEXT_TYPE,INIT_OP_A,TEXT_A,PPL_A,PROBE_INT_A,H_INT_A,PROBE_EXT_A,H_EXT_A,INIT_OP_B,TEXT_B,PPL_B,PROBE_INT_B,H_INT_B,PROBE_EXT_B,H_EXT_B
290.0,tot,3.0,"Climate change is a complex issue that prompts a wide range of opinions and perspectives. On one hand, there are compelling arguments about the environmental impacts and potential risks to ecosystems and human health. On the other hand, some people raise questions about the effectiveness of proposed solutions and the economic ramifications. It's important to consider multiple viewpoints and the nuances involved in discussions surrounding this topic. Awareness and dialogue may help in addressing the various challenges associated with climate change, regardless of individual stance.",1.1069704457140365e+47,4.2689414092946,0.5822031024798173,,,2.0,"I believe that while environmental issues are important, the emphasis on climate change often overshadows other pressing concerns that deserve equal attention. The notion that climate change is the most urgent problem can lead to ineffective policies that prioritize emissions reduction over economic development and social needs. Many regions still face poverty, health crises, and infrastructure challenges that are immediate and require resources. Additionally, the Earth's climate has always been subject to natural changes, and history shows that societies have adapted to these changes over time. Instead of focusing exclusively on climate change, we should adopt a more balanced approach that addresses a range of environmental and societal issues simultaneously.",4.316569018253902e+35,2.0195507794861602,0.09646174120892378,,
290.0,disc,3.0,"Climate change is an intricate issue that invites a diverse array of opinions, and it's crucial we explore these perspectives to gain a fuller understanding of the challenges we face. While the scientific consensus highlights alarming environmental impacts and health risks, we also need to critically examine the proposed solutions and their economic implications. By fostering open dialogue, we can better navigate the complexities of climate change and work towards effective strategies that take all viewpoints into account.",1.8692899668216352,4.003172683005701,0.02142065550210958,,,2.0,"I appreciate the acknowledgment that climate change is a multifaceted issue requiring diverse perspectives. However, I believe that focusing predominantly on climate change can divert our attention from other urgent social issues like poverty and health crises, which also demand immediate action. A more balanced approach that evaluates a broad spectrum of environmental and societal challenges would likely yield more effective solutions for all.",2.134706107644948,2.0600910536503187,0.2272429419864118,,
290.0,disc,3.0,"I completely understand your concern about the need for a balanced approach that encompasses various urgent social issues alongside climate change. It's essential to recognize that these challenges are often interconnected; addressing climate change can actually provide opportunities to alleviate poverty and improve public health. By integrating our efforts and considering the intersections of these issues, we can develop more holistic solutions that benefit both the environment and society as a whole.",1.5139254649582299,4.005220125410175,0.032639463955662154,,,2.0,"While it's true that some initiatives addressing climate change can have co-benefits for poverty and health, we must be cautious not to prioritize these solutions at the expense of urgent social needs. For many regions, immediate issues like access to clean water, healthcare, and infrastructure are more pressing and may be overshadowed by the climate narrative. We should strive for a more equitable approach that ensures resources are allocated fairly to address all critical concerns, rather than assuming that climate solutions will automatically resolve other societal challenges.",2.329736293445676,2.0600930006046196,0.2272590592062487,,
290.0,disc,3.0,"You raise a valid point about the importance of prioritizing immediate social needs and ensuring that resource allocation is equitable. It’s crucial that we don’t fall into the trap of viewing climate solutions as a panacea for other pressing issues; instead, each challenge deserves its own dedicated attention and resources. By intentionally designing policies that simultaneously address climate change and immediate social concerns, we can work towards a more integrated approach that recognizes the unique needs of different regions and communities.",1.744622298516208,4.8175744847813675,0.47505155410314526,,,2.0,"I appreciate your recognition of the need for dedicated attention to each individual challenge, including both climate change and immediate social concerns. However, I am concerned that crafting policies that attempt to address multiple issues simultaneously may lead to diluted efforts that fail to adequately tackle any one area. Instead, we may be better served by prioritizing the most pressing local needs and implementing targeted solutions, while also considering climate change as a separate but important issue in the broader context of sustainable development.",2.295493430975836,2.6298379557415994,0.6926521578478549,,
290.0,disc,3.0,"Your concern about the potential dilution of efforts when attempting to tackle multiple issues simultaneously is certainly valid and worth considering. I agree that prioritizing local needs can lead to more effective, targeted solutions, particularly in regions facing acute challenges. However, I believe we can still hold space for the climate narrative in those discussions, ensuring that as we address immediate concerns, we also lay the groundwork for long-term sustainability, recognizing that all these issues are interconnected in the larger framework of sustainable development.",1.9762481316508962,4.999664649945812,0.0030182068063981443,,,2.0,"I agree that it's essential to maintain a climate narrative in discussions about immediate local needs, as long as it doesn’t distract from addressing those urgent issues directly. However, we should be cautious about how we define “long-term sustainability,” as it can sometimes prioritize climate goals over the pressing socio-economic realities faced by many communities. Balancing these perspectives is crucial, but we must ensure that our immediate responses are not compromised by a climate agenda that assumes solutions are universally applicable across different contexts.",2.543730093466753,2.9973151556560773,0.025606505487921864,,
290.0,disc,3.0,"You've highlighted an important aspect of the discussion—defining ""long-term sustainability"" in a way that is inclusive of diverse socio-economic realities is vital. It’s essential that our climate narrative acknowledges the unique contexts and challenges faced by different communities, allowing for tailored solutions that respect their immediate needs. Ultimately, achieving a balance requires not only clear definitions but also a willingness to adapt our approaches as we learn from local experiences and feedback, ensuring that both immediate responses and long-term goals are genuinely effective and relevant.",2.2033877379007096,4.998498817972579,0.011259993349039722,,,2.0,"I appreciate your emphasis on the importance of context and the need for tailored solutions that respect communities' immediate needs. However, we must ensure that the adaptability you mention does not lead to inconsistent or reactive policies that could undermine established priorities. A clear, focused strategy that prioritizes immediate socio-economic concerns while cautiously integrating climate considerations only where they align will likely result in more sustainable and effective outcomes for all communities involved.",2.6820619273136828,2.906559779689037,0.32701290026210394,,
