ID,TEXT_TYPE,INIT_OP_A,TEXT_A,PPL_A,PROBE_INT_A,H_INT_A,PROBE_EXT_A,H_EXT_A,INIT_OP_B,TEXT_B,PPL_B,PROBE_INT_B,H_INT_B,PROBE_EXT_B,H_EXT_B
2.0,tot,1.0,"I believe that the focus on climate change has been exaggerated and often distracts from more immediate and pressing issues facing humanity, such as poverty, healthcare, and education. Many proposed solutions, like drastic emissions cuts or the transition to renewable energy, can have significant economic ramifications that might harm communities, particularly those that rely on fossil fuel industries. Additionally, the climate has always been subject to natural fluctuations, and while human activity may contribute to changes, the narrative around climate change often lacks nuance. It's essential to seek a balanced approach that prioritizes both environmental stewardship and human development.",2.133280241269172,2.000000722066383,3.480560220407132e-05,,,1.0,"I believe that the focus on climate change has been exaggerated and often distracts from more immediate and pressing issues facing humanity, such as poverty, healthcare, and education. Many climate models are speculative, and the economic impact of drastic measures to combat climate change can be detrimental. We should prioritize innovation and adaptation rather than imposing regulations that might hinder growth and development. Ultimately, it's crucial to maintain a balanced perspective on environmental issues without sacrificing progress in other vital areas.",1.7560756449865758,1.9999981725736453,4.663726182767045e-05,,
2.0,disc,1.0,"While climate change is undeniably a topic of concern, I believe we should be cautious not to let the focus on it overshadow more pressing issues like poverty, healthcare, and education that directly affect people's lives every day. The proposed solutions, such as drastic emissions cuts, could have unintended economic consequences, disproportionately impacting communities dependent on fossil fuel industries. It's crucial that we adopt a balanced approach that promotes both environmental stewardship and the development of human well-being.",1.7912138282498276,2.0179871338851263,0.0901132650876464,,,1.0,"I completely agree with your perspective on the need for balance in this discussion. While climate change is important, we must remember that immediate challenges like poverty and healthcare require our urgent attention and resources. Prioritizing flexible solutions and innovation can allow us to address environmental concerns without undermining economic growth and societal progress.",2.9872557707101172e+71,2.0052195556086634,0.032648195654866104,,
2.0,disc,1.0,"I appreciate your agreement on the importance of balance, as it's vital that our approach to climate change does not divert resources from urgent humanitarian needs. Encouraging innovation and flexible solutions can indeed provide pathways to address environmental challenges while supporting economic growth and societal progress. By fostering dialogue that values both environmental sustainability and human development, we can work towards solutions that uplift communities without compromising their livelihoods.",2.010649911706815,2.562208078747442,0.6856513838390953,,,1.0,"I'm glad we share this understanding of the need for a balanced approach. By fostering innovation, we can encourage the development of new technologies that not only address environmental issues but also create jobs and enhance quality of life. Ultimately, prioritizing human development alongside environmental stewardship will yield more sustainable and inclusive progress for all communities.",1.9206285245807813,2.0085761162049183,0.04937720968069505,,
2.0,disc,1.0,"I completely agree that fostering innovation can lead to technological advancements that benefit both the environment and communities, creating much-needed jobs and improving quality of life. It's this intersection of human development and environmental stewardship that can truly drive sustainable progress, ensuring that no community is left behind. Together, we can advocate for policies that integrate these priorities, paving the way for a holistic approach to the challenges we face.",2.0424594401457594,2.562568458818754,0.6877541588245208,,,1.0,"Your emphasis on collaboration to advocate for policies that integrate human development and environmental stewardship is commendable. It's essential that we work together to create frameworks that support innovation while being mindful of the impact on communities. By focusing on practical solutions that enhance both livelihoods and the environment, we can pave the way for a resilient future without sacrificing progress in crucial areas like education and healthcare.",2.306717324383481,2.437822931190941,0.6854017835203785,,
2.0,disc,1.0,"Thank you for highlighting the importance of collaboration; it truly is essential for crafting effective frameworks that consider the needs of all communities. By emphasizing practical solutions that enhance livelihoods alongside environmental goals, we can create a more resilient future that doesn’t compromise on vital areas like education and healthcare. It’s about finding common ground where innovation can thrive without negatively impacting those who rely on traditional industries for their survival.",1.815759801293375,2.731270710600512,0.583752188863218,,,1.0,"I appreciate your thoughtful response and your focus on finding common ground. It's vital that we recognize the realities facing communities dependent on traditional industries, ensuring that any transition toward environmental goals is both just and inclusive. By fostering innovation and supporting adaptive measures, we can pursue environmental sustainability while safeguarding the livelihoods and well-being of all individuals.",1.5877153518065768e+68,2.8807964487885735,0.36533976206371555,,
2.0,disc,1.0,I wholeheartedly agree that recognizing the realities of communities dependent on traditional industries is crucial for a just and inclusive transition. Supporting adaptive measures and fostering innovation not only ensures the protection of livelihoods but also empowers these communities to embrace new opportunities. This balanced approach can lead us toward a sustainable future where environmental goals and human well-being coexist harmoniously.,1.9602929511745588,2.563733480082248,0.6931526184965947,,,1.0,"I'm glad to see that we are on the same page regarding the importance of supporting communities during this transition. By prioritizing adaptive measures and fostering an environment ripe for innovation, we can empower individuals to thrive in emerging sectors while maintaining their traditional roots. Ultimately, a harmonious coexistence of environmental goals and human well-being will yield a more sustainable future for everyone.",1.9166083142098773,2.182423403101694,0.47507755147490405,,
