ID,TEXT_TYPE,INIT_OP_A,TEXT_A,PPL_A,PROBE_INT_A,H_INT_A,PROBE_EXT_A,H_EXT_A,INIT_OP_B,TEXT_B,PPL_B,PROBE_INT_B,H_INT_B,PROBE_EXT_B,H_EXT_B
303.0,tot,3.0,"Climate change is a complex issue that prompts a wide range of opinions and perspectives. On one hand, there are compelling arguments about the environmental impacts and potential risks to ecosystems and human health. On the other hand, some people raise questions about the effectiveness of proposed solutions and the economic ramifications. It's important to consider multiple viewpoints and the nuances involved in discussions surrounding this topic. Awareness and dialogue may help in addressing the various challenges associated with climate change, regardless of individual stance.",1.1037739948238141e+47,4.014063627077826,0.07393387632669858,,,3.0,"Climate change is a complex issue that elicits a wide range of opinions and perspectives. On one hand, there is significant scientific evidence suggesting changes in climate patterns and potential impacts on ecosystems, weather events, and human health. On the other hand, the approaches to address these changes, the economic implications, and the effectiveness of various solutions are subjects of ongoing debate. The discussion around climate change involves not just environmental aspects, but also social, political, and economic dimensions, making it a multifaceted topic worthy of careful consideration. It’s essential to engage in open dialogue and explore diverse viewpoints to navigate the intricacies of this issue.",1.776524838025526,4.999954602144252,0.0004993774566967509,,
303.0,disc,3.0,"Climate change is an intricate issue that invites a diverse array of opinions and perspectives, reflecting the complexity of our global systems. It's crucial to acknowledge the compelling evidence regarding the environmental impacts and potential risks to both ecosystems and human health. However, as we navigate this dialogue, we must also consider the effectiveness of proposed solutions and their economic implications, fostering an open exchange of ideas to address the challenges we face.",1.7776672134348237,4.999999836262282,2.7221395426149703e-06,,,3.0,"I completely agree that the topic of climate change is multifaceted and requires a nuanced conversation. Acknowledging the environmental evidence is critical, yet it is equally important to assess the viability and economic ramifications of various solutions we propose. Engaging in an open exchange of ideas will help us better understand the complexities involved and work towards a more informed approach to tackle these pressing challenges.",2.2981542435224513,4.999999694097641,4.89443765983855e-06,,
303.0,disc,3.0,"I appreciate your agreement on the importance of a nuanced conversation about climate change, and I wholeheartedly concur that evaluating the viability of proposed solutions is essential. By embracing an open dialogue, we can explore the complexities of climate change from various angles, which may lead to innovative and effective strategies. It’s through this collaborative approach that we can work towards sustainable solutions that balance environmental preservation with economic realities.",5.146222019250071e+56,4.999999931743958,1.1944807296497412e-06,,,3.0,"Thank you for your thoughtful response; I share your belief in the value of collaborative dialogue as a means to navigate the complexities of climate change. Exploring diverse perspectives can indeed foster innovation and help us identify strategies that effectively balance environmental goals with economic considerations. As we continue this conversation, it’s vital to remain adaptable and open to new ideas, as the journey towards sustainability requires a collective effort.",1.9434224492321663,4.9999999634651795,6.621936276310476e-07,,
303.0,disc,3.0,"Thank you for your kind words; I appreciate your commitment to collaborative dialogue as we navigate these complex issues. Staying adaptable and open to new ideas is crucial, especially as we encounter challenges that require innovative solutions and a willingness to rethink our approaches. By working together and valuing diverse perspectives, we can enhance our collective efforts towards meaningful sustainability and ultimately create a healthier planet for future generations.",1.956241004882398,4.999999998181038,3.8425565544945045e-08,,,3.0,"I completely resonate with your emphasis on adaptability and the need for innovative thinking in addressing climate challenges. Valuing diverse perspectives is indeed a cornerstone of effective collaboration, as it enriches our understanding and fosters creative solutions. By maintaining this spirit of cooperation, we can make significant progress toward achieving meaningful sustainability and ensuring a healthier planet for those who come after us.",1.750991253906206,4.999999998749847,2.6878286599732936e-08,,
303.0,disc,3.0,"I'm glad to hear that you resonate with the importance of adaptability and innovative thinking in tackling climate challenges. The richness that diverse perspectives bring to our discussions can truly enhance our problem-solving capabilities, leading to more creative and effective solutions. By continuing to cultivate a spirit of cooperation, we can build the momentum needed to drive significant progress toward sustainability for both our present and future generations.",1.6377071512695063,4.999999998181038,3.842556554497586e-08,,,3.0,"I appreciate your insightful reflections on the power of diverse perspectives and the role they play in enhancing our problem-solving abilities. Building momentum for sustainability requires not only cooperation but also a shared commitment to learning and evolving our strategies over time. Together, by fostering an inclusive dialogue, we can make meaningful strides toward a more sustainable future for both our planet and its inhabitants.",1.8147862812592215,4.999999999641825,8.14847656875183e-09,,
303.0,disc,3.0,"Thank you for your thoughtful response; I completely agree that a shared commitment to learning is essential for evolving our strategies in the face of climate change. By fostering an inclusive dialogue, we can create an environment where all voices are heard, allowing us to collectively address the multifaceted nature of sustainability. As we embark on this journey together, each step we take can lead to meaningful advancements for our planet and all those who inhabit it.",1.6886048595175742,4.99999999184798,1.5998340532728673e-07,,,3.0,"I appreciate your acknowledgment of the importance of a shared commitment to learning, as it truly forms the backbone of our collective efforts. Creating an environment that values every voice not only enriches our discussions but also ensures that we tackle the diverse challenges of sustainability from multiple angles. As we progress on this journey, I am optimistic that each step we take will contribute to building a more resilient and sustainable future for our planet and future generations.",1.7992910823870356,4.9999999996839115,7.23051622378486e-09,,
