ID,TEXT_TYPE,INIT_OP_A,TEXT_A,PPL_A,PROBE_INT_A,H_INT_A,PROBE_EXT_A,H_EXT_A,INIT_OP_B,TEXT_B,PPL_B,PROBE_INT_B,H_INT_B,PROBE_EXT_B,H_EXT_B
305.0,tot,3.0,"Climate change is a complex issue that elicits a range of opinions and perspectives. On one hand, there are compelling arguments about the environmental impacts and potential risks to ecosystems and human health. On the other hand, some people raise concerns about economic implications, energy policies, and technological feasibility. It's important to consider multiple viewpoints and the interplay of scientific data, societal values, and policy decisions in addressing this multifaceted challenge. Ultimately, further dialogue and research are crucial for informed decision-making.",3.2205613602540925e+45,4.998830489656622,0.009064389493658967,,,3.0,"Climate change is a complex issue that prompts a wide range of opinions and perspectives. On one hand, there are compelling arguments about the environmental impacts and potential risks to ecosystems and human health. On the other hand, some people raise economic and social considerations, emphasizing development and resource management. It's a multifaceted topic that warrants careful examination and discussion rather than a binary agreement or disagreement.",2.242618191607945,4.001501181769293,0.011259999106337579,,
305.0,disc,3.0,"Climate change is a pressing global issue that encompasses a wide array of environmental, economic, and social dimensions. It's essential that we engage in an open dialogue that considers the scientific evidence while also addressing the diverse viewpoints surrounding energy policies and technological solutions. By collaborating and sharing insights, we can work towards more informed and effective strategies to tackle this multifaceted challenge.",1.8385526349530232,4.9999999634651795,6.62193627630435e-07,,,3.0,"I completely agree that an open dialogue is crucial for addressing climate change effectively. Recognizing the scientific evidence while also taking into account various economic and social perspectives allows for a more holistic understanding of the issue. By fostering collaboration and sharing insights, we can develop strategies that not only mitigate environmental risks but also consider the implications for development and resource management, ultimately leading to more sustainable solutions.",1.836524775568135,4.9999869928752245,0.00015933736677431674,,
305.0,disc,3.0,"I appreciate your thoughtful response and the emphasis on a holistic understanding of climate change. It's indeed vital to balance environmental concerns with economic and social implications to develop sustainable solutions that benefit all stakeholders. Moving forward, we should prioritize inclusive discussions that allow diverse voices to contribute to the decision-making process, ensuring that our strategies are equitable and practical.",1.7158644663916058,4.999999997664407,4.8755504592619664e-08,,,3.0,"Thank you for your insightful reflection on the importance of inclusivity in discussions about climate change. It's essential that we create spaces where diverse voices can express their perspectives, as this enriches the decision-making process and leads to more equitable solutions. By actively involving all stakeholders, we can better address the complexities of climate change and ensure that our strategies are both practical and just.",1.6204102002461258,4.9999999123575085,1.5118329649367708e-06,,
305.0,disc,3.0,"Thank you for highlighting the importance of inclusivity; it truly is vital for fostering equitable and innovative solutions to climate change. Creating spaces for diverse voices not only enriches our understanding but also ensures that the needs and concerns of various communities are adequately addressed. As we move forward, let's commit to establishing forums that actively engage all stakeholders, promoting collaboration that drives meaningful change.",2.358032501376555,4.9999999956365375,8.836011027007375e-08,,,3.0,"I appreciate your dedication to fostering collaboration among all stakeholders in the conversation about climate change. Establishing forums that actively engage diverse voices is a crucial step in addressing the unique needs and concerns of different communities. By committing to this approach, we not only broaden our understanding of the challenges at hand but also increase the likelihood of developing innovative and effective solutions that benefit everyone.",1.9653603802456143,4.999999939764254,1.061655020656132e-06,,
305.0,disc,3.0,"Thank you for recognizing the significance of collaboration; it truly is at the heart of finding effective solutions to climate change. By engaging with a wide range of perspectives, we stand to gain valuable insights that can help tailor strategies to various local contexts and needs. Moving forward, I believe it's essential that we continue to nurture these collaborative efforts, as they play a pivotal role in driving both innovation and inclusivity in our response to this global challenge.",2.311165922127699,4.999999999753831,5.6926741447884665e-09,,,3.0,"I wholeheartedly agree that collaboration is fundamental to crafting effective and context-sensitive responses to climate change. Engaging a diverse range of perspectives not only enhances our understanding of local needs but also fosters innovation by combining different ideas and approaches. As we continue to nurture these collaborative efforts, we will be better equipped to address the complexities of climate change in a way that is both inclusive and responsive to the varying challenges faced by different communities.",1.5712083124118184,4.9999999634651795,6.621936276317199e-07,,
305.0,disc,3.0,"I completely agree with your insights on the power of collaboration in addressing climate change. By bringing together varied perspectives, we can unlock new ideas and solutions that are better aligned with local realities and challenges. This inclusive approach will not only enhance our adaptability but also build resilience within communities as we face the complexities of this global issue together.",2.3032637444572828,4.999999999808283,4.4813883478667155e-09,,,3.0,"Thank you for your thoughtful response; I particularly appreciate your emphasis on enhancing adaptability and resilience within communities. By fostering an environment where diverse perspectives are valued, we can indeed uncover innovative solutions that are more effectively tailored to local realities. This collective effort not only strengthens our approach to climate change but also empowers communities to thrive even in the face of adversity.",1.5375938392193609e+63,4.999999988138881,2.2832656023958115e-07,,
