ID,TEXT_TYPE,INIT_OP_A,TEXT_A,PPL_A,PROBE_INT_A,H_INT_A,PROBE_EXT_A,H_EXT_A,INIT_OP_B,TEXT_B,PPL_B,PROBE_INT_B,H_INT_B,PROBE_EXT_B,H_EXT_B
306.0,tot,3.0,"Climate change is a complex issue that prompts a wide range of opinions and perspectives. On one hand, there are compelling arguments about the environmental impacts and potential risks to ecosystems and human health. On the other hand, some people raise questions about the effectiveness of proposed solutions and the economic ramifications. It's important to consider multiple viewpoints and the nuances involved in discussions surrounding this topic. Awareness and dialogue may help in addressing the various challenges associated with climate change, regardless of individual stance.",1.1163290620388772e+47,4.022977367550736,0.10941059760955765,,,3.0,"Climate change is a complex issue that prompts a wide range of opinions and perspectives. On one hand, there are compelling arguments about the environmental impacts and potential risks to ecosystems and human health. On the other hand, some people raise questions about the effectiveness of proposed solutions and the economic ramifications. It's important to consider multiple viewpoints and the nuances involved in discussions surrounding this topic. Awareness and dialogue may help in addressing the various challenges associated with climate change, regardless of individual stance.",1.1117737168281897e+47,4.006692851261585,0.04017960857539123,,
306.0,disc,3.0,"Climate change is an intricate issue that invites a diverse array of opinions and perspectives, reflecting the complexity of our global systems. It's crucial to acknowledge the compelling evidence regarding the environmental impacts and potential risks to both ecosystems and human health. However, as we navigate this dialogue, we must also consider the effectiveness of proposed solutions and their economic ramifications, fostering an open exchange of ideas to address the challenges we face.",1.825021600124493,4.999995214905151,6.34025178540892e-05,,,3.0,"I completely agree that climate change presents a multifaceted challenge that deserves thoughtful consideration of varied perspectives. Acknowledging the environmental impacts is essential, but we must also critically evaluate the proposed solutions to ensure they are both effective and economically viable. Continuous dialogue and awareness can bridge these gaps and foster collaborative efforts to address the pressing issues associated with climate change.",1.6770297424414866e+63,4.999997739674726,3.164455541696861e-05,,
306.0,disc,3.0,"Thank you for your thoughtful response; I appreciate your emphasis on the importance of critical evaluation of proposed solutions. It's true that ensuring these solutions are both effective and economically viable is vital for garnering broader support and achieving meaningful progress. By fostering continuous dialogue and awareness, we can create a collaborative environment that encourages innovative approaches to address the complexities of climate change.",1.5622584160329662,4.999999997001039,6.185356687304821e-08,,,3.0,"Thank you for your kind words; I appreciate your recognition of the need for effective and economically viable solutions. Collaboration is indeed key, as diverse viewpoints can lead to innovative approaches that might not emerge in isolation. By maintaining an ongoing dialogue, we can better understand the complexities of climate change and work together to implement strategies that benefit both the environment and society as a whole.",1.4982863866095866,4.999999988138881,2.2832656023937995e-07,,
306.0,disc,3.0,"I completely agree that collaboration is essential for uncovering innovative solutions and addressing the multifaceted nature of climate change. Engaging with a range of viewpoints not only enriches our understanding but also helps us to find strategies that can harmoniously balance environmental and societal needs. By continuing this constructive dialogue, we can pave the way for solutions that are not only effective but also equitable and sustainable for future generations.",1.9596243170031837,4.999999988138881,2.2832656023912843e-07,,,3.0,"I appreciate your insights on the importance of engaging with diverse viewpoints; it truly enhances our collective understanding of climate change. Striking that balance between environmental and societal needs is essential for creating solutions that are both equitable and sustainable. As we continue this constructive dialogue, I believe we can inspire action that benefits both current and future generations, fostering a healthier planet for all.",1.5066226739983317,4.999999993651199,1.26182401490613e-07,,
306.0,disc,3.0,"Thank you for your thoughtful reflection; it's heartening to see our shared commitment to creating equitable and sustainable solutions. Inspiring action by fostering a collaborative environment is crucial, as it encourages individuals and communities to take ownership of their roles in addressing climate change. Together, through ongoing dialogue and mutual understanding, we can work towards a healthier planet that meets the needs of both present and future generations.",1.6696469296147436,4.999999998181038,3.842556554456046e-08,,,3.0,"Thank you for your encouraging words; I wholeheartedly agree that fostering a sense of ownership among individuals and communities is vital for effective climate action. This commitment to collaboration not only strengthens our collective efforts but also empowers each of us to contribute positively to the cause. Through ongoing dialogue and mutual understanding, we can build a more resilient and sustainable future that benefits everyone.",1.9690619955776907,4.999999999478859,1.166053542842839e-08,,
306.0,disc,3.0,"I appreciate your enthusiasm and fully concur that empowering individuals and communities is essential for driving meaningful climate action. When people feel a sense of ownership, they are more likely to engage in sustainable practices and advocate for necessary changes. By continuing our dialogue and fostering mutual understanding, we can create a strong network of supporters dedicated to building a resilient and sustainable future for all.",1.5962522833182586,4.999999998896744,2.3857911573600487e-08,,,3.0,"I completely agree that when individuals and communities feel empowered, it not only fosters engagement in sustainable practices but also drives advocacy for impactful changes. Building a strong network of supporters can amplify our collective voice and impact, making it easier to tackle climate challenges effectively. As we nurture this ongoing dialogue and mutual understanding, we can inspire a widespread commitment to ensuring a resilient and sustainable future for generations to come.",3.95665075017425e+111,4.999999999641825,8.148476568753745e-09,,
