ID,TEXT_TYPE,INIT_OP_A,TEXT_A,PPL_A,PROBE_INT_A,H_INT_A,PROBE_EXT_A,H_EXT_A,INIT_OP_B,TEXT_B,PPL_B,PROBE_INT_B,H_INT_B,PROBE_EXT_B,H_EXT_B
30.0,tot,1.0,"I believe that the focus on climate change has been exaggerated and often distracts from more pressing and immediate issues facing humanity, such as poverty, healthcare, and education. Many proposed solutions, like drastic policy changes and economic upheaval, could harm economies and livelihoods without guaranteeing significant impact on climate. Instead of prioritizing climate alarmism, we should invest in innovation and technology that can address environmental issues without sacrificing progress and development. It's important to critically assess the data and consider the broader picture of human welfare rather than focusing solely on climate narratives.",8.686924954808662e+40,1.9999759697728952,0.0002868441026483053,,,2.0,"I believe that while environmental issues are important, the emphasis on climate change often overshadows other pressing concerns that deserve equal attention. There are natural climate fluctuations that have occurred throughout Earth's history, and many argue that humanity's ability to adapt is significant. Rather than focusing solely on climate change, we should prioritize economic development, technological innovation, and improving living standards globally, which can also contribute to better environmental stewardship. Addressing immediate human needs can lead to more sustainable long-term solutions without the alarmism often tied to climate narratives.",2.1616372702763376,2.0031717133489555,0.02143720063416331,,
30.0,disc,1.0,"While it's important to acknowledge the conversation around climate change, we must be cautious not to let it overshadow other critical issues like poverty, healthcare, and education that need immediate attention. The proposed solutions often come with significant economic risks and could disrupt livelihoods without ensuring a meaningful impact on the climate. Let's explore ways to use innovation and technology to address environmental challenges while still prioritizing human welfare and development.",1.850356807345931,2.060081073651163,0.22729949824663082,,,2.0,"I completely agree with your perspective that we must not allow the urgency of climate change to eclipse other vital issues like poverty, healthcare, and education. It's crucial that we find a balanced approach where technological innovation addresses environmental challenges while also focusing on immediate human needs and economic stability. By prioritizing human welfare and development, we can create sustainable solutions that benefit both people and the planet without falling into alarmist narratives.",1.5887176893071806,2.9626730629986495,0.15935490101988467,,
30.0,disc,1.0,"I'm glad to see we share the same view on the importance of a balanced approach that doesn't sacrifice human needs for climate agendas. By emphasizing innovation and practical solutions, we can drive progress that supports both economic stability and environmental sustainability. It's essential that our efforts to address climate challenges do not come at the cost of worsening the very conditions of humanity that we strive to improve.",2.2443353835611854,2.022975577776855,0.10945792123162126,,,2.0,"Absolutely, it's vital that our strategies to combat climate challenges enhance, rather than hinder, human development. Focusing on pragmatic solutions and innovative technologies can yield progress in both economic and environmental arenas, ensuring we uplift communities while addressing ecological concerns. Ultimately, a collaborative approach that prioritizes human welfare will lead to more effective and sustainable outcomes for our planet and its inhabitants.",2.1326167294431833,2.9933072240274345,0.04018561725518506,,
30.0,disc,1.0,"I completely agree that any strategies we pursue must be synergistic, aiming to uplift communities while also addressing ecological issues. Collaborative approaches that prioritize human welfare have the potential to yield innovative solutions that benefit both the economy and the environment. By fostering an environment where technology and human development go hand in hand, we can work towards truly sustainable outcomes for everyone.",2.18466154685643,2.777745679509859,0.5335912638844768,,,2.0,"I’m glad to hear you emphasize the importance of synergy in our strategies, as it’s crucial for fostering solutions that genuinely benefit both people and the planet. By integrating technology with human development, we can create a pathway that simultaneously addresses immediate needs and long-term sustainability. This balanced focus can help us build resilient communities that thrive economically while also taking care of our environmental responsibilities.",2.270599428831071,2.9968308263567875,0.021472710505304752,,
30.0,disc,1.0,"It's encouraging to see such strong support for the idea of integrating technology with human development to create effective solutions. A focus on resilience not only benefits our communities but also ensures that we can meet our environmental responsibilities without compromising immediate human needs. By promoting this synergy, we're setting the stage for a future where economic growth and ecological stewardship go hand in hand.",1.9685276072595037,2.3208184302495587,0.6275247738333926,,,2.0,"It's truly inspiring to see this collective commitment to fostering a resilient future for our communities while balancing economic growth with ecological stewardship. By promoting innovative solutions that prioritize human needs alongside environmental responsibilities, we can create a sustainable framework for progress. This integrated approach not only addresses the challenges we face today but also lays the groundwork for a thriving and adaptable society in the long run.",2.1242443957257917,2.731171556698657,0.5830940044119779,,
30.0,disc,1.0,"I appreciate your enthusiasm for this integrated approach, as it truly reflects our shared vision for a resilient and adaptable future. By prioritizing innovative solutions that consider both human and ecological needs, we can create a sustainable framework that empowers communities today and builds a stronger foundation for the future. Together, we can ensure that our efforts not only meet the challenges of the present but also spark lasting progress for generations to come.",7.519286661609167e+53,2.5621196634158587,0.6857973388775347,,,2.0,"Thank you for your kind words; it's encouraging to see such passionate alignment on this important issue. By focusing on innovative solutions that empower communities and address ecological needs, we are indeed paving the way for a more resilient future. This collaborative spirit will enable us to tackle current challenges while cultivating a legacy of sustainable progress for generations to come.",2.0703672642561153,2.999999927108078,0.0024684616774891996,,
