ID,TEXT_TYPE,INIT_OP_A,TEXT_A,PPL_A,PROBE_INT_A,H_INT_A,PROBE_EXT_A,H_EXT_A,INIT_OP_B,TEXT_B,PPL_B,PROBE_INT_B,H_INT_B,PROBE_EXT_B,H_EXT_B
310.0,tot,3.0,"Climate change is a complex issue that prompts a wide range of opinions and perspectives. On one hand, there are compelling arguments about the environmental impacts and potential risks to ecosystems and human health. On the other hand, some people raise questions about the effectiveness of proposed solutions and the economic ramifications. It's important to consider multiple viewpoints and the nuances involved in discussions surrounding this topic. Awareness and dialogue may help in addressing the various challenges associated with climate change, regardless of individual stance.",1.1184143848705653e+47,4.006692851261585,0.04017960857539123,,,3.0,"Climate change is a complex issue that prompts a wide range of opinions and perspectives. On one hand, there are compelling arguments about the environmental impacts and potential risks to ecosystems and human health. On the other hand, some people raise questions about the effectiveness of proposed solutions and the economic ramifications. It's important to consider multiple viewpoints and the nuances involved in discussions surrounding this topic. Awareness and dialogue may help in addressing the various challenges associated with climate change, regardless of individual stance.",1.0932154377284367e+47,4.014063627033353,0.07393387721677512,,
310.0,disc,3.0,"Climate change is an intricate issue that invites a diverse array of opinions and perspectives, reflecting the complexity of our global systems. It's crucial to acknowledge the compelling evidence regarding environmental impacts and health risks while also considering the economic implications of various proposed solutions. Engaging in thoughtful dialogue that incorporates multiple viewpoints will be essential for navigating the challenges posed by climate change effectively.",2.0108002656435655,4.999999730042138,4.353070475149139e-06,,,3.0,"I completely agree with your assessment of climate change as a multifaceted issue that necessitates an inclusive dialogue. It's vital to balance the urgency of environmental and health concerns with an understanding of the economic implications that solutions may bring. By fostering a space for diverse opinions, we can better navigate the challenges and develop more effective strategies to address this pressing issue.",1.7466515190229916,4.999999057755336,1.401588975041155e-05,,
310.0,disc,3.0,"Thank you for your thoughtful response; I appreciate your emphasis on the importance of inclusive dialogue. Balancing environmental urgency with economic considerations is indeed a delicate task, and it requires careful examination of all potential impacts. By creating a space where diverse opinions can be shared, we enhance our ability to develop holistic and effective strategies to tackle climate change together.",1.6353859410061962,4.999999997664407,4.8755504592621106e-08,,,3.0,"Thank you for your kind words; I appreciate your acknowledgment of the need for a balanced approach. The interplay between environmental and economic factors is certainly intricate, and thorough examination is essential in finding workable solutions. Together, by encouraging open conversations and sharing insights, we can pave the way for more comprehensive strategies that address the diverse aspects of climate change.",2.0573051335729167,4.999999997001039,6.185356687312326e-08,,
310.0,disc,3.0,"I completely agree; open conversations and the sharing of insights are vital for developing comprehensive strategies. It's encouraging to see that we all recognize the intricate nature of the relationship between environmental and economic factors. By collaborating and exchanging ideas, we can foster innovative solutions that address the multifaceted challenges posed by climate change while considering the needs of both people and the planet.",1.8095046324179296,4.999999992805867,1.420841263297355e-07,,,3.0,"I'm glad to hear we share a mutual understanding of the importance of collaboration in this dialogue. Recognizing the intertwined relationship between environmental and economic factors is indeed crucial to fostering innovative solutions that benefit both people and the planet. By continuing to exchange ideas and perspectives, we can build a more resilient approach to tackling the multi-layered challenges of climate change.",1.8950946716006265,4.999999998896744,2.38579115736004e-08,,
310.0,disc,3.0,"I appreciate your commitment to collaboration; it's reassuring to engage with others who share this understanding. The interconnectedness of environmental and economic factors truly underscores the necessity for innovative and resilient solutions. As we continue to exchange ideas and perspectives, I believe we can forge a path that not only addresses the complexities of climate change but also fosters sustainable development for present and future generations.",1.9674430649588937,4.99999999505555,9.950706579873616e-08,,,3.0,"Thank you for your thoughtful reply; it's uplifting to connect with others who value collaboration as much as I do. Your emphasis on the importance of sustainable development alongside climate solutions resonates deeply, as we must ensure that our actions today do not compromise the needs of future generations. By maintaining this dialogue and focusing on innovative approaches, we can indeed pave the way for a more sustainable future that benefits both people and the planet.",1.6521705327747527,4.99999999983081,3.975960098542307e-09,,
310.0,disc,3.0,"Thank you for your kind words; it's inspiring to engage with others who prioritize sustainable development in our discussions. Ensuring that our actions support the needs of future generations is not only a moral obligation but also a foundational principle for effective climate solutions. By continuing this dialogue and exploring innovative approaches, we can collectively work towards a future that harmonizes ecological health with human well-being.",1.6417660369141818,4.999999999721053,6.415776557209033e-09,,,3.0,"I completely agree; prioritizing sustainable development is indeed a moral obligation that can guide us toward more effective climate solutions. Balancing ecological health with human well-being is essential for creating a future that supports all members of our global community. By maintaining our commitment to dialogue and innovation, we can drive meaningful change and ensure a healthier planet for generations to come.",1.8128405005602815,4.999999999540094,1.0347874506693745e-08,,
