ID,TEXT_TYPE,INIT_OP_A,TEXT_A,PPL_A,PROBE_INT_A,H_INT_A,PROBE_EXT_A,H_EXT_A,INIT_OP_B,TEXT_B,PPL_B,PROBE_INT_B,H_INT_B,PROBE_EXT_B,H_EXT_B
312.0,tot,3.0,"Climate change is a complex issue that prompts a wide range of opinions and perspectives. On one hand, there are compelling arguments about the environmental impacts and potential risks to ecosystems and human health. On the other hand, some people raise concerns about economic implications, energy policies, and technological feasibility. It's important to consider multiple viewpoints and the interplay of scientific data, societal needs, and policy decisions in any discussion about climate change. Ultimately, further dialogue and research are crucial for informed decision-making.",2.0430830551655155,4.999664649945813,0.003018206806392461,,,3.0,"Climate change is a complex issue that prompts a wide range of opinions and perspectives. On one hand, there are compelling arguments about the environmental impacts and potential risks to ecosystems and human health. On the other hand, some people raise questions about the effectiveness of proposed solutions and the economic ramifications. It's important to consider multiple viewpoints and the nuances involved in discussions surrounding this topic. Awareness and dialogue may help in addressing the various dimensions of climate change.",1.7747804425906978e+50,4.9859363726713415,0.07393387358667293,,
312.0,disc,3.0,"Climate change is a multifaceted issue that encompasses not only environmental concerns but also economic and social dimensions. As we navigate this complex landscape, it's crucial to engage with diverse perspectives to better understand the implications for both ecosystems and human society. I believe that fostering open dialogue and supporting ongoing research will allow us to make informed decisions that balance ecological sustainability with economic viability.",1.6565326761494126,4.999999958600624,7.451887593943125e-07,,,3.0,"I completely agree that climate change is a multifaceted issue that extends beyond just environmental concerns to include economic and social dimensions. Engaging with diverse perspectives is essential to gain a holistic understanding of its implications for both ecosystems and human society. By fostering open dialogue and supporting ongoing research, we can work towards solutions that effectively balance ecological sustainability with economic viability.",1.410346383242365,4.999995214905151,6.340251785403617e-05,,
312.0,disc,3.0,"I'm glad to hear that we share a common understanding of the complexities surrounding climate change. It's encouraging to know that there is a commitment to engaging in open dialogue, as this collaboration is key to addressing the diverse challenges we face. By collectively exploring innovative solutions, we can strive toward a future that harmonizes environmental integrity with the needs of our societies.",2.0547554332056372,4.999999998394772,3.411109601708488e-08,,,3.0,"I appreciate your enthusiasm for the importance of collaboration in addressing the complexities of climate change. Together, as we explore innovative solutions, we can create a more comprehensive approach that respects both environmental integrity and societal needs. It’s through this collective effort that we can hope to navigate the challenges we face and move toward a sustainable future for all.",1.773800870419578,4.999999971546652,5.228302566312981e-07,,
312.0,disc,3.0,"Thank you for your thoughtful response; I completely agree that collaboration is vital for developing a more comprehensive approach to climate change. By pooling our knowledge and resources, we can identify solutions that address both immediate challenges and long-term sustainability goals. It's inspiring to envision a future where our collective efforts not only protect the environment but also enhance the well-being of communities worldwide.",1.5406716389370319,4.99999999902638,2.117623570367898e-08,,,3.0,"Thank you for your kind words; I share your optimism about the potential of our collective efforts in tackling climate change. By pooling our knowledge and resources, we can indeed address both immediate challenges and long-term sustainability goals more effectively. Envisioning a future where environmental protection goes hand-in-hand with community well-being encourages a more inclusive and resilient approach to the complex issues we face.",1.5698064355089842,4.999999999641825,8.148476568753498e-09,,
312.0,disc,3.0,"I'm grateful for your shared optimism, as it truly fosters a sense of community in our efforts against climate change. An inclusive and resilient approach is essential, as it ensures that the solutions we devise are equitable and considerate of diverse perspectives. Together, by maintaining this collaborative spirit, we can work towards innovative strategies that not only protect our environment but also uplift communities across the globe.",2.0701088734987048,4.999999999594134,9.182700339296647e-09,,,3.0,"I appreciate your emphasis on the importance of inclusivity and resilience in our approach to climate change solutions. Ensuring that we consider diverse perspectives will indeed lead to more equitable outcomes that benefit all communities. By nurturing this collaborative spirit, we can foster innovative strategies that not only protect our planet but also empower people around the world.",1.6104297779815024,4.999999999782756,5.050922855081042e-09,,
312.0,disc,3.0,Thank you for highlighting the significance of inclusivity in our discussions about climate change; it's a foundational element for achieving genuine progress. Empowering communities through equitable solutions not only strengthens our response to environmental challenges but also builds a sense of ownership and responsibility among individuals. I'm excited to explore how this collaborative spirit can drive forward-thinking strategies that benefit both the planet and its inhabitants.,1.8165027634954136,4.999999999868235,3.1294220393758895e-09,,,3.0,"I completely agree that inclusivity is a foundational element for making meaningful progress in addressing climate change. By empowering communities with equitable solutions, we not only enhance our collective response to environmental challenges but also foster a sense of ownership that can lead to greater engagement and responsibility among individuals. I'm equally excited about the possibilities that this collaborative spirit brings in developing forward-thinking strategies that truly benefit both our planet and its inhabitants.",1.5242354927187896,4.999999999753831,5.692674144793188e-09,,
