ID,TEXT_TYPE,INIT_OP_A,TEXT_A,PPL_A,PROBE_INT_A,H_INT_A,PROBE_EXT_A,H_EXT_A,INIT_OP_B,TEXT_B,PPL_B,PROBE_INT_B,H_INT_B,PROBE_EXT_B,H_EXT_B
340.0,tot,3.0,"Climate change is a complex issue that elicits a wide range of opinions and perspectives. On one hand, there is significant scientific evidence suggesting changes in climate patterns and potential impacts on ecosystems, weather events, and human health. On the other hand, the approaches to address these changes, the economic implications, and the effectiveness of various solutions are subjects of ongoing debate. The discussion around climate change involves not just environmental aspects, but also social, political, and economic dimensions, making it a multifaceted topic worthy of careful consideration. It’s essential to engage in open dialogue and explore diverse viewpoints to navigate the intricacies of this issue.",1.7862071954529544,4.995929862207153,0.026464201285588976,,,4.0,"Climate change is one of the most pressing issues of our time, posing serious threats to ecosystems, economies, and human health. The scientific consensus is clear: human activities, particularly the burning of fossil fuels, are driving unprecedented changes in our climate. These changes result in extreme weather events, rising sea levels, and altered agricultural patterns, impacting food security and biodiversity. 

Addressing climate change requires urgent collective action, including reducing greenhouse gas emissions, transitioning to renewable energy, and promoting sustainable practices. Furthermore, it necessitates global cooperation and equitable solutions to support vulnerable communities most affected by climate impacts. The time to act is now—our planet’s future depends on it.",1.59949795314746,4.999999999996021,1.0842669486252715e-10,,
340.0,disc,3.0,"Climate change is undeniably a pressing challenge that intertwines scientific, social, and economic factors, prompting diverse opinions on how best to address it. As we engage in this discussion, it's crucial to acknowledge the overwhelming scientific consensus on the reality of climate change while also considering the various strategies and policies that could mitigate its impacts. I invite everyone to share their perspectives on both the evidence of climate change and the potential solutions we can explore together.",1.777225163082883,4.999999997353426,5.491640285703344e-08,,,4.0,"I wholeheartedly agree that acknowledging the scientific consensus on climate change is essential for productive dialogue. It's important that our conversations also prioritize actionable strategies, such as reducing greenhouse gas emissions and transitioning to renewable energy sources. By exploring equitable solutions that support the most vulnerable communities, we can work together more effectively to address this urgent crisis and protect our planet for future generations.",2.146268971114906,5.0,0.0,,
340.0,disc,3.0,"I appreciate your emphasis on actionable strategies and the need for equitable solutions, as these elements are vital in ensuring that our efforts to combat climate change are inclusive and effective. Transitioning to renewable energy sources while reducing greenhouse gas emissions can create significant opportunities for innovation and job creation, which is essential for garnering broader support. Moreover, addressing the needs of vulnerable communities not only enhances resilience but also fosters a sense of solidarity as we tackle this global challenge together.",1.6031525080896818,4.999999999996901,8.521756168202174e-11,,,4.0,"Thank you for highlighting the potential for innovation and job creation through the transition to renewable energy; this aspect can indeed galvanize wider public support for climate initiatives. By framing climate action as not just an environmental necessity but also an economic opportunity, we can inspire a collective movement toward sustainable practices. Furthermore, fostering solidarity and resilience among communities will be crucial as we work to ensure that no one is left behind in our efforts to create a more sustainable future for all.",1.7621314147089784,5.0,0.0,,
340.0,disc,3.0,"You raise an important point about framing climate action as an economic opportunity, as this perspective can inspire greater engagement and investment in sustainable practices. By uniting the narrative of environmental necessity with economic benefits, we can attract a diverse range of stakeholders, including businesses and policymakers, to collaborate on effective solutions. Ultimately, fostering solidarity and ensuring that all communities benefit from this transition will be key to building a sustainable future that is equitable and resilient for everyone.",1.7800186459471747,4.99999999999344,1.7548535115825122e-10,,,4.0,"Absolutely, uniting the narratives of environmental necessity and economic opportunity is crucial for attracting a broad coalition of stakeholders. When businesses and policymakers recognize the tangible benefits of sustainable practices, it fosters innovation and encourages collaborative solutions that can accelerate our transition to a low-carbon economy. Ensuring that all communities reap the rewards of this transition not only enhances social equity but also strengthens our collective resilience in the face of climate challenges.",1.948783058090412,4.999999999994891,1.3794533904319263e-10,,
340.0,disc,3.0,"I completely agree that fostering collaboration among businesses, policymakers, and communities is essential for accelerating our transition to a low-carbon economy. The recognition of tangible benefits from sustainable practices can indeed drive innovation and lead to groundbreaking solutions that address both environmental and economic concerns. By prioritizing social equity in this transition, we not only promote fairness but also create a stronger foundation for resilience against the ongoing challenges posed by climate change.",1.5019163725436369,4.99999999985069,3.5274361580857058e-09,,,4.0,"Your insights highlight the critical role that collaboration plays in driving meaningful change in our approach to climate action. By fostering partnerships across sectors, we can leverage diverse expertise and resources to create innovative solutions that align with both environmental and economic goals. Prioritizing social equity not only improves fairness but also ensures that our resilience strategies are robust and inclusive, ultimately benefiting everyone as we confront the climate crisis together.",8.445248932616919e+55,4.999999999990455,2.5175029259165233e-10,,
340.0,disc,3.0,"Thank you for reinforcing the importance of collaboration across sectors; it truly is a cornerstone for achieving meaningful progress in our climate initiatives. By bringing together diverse expertise and resources, we have the potential to develop comprehensive solutions that can meet both environmental objectives and economic needs. Additionally, ensuring that our resilience strategies are robust and inclusive will strengthen our collective ability to navigate the complexities of the climate crisis, fostering a more sustainable future for all.",1.9316740308654035,4.999999999996901,8.521756168197053e-11,,,4.0,"I appreciate your thoughtful response and your recognition of collaboration as a cornerstone in our climate initiatives. Developing comprehensive solutions that address both environmental and economic needs will be essential for creating lasting impact and encouraging widespread support. By prioritizing inclusivity in our resilience strategies, we can ensure that our progress is not only effective but also equitable, paving the way for a sustainable future that benefits everyone in our global community.",1.880057285487416,4.999999999994211,1.5558896398861616e-10,,
