ID,TEXT_TYPE,INIT_OP_A,TEXT_A,PPL_A,PROBE_INT_A,H_INT_A,PROBE_EXT_A,H_EXT_A,INIT_OP_B,TEXT_B,PPL_B,PROBE_INT_B,H_INT_B,PROBE_EXT_B,H_EXT_B
353.0,tot,3.0,"Climate change is a complex issue that prompts a wide range of opinions and perspectives. On one hand, there are compelling arguments about the environmental impacts and potential risks to ecosystems and human health. On the other hand, some people raise questions about the effectiveness of proposed solutions and the economic ramifications. It's important to consider multiple viewpoints and the various implications of climate-related policies and actions. Ultimately, the conversation around climate change involves balancing scientific data, economic factors, and societal values.",1.9705637324060798,4.989013057619991,0.06048898572012438,,,5.0,"Climate change is one of the most pressing issues of our time, affecting not only the environment but also public health, economies, and social equity. The evidence is undeniable—rising temperatures, extreme weather events, and melting ice caps are all consequences of human activity. Urgent action is needed, not just from governments but also from individuals and businesses to reduce carbon emissions and shift towards sustainable practices. The time to act is now, as the longer we wait, the more severe the repercussions will be for future generations. It's essential to foster awareness and advocate for policies that prioritize the planet's health. Every action counts.",1.8637043079974864,4.999999999994891,1.3794533904351392e-10,,
353.0,disc,3.0,"Climate change is an intricate issue that intersects with environmental science, economics, and social values, creating a diverse array of opinions and solutions. It's crucial that we examine both the scientific evidence regarding climate impacts and the socioeconomic implications of various policy options. As we engage in this discussion, let's be open to different perspectives and consider how we can collectively address this pressing global challenge.",2.0779348614850877,4.99999998655959,2.570478368536811e-07,,,5.0,"I completely agree that climate change is a multifaceted issue that demands a comprehensive approach, considering both scientific evidence and socioeconomic factors. However, it's important to emphasize that while diverse perspectives are valuable, the overwhelming scientific consensus urges us to prioritize urgent action based on clear evidence of the impacts of climate change. Together, we must advocate for solutions that not only mitigate environmental damage but also promote social equity and economic resilience, ensuring a sustainable future for all.",1.7073801731928941,4.999999999987744,3.2018966852877686e-10,,
353.0,disc,3.0,"You bring up a critical point about the urgency of addressing climate change in light of the overwhelming scientific consensus. It’s essential that any solutions we pursue not only tackle environmental issues but also actively foster social equity and economic resilience, ensuring no community is left behind. By prioritizing a holistic approach that integrates these values, we can work towards a sustainable future that benefits both the planet and its inhabitants.",1.8737246700382926,4.999999997001039,6.185356687302753e-08,,,5.0,"I'm glad to hear that we share a commitment to a holistic approach in addressing climate change. It’s vital that as we pursue sustainability, we actively include marginalized communities in the conversation, ensuring they have both a voice and resources to adapt and thrive. Moreover, integrating climate justice into our solutions will not only enhance the effectiveness of our efforts but also build a more equitable and resilient society for everyone.",9.187381044084557e+55,4.999999999990455,2.5175029258773827e-10,,
353.0,disc,3.0,"Absolutely, including marginalized communities in the climate conversation is essential for both effective action and social justice. By ensuring that these communities have a voice and access to resources, we create solutions that are not only equitable but also more sustainable in the long term. Integrating climate justice into our strategies will indeed strengthen our collective resilience and foster a sense of shared responsibility towards a healthier planet and society.",1.7179360452947812,4.999999999721053,6.415776557201965e-09,,,5.0,"You're spot on about the importance of shared responsibility and the long-term benefits of equitable solutions. By actively engaging marginalized communities, we can uncover unique insights and innovative ideas that improve our collective response to climate change. Ultimately, fostering collaboration across all sectors of society will empower us to build a more sustainable and just future, one where every individual has the opportunity to contribute to and benefit from a healthier planet.",1.6556518652838907e+55,4.99999999999344,1.7548535115771306e-10,,
353.0,disc,3.0,"I completely agree that engaging marginalized communities can unlock valuable insights and innovative approaches that may otherwise be overlooked. Collaborative efforts across all sectors of society not only enrich our solutions but also foster a sense of ownership and commitment to climate action among everyone involved. By working together, we can create a more inclusive and sustainable future that leverages the strengths and perspectives of all individuals.",1.8750784799430606,4.999999999996021,1.084266948628742e-10,,,5.0,"Absolutely, the sense of ownership and commitment that arises from inclusive collaboration is crucial to driving meaningful climate action. By tapping into the diverse strengths and perspectives of all individuals, we're better equipped to tackle the complexity of climate change and its impacts on various communities. Together, we can cultivate a culture of shared stewardship that highlights the importance of every contribution, ensuring our efforts are both innovative and widely supported.",1.0101115265709568e+56,5.0,0.0,,
353.0,disc,3.0,"You make an excellent point about the role of shared stewardship in fostering a culture of collective responsibility for climate action. Recognizing and valuing each contribution not only enhances the effectiveness of our initiatives but also strengthens community ties and support for those efforts. As we continue to work together, let's remain focused on embracing diversity as a source of strength, enabling us to create innovative solutions that resonate with and uplift all communities.",1.988367510187773,4.999999999721053,6.415776557202464e-09,,,5.0,"I wholeheartedly agree that embracing diversity is a powerful catalyst for innovation in our climate initiatives. By valuing each contribution and leveraging the unique strengths within our communities, we can develop solutions that are not only effective but also culturally relevant and widely embraced. Moving forward, it's essential that we celebrate this diversity as it enriches our collective efforts and empowers us to create a truly inclusive and resilient future for everyone.",1.826445367028653,4.999999999996901,8.521756168169404e-11,,
