ID,TEXT_TYPE,INIT_OP_A,TEXT_A,PPL_A,PROBE_INT_A,H_INT_A,PROBE_EXT_A,H_EXT_A,INIT_OP_B,TEXT_B,PPL_B,PROBE_INT_B,H_INT_B,PROBE_EXT_B,H_EXT_B
358.0,tot,3.0,"Climate change is a complex issue that elicits a range of opinions and perspectives. On one hand, there are compelling arguments and scientific evidence highlighting significant environmental changes and potential impacts on ecosystems, weather patterns, and human health. On the other hand, there are discussions around economic consequences, energy policies, and varying priorities among different regions and communities. Ultimately, the conversation around climate change is multifaceted, involving science, politics, and social considerations, making it a topic that warrants careful thought and diverse viewpoints.",1.8990161936504801,4.994779874308407,0.032639458058451476,,,5.0,"Climate change is one of the most pressing issues of our time, affecting not only the environment but also public health, economies, and social equity. The evidence is undeniable—rising temperatures, extreme weather events, and melting ice caps are all consequences of human activity. Urgent action is needed, not just from governments but also from individuals and businesses to reduce carbon emissions and shift towards sustainable practices. The time to act is now, as the longer we wait, the more severe the repercussions will be for future generations. It's essential to foster awareness and advocate for policies that prioritize the planet's health. Every step towards sustainability is a step towards a viable future.",1.8855758780865008,4.99999999999787,5.936771729735196e-11,,
358.0,disc,3.0,"Climate change is an intricate issue that affects every facet of our lives, from the environment to our economies. It's crucial to acknowledge the scientific findings that outline the serious impacts on ecosystems and human health while also considering the diverse economic and political contexts that shape our responses to this challenge. As we engage in this conversation, I encourage everyone to share their perspectives and insights, fostering a balanced dialogue that reflects the complexity of climate change.",2.1058361376172203,4.999999967758133,5.884140610491289e-07,,,5.0,"I completely agree that climate change is a complex issue that touches all aspects of life. However, while it's important to discuss the diverse economic and political contexts, we must also recognize the urgency of the situation; delaying action only exacerbates the challenges we face. Let's prioritize science-based solutions and collective responsibility, as this is fundamental to fostering a sustainable future for generations to come.",2.1172002116353377,5.0,0.0,,
358.0,disc,3.0,"You raise an important point about the urgency of addressing climate change, and I wholeheartedly agree that timely action is essential to mitigating its impacts. While pursuing science-based solutions is crucial, we must also navigate the varying priorities and capacities of different regions and communities to ensure that our efforts are equitable and inclusive. Fostering collective responsibility not only empowers individuals and communities but also highlights the interconnected nature of our global response to this pressing challenge.",1.812723837714345,4.999999999540094,1.0347874506687645e-08,,,5.0,"Absolutely, it's vital that our approach to addressing climate change is equitable and inclusive, recognizing the unique challenges faced by different regions and communities. By embracing local contexts and empowering marginalized voices, we can create solutions that not only mitigate climate impacts but also promote social equity. This interconnectedness is at the heart of our collective responsibility, and the more we collaborate internationally, the stronger our response will be in ensuring a sustainable future for all.",2.133751543059895,4.9999999999915765,2.232218098673805e-10,,
358.0,disc,3.0,"I appreciate your emphasis on equity and inclusivity in our climate change strategies; it's crucial to recognize that marginalized communities often bear the brunt of environmental impacts while having the least resources to adapt. Empowering local voices and tailoring solutions to specific contexts can lead to more effective and just approaches, ensuring that we address both climate and social challenges simultaneously. International collaboration is indeed vital, as sharing knowledge and resources strengthens our collective capacity to build a sustainable and resilient future for everyone.",1.8162188200841547,4.999999999996021,1.0842669486292544e-10,,,5.0,"You’ve highlighted a critical aspect of our climate response—marginalized communities not only face the greatest risks but often lack the resources needed to adapt effectively. By genuinely empowering these voices and incorporating local knowledge into decision-making, we can create solutions that are not only just but also more impactful. International collaboration is essential, as it allows us to share successful strategies and technologies, fostering a united front against climate change while promoting equity and resilience across all communities.",2.026620155795535,5.0,0.0,,
358.0,disc,3.0,"You've captured the essence of effective climate action perfectly; empowering marginalized communities and incorporating their knowledge can lead to truly transformative solutions. By fostering a more inclusive decision-making process, we not only enhance the effectiveness of our responses but also ensure that all voices contribute to shaping a sustainable future. Sharing successful strategies and technologies through international collaboration is indeed the way forward, as it helps us build resilience and equity across diverse communities while tackling the global challenge of climate change together.",1.9536301204554412,4.999999999997587,6.697085695718339e-11,,,5.0,"Thank you for your insightful observations; they underscore the importance of inclusivity in crafting effective climate solutions. By valuing diverse perspectives, we can harness the innovative potential within marginalized communities and create more robust responses to climate challenges. Ultimately, our collective efforts will not only address the environmental crisis but also pave the way for a more equitable society, where everyone has a stake in shaping a sustainable future.",2.0825339916246177,4.999999999992566,1.979216765093367e-10,,
358.0,disc,3.0,"I appreciate your thoughtful response, and I agree that valuing diverse perspectives can unlock a wealth of innovative solutions to climate challenges. Harnessing the creativity and insights of marginalized communities not only strengthens our environmental responses but also fosters a sense of ownership and agency among those who are often overlooked. As we work together toward a more equitable society, it's essential to ensure that everyone has the opportunity to participate in shaping a sustainable future, reinforcing the idea that climate action and social justice are inherently linked.",1.6972127325247368,4.999999999897382,2.462851117392009e-09,,,5.0,"I completely resonate with your points about ownership and agency; when marginalized communities are actively involved in climate action, it empowers them and strengthens the overall effectiveness of our solutions. The intersection of climate action and social justice is clear—addressing one without the other compromises our efforts to create a sustainable future for all. By fostering an inclusive environment, we can ensure that every individual has the opportunity to contribute, ultimately leading to a more resilient planet and equitable society.",2.030077204992118,4.99999999999344,1.754853511573246e-10,,
