ID,TEXT_TYPE,INIT_OP_A,TEXT_A,PPL_A,PROBE_INT_A,H_INT_A,PROBE_EXT_A,H_EXT_A,INIT_OP_B,TEXT_B,PPL_B,PROBE_INT_B,H_INT_B,PROBE_EXT_B,H_EXT_B
426.0,tot,4.0,"Climate change is one of the most pressing issues of our time, posing serious threats to ecosystems, economies, and human health. The scientific consensus is clear: human activities, particularly the burning of fossil fuels, are driving unprecedented changes in our climate. These changes result in extreme weather events, rising sea levels, and altered agricultural patterns, impacting food security and biodiversity. 

Addressing climate change requires urgent collective action, including transitioning to renewable energy sources, improving energy efficiency, and promoting sustainable practices. Furthermore, equitable policy-making is essential to support vulnerable communities and ensure a just transition. By prioritizing environmental stewardship and fostering innovation, we can mitigate the impacts of climate change and create a sustainable future for generations to come. Time is of the essence, and the choices we make today will shape the world of tomorrow.",1.6653342417842911,4.999999999937758,1.5249154204400733e-09,,,3.0,"Climate change is a complex issue that prompts a wide range of opinions and perspectives. On one hand, there are compelling arguments about the environmental impacts and potential risks to ecosystems and human health. On the other hand, some people raise questions about the effectiveness of proposed solutions and the economic ramifications. It's important to consider multiple viewpoints and the nuances involved in discussions surrounding this topic. Awareness and dialogue may help in addressing the various challenges associated with climate change, regardless of individual stance.",1.1050221578601967e+47,4.377540674603749,0.6628473378432043,,
426.0,disc,4.0,"Climate change is an urgent global challenge that requires our immediate attention and action. As we witness the increasing frequency of extreme weather events and the tangible impacts on our ecosystems and communities, it's clear that we must unite in our efforts to combat this crisis. Let's explore innovative solutions, equitable policies, and collective commitments that can help us transition towards a more sustainable future.",1.7354470932240322,4.999999999995492,1.2229995742928585e-10,,,3.0,"I appreciate your call to unite and take action against climate change, as it indeed poses significant risks to both our ecosystems and communities. It's vital to explore innovative solutions and equitable policies, but we should also critically examine the potential economic implications of these actions to ensure they are feasible and effective for all stakeholders involved. Engaging in open dialogue about diverse perspectives will ultimately strengthen our collective efforts in addressing this complex issue.",1.8448563476089408,4.499999999749731,0.693147184317161,,
426.0,disc,4.0,I completely agree that examining the economic implications of our climate actions is essential for creating feasible and effective solutions. Balancing environmental sustainability with economic viability is crucial to garnering broad support and ensuring that all stakeholders can participate in the transition toward a greener future. Open dialogue about diverse perspectives not only strengthens our collective efforts but also fosters an inclusive approach that addresses the needs of vulnerable communities while promoting innovations that benefit everyone.,7.174930034964297e+53,5.0,0.0,,,3.0,"I appreciate your insightful response, as balancing environmental sustainability with economic viability is indeed a key factor in achieving widespread support for climate initiatives. It's crucial that we not only consider the needs of vulnerable communities but also ensure that innovative solutions are inclusive and accessible to all. Continued dialogue and collaboration among diverse stakeholders will be essential in navigating the complexities of this issue and in developing strategies that truly benefit both people and the planet.",1.8317503287917223,4.999088948598335,0.00728882626542449,,
426.0,disc,4.0,"Thank you for your thoughtful response; I wholeheartedly agree that inclusivity in our innovative solutions is vital for ensuring that all communities can benefit from a sustainable transition. Collaboration among diverse stakeholders can lead to creative strategies that not only address environmental challenges but also empower marginalized groups economically and socially. By fostering this continued dialogue, we can build a resilient framework to tackle the complexities of climate change while ensuring that no one is left behind.",1.927765047164391,4.999999999979793,5.178002487860019e-10,,,3.0,"Thank you for your engaging perspective; I share your belief that empowering marginalized groups is essential for a fair and effective transition to sustainability. By fostering collaboration among various stakeholders, we can indeed generate creative strategies that address both environmental and social challenges, enhancing resilience in our communities. It’s this inclusive approach that can pave the way for lasting change and ensure that our climate actions benefit everyone, leaving no one behind in the process.",2.100607658760519,4.999999967758133,5.88414061051326e-07,,
426.0,disc,4.0,"I appreciate your agreement and enthusiasm for an inclusive approach to sustainability; it's inspiring to see so much commitment to equity in our climate actions. By prioritizing the empowerment of marginalized groups, we not only enhance resilience but also tap into the diverse perspectives and innovations that can drive meaningful change. Together, we can build a stronger, more equitable movement that truly reflects the needs and aspirations of all communities as we work toward a sustainable future.",1.7637597846671489,4.9999999999915765,2.2322180986825875e-10,,,3.0,"I share your enthusiasm for fostering an equitable approach to sustainability, as it is essential for driving meaningful change and building a movement that genuinely represents all communities. By incorporating the diverse perspectives and ideas of marginalized groups, we can enrich our strategies and create solutions that are not only effective but also resonate on a deeper level with those most affected. Together, through collaboration and mutual support, we can indeed create a more resilient and inclusive framework for the sustainable future we aspire to achieve.",2.2349179966167125,4.999999352405386,9.875818268366139e-06,,
426.0,disc,4.0,"Thank you for reinforcing the importance of including diverse perspectives in our sustainability efforts; their insights are invaluable in creating strategies that resonate with the communities most impacted by climate change. By embracing collaboration and mutual support, we not only enhance our effectiveness but also cultivate a sense of ownership among all stakeholders, fostering a true partnership in this critical work. Together, we can build a resilient framework that not only addresses environmental challenges but also nurtures social equity, ensuring that our collective aspirations for the future are realized.",1.9253167067195311,4.999999999998536,4.135168254544166e-11,,,3.0,"I wholeheartedly agree that embracing diverse perspectives is crucial for developing strategies that genuinely address the needs of those most affected by climate change. Fostering a sense of ownership and partnership among all stakeholders indeed strengthens our collective efforts and enhances our effectiveness in tackling both environmental and social issues. By prioritizing collaboration and mutual support, we can create a resilient framework that not only meets our climate goals but also promotes social equity for a more just and sustainable future.",1.527904852240796,4.999999887464816,1.9130981098712803e-06,,
