ID,TEXT_TYPE,INIT_OP_A,TEXT_A,PPL_A,PROBE_INT_A,H_INT_A,PROBE_EXT_A,H_EXT_A,INIT_OP_B,TEXT_B,PPL_B,PROBE_INT_B,H_INT_B,PROBE_EXT_B,H_EXT_B
427.0,tot,4.0,"Climate change is one of the most pressing issues of our time, posing serious threats to ecosystems, economies, and human health. The scientific consensus is clear: human activities, particularly the burning of fossil fuels, are driving unprecedented changes in our climate. These changes result in extreme weather events, rising sea levels, and altered agricultural patterns, impacting food security and biodiversity. 

Addressing climate change requires urgent collective action, including reducing greenhouse gas emissions, transitioning to renewable energy, and promoting sustainable practices. Furthermore, it necessitates global cooperation and equitable solutions to support vulnerable communities most affected by climate impacts. The longer we delay, the more severe the consequences will be, making it imperative for individuals, governments, and organizations to work together towards a sustainable future.",1.6035447196202417,4.999999999995492,1.222999574291839e-10,,,3.0,"Climate change is a complex issue that prompts a wide range of opinions and perspectives. On one hand, there are compelling arguments about the environmental impacts and potential risks to ecosystems and human health. On the other hand, some people raise questions about the effectiveness of proposed solutions and the economic ramifications. It's important to consider multiple viewpoints and the nuances involved in discussions surrounding this topic. Awareness and dialogue may help in addressing the various challenges associated with climate change, regardless of individual stance.",1.1115861813346906e+47,4.222700143539692,0.5303042679088743,,
427.0,disc,4.0,"Climate change is not just an environmental issue; it is a multifaceted crisis that threatens our ecosystems, economies, and health. We need to address the profound impacts of rising temperatures, extreme weather, and sea-level rise on both natural and human systems. To create sustainable solutions, it is essential that we collaborate across borders, industries, and communities to implement effective strategies for reducing greenhouse gas emissions and promoting resilience in the face of these challenges.",1.6191409577836444e+50,4.999999999996021,1.0842669486292117e-10,,,3.0,"I completely agree that climate change is indeed a multifaceted crisis that touches upon various aspects of our lives and the environment. Collaboration across different sectors and communities is crucial, as diverse perspectives can lead to more effective and innovative solutions. However, it's also important to critically evaluate the proposed strategies and their potential impacts on both the economy and society to ensure a balanced approach to addressing this issue.",1.7740925857271803,4.999989870011893,0.00012662490552008457,,
427.0,disc,4.0,"You make an excellent point about the necessity of critically evaluating proposed strategies, as understanding their economic and social impacts is vital for fostering long-term support and sustainability. Engaging diverse stakeholders not only brings innovative solutions to the table but also helps to identify potential drawbacks and unintended consequences early in the process. As we move forward, we must prioritize transparency and inclusivity in our climate actions to build a more equitable future for all communities affected by the changing climate.",2.190528246387688,5.0,0.0,,,3.0,"I appreciate your insights, particularly on the importance of transparency and inclusivity in our climate actions, as these elements can significantly enhance community trust and participation. Engaging a variety of stakeholders allows for a richer understanding of the challenges we face and can lead to more comprehensive solutions that account for differing needs and perspectives. Ultimately, fostering an equitable approach will not only address the immediate impacts of climate change but also ensure that vulnerable communities are empowered to adapt and thrive in the long run.",1.835486340994429,4.999999953088362,8.385455305530482e-07,,
427.0,disc,4.0,"I completely agree that fostering trust and a sense of ownership among communities is essential for effective climate action. When vulnerable communities are empowered to share their experiences and participate in decision-making processes, we create more robust, tailored solutions that address their unique challenges. This empowerment not only helps mitigate the impacts of climate change but also builds resilience, ensuring that these communities can adapt and thrive amid future environmental shifts.",9.02289572943813e+55,4.999999999998121,5.262677460475884e-11,,,3.0,"You've highlighted a crucial aspect of climate action—the empowerment of vulnerable communities is indeed key to developing tailored solutions that resonate with their specific experiences and needs. By actively involving these communities in decision-making, we not only enhance the effectiveness of our strategies but also cultivate a stronger sense of ownership and responsibility towards the outcomes. Moreover, by fostering resilience in these populations, we can better equip them to navigate the challenges posed by climate change and emerge stronger in the face of future uncertainties.",1.7813004707299722,4.999999988138881,2.283265602393721e-07,,
427.0,disc,4.0,"Your emphasis on ownership and responsibility is spot on; when communities feel invested in the solutions, their commitment to implementing and sustaining them grows significantly. This collaborative approach not only enriches the strategies we develop but also fosters a culture of resilience, enabling communities to adapt to both current and future challenges. Ultimately, empowering vulnerable populations is not just a moral imperative; it is a critical component of an effective climate response that leads to stronger, more adaptable societies.",1.9611276366159989,4.999999999998994,2.879791919506629e-11,,,3.0,"I completely resonate with your perspective on the importance of investment and commitment from communities in implementing climate solutions. This collaborative approach not only enhances the effectiveness of our strategies but also creates a sense of shared responsibility that can lead to long-term sustainability. Moreover, recognizing the empowerment of vulnerable populations as a critical component of our climate response underscores the interconnectedness of social equity and environmental resilience, paving the way for a more adaptable society overall.",1.5793281647870259,4.999999998394772,3.4111096017096134e-08,,
427.0,disc,4.0,"You’ve articulated the connection between social equity and environmental resilience beautifully; it truly underscores the idea that a holistic approach is necessary for meaningful climate action. When we invest in the empowerment of marginalized communities, we are not only addressing environmental challenges but also promoting social justice and equity. This interconnected approach will ultimately yield more sustainable, inclusive solutions that benefit everyone and foster a thriving planet for generations to come.",2.2768676777052486,4.999999999982167,4.5918610667669227e-10,,,3.0,"Thank you for your kind words; it's heartening to see such recognition of the interconnectedness between social equity and environmental resilience. A holistic approach to climate action indeed creates a framework where environmental sustainability goes hand in hand with social justice, leading to more inclusive solutions. By prioritizing the needs and empowerment of marginalized communities, we can build a thriving planet that not only addresses current challenges but also lays the foundation for future generations to thrive in harmony with their environment.",1.831494740871144,4.99999999076255,1.8013026679310342e-07,,
