ID,TEXT_TYPE,INIT_OP_A,TEXT_A,PPL_A,PROBE_INT_A,H_INT_A,PROBE_EXT_A,H_EXT_A,INIT_OP_B,TEXT_B,PPL_B,PROBE_INT_B,H_INT_B,PROBE_EXT_B,H_EXT_B
430.0,tot,4.0,"Climate change is one of the most pressing issues of our time, posing serious threats to ecosystems, economies, and human health. The scientific consensus is clear: human activities, particularly the burning of fossil fuels, are driving unprecedented changes in our climate. These changes result in extreme weather events, rising sea levels, and altered agricultural patterns, impacting food security and biodiversity. 

Addressing climate change requires urgent collective action, including reducing greenhouse gas emissions, transitioning to renewable energy, and promoting sustainable practices. Furthermore, it necessitates global cooperation and equitable solutions to support vulnerable communities most affected by climate impacts. The longer we delay, the more severe the consequences will be, making it imperative for individuals, governments, and organizations to work together towards a sustainable future.",1.6052292648676743,4.999999999977103,5.838822768181262e-10,,,3.0,"Climate change is a complex issue that elicits a wide range of opinions and perspectives. On one hand, there is significant scientific evidence suggesting changes in climate patterns and potential impacts on ecosystems, weather events, and human health. On the other hand, the approaches to address these changes, the economic implications, and the effectiveness of various solutions are subjects of ongoing debate. The discussion around climate change involves not just environmental aspects, but also social, political, and economic dimensions that make it a multifaceted topic. It's essential to consider all viewpoints and data when exploring this issue.",1.7260196684778255,4.880797075764035,0.3653338649874392,,
430.0,disc,4.0,"Climate change is not just an environmental issue; it is a multifaceted crisis that threatens our ecosystems, economies, and health. We need to recognize that the scientific consensus underscores the urgency of transitioning to renewable energy and reducing our greenhouse gas emissions to mitigate these impacts. It's crucial for us to engage in meaningful conversations about equitable solutions that will support the most vulnerable communities facing the dire consequences of climate change.",1.785109907011119,4.999999999994891,1.3794533904280226e-10,,,3.0,"I completely agree that climate change is a multifaceted crisis that goes beyond environmental concerns and encompasses urgent economic, health, and social issues. The scientific consensus indeed emphasizes the need for a rapid transition to renewable energy sources and reducing greenhouse gas emissions as critical steps in addressing these challenges. Additionally, it is vital to engage in conversations that prioritize equitable solutions so that vulnerable communities are supported in adapting to and mitigating the impacts of climate change.",2.021019558499245,4.9999999748900095,4.645348325111003e-07,,
430.0,disc,4.0,"I'm glad to hear that we are on the same page regarding the comprehensive nature of the climate crisis. As we push for rapid transitions to renewable energy and emission reductions, we must also ensure that our strategies are inclusive, allowing those on the front lines to have a voice in decision-making. By focusing on justice and equity in our climate actions, we can build not only a sustainable future but also a more resilient society that uplifts everyone.",2.1289676876756007,4.999999999974054,6.583821993059796e-10,,,3.0,"I appreciate your emphasis on inclusivity in our climate strategies, as it is essential to amplify the voices of those most affected by climate change. Ensuring that marginalized communities have a say in decision-making processes is critical for fostering both justice and equity in our climate actions. By prioritizing these values, we can indeed create a more resilient society that not only addresses the urgent concerns of the climate crisis but also promotes social cohesion and empowerment.",1.716526957746767,4.9999999943972036,1.1205592818096456e-07,,
430.0,disc,4.0,"Absolutely, amplifying the voices of marginalized communities is central to effective climate action and a just transition. When we prioritize justice and inclusivity, we not only enhance our strategies but also empower individuals to take part in shaping the solutions that will directly impact their lives. This collaborative approach can lead to innovative practices that foster resilience while ensuring that no one is left behind in the fight against climate change.",9.166553949696858e+55,4.999999999997265,7.554604336725987e-11,,,3.0,"I wholeheartedly agree that a collaborative approach to climate action fosters empowerment and innovation, enabling communities to participate actively in developing solutions that impact their lives. When diverse perspectives are incorporated into climate strategies, we stand a better chance of creating resilient practices that are effective and grounded in real-world experiences. This ensures that our efforts truly reflect the needs and priorities of those most affected, ultimately leading to a more just and sustainable future for all.",2.6234495311133457,4.999999999996901,8.521756168196756e-11,,
430.0,disc,4.0,"You're absolutely right—diverse perspectives enrich our understanding of the challenges posed by climate change and help to craft solutions that are both relevant and practical for the communities affected. By actively involving those on the ground, we can tailor our efforts to address specific local needs, thereby enhancing the effectiveness of our climate strategies. Ultimately, this inclusive approach not only fosters resilience but also builds a sense of ownership among community members, making our collective fight for a sustainable future even stronger.",2.10660440841186,4.999999999998709,3.665422212007915e-11,,,3.0,"I completely agree that involving diverse perspectives is crucial for creating relevant and practical solutions that resonate with the unique challenges faced by local communities. Tailoring our strategies to address specific needs not only improves their effectiveness but also strengthens the bonds of community ownership and commitment to these initiatives. This sense of collective responsibility is vital for fostering lasting resilience and solidarity in our fight against climate change, ensuring that we tackle these challenges together as a united front.",2.184459773165193,4.999999999997265,7.554604336746056e-11,,
430.0,disc,4.0,"I couldn't agree more—collective responsibility is indeed a cornerstone of effective climate action, as it fosters unity and shared purpose among community members. When people feel a sense of ownership over the solutions being implemented, they are more likely to engage actively and sustain these efforts over time. By working together as a united front, we can harness the collective strength of communities to drive meaningful change and build a more resilient future in the face of climate challenges.",1.5048758593611355,4.999999999999217,2.2623663364293214e-11,,,3.0,"Absolutely, collective responsibility cultivates a strong sense of unity that is essential for driving meaningful climate action. When individuals feel personally invested in the solutions developed, their sustained engagement can lead to innovative practices and a lasting impact on the community's resilience. By harnessing this collective strength, we can effectively address climate challenges and create a more sustainable future that reflects the aspirations and needs of all community members.",1.890999802534376,4.999999999883718,2.7762406224579173e-09,,
