ID,TEXT_TYPE,INIT_OP_A,TEXT_A,PPL_A,PROBE_INT_A,H_INT_A,PROBE_EXT_A,H_EXT_A,INIT_OP_B,TEXT_B,PPL_B,PROBE_INT_B,H_INT_B,PROBE_EXT_B,H_EXT_B
434.0,tot,4.0,"Climate change is one of the most pressing issues of our time, posing serious threats to ecosystems, economies, and human health. The scientific consensus is clear: human activities, particularly the burning of fossil fuels, are driving unprecedented changes in our climate. These changes result in extreme weather events, rising sea levels, and altered agricultural patterns, impacting food security and biodiversity. 

Addressing climate change requires urgent collective action, including reducing greenhouse gas emissions, transitioning to renewable energy, and promoting sustainable practices. Furthermore, it necessitates global cooperation and equitable solutions to support vulnerable communities most affected by climate impacts. The longer we delay, the more severe the consequences will be, making it imperative for individuals, governments, and organizations to work together towards a sustainable future.",1.603263199872855,4.999999999966684,8.37050471212427e-10,,,3.0,"Climate change is a complex issue that prompts a wide range of opinions and perspectives. On one hand, there are compelling arguments about the environmental impacts and potential risks to ecosystems and human health. On the other hand, some people raise questions about the effectiveness of proposed solutions and the economic ramifications. It's important to consider multiple viewpoints and the nuances involved in discussions surrounding this topic. Awareness and dialogue may help in addressing the various challenges associated with climate change, regardless of individual stance.",1.0973391442227293e+47,4.182425514478464,0.47505155715876923,,
434.0,disc,4.0,"Climate change is not just an environmental issue; it is a multifaceted crisis that threatens our ecosystems, economies, and health. We need to address the profound impacts of rising temperatures, extreme weather, and sea-level rise on both natural and human systems. To create sustainable solutions, it is essential that we collaborate across borders, industries, and communities to implement effective strategies for reducing greenhouse gas emissions and promoting resilience in the face of these challenges.",1.624994586291629e+50,4.99999999985069,3.527436158077996e-09,,,3.0,"I completely agree that climate change is indeed a multifaceted crisis that touches upon various aspects of our lives and the environment. Collaboration across different sectors and communities is crucial, as diverse perspectives can lead to more effective and innovative solutions. However, it's also important to critically evaluate the proposed strategies and their potential impacts on both the economy and society to ensure a balanced approach to addressing this issue.",1.795341654968008,4.999972464310155,0.000316660813601724,,
434.0,disc,4.0,"You make an excellent point about the necessity of critically evaluating proposed strategies, as understanding their economic and social impacts is vital for fostering long-term support and sustainability. Engaging diverse stakeholders not only brings innovative solutions to the table but also helps to identify potential drawbacks and unintended consequences, ensuring that our approaches are equitable and effective. By prioritizing transparency and inclusivity in this process, we can build a stronger foundation for addressing climate change that benefits both people and the planet.",1.8756866247858242,4.999999999998121,5.2626774604734726e-11,,,3.0,"I appreciate your thoughtful response, and I agree that transparency and inclusivity are key to fostering long-term support for climate initiatives. Engaging a broad range of stakeholders can indeed illuminate both the strengths and weaknesses of different strategies, enabling us to create more comprehensive solutions. Ultimately, addressing climate change effectively requires not only innovative ideas but also a commitment to equitable practices that consider the diverse needs and perspectives of affected communities.",1.8612452462301328,4.9999999943972036,1.1205592818091027e-07,,
434.0,disc,4.0,"I’m glad to hear you emphasize the importance of equitable practices as we navigate the complexities of climate change. Recognizing and integrating the diverse needs of affected communities is essential for ensuring that our solutions are just and widely supported, particularly for those who are most vulnerable to its impacts. By fostering a collaborative environment where all voices are heard, we can strengthen our collective efforts and develop strategies that not only mitigate climate change but also promote social justice and resilience.",1.848638039844652,4.999999999992566,1.9792167650899265e-10,,,3.0,"I completely resonate with your view on the importance of integrating the needs of vulnerable communities in our climate responses. Ensuring that our solutions are both just and effective is essential for building trust and garnering widespread support. By fostering a truly collaborative environment, we not only enhance our strategies to combat climate change but also create opportunities for social equity and resilience that benefit everyone involved.",1.944859068845123,4.999999998749847,2.687828659969863e-08,,
434.0,disc,4.0,"Absolutely, building trust through inclusive and just climate solutions is crucial for inspiring widespread commitment and action. When vulnerable communities are actively involved in the decision-making process, we empower them to advocate for their own needs and priorities, which enriches our overall responses. This collaborative approach not only strengthens our efforts to combat climate change but also paves the way for sustainable development that uplifts all members of society, creating a more resilient future for everyone.",1.9360255895180876,4.999999999998121,5.262677460474425e-11,,,3.0,"I couldn't agree more that empowering vulnerable communities through their involvement in the decision-making process is a vital step toward more effective climate solutions. Their firsthand experiences and insights can significantly enhance our understanding of local challenges and priorities, leading to more tailored and impactful responses. Ultimately, this collaborative approach not only addresses climate change but also fosters a stronger sense of community and shared responsibility, contributing to a resilient and equitable future for all.",1.802268766090796,4.999999999641825,8.148476568753498e-09,,
434.0,disc,4.0,"You’ve highlighted a key aspect of effective climate action—leveraging the unique perspectives of those most affected to shape our strategies. By prioritizing the input of vulnerable communities, we can ensure that our responses are not only well-informed but also culturally relevant and context-specific, maximizing their effectiveness. This sense of shared responsibility and interconnectedness is essential, as it cultivates a united front in our efforts to tackle climate change while simultaneously building stronger, more resilient communities.",2.0143647478087705,4.999999999994891,1.379453390436835e-10,,,3.0,"You raise an important point about the need for context-specific and culturally relevant strategies in our climate actions. By genuinely prioritizing the perspectives of vulnerable communities, we can create responses that resonate more deeply and yield greater impact. This shared responsibility fosters a sense of interconnectedness that strengthens our collective commitment to addressing climate change while simultaneously enriching the social fabric of our communities.",2.025986637612847,4.999999997664407,4.875550459260844e-08,,
