ID,TEXT_TYPE,INIT_OP_A,TEXT_A,PPL_A,PROBE_INT_A,H_INT_A,PROBE_EXT_A,H_EXT_A,INIT_OP_B,TEXT_B,PPL_B,PROBE_INT_B,H_INT_B,PROBE_EXT_B,H_EXT_B
438.0,tot,4.0,"Climate change is one of the most pressing issues of our time, posing serious threats to ecosystems, economies, and human health. The scientific consensus is clear: human activities, particularly the burning of fossil fuels, are driving unprecedented changes in our climate. These changes result in extreme weather events, rising sea levels, and altered agricultural patterns, impacting food security and biodiversity. 

Addressing climate change requires urgent collective action, including reducing greenhouse gas emissions, transitioning to renewable energy, and promoting sustainable practices. Furthermore, it necessitates global cooperation, as its effects are felt across borders. By prioritizing climate resilience and investing in green technologies, we can create a sustainable future for generations to come. It's imperative that we act now to mitigate the impacts and adapt to the changes that are already occurring.",1.5693939987502197,4.999999999996901,8.521756168197624e-11,,,3.0,"Climate change is a complex issue that prompts a wide range of opinions and perspectives. On one hand, there are compelling arguments about the environmental impacts and potential risks to ecosystems and human health. On the other hand, some people raise questions about the effectiveness of proposed solutions and the economic ramifications. It's important to consider multiple viewpoints and the nuances involved in discussions surrounding this topic. Awareness and dialogue may help in addressing the various challenges associated with climate change, regardless of individual stance.",1.1126864402107033e+47,4.075858175551574,0.26853517912943525,,
438.0,disc,4.0,"Climate change is not just an environmental issue; it is a multifaceted challenge that affects economies, health, and social equity. As we witness more frequent and intense weather events and the ongoing loss of biodiversity, it becomes increasingly clear that urgent action is needed. I believe that a collective, global response—focused on reducing emissions, transitioning to renewable energy, and fostering sustainable practices—is essential for a resilient and thriving future.",1.959947575640403,4.999999999996021,1.0842669486292117e-10,,,3.0,"I agree that climate change is indeed a multifaceted challenge that extends beyond environmental concerns and touches upon economic, health, and social equity issues. The call for urgent action resonates strongly given the escalating impacts we observe, such as extreme weather and biodiversity loss. However, it's also critical to engage in dialogue about the practicality and feasibility of proposed solutions, ensuring that we consider their economic implications and social ramifications for various communities as we work toward a sustainable future.",2.0750939253226997,4.999664649945815,0.003018206806385136,,
438.0,disc,4.0,"You raise an important point about the practicality and feasibility of proposed solutions, and it’s essential that we take a balanced approach when evaluating them. Engaging diverse communities in the dialogue is crucial, as local perspectives can help tailor solutions that consider economic implications and social equity. By prioritizing inclusive discussions and innovative strategies, we can better ensure that our efforts to combat climate change are effective, equitable, and sustainable for all.",1.9370148187677827,4.999999999721053,6.415776557171628e-09,,,3.0,"I appreciate your emphasis on the importance of inclusive discussions and the role of diverse communities in shaping effective solutions to climate change. Tailoring strategies to fit local contexts not only enhances their feasibility but also empowers communities to take ownership of their climate action efforts. As we move forward, fostering collaboration and innovative thinking will be essential in addressing the intertwined issues of climate change, economic stability, and social equity.",1.734199823449478,4.9999999123575085,1.511832964935491e-06,,
438.0,disc,4.0,"Absolutely, empowering communities to take ownership of climate action is vital for a sustainable and impactful response to climate change. Collaboration across sectors and disciplines will drive innovative solutions that not only address environmental challenges but also promote economic stability and social equity. By integrating local knowledge and fostering partnerships, we can create a more resilient framework that benefits both people and the planet.",1.3132000589137209e+63,4.999999999992566,1.979216765099559e-10,,,3.0,"I completely agree that collaboration across sectors is fundamental in devising innovative and impactful solutions to climate change. By integrating local knowledge and fostering partnerships, we can create approaches that are not only effective in mitigating environmental challenges but also enhance economic resilience and social equity. This holistic framework is essential for fostering both community engagement and sustainable outcomes that ultimately benefit both people and the planet.",2.1594379331566707,4.999999997353426,5.491640286036793e-08,,
438.0,disc,4.0,"Your insights truly highlight the interconnectedness of climate action with economic and social well-being. This holistic framework not only fosters community engagement but also empowers individuals and businesses to actively participate in the transition to sustainable practices. By leveraging diverse expertise and resources, we can build a more resilient future that harmonizes ecological health with economic and social prosperity for all.",2.4796980067220367,4.999999999984263,4.071974932065393e-10,,,3.0,"Thank you for capturing the essence of how interconnected climate action is with broader economic and social well-being. Empowering individuals and businesses to engage in sustainable practices is indeed crucial for creating momentum toward a more resilient future. By leveraging diverse expertise and resources, we can foster a collaborative environment that nurtures both ecological health and economic and social prosperity, ensuring that no one is left behind in this critical transition.",1.5133105501432595,4.99999999184798,1.5998340532718405e-07,,
438.0,disc,4.0,"You've articulated an essential aspect of this journey—ensuring that no one is left behind is fundamental to achieving equitable solutions in our climate response. By fostering inclusive collaboration, we can harness the collective strengths of various stakeholders, enabling us to tackle the diverse challenges we face. Ultimately, a shared commitment to sustainability will not only enhance ecological health but also forge stronger, more resilient communities that thrive together.",2.132346748245703,4.999999999989184,2.839184280434794e-10,,,3.0,"I wholeheartedly agree that ensuring no one is left behind is vital for achieving truly equitable solutions in our climate response. By embracing inclusive collaboration, we can capitalize on the diverse strengths and perspectives of various stakeholders, which is essential for addressing the multifaceted challenges of climate change. A shared commitment to sustainability not only benefits our ecological systems but also strengthens the fabric of our communities, fostering resilience that empowers us all to thrive together.",1.5738803723328787,4.999999997938846,4.3284225946966604e-08,,
