ID,TEXT_TYPE,INIT_OP_A,TEXT_A,PPL_A,PROBE_INT_A,H_INT_A,PROBE_EXT_A,H_EXT_A,INIT_OP_B,TEXT_B,PPL_B,PROBE_INT_B,H_INT_B,PROBE_EXT_B,H_EXT_B
440.0,tot,4.0,"Climate change is one of the most pressing issues of our time, posing serious threats to ecosystems, economies, and human health. The scientific consensus is clear: human activities, particularly the burning of fossil fuels, are driving unprecedented changes in our climate. These changes result in extreme weather events, rising sea levels, and altered agricultural patterns, impacting food security and biodiversity. 

Addressing climate change requires urgent collective action, including reducing greenhouse gas emissions, transitioning to renewable energy, and promoting sustainable practices. Furthermore, it necessitates global cooperation and equitable solutions to support vulnerable communities most affected by climate impacts. The longer we delay, the more severe the consequences will be for future generations. It's imperative that we prioritize climate action now to create a sustainable future.",1.640404942972487,4.999999999996488,9.612517162218127e-11,,,3.0,"Climate change is a complex issue that prompts a wide range of opinions and perspectives. On one hand, there are compelling arguments about the environmental impacts and potential risks to ecosystems and human health. On the other hand, some people raise questions about the effectiveness of proposed solutions and the economic ramifications. It's important to consider multiple viewpoints and the nuances involved in discussions surrounding this topic. Awareness and dialogue may help in addressing the various challenges associated with climate change, regardless of individual stance.",1.1095937966216674e+47,4.0474258750422925,0.19086498367639315,,
440.0,disc,4.0,"Climate change represents one of the most urgent challenges we face today, with far-reaching implications for our planet and future generations. It is essential that we recognize the profound impacts of human activities on our climate, particularly through the burning of fossil fuels. As we embark on this discussion, let's focus on actionable solutions that can reduce greenhouse gas emissions and promote sustainable practices for a healthier, more resilient world.",1.6101018099179922,4.999999999996021,1.084266948628742e-10,,,3.0,"I appreciate your emphasis on the urgency of addressing climate change and the role of human activities in exacerbating this issue. While it's crucial to explore actionable solutions for reducing greenhouse gas emissions, we should also acknowledge the complexities involved, including economic consequences and technological challenges. A balanced dialogue that incorporates various perspectives will ultimately strengthen our collective efforts to tackle climate change effectively.",1.9991238487903618,4.939913345595287,0.2272058888064919,,
440.0,disc,4.0,"I completely agree that a balanced dialogue is essential for effectively tackling climate change, and it's important to acknowledge the economic and technological complexities involved. However, we must prioritize the urgency of our response, recognizing that delays in action only exacerbate these challenges. By working collaboratively and embracing innovative solutions, we can navigate these complexities and pave the way for a sustainable future that benefits both the economy and the environment.",1.7594694735607421,4.999999999996488,9.612517162168636e-11,,,3.0,"Your points about prioritizing urgency and collaboration resonate with me, as timely action is indeed crucial in addressing the escalating challenges of climate change. Embracing innovative solutions can be a powerful approach, but we should also consider the varying capacities of different regions and communities to implement these changes effectively. Striking a balance between swift action and thoughtful planning will be key to ensuring that both economic stability and environmental sustainability are achieved together.",1.79065867942981,4.999447221417427,0.004698770844661167,,
440.0,disc,4.0,"You're absolutely right; the varying capacities of regions and communities to implement climate solutions cannot be overlooked. It's crucial to tailor our approaches, ensuring that they are equitable and consider local contexts, while still maintaining a sense of urgency in our actions. By fostering collaboration and sharing resources, we can empower all communities to actively participate in the transition towards a sustainable future, ultimately benefiting both environmental and economic resilience.",1.881752612388925,4.999999999997587,6.697085695704817e-11,,,3.0,"I completely agree that tailoring our approaches to the specific capacities and contexts of different communities is essential for fostering equitable climate solutions. Your emphasis on collaboration and resource sharing is particularly important, as it enables diverse stakeholders to contribute to and benefit from the transition towards sustainability. By empowering communities to engage in this process, we not only enhance environmental resilience but also promote social equity and economic growth, creating a more inclusive path forward.",1.720105829643787,4.999999931743958,1.1944807296498496e-06,,
440.0,disc,4.0,"I'm glad to hear you share my enthusiasm for the importance of empowerment and collaboration in our climate efforts. By facilitating inclusive participation, we can ensure that all voices are heard and that solutions reflect the diverse needs of communities. Ultimately, this approach not only strengthens our collective capacity to address climate change but also fosters a sense of ownership and responsibility, driving us all toward a more resilient and equitable future.",2.051386813895241,4.999999999995492,1.2229995742922583e-10,,,3.0,"I appreciate your focus on the value of inclusive participation, as hearing diverse voices is crucial for developing effective and meaningful climate solutions. This sense of ownership and responsibility can inspire communities to take proactive steps in addressing climate challenges, fostering a deeper connection to the issues at hand. Ultimately, by nurturing this collaborative spirit, we can build a stronger foundation for sustainable practices that benefit both our environment and society at large.",2.093319487268072,4.999999992805867,1.4208412632974468e-07,,
440.0,disc,4.0,"Thank you for highlighting the importance of fostering a deeper connection to climate issues within communities; this emotional investment is vital for driving meaningful action. When individuals feel a sense of ownership over their environment, they are more likely to engage in sustainable practices and advocate for solutions that resonate with their specific circumstances. By nurturing this collaborative spirit and focusing on shared goals, we can create a robust framework for sustainability that not only addresses environmental challenges but also enhances social cohesion and community well-being.",1.5228567387612997,4.999999999984263,4.071974932030867e-10,,,3.0,"I completely agree that fostering an emotional investment in our environment can significantly encourage individuals to adopt sustainable practices and advocate for tailored solutions. By focusing on shared goals, we can cultivate a sense of solidarity within communities, which is essential for both environmental action and social cohesion. This integrated approach not only addresses climate challenges but also nurtures the overall well-being of community members, ultimately leading to a more resilient society.",1.9128468722037637,4.999999836262282,2.722139542616716e-06,,
