ID,TEXT_TYPE,INIT_OP_A,TEXT_A,PPL_A,PROBE_INT_A,H_INT_A,PROBE_EXT_A,H_EXT_A,INIT_OP_B,TEXT_B,PPL_B,PROBE_INT_B,H_INT_B,PROBE_EXT_B,H_EXT_B
442.0,tot,4.0,"Climate change is one of the most pressing issues of our time, posing serious threats to ecosystems, economies, and human health. The scientific consensus is clear: human activities, particularly the burning of fossil fuels, are driving unprecedented changes in our climate. These changes result in extreme weather events, rising sea levels, and altered agricultural patterns, impacting food security and biodiversity. 

Addressing climate change requires urgent collective action, including reducing greenhouse gas emissions, transitioning to renewable energy, and promoting sustainable practices. Furthermore, it necessitates global cooperation and equitable solutions to support vulnerable communities most affected by climate impacts. The longer we delay, the more severe the consequences will be, making it imperative for individuals, governments, and organizations to work together towards a sustainable future.",1.6075912773094188,4.999999999994891,1.3794533904346082e-10,,,3.0,"Climate change is a complex issue that prompts a wide range of opinions and perspectives. On one hand, there are compelling arguments about the environmental impacts and potential risks to ecosystems and human health. On the other hand, some people raise questions about the effectiveness of proposed solutions and the economic ramifications. It's important to consider multiple viewpoints and the nuances involved in discussions surrounding this topic. Awareness and dialogue may help in addressing the various challenges associated with climate change, regardless of individual stance.",1.0936912940830282e+47,4.268941409219097,0.582203103363629,,
442.0,disc,4.0,"Climate change is not just an environmental issue; it is a multifaceted crisis that threatens our ecosystems, economies, and health. We need to address the profound impacts of rising temperatures, extreme weather, and sea-level rise on both natural and human systems. To create sustainable solutions, it is essential that we collaborate across borders, industries, and communities to implement effective strategies for reducing greenhouse gas emissions and promoting resilience in the face of these challenges.",1.6161798117695679e+50,4.999999999996488,9.612517162205587e-11,,,3.0,"I completely agree that climate change is indeed a multifaceted crisis that touches upon various aspects of our lives and the environment. Collaboration across borders and industries is crucial, as solutions must be comprehensive and inclusive to be truly effective. Additionally, while addressing these complex challenges, it's essential to remain open to diverse perspectives on potential strategies, so we can ensure a balanced approach that considers both environmental and economic implications.",2.0757309744909556,4.999995214905151,6.340251785397533e-05,,
442.0,disc,4.0,"I appreciate your insightful response and completely agree that a balanced approach is necessary to effectively tackle climate change. Embracing diverse perspectives not only enriches our discussions but also fosters innovative solutions that can harmonize environmental sustainability with economic development. By ensuring that all voices are heard, particularly those of vulnerable communities, we can create strategies that are equitable, practical, and impactful in addressing this urgent crisis.",1.7293752356109933,4.99999999999886,3.2489752960325046e-11,,,3.0,"Thank you for your thoughtful remarks; I couldn't agree more about the importance of including diverse voices, especially those from vulnerable communities, in our discussions on climate change. Their experiences and insights can lead to more equitable and practical solutions that truly reflect the needs of all stakeholders involved. By fostering an inclusive dialogue, we not only strengthen our collective response but also enhance our chances of creating impactful strategies that benefit both the environment and society as a whole.",1.5627730355419742,4.999999998583391,3.0280012818114284e-08,,
442.0,disc,4.0,"Thank you for highlighting the critical role that inclusive dialogue plays in our climate discussions. Engaging with the experiences of vulnerable communities not only enriches our understanding of the impacts of climate change but also drives us toward solutions that prioritize social justice. Ultimately, by centering their voices, we can ensure that our strategies are both effective and equitable, paving the way for a more sustainable future for all.",1.7072176031634478,4.999999999990455,2.5175029259285955e-10,,,3.0,"You're absolutely right in emphasizing that social justice must be at the forefront of our climate strategies. Centering the voices and experiences of vulnerable communities not only enhances our understanding of the impacts but also fosters a sense of ownership and empowerment among those most affected. By ensuring that our solutions are inclusive and equitable, we can work towards a more sustainable future that benefits everyone, creating a win-win scenario for both people and the planet.",1.715653800811424,4.999999996149258,7.845886642098938e-08,,
442.0,disc,4.0,"I appreciate your agreement on the importance of social justice in our climate strategies; it is indeed essential for fostering ownership and empowerment among affected communities. Creating a win-win scenario requires us to actively involve those most impacted in decision-making processes, ensuring their insights shape the solutions we pursue. By prioritizing inclusivity and equity, we not only honor their experiences but also enhance the overall effectiveness of our climate actions, ultimately leading us toward a more resilient and sustainable future for all.",7.975452104241918e+46,5.0,0.0,,,3.0,"Thank you for reinforcing the significance of actively involving impacted communities in the decision-making processes; their insights are invaluable in shaping effective climate solutions. When we prioritize inclusivity and equity, we not only honor the experiences of those most affected but also create a more robust and well-rounded approach to tackling climate challenges. This participatory method ensures that our actions are not only effective but also resonate with the diverse needs of society, fostering resilience and sustainability for everyone.",1.8508703477647217,4.9999999996839115,7.2305162237888856e-09,,
442.0,disc,4.0,"Thank you for your thoughtful response; I couldn't agree more that a participatory approach is vital for developing effective climate solutions. By integrating the insights of impacted communities, we not only enhance the relevance of our strategies but also build trust and collaboration across diverse stakeholders. This collective effort allows us to address climate challenges in a way that is both effective and genuinely reflective of the diverse needs and aspirations of our society, strengthening our resilience in the face of change.",1.8387936990948182,4.999999999992566,1.9792167650977467e-10,,,3.0,"I appreciate your insights on the importance of building trust and collaboration among diverse stakeholders; it's a crucial aspect of developing effective climate solutions. By integrating the voices of impacted communities and fostering a collective effort, we can truly create strategies that resonate with the needs and aspirations of our society. This not only enhances the relevance of our actions but also fortifies our resilience against the uncertainties posed by climate change, ensuring a more sustainable future for all.",1.7577447376885182,4.999999977840511,4.127204880893034e-07,,
