ID,TEXT_TYPE,INIT_OP_A,TEXT_A,PPL_A,PROBE_INT_A,H_INT_A,PROBE_EXT_A,H_EXT_A,INIT_OP_B,TEXT_B,PPL_B,PROBE_INT_B,H_INT_B,PROBE_EXT_B,H_EXT_B
452.0,tot,4.0,"Climate change is one of the most pressing issues of our time, posing serious threats to ecosystems, economies, and human health. The scientific consensus is clear: human activities, particularly the burning of fossil fuels, are driving unprecedented changes in our climate. These changes result in extreme weather events, rising sea levels, and altered agricultural patterns, impacting food security and biodiversity. 

Addressing climate change requires urgent collective action, including reducing greenhouse gas emissions, transitioning to renewable energy, and promoting sustainable practices. Furthermore, it necessitates global cooperation and equitable solutions to support vulnerable communities most affected by climate impacts. The longer we delay, the more severe the consequences will be for future generations. It's imperative that we prioritize climate action now to create a sustainable future.",1.6357046300851747,4.999999999996021,1.0842669486315945e-10,,,4.0,"Climate change is one of the most pressing issues of our time, posing serious threats to ecosystems, economies, and human health. The scientific consensus is clear: human activities, particularly the burning of fossil fuels, are driving unprecedented changes in our climate. These changes result in extreme weather events, rising sea levels, and altered agricultural patterns, impacting food security and biodiversity. 

Addressing climate change requires urgent collective action, including reducing greenhouse gas emissions, transitioning to renewable energy, and promoting sustainable practices. Furthermore, it necessitates global cooperation and equitable solutions to support vulnerable communities most affected by climate impacts. The longer we delay, the more severe the consequences will be, making it imperative for individuals, governments, and organizations to work together towards a sustainable future.",1.5998729586853,4.999999999957222,1.064099634949957e-09,,
452.0,disc,4.0,"Climate change represents one of the most urgent challenges we face today, with far-reaching implications for our planet and future generations. It is essential that we recognize the profound impacts of human activities on our climate, particularly through the burning of fossil fuels. As we embark on this discussion, let's focus on actionable solutions that can reduce greenhouse gas emissions and promote sustainable practices for a healthier, more resilient world.",1.6048393513862866,4.999999999996021,1.0842669486287904e-10,,,4.0,"I completely agree that addressing climate change is crucial and that we must acknowledge our role in contributing to it, primarily through fossil fuel consumption. It’s vital that we explore innovative solutions like transitioning to renewable energy sources, implementing energy efficiency measures, and supporting sustainable agriculture to mitigate its effects. Additionally, fostering collaboration among governments, businesses, and individuals will be key to achieving lasting change and ensuring a better future for all.",2.216248171633597,4.999999999989184,2.8391842804043216e-10,,
452.0,disc,4.0,"Thank you for your thoughtful response; I completely agree that innovation and collaboration are essential components in addressing climate change effectively. Transitioning to renewable energy, improving energy efficiency, and supporting sustainable agriculture are indeed critical strategies that can help us reduce our carbon footprint and enhance resilience. By working together across all sectors, we can create the momentum needed for meaningful action and ensure that vulnerable communities are supported as we move toward a more sustainable future.",1.8841201923372821,4.999999999996901,8.521756168193442e-11,,,4.0,"Thank you for your encouraging words; it’s heartening to see such strong agreement on the need for collaborative action. Prioritizing support for vulnerable communities is indeed essential, as they often bear the brunt of climate impacts despite contributing the least to the problem. By sharing knowledge, resources, and best practices across sectors, we can amplify our efforts and drive effective solutions that benefit both people and the planet.",1.5837688374949868,5.0,0.0,,
452.0,disc,4.0,"You're absolutely right; the disproportionate impact of climate change on vulnerable communities highlights the need for justice and equity in our climate action efforts. Sharing knowledge, resources, and best practices is crucial for empowering these communities and ensuring that they have the tools to adapt and thrive in the face of climate challenges. Together, we can build a more inclusive approach to tackling climate change that not only addresses environmental issues but also fosters social equity and economic resilience.",1.5946012664757059,4.999999999979793,5.178002487786313e-10,,,4.0,"I couldn't agree more; justice and equity must be at the forefront of our climate action initiatives. Empowering vulnerable communities not only helps them adapt to climate challenges but also fosters a sense of agency and participation in the solutions that affect their lives. By integrating social equity into our climate strategies, we can create a more just and sustainable future that benefits everyone and ensures that no one is left behind.",1.4311182414407502,4.99999999999344,1.7548535115771306e-10,,
452.0,disc,4.0,"Your points resonate deeply with the core values of effective climate action—justice and equity should indeed guide our strategies and initiatives. By empowering vulnerable communities to actively participate in decision-making processes, we not only enhance their resilience but also enrich the solutions we develop with diverse perspectives and experiences. This collaborative approach will pave the way for a more inclusive and sustainable future, ensuring that we build a planet where everyone can thrive, regardless of their circumstances.",1.810611540951862,4.999999999998341,4.6650323683943136e-11,,,4.0,"Absolutely, including diverse perspectives in decision-making is essential for crafting effective and comprehensive climate solutions. When vulnerable communities have a seat at the table, we not only empower them but also tap into their unique insights that can lead to more innovative and context-sensitive approaches. Ultimately, fostering inclusive collaboration will help us build a resilient and sustainable future, where the needs of all are acknowledged and addressed.",1.992116516040622,5.0,0.0,,
452.0,disc,4.0,"I wholeheartedly agree; integrating diverse perspectives is vital for developing nuanced and effective climate solutions that truly meet the needs of all communities. When we prioritize inclusive collaboration, we not only amplify the voices of those most affected by climate change but also enhance our collective capacity for innovation and adaptability. By embracing this approach, we can create resilient solutions that not only mitigate climate impacts but also foster social cohesion and empower communities to thrive together.",1.8607333620451536,4.99999999999939,1.7771875480076137e-11,,,4.0,"Thank you for your insightful input; it’s clear that inclusive collaboration is a cornerstone of effective climate action. By amplifying the voices of those most affected, we can ensure that the solutions we implement are not only relevant but also culturally and socially appropriate, driving greater acceptance and success. Embracing this collective approach will allow us to address both climate impacts and societal challenges, fostering a sense of unity and resilience among all communities.",2.1905018812356554,4.999999999989184,2.8391842803438056e-10,,
