ID,TEXT_TYPE,INIT_OP_A,TEXT_A,PPL_A,PROBE_INT_A,H_INT_A,PROBE_EXT_A,H_EXT_A,INIT_OP_B,TEXT_B,PPL_B,PROBE_INT_B,H_INT_B,PROBE_EXT_B,H_EXT_B
456.0,tot,4.0,"Climate change is one of the most pressing issues of our time, posing serious threats to ecosystems, economies, and human health. The scientific consensus is clear: human activities, particularly the burning of fossil fuels, are driving unprecedented changes in our climate. These changes result in extreme weather events, rising sea levels, and altered agricultural patterns, impacting food security and biodiversity. 

Addressing climate change requires urgent collective action, including reducing greenhouse gas emissions, transitioning to renewable energy, and promoting sustainable practices. Furthermore, it necessitates global cooperation and equitable solutions to support vulnerable communities most affected by climate impacts. The longer we delay, the more severe the consequences will be, making it imperative for individuals, governments, and organizations to work together towards a sustainable future.",1.6070526467565887,4.999999999957222,1.064099634949957e-09,,,4.0,"Climate change is one of the most pressing issues of our time, posing severe threats to ecosystems, economies, and human health. The scientific consensus is clear: human activities, particularly the burning of fossil fuels, are driving unprecedented changes in our climate. These changes result in extreme weather events, rising sea levels, and altered agricultural patterns, disproportionately affecting vulnerable communities. 

Addressing climate change requires urgent collective action on a global scale, including transitioning to renewable energy, enhancing energy efficiency, and implementing sustainable practices across all sectors. Every individual can play a role in this transition through conscious choices and advocacy. The longer we delay, the greater the risks we face, not only for ourselves but for future generations. It’s essential that we prioritize this issue and work together to create a sustainable future.",1.7062289022116173,4.999999999982167,4.5918610668455917e-10,,
456.0,disc,4.0,"Climate change is not just an environmental issue; it is a multifaceted crisis that threatens our ecosystems, economies, and health. We need to address the profound impacts of rising temperatures, extreme weather, and sea-level rise on both natural and human systems. To create sustainable solutions, it is essential that we collaborate across borders, industries, and communities to implement effective strategies for reducing greenhouse gas emissions and promoting renewable energy.",1.75173514052558e+53,5.0,0.0,,,4.0,"I completely agree with your assessment that climate change is a multifaceted crisis that requires a collaborative approach. The interconnectedness of ecosystems, economies, and human health makes it imperative that we tackle these challenges holistically. Together, by prioritizing the reduction of greenhouse gas emissions and promoting renewable energy, we can create sustainable solutions that protect both our planet and future generations.",1.6419534020533455,5.0,0.0,,
456.0,disc,4.0,"Thank you for your thoughtful response; I appreciate your recognition of the interconnected nature of these challenges. It’s crucial that we not only prioritize reducing emissions but also ensure that our transition to renewable energy is just and equitable, addressing the needs of marginalized communities. By fostering innovation, sharing knowledge, and supporting local initiatives, we can work collectively toward a resilient and sustainable future for all.",1.7677172525482625,4.999999999996021,1.0842669486296263e-10,,,4.0,"You've highlighted a vital aspect of the climate crisis—ensuring that our transition to renewable energy is just and equitable. It’s essential to uplift marginalized communities and involve them in the decision-making process, as they are often the most affected by climate change and its impacts. By fostering innovation and supporting local initiatives, we can build a more inclusive approach that not only protects our planet but also promotes social equity and resilience for all.",1.6690568677773725,5.0,0.0,,
456.0,disc,4.0,"Absolutely, your emphasis on inclusivity and social equity is essential for meaningful climate action. Empowering marginalized communities not only helps to address historical injustices but also brings valuable perspectives that can enrich the solutions we develop. By creating platforms for participation and collaboration, we can ensure that our approach to combating climate change is truly comprehensive and just, ultimately benefiting both people and the planet.",2.298474086078917,4.999999999982167,4.5918610668455917e-10,,,4.0,"I wholeheartedly agree that empowering marginalized communities is crucial for developing effective and equitable climate solutions. Their unique experiences and perspectives can lead to innovative approaches that address both environmental and social challenges. By creating inclusive platforms for participation and collaboration, we can truly enhance our climate action efforts and build a more sustainable future that benefits everyone.",1.5740602799195489,5.0,0.0,,
456.0,disc,4.0,"I’m glad to hear you share this perspective; the diversity of ideas and experiences can drive innovative climate solutions that might otherwise be overlooked. It's essential to recognize that empowerment goes beyond mere participation; it involves actively facilitating access to resources, education, and decision-making processes for those communities. By prioritizing these actions, we not only enhance our climate strategies but also foster a sense of ownership and agency, ensuring that the future we create is equitable and sustainable for all.",5.2951036019287575e+94,4.999999999999217,2.2623663364302184e-11,,,4.0,"You've articulated a critical point about the importance of actively facilitating access to resources and education for marginalized communities. True empowerment is indeed about fostering a sense of ownership and agency, enabling these communities to be key players in climate solutions. By prioritizing these actions, we not only enhance our strategies but also cultivate a more equitable and sustainable future that reflects the needs and aspirations of everyone involved.",1.6255547345291301,5.0,0.0,,
456.0,disc,4.0,"Thank you for emphasizing the significance of ownership and agency in empowering marginalized communities; it truly is a foundational aspect of effective climate action. When we prioritize access to resources and education, we enable these communities to leverage their unique knowledge and experiences, which can lead to innovative and locally relevant solutions. Ultimately, by fostering an environment where everyone’s voice is heard, we can create a more resilient and inclusive approach to tackling climate change that meets the diverse needs of our global society.",1.6501596966106074,4.99999999999787,5.936771729725973e-11,,,4.0,"I appreciate your insights on the transformative power of ownership and agency; they are indeed essential for effective climate action. By enabling marginalized communities to leverage their unique knowledge and experiences, we unlock the potential for innovative solutions that are grounded in local context. Fostering an inclusive environment where all voices are heard is crucial for creating a resilient approach to climate change that addresses the diverse needs of our global society as we move forward together.",1.725251819156588,4.999999999994211,1.555889639880524e-10,,
