ID,TEXT_TYPE,INIT_OP_A,TEXT_A,PPL_A,PROBE_INT_A,H_INT_A,PROBE_EXT_A,H_EXT_A,INIT_OP_B,TEXT_B,PPL_B,PROBE_INT_B,H_INT_B,PROBE_EXT_B,H_EXT_B
45.0,tot,1.0,"I believe that the focus on climate change has been exaggerated and often distracts from more immediate and pressing issues facing humanity, such as poverty, healthcare, and education. Many proposed solutions, like drastic policy changes and economic upheaval, could harm economies and livelihoods without guaranteeing significant impact on climate. Instead of prioritizing climate alarmism, we should invest in innovation and technology that can address environmental issues without sacrificing progress and development. It's important to critically assess the data and consider the broader picture of human welfare.",5.621486746841131e+43,1.9999552497640876,0.0005092534669951569,,,2.0,"I believe that while environmental issues are important, the emphasis on climate change often overshadows other pressing concerns that deserve equal attention. There are natural climate fluctuations that have occurred throughout Earth's history, and many argue that humanity's ability to adapt is significant. Rather than focusing solely on climate change, we should prioritize economic development, technological innovation, and improving living standards globally, which can also contribute to better environmental stewardship. Addressing immediate human needs can lead to more sustainable long-term solutions without the alarmism often tied to climate narratives.",2.179210224093066,2.0031717133489555,0.02143720063416331,,
45.0,disc,1.0,"While climate change is often highlighted as a critical threat, we must consider whether this focus distracts us from more immediate issues like poverty and education that affect millions daily. Solutions aimed at drastically altering our economy could jeopardize livelihoods without ensuring significant benefits for the climate. Instead, we should prioritize innovation and technology that can provide sustainable solutions without compromising human development.",2.2746093254344615,2.0140653556745067,0.0741147827863972,,,2.0,"I completely agree with the perspective that while climate change is a significant concern, we must not lose sight of pressing issues like poverty and education that directly impact millions of lives every day. Innovations and technological advancements can indeed offer sustainable solutions without undermining economic development or livelihoods. By addressing immediate human needs first, we can create an environment where both societal progress and environmental stewardship can thrive together, rather than succumbing to alarmist narratives that may hinder practical progress.",3.053828498639983e+48,2.3779752704701753,0.6651456226317446,,
45.0,disc,1.0,"I'm glad to see that you resonate with the idea of prioritizing immediate human needs alongside environmental concerns. It’s crucial that we foster collaboration across sectors to ensure that advancements in technology also enhance our capacity to combat poverty and improve education. By focusing on practical, innovative solutions instead of alarmist narratives, we can build a more resilient society that addresses both current and future challenges effectively.",2.3033748374976577,2.047465672243214,0.1911979116525373,,,2.0,"Absolutely, fostering collaboration across sectors is essential for developing holistic solutions that tackle both immediate human needs and environmental sustainability. The key is to align technological advancements with practical applications that uplift communities, thereby improving living standards while also addressing environmental challenges. By nurturing a balanced approach, we can create a resilient society that thrives on innovation and inclusivity, ensuring that both people and the planet benefit from progress.",5.653660484103231e+56,2.9667375736245942,0.18436380529896565,,
45.0,disc,1.0,"You make an excellent point about the necessity of aligning technological advancements with practical applications that directly uplift communities. A balanced approach not only boosts living standards but also encourages a sense of shared responsibility for environmental stewardship. By prioritizing inclusivity and collaboration, we can cultivate innovative solutions that truly benefit both people and the planet, breaking away from the constraints of alarmism.",3.3489873053982175e+122,2.3210484993585636,0.6288141015862632,,,2.0,"I appreciate your emphasis on shared responsibility, as it’s essential for fostering a collective commitment to both social and environmental well-being. By focusing on inclusivity and collaboration, we can ensure that diverse perspectives contribute to innovative solutions that address the varied challenges communities face. This balanced mindset not only empowers individuals but also paves the way for sustainable progress, helping us move past alarmism towards practical and effective action.",2.0444099078375806,3.0491320264843385,0.2823881724788436,,
45.0,disc,1.0,"Thank you for highlighting the importance of diverse perspectives in crafting innovative solutions; inclusivity truly enriches our approaches to complex challenges. A collective commitment to both social and environmental well-being helps us create solutions that are not only effective but also equitable. By moving beyond alarmism and fostering practical actions, we can build a brighter future that addresses the needs of all communities while maintaining environmental integrity.",1.91726968761317,2.0179844276499663,0.09014238000172375,,,2.0,"You're absolutely right; diverse perspectives are invaluable in tackling the complexities we face, ensuring that solutions are not only innovative but also equitable for all stakeholders. By fostering a collective commitment, we can develop approaches that respect both human needs and the environment, allowing for a more holistic understanding of sustainability. Ultimately, moving beyond alarmism to embrace practical actions provides a pathway to a brighter future where every community can thrive alongside a healthy planet.",9.451138305735451e+51,3.1717825096120627,0.5221366022172135,,
45.0,disc,1.0,"I couldn't agree more; a holistic understanding of sustainability is vital for crafting solutions that genuinely benefit all stakeholders involved. By fostering that collective commitment, we create a framework where both human needs and environmental health are prioritized, leading to more effective and enduring outcomes. Ultimately, our focus should remain on practical actions that empower communities, providing them with the tools necessary to thrive in harmony with a healthy planet.",8.429650519475487e+55,2.0109827918888286,0.06054529699029135,,,2.0,"I appreciate your insights on the necessity of a holistic understanding of sustainability—it truly is essential for creating solutions that resonate across various communities. By equipping communities with the necessary tools and fostering a collaborative environment, we can empower individuals to embrace practices that promote both their well-being and environmental health. This practical approach not only leads to meaningful progress but also ensures that the benefits of innovation are felt broadly and equitably, enabling all stakeholders to thrive together.",1.3774083032307543e+49,2.9987866344893375,0.01674443230732457,,
