ID,TEXT_TYPE,INIT_OP_A,TEXT_A,PPL_A,PROBE_INT_A,H_INT_A,PROBE_EXT_A,H_EXT_A,INIT_OP_B,TEXT_B,PPL_B,PROBE_INT_B,H_INT_B,PROBE_EXT_B,H_EXT_B
467.0,tot,4.0,"Climate change is one of the most pressing issues of our time, posing serious threats to ecosystems, economies, and human health. The scientific consensus is clear: human activities, particularly the burning of fossil fuels, are driving unprecedented changes in our climate. These changes result in extreme weather events, rising sea levels, and altered agricultural patterns, impacting food security and biodiversity. 

Addressing climate change requires urgent collective action, including a transition to renewable energy, sustainable transportation, and effective conservation strategies. It’s essential for individuals, governments, and businesses to adopt sustainable practices and advocate for policies that mitigate climate impacts. By fostering innovation and investing in clean technologies, we can work towards a more resilient and sustainable future for generations to come.",1.7481470731287987,4.9999999999705995,7.423695558484765e-10,,,4.0,"Climate change is one of the most pressing issues of our time, posing serious threats to ecosystems, economies, and human health. The scientific consensus is clear: human activities, particularly the burning of fossil fuels, are driving unprecedented changes in our climate. These changes result in extreme weather events, rising sea levels, and altered agricultural patterns, impacting food security and biodiversity. 

Addressing climate change requires urgent collective action, including reducing greenhouse gas emissions, transitioning to renewable energy, and promoting sustainable practices. Furthermore, it necessitates global cooperation and equitable solutions to support vulnerable communities most affected by climate impacts. The longer we delay, the more severe the consequences will be, making it imperative for individuals, governments, and organizations to work together towards a sustainable future.",1.602797381611541,4.99999999999787,5.936771729732116e-11,,
467.0,disc,4.0,"Climate change is not just an environmental issue; it is fundamentally intertwined with our health, economy, and social justice. As we witness the increasing frequency of extreme weather events and rising sea levels, it is crucial that we come together to develop actionable solutions. Let’s explore how we can accelerate the transition to renewable energy and implement sustainable practices across various sectors to mitigate the impacts of climate change.",1.584389715703591,4.999999999996901,8.521756168199896e-11,,,4.0,"I completely agree that climate change is a multidimensional issue affecting our health, economy, and social justice. Accelerating the transition to renewable energy and implementing sustainable practices are vital steps in combating its impacts and creating a resilient future for all. It’s essential that we foster collaboration across all sectors to ensure these solutions are equitable and accessible, particularly for those communities most vulnerable to climate change.",1.7783776359556214,4.999999999982167,4.591861066779892e-10,,
467.0,disc,4.0,"Absolutely, collaboration across sectors is key to ensuring that our solutions are not only effective but equitable as well. Vulnerable communities often bear the brunt of climate impacts, and it is our responsibility to ensure that they are not left behind in the transition to a sustainable future. By prioritizing inclusive policies and empowering these communities through access to clean technologies and resources, we can build resilience and foster greater social equity in our fight against climate change.",1.621776115950684,5.0,0.0,,,4.0,"Your emphasis on prioritizing inclusive policies is critical in our fight against climate change. Empowering vulnerable communities with access to clean technologies and resources not only helps them adapt but also engages them as active participants in the transition to sustainability. By integrating social equity into our climate strategies, we can create a more just and resilient future for everyone, ensuring that no one is left behind.",1.4599591790787831,4.999999999994891,1.379453390397343e-10,,
467.0,disc,4.0,"You're absolutely right; integrating social equity into our climate strategies is essential to achieving long-term success. When we empower vulnerable communities, we not only help them adapt but also tap into their unique insights and solutions, fostering a more innovative approach to sustainability. This collaborative effort can lead to a future where everyone has a stake in our shared environmental goals, ultimately strengthening our collective resilience against the challenges of climate change.",1.9073235179782166,4.9999999999705995,7.423695558280637e-10,,,4.0,"I appreciate your recognition of the valuable insights that vulnerable communities can provide; their experiences and perspectives are crucial for developing innovative and effective sustainability solutions. By fostering collaboration and inclusivity, we can create a sense of shared ownership in our environmental goals, making climate action more comprehensive and impactful. This collective approach not only enhances our resilience but also empowers individuals and communities to thrive in the face of climate challenges, paving the way for a truly sustainable future.",1.707411227001734,5.0,0.0,,
467.0,disc,4.0,"Thank you for highlighting the importance of shared ownership in our environmental goals; it truly is a powerful way to drive meaningful change. When we collaboratively engage with diverse communities, we not only benefit from their unique experiences but also build trust and solidarity in our climate efforts. This sense of empowerment fosters a culture of resilience, where individuals feel motivated to actively participate in sustainability initiatives, ultimately leading us toward a more inclusive and thriving future for all.",5.1384241287590645e+50,4.999999999996021,1.0842669486269235e-10,,,4.0,"You’ve articulated an essential point about the role of trust and solidarity in our climate efforts; it is indeed crucial for fostering a culture of resilience. When individuals feel empowered and motivated to engage, they become valuable agents of change within their communities, amplifying our collective impact. By nurturing this collaborative spirit, we can pave the way for sustainable initiatives that not only address climate change but also enhance social cohesion and well-being for all members of society.",1.7797778842372238,5.0,0.0,,
467.0,disc,4.0,"I completely agree; nurturing trust and solidarity within communities is fundamental to driving impactful climate action. As individuals recognize their potential as agents of change, they inspire others and create a ripple effect that strengthens our collective resolve to address environmental challenges. By focusing on initiatives that enhance both sustainability and social cohesion, we can not only combat climate change but also foster healthier, more connected communities that thrive together.",1.8869311771631252,4.999999999992566,1.9792167650699255e-10,,,4.0,"You've beautifully captured the transformative power of individuals recognizing their role as agents of change; this empowerment can catalyze a movement that benefits both our environment and our communities. By prioritizing initiatives that enhance sustainability alongside social cohesion, we lay the groundwork for healthier and more resilient societies. Together, we can create a future where addressing climate change strengthens our bonds and fosters a sense of shared purpose, ensuring that we thrive in unity through both challenges and successes.",2.2652344067602512,4.99999999999344,1.7548535115753096e-10,,
