ID,TEXT_TYPE,INIT_OP_A,TEXT_A,PPL_A,PROBE_INT_A,H_INT_A,PROBE_EXT_A,H_EXT_A,INIT_OP_B,TEXT_B,PPL_B,PROBE_INT_B,H_INT_B,PROBE_EXT_B,H_EXT_B
483.0,tot,4.0,"Climate change is one of the most pressing issues of our time, posing serious threats to ecosystems, economies, and human health. The scientific consensus is clear: human activities, particularly the burning of fossil fuels, are driving unprecedented changes in our climate. These changes result in extreme weather events, rising sea levels, and altered agricultural patterns, impacting food security and biodiversity. 

Addressing climate change requires urgent collective action, including reducing greenhouse gas emissions, transitioning to renewable energy, and promoting sustainable practices. Furthermore, it necessitates global cooperation and equitable solutions to support vulnerable communities. It’s crucial for individuals, businesses, and governments to work together to foster a sustainable future for generations to come.",1.6100363938977542,4.999999999951527,1.1997237371281546e-09,,,5.0,"Climate change is one of the most pressing issues of our time, affecting not only the environment but also public health, economies, and social equity. The evidence is undeniable—rising temperatures, extreme weather events, and melting ice caps are all consequences of human activity. Urgent action is needed, not just from governments but also from individuals and businesses to reduce carbon emissions and shift towards sustainable practices. The time to act is now, as the longer we wait, the more severe the repercussions will be for future generations. It's essential to foster awareness and advocate for policies that prioritize the planet's health. Every action counts.",1.8712830186918434,4.99999999999787,5.936771729733817e-11,,
483.0,disc,4.0,"Climate change is a critical challenge that we cannot afford to ignore; it fundamentally threatens our ecosystems and future generations. As we witness an increase in extreme weather events and disruptions to food systems, it becomes imperative that we take collective action to reduce greenhouse gas emissions and transition to sustainable energy practices. Let’s explore what effective strategies and innovations can be implemented at local, national, and global levels to combat this urgent issue.",2.448447400790557,4.999999999996488,9.612517162168636e-11,,,5.0,"I completely agree that the urgent threat of climate change cannot be overlooked, and it's heartening to see a call for collective action. Effective strategies must include not only transitioning to renewable energy sources but also promoting sustainable practices in agriculture, transportation, and industry. Together, as individuals, communities, and nations, we can foster innovation and implement policies that mitigate climate impacts and protect our planet for future generations.",1.9416262289096207,4.99999999999787,5.936771729667229e-11,,
483.0,disc,4.0,"Absolutely, the integration of sustainable practices across all sectors—agriculture, transportation, and industry—is vital for a holistic approach to address climate change. By fostering innovation and prioritizing environmentally-friendly policies, we can not only mitigate the impacts of climate change but also create sustainable economic opportunities. It’s essential that we engage all stakeholders in this effort to ensure that our solutions are equitable and effective for everyone, especially those in vulnerable communities.",1.7662406236457882,4.999999999997265,7.554604336733695e-11,,,5.0,"You raise an important point about the need for equitable solutions that engage all stakeholders, particularly those in vulnerable communities who are often the most impacted by climate change. By prioritizing inclusivity in our climate initiatives, we can ensure that sustainable economic opportunities are accessible to everyone, promoting social equity alongside environmental sustainability. It’s critical that we not only foster innovation but also create frameworks that support collaboration across sectors, empowering all voices in the fight against climate change.",1.681563648106506,4.999999999992566,1.9792167650843032e-10,,
483.0,disc,4.0,"You’re absolutely right; inclusivity is essential in developing effective climate policies that not only address environmental concerns but also promote social justice. By ensuring that marginalized communities have a voice and are actively involved in decision-making processes, we can better identify their unique needs and tailor solutions that truly benefit them. Collaboration across sectors will amplify our efforts, harnessing diverse perspectives and resources to create comprehensive strategies that drive meaningful change for both people and the planet.",2.0172802686973546,4.999999999999112,2.552492103317658e-11,,,5.0,"I wholeheartedly agree that amplifying the voices of marginalized communities is crucial in crafting climate policies that are both effective and just. By actively involving those who are most affected by environmental degradation, we can create solutions that are not only relevant but also empower these communities to participate in their own futures. Collaboration across various sectors will enrich our approach, fostering innovative strategies that address the interconnected challenges of climate change and social equity, ultimately benefiting both people and the planet.",1.6783156394565137,4.999999999994211,1.5558896398676475e-10,,
483.0,disc,4.0,"Thank you for emphasizing the importance of empowerment; enabling marginalized communities to participate in shaping their futures is a key aspect of achieving just climate solutions. By leveraging the insights and experiences of those most impacted, we can develop targeted strategies that tackle the diverse challenges posed by climate change while promoting social equity. Together, through collaboration and innovation, we can create a sustainable and resilient future that serves as a model for communities around the world.",9.922545729503044e+51,4.999999999998121,5.2626774604711694e-11,,,5.0,"You're absolutely right; empowering marginalized communities to have a say in their futures is not just an ethical imperative but also a strategic necessity for effective climate solutions. Their insights are invaluable in shaping targeted strategies that address the unique challenges they face, ensuring that no one is left behind in our efforts to combat climate change. By fostering collaboration and embracing innovation, we can indeed create a sustainable and resilient future that inspires and serves as a blueprint for communities worldwide.",1.664602295909882,4.999999999992566,1.979216765094306e-10,,
483.0,disc,4.0,"I appreciate your recognition of the ethical and strategic importance of empowering marginalized communities; their lived experiences provide crucial context for developing effective climate solutions. By ensuring that these voices are heard and prioritized, we not only enhance the relevance of our strategies but also reinforce inclusivity in the fight against climate change. As we work together to foster collaboration and embrace innovation, we will be better equipped to build a resilient future that inspires action and serves as a guiding example for communities everywhere.",2.0484556058074355,4.999999999990455,2.517502925943298e-10,,,5.0,"Thank you for highlighting the vital role that lived experiences play in shaping contextually relevant climate strategies. Prioritizing the voices of marginalized communities not only strengthens our approach but also cultivates a sense of ownership and agency among those most affected by climate impacts. Together, as we commit to collaboration and innovation, we can inspire action and set a powerful example for communities worldwide, demonstrating that a just and sustainable future is achievable for everyone.",1.7871770356955659,5.0,0.0,,
