ID,TEXT_TYPE,INIT_OP_A,TEXT_A,PPL_A,PROBE_INT_A,H_INT_A,PROBE_EXT_A,H_EXT_A,INIT_OP_B,TEXT_B,PPL_B,PROBE_INT_B,H_INT_B,PROBE_EXT_B,H_EXT_B
487.0,tot,4.0,"Climate change is one of the most pressing issues of our time, posing serious threats to ecosystems, economies, and human health. The scientific consensus is clear: human activities, particularly the burning of fossil fuels, are driving unprecedented changes in our climate. These changes result in extreme weather events, rising sea levels, and altered agricultural patterns, impacting food security and biodiversity. 

Addressing climate change requires urgent collective action, including reducing greenhouse gas emissions, transitioning to renewable energy, and promoting sustainable practices. Furthermore, it necessitates global cooperation and equitable solutions to support vulnerable communities most affected by climate impacts. The longer we delay, the more severe the consequences will be, making it imperative for individuals, governments, and organizations to work together towards a sustainable future.",1.6046036477352628,4.999999999995492,1.2229995742922583e-10,,,5.0,"Climate change is one of the most pressing issues of our time, affecting not only the environment but also public health, economies, and social equity. The evidence is undeniable—rising temperatures, extreme weather events, and melting ice caps are all consequences of human activity. Urgent action is needed, not just from governments but also from individuals and businesses to reduce carbon emissions and shift towards sustainable practices. The time to act is now, as the longer we wait, the more severe the repercussions will be for future generations. It's essential to foster awareness and advocate for policies that prioritize the planet's health. Every action counts.",1.8701859006868116,4.999999999995492,1.2229995742957082e-10,,
487.0,disc,4.0,"Climate change is not just an environmental issue; it is a multifaceted crisis that threatens our ecosystems, economies, and health. We need to address the profound impacts of rising temperatures, extreme weather, and sea-level rise on both natural and human systems. To create sustainable solutions, it is essential that we collaborate across borders, industries, and communities to implement effective strategies for reducing greenhouse gas emissions and supporting vulnerable populations.",1.831968905615196e+53,4.99999999999344,1.7548535115802848e-10,,,5.0,"I completely agree that climate change is a multifaceted crisis that demands our immediate attention. Collaboration across borders, industries, and communities is indeed crucial to develop innovative and sustainable solutions that can mitigate its impacts. By uniting our efforts, we can create a robust action plan that not only reduces greenhouse gas emissions but also supports those most affected by this ongoing crisis.",1.8013823253697325,4.999999999979793,5.178002487731434e-10,,
487.0,disc,4.0,"I appreciate your agreement and recognition of the urgency surrounding climate change. Developing a robust action plan that emphasizes both emissions reduction and support for affected communities is vital for fostering resilience and sustainability. By leveraging innovative approaches and shared resources, we can truly make a difference and ensure a healthier planet for future generations.",1.8979486230172657,4.999999999994891,1.379453390430562e-10,,,5.0,"Thank you for your thoughtful response; it's encouraging to see a shared commitment to addressing climate change. Leveraging innovative approaches and pooling our resources will be key in creating effective strategies that not only reduce emissions but also build resilience in vulnerable communities. Together, we can inspire a movement that prioritizes a healthier planet and long-term sustainability for generations to come.",1.2516851824157213e+63,4.999999999998536,4.135168254523522e-11,,
487.0,disc,4.0,"I completely agree, and I’m heartened by your enthusiasm for fostering a movement focused on climate solutions. Prioritizing both emissions reduction and community resilience will ultimately empower us to create equitable and sustainable futures. By continuing to engage in these discussions and amplifying our collective efforts, we can inspire significant change and motivate others to join us in this critical fight.",2.658831274041389,4.999999999982167,4.591861066804366e-10,,,5.0,"I'm glad to hear that we share a sense of optimism and urgency in our collective efforts to tackle climate change. Engaging in discussions like this is essential for raising awareness and inspiring action within our communities. Together, we can mobilize more individuals to understand their role in this fight and champion equitable solutions that prioritize both the planet and those most affected by climate impacts.",2.2440734013854953,5.0,0.0,,
487.0,disc,4.0,"Absolutely, raising awareness through discussions is a crucial step in mobilizing communities to take action against climate change. By empowering individuals to recognize their unique roles and responsibilities, we can foster a broader movement for change that embraces equity and sustainability. It is vital that we not only share knowledge but also amplify the voices of those most impacted by climate change, ensuring that their experiences and needs guide our solutions.",2.0873493575225344,4.999999999986112,3.6108648745145815e-10,,,5.0,"I couldn’t agree more; amplifying the voices of those most affected by climate change is essential for creating solutions that truly address their needs. By prioritizing equity in our discussions and actions, we can ensure that our movement is inclusive and representative of diverse experiences. Together, we can empower individuals to take meaningful action while also nurturing a sense of community and shared responsibility in the fight for a sustainable future.",1.5489917050620245,5.0,0.0,,
487.0,disc,4.0,"You make an excellent point about the importance of inclusivity and representation in our climate movement. By fostering a strong sense of community and shared responsibility, we can create an environment where everyone feels valued and motivated to contribute to sustainable solutions. As we empower individuals from diverse backgrounds, we not only strengthen our collective efforts but also enhance the effectiveness of the actions we take to combat climate change together.",1.6883419170971492,4.9999999999868345,1.6309602857857915e-10,,,5.0,"Thank you for recognizing the significance of inclusivity in our climate movement; it's a fundamental component for building a robust coalition. When we create an environment that values diverse perspectives, we tap into a wealth of ideas and solutions that can strengthen our collective response to climate change. By working together and empowering individuals from all walks of life, we can make significant strides toward not only combating climate change but also fostering a more just and equitable society.",2.2506493772721345,4.999999999996901,8.52175616815468e-11,,
