ID,TEXT_TYPE,INIT_OP_A,TEXT_A,PPL_A,PROBE_INT_A,H_INT_A,PROBE_EXT_A,H_EXT_A,INIT_OP_B,TEXT_B,PPL_B,PROBE_INT_B,H_INT_B,PROBE_EXT_B,H_EXT_B
488.0,tot,4.0,"Climate change is one of the most pressing issues of our time, posing serious threats to ecosystems, economies, and human health. The scientific consensus is clear: human activities, particularly the burning of fossil fuels, are driving unprecedented changes in our climate. These changes result in extreme weather events, rising sea levels, and altered agricultural patterns, impacting food security and biodiversity. 

Addressing climate change requires urgent collective action, including reducing greenhouse gas emissions, transitioning to renewable energy, and promoting sustainable practices. Furthermore, it necessitates global cooperation and equitable solutions to support vulnerable communities most affected by climate impacts. The longer we delay, the more severe the consequences will be, making it imperative for individuals, governments, and organizations to work together towards a sustainable future.",1.6050614446979148,4.99999999999787,5.936771729726203e-11,,,5.0,"Climate change is one of the most pressing issues of our time, affecting not only the environment but also public health, economies, and social equity. The evidence is undeniable—rising temperatures, extreme weather events, and melting ice caps are all consequences of human activity. Urgent action is needed, not just from governments but also from individuals and businesses to reduce carbon emissions and shift towards sustainable practices. The time to act is now, as the longer we wait, the more severe the repercussions will be for future generations. It's essential to foster awareness and advocate for policies that prioritize the planet's health. Every step towards sustainability is a step towards a viable future.",1.8831631698653573,4.999999999966684,8.370504712414391e-10,,
488.0,disc,4.0,"Climate change is not just an environmental issue; it is a multifaceted crisis that threatens our ecosystems, economies, and health. We need to address the profound impacts of rising temperatures, extreme weather, and sea-level rise on both natural and human systems. As we engage in this discussion, it's crucial to explore actionable solutions, promote sustainable practices, and emphasize the importance of global cooperation to combat this pressing challenge.",7.339431544527864e+53,4.999999999997265,7.554604336750802e-11,,,5.0,"I completely agree with your perspective that climate change is a complex crisis impacting multiple facets of our lives. It is vital to not only discuss the challenges we face but also to actively seek and implement actionable solutions that promote sustainability at all levels of society. Global cooperation is essential; we must work together—individuals, businesses, and governments alike—if we are to create a resilient future and effectively combat this urgent issue.",1.9551528189581011,5.0,0.0,,
488.0,disc,4.0,"I'm glad to hear that we are on the same page regarding the complexity of the climate crisis and the importance of actionable solutions. Each stakeholder—whether individuals, businesses, or governments—has a critical role to play in driving sustainable practices and reducing emissions. By fostering collaboration and sharing innovative ideas, we can build a more resilient future that safeguards both our planet and the well-being of communities worldwide.",1.7417335916861643,4.99999999999787,5.93677172973085e-11,,,5.0,"Absolutely, collaboration is key in addressing the multifaceted challenges of climate change. By leveraging the strengths and resources of each stakeholder, we can create impactful solutions that not only reduce emissions but also promote social equity and community well-being. It’s inspiring to see the potential for innovation and cooperation; together, we can pave the way for a sustainable and just future for everyone.",1.610913525922756,5.0,0.0,,
488.0,disc,4.0,"I completely agree that leveraging the strengths of each stakeholder can lead to powerful and innovative solutions to the climate crisis. Promoting social equity alongside environmental sustainability is essential, as vulnerable communities often bear the brunt of climate impacts. By working together with a shared vision, we can ensure that our efforts not only protect the planet but also uplift and empower those most affected, creating a truly just and sustainable future for all.",1.4813161484950919,4.999999999962249,9.437836481869745e-10,,,5.0,"Your emphasis on social equity in the context of environmental sustainability is crucial, as it highlights the interconnectedness of these issues. It is imperative that we prioritize the voices and needs of vulnerable communities in our climate initiatives, ensuring that no one is left behind in the transition to a sustainable future. By fostering inclusivity and collaboration, we can create a holistic approach that not only addresses climate change but also uplifts those most impacted by its effects, leading to a stronger and more equitable society for all.",1.5784250248235094,4.999999999998121,5.262677460432101e-11,,
488.0,disc,4.0,"Absolutely, prioritizing the voices of vulnerable communities is essential in crafting effective climate initiatives that are both inclusive and equitable. Their experiences and needs must inform our strategies to ensure that the transition to sustainability addresses existing inequalities rather than exacerbating them. By fostering a holistic approach that intertwines social justice with climate action, we can build a stronger foundation for a sustainable future that truly benefits everyone, not just a select few.",1.7259038476329702,5.0,0.0,,,5.0,"I wholeheartedly agree that centering the experiences of vulnerable communities is vital for crafting effective and just climate solutions. By actively engaging these communities in the decision-making process, we can develop strategies that address their unique challenges while promoting inclusive prosperity. This holistic approach not only enhances our climate action but also ensures that our efforts contribute to dismantling systemic inequalities, ultimately creating a more resilient and equitable future for all.",1.9705102406801227,4.999999999994891,1.3794533904262496e-10,,
488.0,disc,4.0,"I completely resonate with your perspective on the importance of engaging vulnerable communities in the decision-making process. By incorporating their insights and challenges, we can design climate solutions that are not only effective but also tailored to promote inclusive prosperity. This collaborative approach will strengthen our resilience against climate impacts while actively working to dismantle systemic inequalities, ensuring a more just and sustainable future for everyone.",1.645609720443232,4.999999999998709,3.6654222120076735e-11,,,5.0,"I'm glad to see that we are in agreement on the necessity of incorporating the insights and challenges of vulnerable communities into our climate solutions. This collaborative approach not only enhances the effectiveness of our initiatives but also empowers those who have historically been marginalized, making it a truly democratic process. By weaving together climate action and social justice, we can forge a path toward a future where both the planet and its people thrive in harmony.",1.959892946620972,4.999999999994211,1.555889639880524e-10,,
