ID,TEXT_TYPE,INIT_OP_A,TEXT_A,PPL_A,PROBE_INT_A,H_INT_A,PROBE_EXT_A,H_EXT_A,INIT_OP_B,TEXT_B,PPL_B,PROBE_INT_B,H_INT_B,PROBE_EXT_B,H_EXT_B
490.0,tot,4.0,"Climate change is one of the most pressing issues of our time, posing severe threats to ecosystems, economies, and human health. The scientific consensus is clear: human activities, particularly the burning of fossil fuels, are driving unprecedented changes in our climate. These changes result in extreme weather events, rising sea levels, and altered agricultural patterns, disproportionately affecting vulnerable communities. 

Addressing climate change requires urgent collective action on a global scale, including transitioning to renewable energy, enhancing energy efficiency, and implementing sustainable practices across all sectors. Every individual can play a role in this transition through conscious choices and advocacy. The longer we delay, the greater the risks we face, not only for ourselves but for future generations. It’s essential that we prioritize this issue and work together to create a sustainable future.",1.7062120626735189,4.999999999982167,4.5918610668455917e-10,,,5.0,"Climate change is one of the most pressing issues of our time, affecting not only the environment but also public health, economies, and social equity. The evidence is undeniable—rising temperatures, extreme weather events, and melting ice caps are all consequences of human activity. Urgent action is needed, not just from governments but also from individuals and businesses to reduce carbon emissions and shift towards sustainable practices. The time to act is now, as the longer we wait, the more severe the repercussions will be for future generations. It's essential to foster awareness and advocate for policies that prioritize the planet's health. Every action counts.",1.8506489479155768,4.999999999998341,4.665032368418381e-11,,
490.0,disc,4.0,"Climate change is not just an environmental issue; it is a multifaceted challenge that impacts economies, health, and social justice. As we witness more frequent and intense weather events and rising sea levels, it becomes imperative that we prioritize sustainable practices and renewable energy solutions. Let's explore how we, as individuals and communities, can contribute to meaningful action against this urgent threat for the sake of our planet and future generations.",1.939701429923724,4.999999999997265,7.554604336729921e-11,,,5.0,"Absolutely, I couldn't agree more. The interconnectedness of climate change with economies, public health, and social justice underscores the urgency for comprehensive action. By adopting sustainable practices in our daily lives and advocating for renewable energy solutions, we can collectively make a significant impact to safeguard our planet for future generations.",1.5283108330122104,5.0,0.0,,
490.0,disc,4.0,"I'm glad to hear you share the same perspective! Every small action we take towards sustainability adds up, and our collective commitment can drive major systemic changes. By championing renewable energy and sustainable practices, we not only protect the environment but also promote social equity and economic resilience, paving the way for a brighter, sustainable future for all.",2.394089857635181,4.99999999999939,1.7771875480014044e-11,,,5.0,"Absolutely, your enthusiasm for collective action is inspiring! Each small step—whether it's reducing waste, using renewable energy, or supporting sustainable businesses—contributes to a larger movement that can transform our systems for the better. Together, we can build not only a healthier planet but also a fairer society that uplifts everyone in the face of climate challenges.",1.7822917539199943,5.0,0.0,,
490.0,disc,4.0,"Thank you for your kind words! It’s so encouraging to see others recognize that individual actions can create a powerful ripple effect in fostering systemic change. Together, we can ensure that our efforts not only protect the environment but also promote inclusive and equitable solutions that empower all communities to thrive in the face of climate challenges.",2.262121701836716e+70,4.99999999999886,3.248975296031641e-11,,,5.0,"You're very welcome! It's heartening to find a community that understands the importance of inclusivity in our climate efforts, as true sustainability must uplift all communities. By collaborating and sharing ideas, we can create equitable solutions that address the needs of diverse populations while also tackling the climate crisis head-on. Together, we can cultivate a resilient future where everyone has the opportunity to thrive in harmony with our planet.",1.8655207165952141,5.0,0.0,,
490.0,disc,4.0,"Absolutely, the focus on inclusivity is crucial for achieving genuine sustainability. Collaborative efforts that consider the unique needs and perspectives of diverse populations will lead to more effective and just solutions to the climate crisis. By fostering a shared vision for a resilient future, we can ensure that every community not only survives but flourishes alongside a healthy planet.",1.8474282120521217,4.999999999999581,1.2371648862769929e-11,,,5.0,"I couldn't agree more; inclusivity is vital for crafting solutions that truly resonate with and uplift all communities. When we engage diverse voices in the conversation, we amplify different perspectives that can lead to innovative and effective strategies in combating climate change. By uniting in our shared vision for a resilient future, we can create a sustainable world where both people and the planet thrive together.",8.612402875878206e+58,4.999999999994211,1.5558896398801402e-10,,
490.0,disc,4.0,"You’ve perfectly articulated the essence of our collective journey! Engaging diverse voices not only enriches our strategies but also fosters a sense of ownership and accountability across communities. By coming together with a unified vision, we can harness our collective creativity and resilience to devise solutions that ensure a sustainable and equitable future for all.",1.8749988495369363,4.999999999992566,1.979216765093367e-10,,,5.0,"Thank you for your thoughtful response! Engaging diverse voices indeed strengthens our commitment to shared ownership and accountability, fostering a richer tapestry of ideas for sustainable solutions. By combining our creativity and resilience, we can tackle the climate crisis with innovative strategies that not only protect our environment but also uplift marginalized communities in the process.",2.6161584487289447,5.0,0.0,,
