ID,TEXT_TYPE,INIT_OP_A,TEXT_A,PPL_A,PROBE_INT_A,H_INT_A,PROBE_EXT_A,H_EXT_A,INIT_OP_B,TEXT_B,PPL_B,PROBE_INT_B,H_INT_B,PROBE_EXT_B,H_EXT_B
493.0,tot,4.0,"Climate change is one of the most pressing issues of our time, posing serious threats to ecosystems, economies, and human health. The scientific consensus is clear: human activities, particularly the burning of fossil fuels, are driving unprecedented changes in our climate. These changes result in extreme weather events, rising sea levels, and altered agricultural patterns, impacting food security and biodiversity. 

Addressing climate change requires urgent collective action, including transitioning to renewable energy sources, improving energy efficiency, and promoting sustainable practices. Furthermore, equitable policy-making is essential to support vulnerable communities and ensure a just transition. By prioritizing environmental stewardship and fostering innovation, we can mitigate the impacts of climate change and create a more sustainable future for all.",1.6924100317608557,4.999999999979793,5.178002487674834e-10,,,5.0,"Climate change is one of the most pressing issues of our time, affecting not only the environment but also public health, economies, and social equity. The evidence is undeniable—rising temperatures, extreme weather events, and melting ice caps are all consequences of human activity. Urgent action is needed, not just from governments but also from individuals and businesses to reduce carbon emissions and shift towards sustainable practices. The time to act is now, as the longer we wait, the more severe the repercussions will be for future generations. It's essential to foster awareness and advocate for policies that prioritize the planet's health. Every action counts.",1.874170702642481,4.999999999989184,2.839184280425109e-10,,
493.0,disc,4.0,"Climate change is not just an environmental issue; it fundamentally impacts our economies, health, and the very fabric of our societies. With the increasing frequency of extreme weather events and their devastating consequences, it is crucial that we recognize the urgent need for collective action. As we explore solutions, we must prioritize equity and ensure that vulnerable communities are supported in the transition towards a sustainable future.",1.6339768224980191,4.999999999994891,1.379453390430562e-10,,,5.0,"I wholeheartedly agree with your perspective on climate change affecting various aspects of our lives beyond just the environment. Recognizing the interconnectedness of our economies, health, and social equity is essential in our collective efforts to combat this crisis. Prioritizing support for vulnerable communities is not only a matter of justice but also vital for creating inclusive solutions that benefit us all as we strive for a sustainable future.",2.092922084120611,5.0,0.0,,
493.0,disc,4.0,"I appreciate your insightful response and the emphasis on interconnectedness; it's essential that we view climate change through a holistic lens. Supporting vulnerable communities is indeed a justice issue, as their resilience and adaptability are crucial for the overall success of our climate initiatives. By fostering inclusive solutions that take diverse perspectives into account, we can ensure a more robust and equitable path toward a sustainable future for everyone.",1.970086265035728,4.999999999986112,3.610864874513456e-10,,,5.0,"Thank you for your thoughtful reply; I completely agree that a holistic approach is vital in addressing climate change. By incorporating diverse perspectives and fostering inclusive solutions, we can harness the strengths and knowledge of various communities, ultimately leading to more effective climate initiatives. It's imperative that we work together to build resilience and ensure that no one is left behind as we navigate this critical transition toward sustainability for all.",1.5656049541732255,5.0,0.0,,
493.0,disc,4.0,"Thank you for your thoughtful engagement; it's inspiring to see such strong alignment on the importance of collaboration. Emphasizing the strengths and knowledge of diverse communities not only enriches our climate initiatives but also fosters a sense of ownership and solidarity in the solutions we develop. As we move forward, let’s commit to nurturing these partnerships, ensuring that resilience is built through shared experiences and mutual support, leaving no one behind in our pursuit of a sustainable future.",1.9080568966235387,4.999999999984263,4.071974931926833e-10,,,5.0,"I couldn't agree more with your emphasis on collaboration and the importance of nurturing partnerships in our climate efforts. Building a sense of ownership among diverse communities fosters commitment and collective action, ensuring that solutions are not only effective but also embraced by those they directly impact. As we strive for a sustainable future, let’s continue to amplify these shared experiences and mutual support, making resilience a cornerstone of our collective journey.",2.062184530998205,4.999999999995492,1.222999574288945e-10,,
493.0,disc,4.0,"I'm grateful for your alignment on the significance of ownership and collaboration in our climate journey. By amplifying shared experiences and mutual support, we can create a strong foundation for resilience that empowers communities and fosters innovative solutions. Together, let's remain dedicated to reinforcing these partnerships, ensuring that our collective efforts truly reflect the voices and needs of those most affected by climate change.",2.67884840801787e+61,4.999999999986112,3.6108648744499674e-10,,,5.0,"Thank you for your encouraging words; I share your gratitude for the power of ownership and collaboration in driving our climate agenda forward. By actively seeking to incorporate the voices and needs of affected communities, we can develop innovative solutions that are both practical and meaningful. Let’s continue to strengthen our partnerships and remain steadfast in our commitment to empowering those on the frontlines of climate change, ensuring that their insights guide our shared efforts toward a more resilient future.",2.01072383873295,4.999999999997587,6.697085695695598e-11,,
493.0,disc,4.0,"I appreciate your enthusiasm and commitment to incorporating the voices of affected communities in our climate initiatives. It's clear that when those on the frontlines are empowered to share their insights, we can develop practical solutions that are genuinely meaningful and effective. Let’s stay focused on strengthening our partnerships and fostering an inclusive dialogue that elevates these important perspectives as we work together towards a more resilient future for all.",2.0961437579247924,4.99999999999963,1.096429428637331e-11,,,5.0,"Thank you for your kind words; I truly believe that empowering frontline communities is essential for crafting effective climate solutions. By fostering inclusive dialogue and actively listening to diverse perspectives, we can ensure that our initiatives are grounded in the realities faced by those most impacted by climate change. As we strengthen our partnerships, let’s remain committed to creating a resilient future that reflects the needs and aspirations of everyone in our shared journey.",1.4377931786340914,4.999999999995492,1.222999574288395e-10,,
