ID,TEXT_TYPE,INIT_OP_A,TEXT_A,PPL_A,PROBE_INT_A,H_INT_A,PROBE_EXT_A,H_EXT_A,INIT_OP_B,TEXT_B,PPL_B,PROBE_INT_B,H_INT_B,PROBE_EXT_B,H_EXT_B
518.0,tot,5.0,"Climate change is one of the most pressing issues of our time, affecting not only the environment but also public health, economies, and social equity. The evidence is undeniable—rising temperatures, extreme weather events, and melting ice caps are all consequences of human activity. Urgent action is needed, not just from governments but also from individuals and businesses to reduce carbon emissions and shift towards sustainable practices. The time to act is now, as the longer we wait, the more severe the repercussions will be for future generations. It's essential to foster awareness and advocate for policies that prioritize the planet's health. Every action counts.",1.8849370755910153,4.999999999998121,5.262677460474549e-11,,,1.0,"I believe that the focus on climate change has been exaggerated and often distracts from more pressing and immediate issues facing humanity, such as poverty, healthcare, and education. Many proposed solutions, like drastic policy changes and economic upheaval, could harm economies without solving the problem effectively. Furthermore, there are natural climate cycles that have occurred throughout history, and it's essential to consider all factors rather than placing undue blame on human activity. Instead of prioritizing climate change, we should direct our resources towards sustainable development and technological innovations that can address a variety of global challenges.",2.0787984766763907,1.9997388318580793,0.002416457418406435,,
518.0,disc,5.0,"Climate change is an urgent crisis that we can no longer ignore, as its impacts are being felt in every corner of the globe. From unprecedented heatwaves to devastating floods, the evidence clearly shows that human activity is driving these changes, and we must take immediate action to mitigate further harm. As individuals, communities, and global citizens, we all have a role to play in advocating for sustainable practices and supporting policies that prioritize our planet's future.",1.69107396823575,4.999999939764254,1.061655020654009e-06,,,1.0,"While I understand the urgency expressed, I believe that the focus on climate change can overshadow more immediate issues like poverty, healthcare, and education that need our attention. The proposed drastic measures often come with significant economic risks and may not effectively address the complexities of climate issues, which have natural cycles that extend beyond human influence. Instead of prioritizing climate change alone, we should invest in sustainable development and technological innovations that can tackle a broader range of global challenges.",1.6287691564421478,1.9999998884387973,1.4003761104985397e-05,,
518.0,disc,5.0,"I completely agree that poverty, healthcare, and education are critical issues that deserve our attention, but climate change is intricately linked to these challenges; for instance, its impacts on public health and economic stability can exacerbate inequalities. Addressing climate change is not about overshadowing other concerns; rather, it’s about recognizing that a destabilized climate will make it increasingly difficult to solve those very issues. Moreover, investing in sustainable development and innovative technologies can go hand in hand with climate action, leading to a more resilient future for all, while also creating jobs and fostering economic growth.",2.0459817181120012,4.999999997938846,4.328422594691787e-08,,,1.0,"I appreciate your perspective and recognize the interconnectedness of climate change and other global challenges; however, the solutions we pursue must be carefully considered to avoid unintended consequences. While it’s true that climate issues can impact public health and economic stability, I worry that prioritizing climate change policy may divert resources from addressing urgent human needs that could have more immediate benefits. We should strive for a balanced approach that focuses on sustainable development and innovation without overemphasizing climate change to the detriment of other pressing priorities.",2.1713339012684916,2.0000022281028262,8.465571073347532e-05,,
518.0,disc,5.0,"I completely understand your concerns about unintended consequences and the need for a balanced approach; however, it's important to acknowledge that climate change threatens to undermine progress in areas like public health, food security, and economic stability. By prioritizing climate action, we can create solutions that not only reduce greenhouse gas emissions but also support sustainable development and innovation, ensuring that resources are effectively utilized for multiple benefits. It’s essential to recognize that climate policies can actually provide immediate benefits, such as job creation in clean energy sectors, which can help address urgent human needs while also safeguarding our planet for future generations.",5.719461230568424e+37,4.999999999241744,1.6681632900324748e-08,,,1.0,"I see your point about the potential for climate policies to yield immediate benefits, such as job creation in clean energy sectors; however, I remain concerned about the overarching focus on climate change that could lead to rash policy decisions. It’s crucial to ensure that any initiatives taken to address climate change do not inadvertently compromise economic stability or divert funding from essential areas like healthcare and education. Ultimately, the most effective approach may lie in prioritizing holistic solutions that address multiple global challenges without placing excessive emphasis on climate change alone.",1.9599582150917424e+43,2.000004546880638,6.727413420629055e-05,,
518.0,disc,5.0,"Your concerns about hasty policy decisions and the need for economic stability are valid, and the goal should always be to implement solutions that are both effective and equitable. However, it’s important to recognize that the climate crisis is a pressing global challenge that requires urgent action; if we do not address it, we risk jeopardizing all other areas, including healthcare and education, as these systems are increasingly affected by climate-related impacts. A holistic approach can indeed be the key, and by integrating climate considerations into broader policy frameworks, we can create resilient solutions that support a thriving economy while also addressing the pressing needs of our communities.",2.188886123530509,4.999999999994891,1.3794533904319263e-10,,,1.0,"I appreciate your acknowledgment of the need for equitable solutions, and I understand the urgency of the climate crisis as a global challenge. However, my concern remains that an intense focus on climate-related actions can lead to potential economic repercussions that might undermine our ability to effectively address urgent human needs. A truly holistic approach should prioritize immediate issues like poverty and healthcare while incorporating climate considerations in a way that doesn’t overshadow or detract from the primary goal of improving human well-being.",3.377059503650687e+47,2.000044330175312,0.0005151251498077004,,
518.0,disc,5.0,"I appreciate your emphasis on prioritizing immediate human needs like poverty and healthcare, as they are indeed essential to our well-being; however, it's vital to highlight that climate change can exacerbate these very issues. The impacts of climate change, such as extreme weather events and resource scarcity, can significantly disrupt economic stability and public health systems, making it imperative that we address them concurrently. A truly holistic approach means integrating climate action with efforts to support those in need, ensuring that addressing the climate crisis enhances, rather than detracts from, our overall goals of human well-being and societal progress.",2.3466739205176306,4.999999999753831,5.692674144800494e-09,,,1.0,"I understand your argument about the exacerbating effects of climate change on poverty and healthcare, and I agree that these connections are important to consider. Nevertheless, I caution against prioritizing climate action to the extent that it distracts from addressing immediate human needs that require urgent attention and resources. A balanced approach is vital; we should strive to alleviate pressing issues like poverty and healthcare while exploring climate solutions only as they align with and support our overarching goal of improving human welfare, rather than risking economic stability.",4.5357914446868516e+44,2.000006679409079,0.0001182823176349605,,
