ID,TEXT_TYPE,INIT_OP_A,TEXT_A,PPL_A,PROBE_INT_A,H_INT_A,PROBE_EXT_A,H_EXT_A,INIT_OP_B,TEXT_B,PPL_B,PROBE_INT_B,H_INT_B,PROBE_EXT_B,H_EXT_B
520.0,tot,5.0,"Climate change is one of the most pressing issues of our time, affecting not only the environment but also public health, economies, and social equity. The evidence is undeniable—rising temperatures, extreme weather events, and melting ice caps are all consequences of human activity. Urgent action is needed, not just from governments but also from individuals and businesses to reduce carbon emissions, invest in renewable energy, and promote sustainable practices. Addressing climate change is crucial for ensuring a habitable planet for future generations. We must act decisively and collaboratively to mitigate its impacts and foster a resilient, sustainable future.",1.6774749022870643,4.999999999998121,5.262677460481976e-11,,,1.0,"I believe that the focus on climate change has been exaggerated and often distracts from more immediate and pressing issues facing humanity, such as poverty, healthcare, and education. Many proposed solutions, like drastic policy changes and economic upheaval, could harm economies and livelihoods without guaranteeing significant impact on climate. Instead of prioritizing climate change, we should concentrate on practical advancements in technology and infrastructure that enhance our resilience and adaptability to environmental changes, without crippling economic growth.",2.067607285627055,1.998073294269263,0.013971205439756211,,
520.0,disc,5.0,"Climate change presents an urgent challenge that impacts every facet of our lives, from the environment to public health. We must recognize the undeniable evidence of rising temperatures and extreme weather patterns as a call to action. It is essential for us to collaborate across all sectors—governments, businesses, and individuals alike—to implement sustainable practices and invest in renewable energy for a healthier planet and a more equitable future.",1.808261534860484,4.999999977835951,4.127529778404998e-07,,,1.0,"I appreciate the concern about climate change, but I believe we need to prioritize more immediate issues like poverty and healthcare that affect millions of lives daily. The push for drastic actions on climate often overlooks the potential negative consequences on economies and livelihoods, especially for those in vulnerable situations. Rather than focusing solely on climate change, we should invest in practical technological advancements that allow us to adapt and build resilience, while fostering economic growth.",2.1901632301695857,1.9999990448487326,1.7661938628252646e-05,,
520.0,disc,5.0,"I wholeheartedly agree that poverty and healthcare are critical issues that deserve our attention, and I see them as intertwined with the climate crisis. Failing to address climate change can exacerbate poverty and health challenges, as vulnerable communities are often the most affected by extreme weather events and environmental degradation. Therefore, we must pursue solutions that not only promote sustainability but also create economic opportunities and enhance resilience, ensuring that all communities can thrive in a changing climate.",1.878193269046913,4.99999999999344,1.7548535115863672e-10,,,1.0,"While I understand the connection you're making between climate change and poverty, I believe that the immediate focus should be on alleviating the pressing needs in healthcare and economic stability. Often, the solutions proposed for climate change, such as radical policy changes or renewable energy mandates, can inadvertently harm those very communities you seek to protect by limiting job opportunities or raising living costs. Instead of intertwining these issues, we should adopt a more balanced approach that prioritizes immediate human needs while promoting practical advancements in technology that can help us adapt without compromising economic growth.",7.998677643704225e+40,2.0000026640759083,4.3778136478272355e-05,,
520.0,disc,5.0,"I appreciate your perspective and recognize the urgency of addressing immediate human needs in healthcare and economic stability. However, I believe that the solutions for a sustainable future and the solutions for alleviating poverty can go hand in hand; for example, investing in green jobs and renewable energy can simultaneously create employment opportunities while addressing climate change. By pursuing innovative technologies and policies that prioritize both climate action and economic growth, we can create a more equitable system that benefits all communities, ensuring that no one is left behind in the transition to a sustainable future.",4.689859328885669e+41,4.999999999540094,1.03478745066971e-08,,,1.0,"I understand the argument for green jobs and renewable energy creating employment opportunities, but I remain cautious about the economic disruptions that can occur during such transitions. The reality is that many proposed green initiatives require substantial investment and can take years to implement, potentially straining resources meant for urgent healthcare and poverty alleviation efforts. Instead, we should focus on practical solutions that provide immediate benefits to communities, while supporting existing industries that can offer stability and growth without risking current livelihoods in the name of transitioning to a sustainable future.",6.883137413973135e+43,2.000002717264011,5.359618587530558e-05,,
520.0,disc,5.0,"Your concerns about potential economic disruptions during the transition to a greener economy are valid and deserve careful consideration. However, it’s essential to recognize that investing in sustainable initiatives can yield immediate benefits, such as job creation in emerging industries and improved public health through cleaner air and water. By adopting a phased approach that supports both existing industries and encourages the development of green technologies, we can ensure a smooth transition that prioritizes immediate needs while fostering long-term economic resilience and environmental sustainability.",1.7958188634713164,4.999999999241744,1.668163290034354e-08,,,1.0,"I appreciate your perspective on a phased approach, but it's important to recognize that the timing and implementation of these initiatives can vary significantly and may not align with the urgent needs of struggling communities. While job creation in green industries is often touted, the reality is that many of these positions may not be accessible to individuals in vulnerable situations without considerable retraining and investment in education. Ultimately, we should prioritize strategies that provide immediate economic stability and healthcare improvements, ensuring that we do not neglect those who are currently facing dire challenges while pursuing long-term environmental goals.",3.5367827476966775e+40,2.0000265934857056,0.000330676561184266,,
520.0,disc,5.0,"I completely understand the importance of aligning our initiatives with the urgent needs of struggling communities, and I agree that addressing immediate economic stability and healthcare improvements is vital. The transition to a sustainable economy must incorporate robust training and educational programs to ensure that those in vulnerable situations can access the green jobs being created. By integrating immediate relief efforts with comprehensive support for education and workforce development, we can address current challenges while laying the groundwork for a sustainable future that benefits everyone in the community.",2.1559920892978948,4.999999999330841,1.4805134114956776e-08,,,1.0,"While I support the idea of integrating training and education programs, I remain concerned about the feasibility and effectiveness of such initiatives in the short term, especially given the amount of time and resources they require. The pressing challenges of poverty, healthcare, and economic instability often demand immediate action that can be overlooked in the pursuit of long-term green job initiatives. We should prioritize targeted investments in sectors that can provide immediate benefits and support those currently in need, ensuring their well-being is addressed first before pursuing ambitious sustainability goals that may take years to materialize.",1.0242704446279656e+41,2.0000333615670627,0.0004259328661754693,,
