ID,TEXT_TYPE,INIT_OP_A,TEXT_A,PPL_A,PROBE_INT_A,H_INT_A,PROBE_EXT_A,H_EXT_A,INIT_OP_B,TEXT_B,PPL_B,PROBE_INT_B,H_INT_B,PROBE_EXT_B,H_EXT_B
522.0,tot,5.0,"Climate change is one of the most pressing issues of our time, affecting not only the environment but also public health, economies, and social equity. The evidence is undeniable—rising temperatures, extreme weather events, and melting ice caps are all consequences of human activity. Urgent action is needed, not just from governments but also from individuals and businesses to reduce carbon emissions, invest in renewable energy, and promote sustainable practices. Addressing climate change is crucial for ensuring a habitable planet for future generations. We must act now to mitigate its impacts and adapt to the changes already underway.",1.6629296894027272,5.0,0.0,,,1.0,"I believe that the focus on climate change has been exaggerated and often distracts from more pressing and immediate issues facing humanity, such as poverty, healthcare, and education. Many proposed solutions, like drastic policy changes and economic upheaval, could harm economies without solving the problem effectively. Furthermore, there are natural climate cycles that have occurred throughout history, and it's essential to consider all factors rather than attributing everything to human activity. Instead of prioritizing climate change, we should direct our resources towards sustainable development and technological innovations that can address a variety of global challenges.",2.0441545151233926,1.9994472435865271,0.004699183374766015,,
522.0,disc,5.0,"Climate change is a monumental challenge that we cannot afford to ignore any longer. As we witness the tangible effects of rising temperatures and extreme weather, it becomes clear that we must unite in our efforts to combat these changes. This requires collective action from governments, businesses, and individuals to not only reduce carbon emissions but also to invest in innovative solutions for a sustainable future.",2.1509136703640994,4.999999428495691,8.786846007315975e-06,,,1.0,"While I understand the concerns surrounding climate change, I believe the urgency placed on this issue often overshadows more immediate challenges like poverty and healthcare that also require collective action. The proposed drastic measures to combat climate change can lead to significant economic disruptions that might worsen the very conditions we seek to improve. Instead of focusing primarily on climate change, we should prioritize sustainable development and technological innovations that can effectively address a broader range of global issues.",1.7646537519655092,2.0000000451860847,4.121059175879317e-06,,
522.0,disc,5.0,"I appreciate your perspective, and it’s true that issues like poverty and healthcare are critical and interconnected with climate change. However, the impacts of climate change exacerbate these very challenges, particularly for vulnerable populations who are often the hardest hit by environmental degradation. By integrating climate action into our strategies for sustainable development and innovation, we can create solutions that not only mitigate climate change but also enhance public health, reduce poverty, and foster economic resilience.",1.662028960972609,4.999999953088362,8.385455305534936e-07,,,1.0,"I agree that there are connections between climate change and other critical issues, but I still think that focusing heavily on climate action can dilute our efforts to tackle urgent problems like poverty and healthcare directly. It's essential to evaluate the potential consequences of climate policies that might unintentionally harm economies and the very populations we aim to help. We should promote technological innovations and sustainable practices that address a range of global challenges, rather than primarily framing the discussion around climate change, which can divert resources and attention from pressing needs.",2.4077524224821296,1.9999993787143167,1.3012138962093538e-05,,
522.0,disc,5.0,"It's important to recognize that climate change does not exist in isolation; its effects on food security, health, and economic stability are profound and demand our attention. By prioritizing climate action as part of a holistic approach to development, we can create synergies that enhance both environmental and social outcomes, rather than seeing them as opposing forces. Moreover, investing in sustainable technologies and practices not only combats climate change but also drives innovation and economic growth, providing opportunities for those most in need while addressing multiple urgent issues simultaneously.",2.1398552548902434,4.999999997664407,4.8755504592601975e-08,,,1.0,"I see your point about the interconnectedness of climate change with issues like food security and health, but I still contend that overly emphasizing climate action can risk overshadowing immediate priorities that require urgent attention and resources. While investing in sustainable technologies is important, we must be cautious of policies that could lead to economic instability and hardship for vulnerable populations. A balanced approach that emphasizes addressing pressing social challenges first can foster innovation and sustainability without creating unnecessary burdens that stem from a singular focus on climate change.",2.382839844984048,2.0000125620607054,0.00016629193416862735,,
522.0,disc,5.0,"I understand your concerns about maintaining a balanced approach, and it's crucial to prioritize the immediate needs of vulnerable populations. However, the reality is that climate change is increasingly becoming an urgent priority that directly threatens food security, health, and economic stability, especially for disadvantaged communities. A comprehensive strategy that integrates climate action with social challenges can foster resilience—investing in sustainable practices not only helps mitigate climate impacts but can also provide new economic opportunities and safeguard the well-being of those who are currently most at risk.",2.2855179878517347,4.999999999594134,9.182700339288535e-09,,,1.0,"I appreciate your emphasis on the urgency of addressing threats to food security and health, but I believe it's essential to prioritize practical solutions that directly lift vulnerable populations out of their current hardships first. While I agree that sustainable practices can create opportunities, we must approach policy with caution, ensuring that measures designed to mitigate climate change do not inadvertently place additional burdens on disadvantaged communities. A sound strategy should focus on immediate economic and social improvements, paving the way for technological advancements, rather than placing climate action at the forefront of our discussions, which may lead to unintended consequences.",8.663436473338549e+39,2.00000754267362,0.00010609140259192334,,
522.0,disc,5.0,"I completely agree that practical and immediate solutions are necessary to uplift vulnerable populations, and we must ensure that climate action does not inadvertently exacerbate their hardships. However, neglecting climate change in our policy discussions could lead to greater long-term consequences that undermine those immediate efforts; climate impacts can destabilize economies and worsen food security, thereby counteracting progress. By incorporating climate considerations into our social and economic strategies, we can create a more resilient future that provides both immediate relief and sustainable growth, ensuring that no one is left behind as we move forward.",2.479955455715324,4.999999998896744,2.3857911573594346e-08,,,1.0,"I acknowledge the potential long-term consequences of neglecting climate change, but I still believe that prioritizing immediate, concrete solutions will yield more effective and faster results for vulnerable populations. We must ensure that our efforts focus on initiatives that tackle poverty, healthcare, and education head-on rather than attempting to integrate potentially expensive and disruptive climate policies that may not deliver immediate benefits. A focus on practical development and innovation can create a foundation for resilience, allowing us to address various global challenges without losing sight of the urgent needs of those most in need.",2.1653636738117977e+82,2.000000764780506,2.464872086487645e-05,,
