ID,TEXT_TYPE,INIT_OP_A,TEXT_A,PPL_A,PROBE_INT_A,H_INT_A,PROBE_EXT_A,H_EXT_A,INIT_OP_B,TEXT_B,PPL_B,PROBE_INT_B,H_INT_B,PROBE_EXT_B,H_EXT_B
533.0,tot,5.0,"Climate change is one of the most pressing issues of our time, affecting not only the environment but also public health, economies, and social equity. The evidence is undeniable—rising temperatures, extreme weather events, and melting ice caps are all consequences of human activity. Urgent action is needed, not just from governments but also from individuals and businesses to reduce carbon emissions, invest in renewable energy, and promote sustainable practices. Addressing climate change is crucial for ensuring a habitable planet for future generations. We must act decisively and collaboratively to mitigate its impacts and foster a resilient, sustainable future.",1.6816896419069671,4.999999999994211,1.5558896398891792e-10,,,2.0,"I believe that while environmental issues are important, the emphasis on climate change often overshadows other pressing concerns that deserve equal attention. There are natural climate fluctuations that have occurred throughout Earth's history, and many argue that humanity's ability to adapt is significant. Rather than focusing solely on climate change, we should prioritize economic development, technological innovation, and improving living standards globally, which can also contribute to better environmental stewardship. Addressing immediate human needs can lead to more sustainable long-term solutions without the alarmism often tied to climate narratives.",2.181616293719759,2.005218877361754,0.032660271527106,,
533.0,disc,5.0,"Climate change presents an urgent challenge that impacts every facet of our lives, from the environment to public health. We must recognize the undeniable evidence of rising temperatures and extreme weather events as a call to action. It is essential for us to collaborate—governments, businesses, and individuals alike—to implement sustainable practices and invest in renewable energy for a resilient future.",1.6521140195395767,4.99999997783696,4.127460131201156e-07,,,2.0,"While I acknowledge the challenges posed by climate change, I believe it’s crucial to also consider the broader context of human development and innovation. Addressing immediate human needs and fostering economic growth can provide pathways to sustainable solutions without the urgency that often accompanies climate narratives. We must ensure that our focus on climate does not overlook other pressing issues that also demand our attention and resources.",2.244470600930301,2.029312281120102,0.13234466430946648,,
533.0,disc,5.0,"I completely understand the importance of addressing human development and economic growth alongside climate action; however, these issues are deeply interconnected. Ignoring the urgency of climate change risks undermining our progress on economic and social fronts, as extreme weather events and environmental degradation can exacerbate poverty and inequality. By integrating sustainable practices into our development goals, we can create a more equitable society while simultaneously addressing the pressing challenges posed by climate change.",1.5535497253531076,4.999999999951527,1.1997237371348943e-09,,,2.0,"I appreciate your perspective on the interconnectedness of these issues, but I believe it's essential to recognize that humanity has historically demonstrated remarkable resilience and adaptability to environmental changes. By prioritizing economic development and technological innovation, we can create a foundation that naturally encourages sustainable practices without succumbing to alarmist narratives. Ultimately, finding a balanced approach that addresses immediate human needs can lead to more effective long-term solutions for both society and the environment.",1.7491129465836126,2.5000006226749063,0.6931569957222979,,
533.0,disc,5.0,"While humanity has shown resilience in the face of change, the unprecedented pace and scale of climate change today demand proactive measures rather than reactive solutions. Relying solely on economic development and technological innovation without urgent action could lead to irreversible damage to our ecosystems and communities, disproportionately affecting the most vulnerable. A balanced approach must prioritize sustainability as a core principle of development, ensuring that we foster long-term solutions that protect both people and the planet.",1.8512930801465615,4.9999999999294715,1.7191393590759786e-09,,,2.0,"I agree that taking proactive measures is important, but I believe that urgency shouldn't overshadow the need for practical solutions and broader priorities. Focusing too heavily on immediate sustainability goals can divert resources away from essential economic development, which ultimately benefits everyone, including the vulnerable. By fostering innovation and improving living standards, we can create resilience that supports both human prosperity and environmental stewardship without the alarmism that can hinder constructive dialogue.",2.520994283931729,2.9984990014406465,0.011263069401262841,,
533.0,disc,5.0,"I appreciate your emphasis on practical solutions and the importance of economic development, which are indeed vital for fostering resilience. However, it's critical to recognize that the consequences of inaction on climate change can threaten the very foundations of economic stability and social welfare, disproportionately impacting the vulnerable populations we seek to uplift. Therefore, we must strive for a balanced approach that integrates immediate sustainability goals with economic growth, allowing for innovative solutions that are both environmentally responsible and socially equitable.",3.646729531853286e+48,4.999999999868235,3.129422039374888e-09,,,2.0,"I completely understand your concern regarding the potential consequences of inaction, but I believe that fostering economic stability through development can also enhance our ability to address environmental issues effectively. Economic growth empowers communities and provides the resources necessary for innovative solutions that benefit both society and the environment. By focusing on uplifting vulnerable populations through broader development initiatives, we can create a stronger foundation for implementing sustainable practices without falling into the trap of alarmism.",2.3224515314352456,2.962684557272075,0.15948935137600367,,
533.0,disc,5.0,"I agree that economic stability is crucial for empowering communities and enabling innovative solutions, and I appreciate your focus on uplifting vulnerable populations. However, the urgency of climate change necessitates immediate action in tandem with economic development, as environmental degradation can undermine growth and exacerbate existing inequalities. By prioritizing sustainability alongside economic initiatives, we can ensure that our development efforts are resilient and inclusive, ultimately leading to a more prosperous future for both people and the planet.",1.7180063517608621,4.99999999983081,3.9759600985511626e-09,,,2.0,"I appreciate your emphasis on the urgency of climate change, but I still believe that we must carefully consider our approach to ensure that it does not hinder broader economic progress. While sustainability is important, immediate needs often take precedence, and a robust economy can provide the resources necessary for long-term environmental stewardship. By focusing on uplifting communities through economic development, we can create a more stable foundation from which to address environmental concerns without compromising overall growth and social progress.",2.4367395128794693,2.9984995391500937,0.011271201287917846,,
