ID,TEXT_TYPE,INIT_OP_A,TEXT_A,PPL_A,PROBE_INT_A,H_INT_A,PROBE_EXT_A,H_EXT_A,INIT_OP_B,TEXT_B,PPL_B,PROBE_INT_B,H_INT_B,PROBE_EXT_B,H_EXT_B
536.0,tot,5.0,"Climate change is one of the most pressing issues of our time, affecting not only the environment but also public health, economies, and social equity. The evidence is undeniable—rising temperatures, extreme weather events, and melting ice caps are all consequences of human activity. Urgent action is needed, not just from governments but also from individuals and businesses to reduce carbon emissions and shift towards sustainable practices. The time to act is now, as the longer we wait, the more severe the repercussions will be for future generations. It's essential to foster awareness and advocate for policies that prioritize the planet's health. Every action counts.",1.8553779459353246,4.999999999998121,5.262677460475772e-11,,,2.0,"I believe that while environmental issues are important, the emphasis on climate change often overshadows other pressing concerns that deserve equal attention. The notion that climate change is the most urgent problem can lead to ineffective policies that prioritize it over economic stability, job creation, and energy independence. We should focus on a balanced approach to environmental stewardship, considering all factors instead of solely prioritizing climate-related initiatives.",9.840011383485321e+55,2.029364517828785,0.1326538656641926,,
536.0,disc,5.0,"Climate change is a critical challenge that we cannot afford to ignore, as it threatens our ecosystems, public health, and economic stability. The alarming rise in global temperatures and the frequency of extreme weather events are clear signs that immediate action is essential. I believe we must work together—individuals, businesses, and governments alike—to implement sustainable practices and advocate for policies that prioritize the health of our planet for the sake of current and future generations.",1.7010354575901137,4.999999997001039,6.185356687316356e-08,,,2.0,"While I understand the urgency expressed regarding climate change, I believe that this focus often distracts us from other equally pressing issues that need our attention. We must pursue a balanced approach that not only addresses climate challenges but also ensures economic stability, job creation, and energy independence. By considering a wider range of factors, we can develop more effective and holistic policies that serve both the environment and society as a whole.",1.876925546791131,2.022982188939507,0.10944719554205355,,
536.0,disc,5.0,"I appreciate your perspective on the need for a balanced approach, and I agree that economic stability and job creation are important considerations in addressing climate change. However, I would argue that climate change fundamentally impacts those very issues—extreme weather can disrupt economies, displace communities, and threaten livelihoods. By integrating climate action into our broader policy goals, we have the opportunity to create sustainable jobs and drive innovation, ultimately benefiting both the environment and society simultaneously.",1.6823237804734774,4.999999992805867,1.4208412632953719e-07,,,2.0,"I acknowledge that climate change can indeed have significant impacts on economies and communities, but we must be careful not to prioritize climate action at the expense of immediate economic needs and job security. It’s essential to recognize that not all climate initiatives lead to sustainable job creation or economic growth, and sometimes they can inadvertently harm long-standing industries. Instead, we should pursue policies that are both environmentally conscious and economically viable, ensuring that our approach is inclusive and considers the broader implications for all sectors.",1.026834258731185e+46,2.1480557364089328,0.4193665871787694,,
536.0,disc,5.0,"I completely agree that we must carefully evaluate the economic implications of climate initiatives to ensure they are both effective and equitable. However, it’s important to recognize that the transition to a sustainable economy can create new industries and job opportunities that are not only environmentally friendly but also provide long-term stability and resilience. By designing policies that invest in clean energy, green technology, and workforce development, we can create a robust economy that prioritizes environmental health while respecting and supporting traditional industries during this necessary transition.",1.2363791133066933e+45,4.999999999996488,9.612517162195804e-11,,,2.0,"While I appreciate your acknowledgment of the need to evaluate economic implications, I remain cautious about the assumption that a transition to a sustainable economy will automatically yield new job opportunities without significant costs to existing industries. It is crucial to support traditional industries during this transition, as many communities rely on them for their livelihoods, and a rapid shift could lead to economic instability. Therefore, our policies should carefully balance investment in green technology with the preservation of current jobs, ensuring that no group is left behind in the quest for environmental progress.",2.030344559716369,2.7773177812093235,0.5304755797852384,,
536.0,disc,5.0,"Your concerns are valid, and it's essential to strike a balance between advancing sustainable practices and supporting communities that depend on traditional industries. Transitioning to a sustainable economy does need to be managed thoughtfully, ensuring that we provide resources and training for workers to adapt to new roles in the green sector. By investing in retraining programs and offering incentives for industries to innovate sustainably, we can create a more inclusive approach that safeguards existing jobs while paving the way for a healthier environment and a resilient economy.",1.8152441264320363,4.9999999999705995,7.423695558266562e-10,,,2.0,"I agree that investing in retraining programs and offering incentives for sustainable innovation can help create a more inclusive approach to this transition. However, it’s crucial to ensure that these programs are adequately funded and accessible to the workers who need them most, particularly in communities heavily reliant on traditional industries. Additionally, we must maintain an ongoing dialogue about the real economic impacts of these changes, ensuring that policy decisions are informed by data and reflect the needs of all stakeholders involved, not just those in the green sector.",2.0587375152060914,2.998328472998106,0.032617896445401126,,
536.0,disc,5.0,"You're absolutely right; adequate funding and accessibility are vital for retraining programs to be effective, especially in communities that are most vulnerable to the transition. Open dialogue and data-driven policies will ensure that we not only address the needs of workers in traditional industries but also incorporate diverse perspectives from all stakeholders to forge a well-rounded approach. By fostering collaboration and continuously evaluating the impacts of our initiatives, we can create a pathway that supports both economic stability and environmental progress for everyone involved.",2.047514650445153,4.999999999974054,6.583821993182196e-10,,,2.0,"I appreciate your emphasis on collaboration and the need for diverse perspectives in shaping policies that impact communities and the economy. However, we must be cautious that the enthusiasm for environmental progress does not overshadow the immediate needs of those who may be negatively affected during the transition. A thorough assessment of both short-term and long-term implications will be critical to ensure that everyone benefits from these initiatives, rather than creating additional challenges for vulnerable populations.",2.222337503628908,2.95504144870722,0.20702236268898122,,
