ID,TEXT_TYPE,INIT_OP_A,TEXT_A,PPL_A,PROBE_INT_A,H_INT_A,PROBE_EXT_A,H_EXT_A,INIT_OP_B,TEXT_B,PPL_B,PROBE_INT_B,H_INT_B,PROBE_EXT_B,H_EXT_B
550.0,tot,5.0,"Climate change is one of the most pressing issues of our time, affecting not only the environment but also public health, economies, and social equity. The evidence is undeniable—rising temperatures, extreme weather events, and melting ice caps are all consequences of human activity. Urgent action is needed, not just from governments but also from individuals and businesses to reduce carbon emissions and shift towards sustainable practices. The time to act is now, as the longer we wait, the more severe the repercussions will be for future generations. It's essential to foster awareness and advocate for policies that prioritize the planet's health. Every action counts.",1.849178381009718,4.999999999995492,1.2229995742957082e-10,,,3.0,"Climate change is a complex issue that prompts a wide range of opinions and perspectives. On one hand, there are compelling arguments about the environmental impacts and potential risks to ecosystems and human health. On the other hand, some people raise questions about the effectiveness of proposed solutions and the economic ramifications. It's important to consider multiple viewpoints and the nuances involved in discussions surrounding this topic. Awareness and dialogue may help in addressing the various challenges associated with climate change, regardless of individual stance.",1.1054777241326926e+47,4.022977367548082,0.10941059791022748,,
550.0,disc,5.0,"Climate change is a critical challenge that we cannot afford to ignore, as it threatens not only our environment but also our health and economic stability. Every community feels the impacts differently, but the underlying truth remains: we must unite to implement sustainable solutions and reduce our carbon footprint. I encourage us all to share our thoughts on actionable steps we can take personally and collectively to make a meaningful difference in combating this urgent crisis.",2.402905501579249,4.999999999995492,1.2229995742922487e-10,,,3.0,"I completely agree that climate change is indeed a pressing issue that affects every facet of our lives. While it's essential to focus on actionable steps that we can all take, it's also crucial to remain aware of the diverse perspectives surrounding the effectiveness of these solutions. Engaging in open dialogue about our differing views can foster a better understanding of the complexities involved and encourage more effective collaborative efforts.",2.259147242308692,4.999738809673314,0.0024160446303880534,,
550.0,disc,5.0,"I appreciate your emphasis on the importance of diverse perspectives in addressing climate change; it’s essential for fostering a comprehensive understanding of the complexities involved. Open dialogue can uncover innovative solutions and help us identify the most effective strategies, ensuring no voices are left unheard in this critical conversation. By working collaboratively, we can not only embrace varying viewpoints but also strengthen our collective commitment to creating a sustainable future for all.",2.304206042924595,4.999999999994891,1.3794533904342885e-10,,,3.0,"Thank you for your thoughtful response; I appreciate your recognition of the value of open dialogue in this critical conversation. By creating an inclusive environment where all viewpoints are welcome, we can indeed harness a greater pool of ideas that may lead to innovative solutions. It's through these collaborative efforts that we can build a more effective approach to tackling climate change while ensuring that diverse voices contribute to our shared goals.",2.266186961682927,4.999999855501969,2.4203420136189475e-06,,
550.0,disc,5.0,"You're absolutely right; an inclusive environment is key to harnessing the diverse perspectives that can drive innovative solutions in our fight against climate change. By actively encouraging contributions from all community members, we can discover unique approaches that might have otherwise gone unheard. Together, we can cultivate a sense of solidarity and shared purpose that empowers us to tackle this urgent crisis more effectively and equitably.",1.6555427838871293e+58,4.999999999994891,1.3794533904330505e-10,,,3.0,"I completely agree that fostering an inclusive environment can lead to the discovery of a wide array of solutions that benefit everyone. Encouraging contributions from all community members not only enhances our problem-solving capacity, but it also builds a stronger sense of solidarity, which is essential for long-term commitment to addressing climate change. By working together and valuing every perspective, we enrich our collective efforts and increase the likelihood of implementing effective and equitable strategies.",2.78170694067976e+102,4.999999939764254,1.061655020655436e-06,,
550.0,disc,5.0,"I'm glad to see we share a common understanding of the importance of solidarity in our climate efforts; it's truly vital for sustained action. By valuing each contribution, we not only empower individuals but also foster a sense of responsibility towards one another and our planet. This collective commitment can create a powerful momentum, enabling us to implement strategies that are not only effective but also equitable for all communities involved in combating climate change.",2.1498498327418814,4.9999999999915765,2.2322180986735386e-10,,,3.0,"Absolutely, the sense of responsibility you mention is crucial for driving continuous action against climate change. When individuals feel empowered and recognized for their contributions, it cultivates a culture of mutual support that enhances our overall effectiveness. This unity can indeed generate significant momentum, enabling us to pursue strategies that ensure a fair and just transition for all communities as we navigate the complexities of this urgent challenge.",2.149933360087454,4.999999992805867,1.4208412632980855e-07,,
550.0,disc,5.0,"You’ve beautifully articulated the role of empowerment and mutual support in driving our collective action against climate change. By fostering a culture where everyone feels valued and responsible, we create a solid foundation for engaging more people in sustainable practices and advocacy. It's this unity and shared purpose that will enable us to not only tackle the complexities we face but also ensure that the transition to a sustainable future is equitable for all communities involved.",7.749859546609718e+53,4.99999999999963,1.0964294286373456e-11,,,3.0,"Thank you for your kind words; I truly appreciate your recognition of the importance of fostering a culture of empowerment. Engaging more people in sustainable practices and advocacy is indeed essential, as it amplifies our collective capacity to address the multifaceted challenges posed by climate change. By working towards an equitable transition, we not only enhance our ability to confront these complexities but also ensure that the benefits of our actions are shared by all communities, creating a brighter future together.",1.8336107969982007,4.999999993651199,1.2618240149069022e-07,,
