ID,TEXT_TYPE,INIT_OP_A,TEXT_A,PPL_A,PROBE_INT_A,H_INT_A,PROBE_EXT_A,H_EXT_A,INIT_OP_B,TEXT_B,PPL_B,PROBE_INT_B,H_INT_B,PROBE_EXT_B,H_EXT_B
561.0,tot,5.0,"Climate change is one of the most pressing issues of our time, affecting not only the environment but also public health, economies, and social equity. The evidence is undeniable—rising temperatures, extreme weather events, and melting ice caps are all consequences of human activity. Urgent action is needed, not just from governments but also from individuals and businesses to reduce carbon emissions and shift towards sustainable practices. The time to act is now, as the longer we wait, the more severe the repercussions will be for future generations. It's essential to prioritize renewable energy, conservation efforts, and innovative solutions to combat this global crisis. Together, we can make a difference.",1.6912312515983368,5.0,0.0,,,3.0,"Climate change is a complex issue that prompts a wide range of opinions and perspectives. On one hand, there are compelling arguments about the environmental impacts and potential risks to ecosystems and human health. On the other hand, some people raise questions about the effectiveness of proposed solutions and the economic ramifications. It's important to consider multiple viewpoints and the nuances involved in discussions surrounding this topic. Awareness and dialogue may help in addressing the various challenges associated with climate change, regardless of individual stance.",1.0988895899544454e+47,4.0293122275664786,0.13234322202097543,,
561.0,disc,5.0,"Climate change is an urgent crisis that requires our immediate attention and collective action. The evidence of its impact—rising temperatures, more frequent extreme weather events, and loss of biodiversity—is becoming increasingly difficult to ignore. It’s essential for us to explore innovative solutions and sustainable practices that not only address environmental concerns but also promote public health and social equity for all.",1.7103973856601846,4.999999999994891,1.3794533904312496e-10,,,3.0,"I appreciate your emphasis on the urgency of the climate crisis and the need for collective action. While it's undeniable that the evidence of climate change is becoming more apparent, it's also crucial to have a balanced dialogue about the practical implications and potential unintended consequences of some proposed solutions. Engaging in discussions that incorporate diverse perspectives can foster a more comprehensive approach to addressing both environmental concerns and societal needs.",2.755234725559314e+57,4.0040701376367,0.02646420411086483,,
561.0,disc,5.0,"Thank you for highlighting the importance of balanced dialogue; it’s essential that we consider diverse perspectives in our discussions on climate change. While it's crucial to acknowledge potential unintended consequences, we must also act decisively, as the risks of inaction are far greater. By fostering open communication and collaboration among various stakeholders, we can develop innovative solutions that not only mitigate environmental impacts but also address societal needs in a holistic manner.",1.7701807908237357,4.999999999996488,9.612517162195804e-11,,,3.0,"I agree that acting decisively is critical, as the risks associated with inaction can indeed be severe. It's encouraging to see the call for open communication and collaboration among stakeholders, as this can lead to more innovative and effective solutions. However, as we pursue these collaborative efforts, it’s essential to remain vigilant about the diverse opinions and concerns that may arise, ensuring that all voices are heard in shaping our collective response to climate change.",1.6356472378670164,4.993307148589739,0.04017960554042035,,
561.0,disc,5.0,"I completely agree that ensuring all voices are heard is vital in shaping an effective response to climate change. By actively engaging diverse opinions and concerns, we can foster a greater sense of ownership and commitment across communities and sectors. This inclusive approach not only helps us identify potential obstacles and solutions but also strengthens our collective resolve to tackle this pressing issue head-on.",2.0115701074794523,4.999999999999112,2.552492103316522e-11,,,3.0,"Your point about fostering a sense of ownership and commitment is essential for mobilizing community engagement in climate action. An inclusive approach indeed enables us to acknowledge and address potential obstacles more effectively, leading to more sustainable solutions. As we build this collaborative framework, it's important to remember that lasting change often comes from grassroots efforts, which can inform and influence policy and larger-scale initiatives.",2.2859597691696458e+119,4.999995214905151,6.340251785393145e-05,,
561.0,disc,5.0,"Absolutely, grassroots efforts play a pivotal role in driving meaningful change and influencing policy decisions. By empowering local communities and recognizing their unique insights, we can cultivate innovative solutions tailored to specific challenges they face. When grassroots movements are integrated into broader climate strategies, we create a more resilient framework that not only addresses immediate concerns but also paves the way for sustainable progress on a larger scale.",1.7008244565380413,4.9999999999915765,2.2322180986630696e-10,,,3.0,"I couldn’t agree more about the importance of grassroots movements in shaping effective climate strategies. By empowering local communities and leveraging their unique experiences, we can indeed develop tailored solutions that are both relevant and impactful. Additionally, integrating these efforts into broader climate policies not only enhances resilience but also fosters a sense of shared responsibility that is crucial for long-term sustainability.",1.873490873242623,4.999964643742472,0.0003977585154494847,,
561.0,disc,5.0,"You’ve captured the essence of what makes grassroots movements so powerful— their ability to foster shared responsibility and create tailored solutions that resonate with local realities. Integrating these community-driven initiatives into broader climate policies not only boosts their effectiveness but also ensures that the voices of those most affected by climate change are heard and valued. Together, we can build a more inclusive and proactive approach that not only addresses current challenges but also prepares us for the uncertainties ahead.",1.8918561729359502,4.999999999998709,3.665422212008404e-11,,,3.0,"Thank you for emphasizing the value of ensuring that the voices of those most affected are central to our climate strategies. This inclusiveness not only enhances the relevance of our solutions but also strengthens community resilience in the face of changing conditions. By working collaboratively and embracing the insights of grassroots movements, we can create a more adaptive and forward-thinking framework that meets both present and future challenges.",1.9252284593390316,4.999998629043345,1.9878872989731816e-05,,
