ID,TEXT_TYPE,INIT_OP_A,TEXT_A,PPL_A,PROBE_INT_A,H_INT_A,PROBE_EXT_A,H_EXT_A,INIT_OP_B,TEXT_B,PPL_B,PROBE_INT_B,H_INT_B,PROBE_EXT_B,H_EXT_B
562.0,tot,5.0,"Climate change is one of the most pressing issues of our time, affecting not only the environment but also public health, economies, and social equity. The evidence is undeniable—rising temperatures, extreme weather events, and melting ice caps are all consequences of human activity. Urgent action is needed, not just from governments but also from individuals and businesses to reduce carbon emissions and shift towards sustainable practices. The time to act is now, as the longer we wait, the more severe the repercussions will be for future generations. It's essential to foster awareness and advocate for policies that prioritize the planet's health. Every action counts.",1.8618174059401396,4.999999999998341,4.665032368419338e-11,,,3.0,"Climate change is a complex issue that prompts a wide range of opinions and perspectives. On one hand, there are compelling arguments about the environmental impacts and potential risks to ecosystems and human health. On the other hand, some people raise questions about the effectiveness of proposed solutions and the economic ramifications. It's important to consider multiple viewpoints and the nuances involved in discussions surrounding this topic. Awareness and dialogue may help in addressing the various challenges associated with climate change, regardless of individual stance.",1.1089629147373647e+47,4.014063627070527,0.0739338763833124,,
562.0,disc,5.0,"Climate change is a critical challenge that we cannot afford to ignore, as it threatens our ecosystems, public health, and economic stability. The alarming rise in global temperatures and the frequency of extreme weather events are clear signs that immediate action is essential. I believe we must work together—individuals, businesses, and governments alike—to implement sustainable practices and advocate for policies that prioritize the health of our planet for the sake of current and future generations.",1.7043626244320296,4.999999999897382,2.462851117391187e-09,,,3.0,"I agree that climate change presents significant threats to both our ecosystems and public health, and the rising temperatures and extreme weather events serve as urgent alarms for action. It's also crucial to engage in open dialogue about the various strategies we can employ, acknowledging that solutions must consider economic impacts and feasibility. By fostering collaboration among individuals, businesses, and governments, we can explore a diverse array of approaches that prioritize sustainability while addressing the complexities of this global challenge.",2.25585147822851,4.999088948598346,0.007288826265357529,,
562.0,disc,5.0,"I completely agree that open dialogue is essential for finding effective and inclusive solutions to climate change. It's important to recognize that sustainability and economic viability can go hand in hand; innovative technologies and practices can create new job opportunities while reducing carbon emissions. By collaborating across sectors and embracing diverse strategies, we can develop a comprehensive approach that not only mitigates climate change but also enhances social equity and community resilience.",1.5245104596509875,4.999999999982167,4.5918610668571526e-10,,,3.0,"You've raised an important point about the potential for sustainability and economic viability to work together, which is often overlooked in discussions about climate change. Embracing innovative technologies and practices can indeed drive both environmental benefits and economic growth, creating jobs that support communities as we transition to a more sustainable future. By fostering cross-sector collaboration and incorporating diverse strategies, we can build a resilient society that addresses the multifaceted challenges of climate change while promoting social equity.",1.9450677368248388,4.999996273360884,5.030963518515404e-05,,
562.0,disc,5.0,"Absolutely! The synergy between sustainability and economic growth is vital for ensuring a just transition that benefits everyone, especially marginalized communities disproportionately affected by climate change. By investing in green technologies and infrastructure, we can create sustainable jobs that not only address environmental concerns but also uplift local economies. It’s essential that we keep pushing for policies that support this collaborative and inclusive approach, as it will ultimately lead us toward a more resilient and equitable future.",1.9225567737920544,4.999999999997265,7.55460433675136e-11,,,3.0,"I wholeheartedly agree that prioritizing marginalized communities in our climate action plans is essential for fostering equity and ensuring that the transition to sustainability is genuinely inclusive. Investing in green technologies and infrastructure not only addresses pressing environmental concerns but also holds the potential to invigorate local economies, creating pathways to prosperity for all. By advocating for collaborative policies that recognize the interconnectedness of social and environmental issues, we can build a more resilient future that benefits everyone, especially those who have historically borne the brunt of climate change impacts.",1.9053449604693726,4.9999999956365375,8.836011027025049e-08,,
562.0,disc,5.0,"You’ve captured the essence of the issue perfectly—prioritizing equity in our climate action plans is not just a moral obligation; it is crucial for the effectiveness of our overall response to climate change. Elevating the voices of marginalized communities in the decision-making process ensures that their unique challenges and needs are addressed, leading to solutions that are truly comprehensive and effective. By fostering collaboration and creating policies that integrate social and environmental considerations, we can pave the way for a sustainable future that uplifts everyone and reinforces our collective resilience against climate impacts.",7.151072041358433e+40,4.9999999999915765,2.2322180986841788e-10,,,3.0,"You've articulated a vital aspect of climate action perfectly; engaging marginalized communities in the decision-making process not only addresses equity but also enhances the overall effectiveness of our responses to climate challenges. Their unique perspectives and experiences can lead to innovative solutions that reflect the real-world complexities of these issues, ensuring that no one is left behind. By fostering collaboration and crafting inclusive policies that blend social and environmental goals, we create a stronger foundation for resilience and sustainability, ultimately benefiting everyone in the process.",2.3314822156918735,4.999999997353426,5.491640286036582e-08,,
562.0,disc,5.0,"I wholeheartedly agree that the inclusion of marginalized communities can significantly enrich our climate action strategies with invaluable insights and innovative solutions. Their lived experiences are crucial for understanding the complexities of environmental challenges, and their engagement will ensure that our efforts are holistic and impactful. Ultimately, by crafting policies that unite social equity with environmental sustainability, we not only build resilience but also create a genuinely inclusive movement that empowers all individuals to thrive in a changing world.",2.7949088029367417e+51,4.999999999997587,6.697085695730403e-11,,,3.0,"You've highlighted an essential truth: the lived experiences of marginalized communities offer critical insights that can greatly enhance our climate action strategies. By actively integrating their voices into the policy-making process, we can address the multifaceted nature of environmental challenges while creating solutions that genuinely reflect the needs of diverse populations. This holistic approach not only builds resilience but also fosters a powerful, inclusive movement that empowers all individuals to thrive in the face of a changing world, ultimately enriching our collective efforts.",2.003435241065755,4.999999997664407,4.875550459265735e-08,,
