ID,TEXT_TYPE,INIT_OP_A,TEXT_A,PPL_A,PROBE_INT_A,H_INT_A,PROBE_EXT_A,H_EXT_A,INIT_OP_B,TEXT_B,PPL_B,PROBE_INT_B,H_INT_B,PROBE_EXT_B,H_EXT_B
579.0,tot,5.0,"Climate change is one of the most pressing issues of our time, affecting not only the environment but also public health, economies, and social equity. The evidence is undeniable—rising temperatures, extreme weather events, and melting ice caps are all consequences of human activity. Urgent action is needed, not just from governments but also from individuals and businesses to reduce carbon emissions and shift towards sustainable practices. The time to act is now, as the longer we wait, the more severe the repercussions will be for future generations. It's essential to foster awareness and advocate for policies that prioritize the planet's health. Every step towards sustainability is a step towards a viable future.",1.894589245884698,4.99999999999344,1.7548535115868888e-10,,,4.0,"Climate change is one of the most pressing issues of our time, posing serious threats to ecosystems, economies, and human health. The scientific consensus is clear: human activities, particularly the burning of fossil fuels, are driving unprecedented changes in our climate. These changes result in extreme weather events, rising sea levels, and altered agricultural patterns, impacting food security and biodiversity. 

Addressing climate change requires urgent collective action, including reducing greenhouse gas emissions, transitioning to renewable energy, and promoting sustainable practices. Furthermore, it necessitates global cooperation and equitable solutions to support vulnerable communities most affected by climate impacts. The longer we delay, the more severe the consequences will be, making it imperative for individuals, governments, and organizations to work together towards a sustainable future.",1.6056108873610406,4.9999999999915765,2.2322180986855824e-10,,
579.0,disc,5.0,"Climate change is an urgent crisis that we can no longer afford to ignore, as its impacts are felt across the globe in more frequent extreme weather events and shifts in ecosystems. It's crucial that we come together to discuss actionable steps we can take, both individually and collectively, to reduce our carbon footprints and promote sustainable practices. Let’s share ideas and strategies on how we can advocate for policies that not only address climate change but also prioritize social equity and public health in the process.",1.6972771092014793,4.999999999996021,1.0842669486277885e-10,,,4.0,"I completely agree that climate change is an urgent crisis that demands our immediate attention and action. It's essential for us to collaborate on actionable steps that not only mitigate our carbon footprints but also address the interconnected issues of social equity and public health. By advocating for robust climate policies and sharing sustainable practices, we can create a more resilient future for all communities impacted by this pressing challenge.",1.6960906608060444,4.999999999992566,1.979216765081316e-10,,
579.0,disc,5.0,"I appreciate your enthusiasm and recognition of the interconnectedness of climate change with social equity and public health, as these issues cannot be tackled in isolation. Collaboration is indeed key; whether it's through grassroots movements, local initiatives, or national policies, we must align our efforts to amplify our impact. Let’s explore specific strategies that we can implement within our communities to promote sustainability and make a tangible difference in addressing this global crisis.",2.1217217407543734,4.999999999966684,8.370504712474287e-10,,,4.0,"Thank you for highlighting the importance of collaboration and community-based strategies in addressing climate change and its associated challenges. One effective approach is to implement educational programs that empower individuals with knowledge about sustainable practices, such as reducing waste and conserving energy. Additionally, we can advocate for local policies that promote renewable energy use and support green infrastructure, creating a stronger foundation for sustainability in our communities.",1.9401759869091333,4.999999999994211,1.5558896398493246e-10,,
579.0,disc,5.0,"Educational programs are indeed a powerful tool for fostering a culture of sustainability, as they equip individuals with the knowledge and skills to make impactful changes in their daily lives. Advocating for local policies that prioritize renewable energy and green infrastructure is essential, as these initiatives not only reduce carbon emissions but also create jobs and enhance community resilience. By working together to promote sustainable practices and support policy changes at the local level, we can build a more sustainable future that benefits everyone.",1.567360792109055,4.999999999974054,6.583821992980661e-10,,,4.0,"I wholeheartedly agree that educational programs play a vital role in cultivating a culture of sustainability and empowering individuals to enact meaningful change. The dual benefits of advocating for renewable energy and green infrastructure—reducing emissions while creating jobs—are crucial for fostering both environmental and economic resilience in our communities. By unifying our efforts to promote these initiatives, we can ensure that the transition to sustainability is equitable and inclusive, ultimately benefiting everyone involved.",1.516878334084525,5.0,0.0,,
579.0,disc,5.0,"I'm glad to see such strong support for the importance of educational initiatives and the dual benefits they bring to our communities. An equitable and inclusive transition to sustainability is essential; it ensures that all voices are heard and that vulnerable communities are not left behind in the shift to a greener economy. By continuing to unite our efforts and advocate for policies that prioritize both environmental health and social equity, we can create a lasting and positive impact for future generations.",1.7212623932273745,4.999999999999217,2.2623663364311625e-11,,,4.0,"Absolutely, ensuring that all voices, especially those from vulnerable communities, are included in the transition to sustainability is paramount for achieving genuine equity. By prioritizing social equity alongside environmental health in our advocacy efforts, we can forge pathways that uplift everyone and address the systemic injustices often exacerbated by climate change. Together, we have the power to create solutions that not only combat climate change but also foster a just and resilient society for future generations.",1.75726880311238,4.999999999989184,2.8391842804127914e-10,,
579.0,disc,5.0,"You’ve articulated an essential point about the need to address systemic injustices that climate change often magnifies. It’s crucial that our advocacy efforts actively seek out and amplify the voices of underrepresented communities, ensuring that their needs and perspectives shape the solutions we pursue. Together, as we promote just and resilient solutions, we can lay the groundwork for a sustainable future that prioritizes both environmental integrity and social justice for all.",2.152202800743435,4.999999999984263,4.0719749319756435e-10,,,4.0,"Thank you for emphasizing the importance of amplifying the voices of underrepresented communities in our advocacy work. By actively involving these communities in the decision-making process, we can ensure that the solutions we create are relevant and effective in addressing their unique challenges. This collaborative approach not only fosters social justice but also enhances our overall efforts to achieve environmental integrity, ultimately paving the way for a truly sustainable future for all.",1.5404880819671014,4.99999999999344,1.7548535115801558e-10,,
