ID,TEXT_TYPE,INIT_OP_A,TEXT_A,PPL_A,PROBE_INT_A,H_INT_A,PROBE_EXT_A,H_EXT_A,INIT_OP_B,TEXT_B,PPL_B,PROBE_INT_B,H_INT_B,PROBE_EXT_B,H_EXT_B
580.0,tot,5.0,"Climate change is one of the most pressing issues of our time, affecting not only the environment but also public health, economies, and social equity. The evidence is undeniable—rising temperatures, extreme weather events, and melting ice caps are all consequences of human activity. Urgent action is needed, not just from governments but also from individuals and businesses to reduce carbon emissions, invest in renewable energy, and promote sustainable practices. Addressing climate change is crucial for ensuring a habitable planet for future generations. We must act decisively and collaboratively to mitigate its impacts and foster a sustainable future.",1.6589095266162113,4.999999999996488,9.612517162218127e-11,,,4.0,"Climate change is one of the most pressing issues of our time, posing serious threats to ecosystems, economies, and human health. The scientific consensus is clear: human activities, particularly the burning of fossil fuels, are driving unprecedented changes in our climate. These changes result in extreme weather events, rising sea levels, and altered agricultural patterns, impacting food security and biodiversity. 

Addressing climate change requires urgent collective action, including reducing greenhouse gas emissions, transitioning to renewable energy, and promoting sustainable practices. Furthermore, it necessitates global cooperation and equitable solutions to support vulnerable communities most affected by climate impacts. The longer we delay, the more severe the consequences will be for future generations. It's imperative that we prioritize climate action now to create a sustainable future.",1.645663228329987,4.999999999996488,9.612517162218127e-11,,
580.0,disc,5.0,"Absolutely, I'm eager to engage in this important conversation. Climate change poses an existential threat that intertwines with every aspect of our lives, from our health and safety to economic resilience and social justice. It’s essential that we not only acknowledge the overwhelming scientific evidence but also take collective action—through policy changes, community initiatives, and individual commitments—to create a sustainable and equitable future for all.",2.11804593408605,4.999999999989184,2.8391842804105105e-10,,,4.0,"I completely agree with your emphasis on the interconnectedness of climate change with our health, safety, and social justice. Collective action is indeed crucial; we must advocate for policies that effectively reduce emissions while also supporting communities disproportionately affected by climate impacts. It’s inspiring to see such enthusiasm for sustainability, as every effort, whether at the community or individual level, contributes to the larger goal of securing a viable future for generations to come.",1.9305935650947124,4.99999999999787,5.936771729691288e-11,,
580.0,disc,5.0,"Thank you for your thoughtful response; I wholeheartedly agree that advocating for inclusive policies is vital in addressing the disproportionate impacts of climate change on vulnerable communities. By elevating their voices and needs in our climate action strategies, we can ensure that our efforts not only reduce emissions but also promote social equity and resilience. Together, through collaboration and shared responsibility, we can create a more sustainable future that genuinely benefits everyone.",1.7604173411151767,4.999999999992566,1.9792167650903308e-10,,,4.0,"Thank you for your insightful remarks; elevating the voices of vulnerable communities is indeed essential to creating comprehensive climate solutions. By integrating their perspectives, we can develop strategies that not only address emissions but also build resilience and promote equity within our society. Collaboration and shared responsibility will be key to ensuring that our climate actions are effective and just for all, paving the way for a truly sustainable future.",1.7667720299487613,5.0,0.0,,
580.0,disc,5.0,"I appreciate your agreement and insights on the importance of integrating diverse perspectives in our climate solutions. When we prioritize the voices of those most affected, we create robust strategies that not only tackle the root causes of emissions but also empower communities to thrive in the face of climate challenges. Let’s continue to advocate for inclusive frameworks and initiatives that recognize the interconnected nature of our struggles, ensuring a just and sustainable future for all.",2.1930890991829335,4.99999999999787,5.936771729726698e-11,,,4.0,"Absolutely, prioritizing diverse perspectives is fundamental to crafting effective climate solutions that truly resonate with those impacted. By empowering communities to be part of the decision-making process, we can foster resilience and innovation that address both emissions and social challenges simultaneously. Let’s commit to continuing this advocacy for inclusive frameworks, as they are essential for building a just and sustainable future that leaves no one behind.",1.766187002446641,5.0,0.0,,
580.0,disc,5.0,"I couldn't agree more; empowering communities not only fosters resilience but also sparks innovative solutions that are tailored to local needs and circumstances. By actively involving those who are directly affected, we can build trust and ensure that our climate actions are both effective and equitable. Let’s keep pushing for these inclusive frameworks and collaboratively work towards a future where everyone has the opportunity to thrive amidst the challenges of climate change.",7.413194670828477e+55,4.99999999999886,3.2489752960309304e-11,,,4.0,"I'm so glad to hear your enthusiasm for empowering communities, as it truly leads to more innovative and context-driven solutions. Building trust and fostering collaboration are critical components of effective climate action, ensuring that the needs and insights of those most affected are at the forefront of our strategies. Together, we can advocate for these inclusive frameworks that not only address climate change but also create pathways for all to thrive, even in the face of adversity.",2.030113264360977,4.9999999999915765,2.2322180986370034e-10,,
580.0,disc,5.0,"Thank you for your kind words; I share your enthusiasm for the potential that grassroots empowerment brings to our climate efforts. By maintaining a focus on trust and collaboration, we can ensure that our strategies are not only informed by local insights but also adaptable to the unique challenges that communities face. Together, we can champion these inclusive frameworks and cultivate resilience that equips all individuals to thrive in a changing world, reinforcing our commitment to justice and sustainability.",2.299504501129986,4.999999999999217,2.262366336430415e-11,,,4.0,"I appreciate your thoughtful perspective on grassroots empowerment; it truly is a catalyst for meaningful change in our climate efforts. By centering local insights and adapting to specific challenges, we can develop robust strategies that not only address climate impacts but also enhance community resilience. Together, let’s continue to champion these inclusive frameworks, as they are vital in reinforcing our shared commitment to justice, sustainability, and the well-being of all individuals in a changing world.",1.6186189155718067,4.999999999995492,1.2229995742928585e-10,,
