ID,TEXT_TYPE,INIT_OP_A,TEXT_A,PPL_A,PROBE_INT_A,H_INT_A,PROBE_EXT_A,H_EXT_A,INIT_OP_B,TEXT_B,PPL_B,PROBE_INT_B,H_INT_B,PROBE_EXT_B,H_EXT_B
582.0,tot,5.0,"Climate change is one of the most pressing issues of our time, affecting not only the environment but also public health, economies, and social equity. The evidence is undeniable—rising temperatures, extreme weather events, and melting ice caps are all consequences of human activity. Urgent action is needed, not just from governments but also from individuals and businesses to reduce carbon emissions and shift towards sustainable practices. The time to act is now, as the longer we wait, the more severe the repercussions will be for future generations. It's essential to foster awareness and advocate for policies that prioritize the planet's health. Every step towards sustainability is a step towards a viable future.",1.8944056884168663,4.999999999996021,1.0842669486315945e-10,,,4.0,"Climate change is one of the most pressing issues of our time, posing serious threats to ecosystems, economies, and human health. The scientific consensus is clear: human activities, particularly the burning of fossil fuels, are driving unprecedented changes in our climate. These changes result in extreme weather events, rising sea levels, and altered agricultural patterns, impacting food security and biodiversity. 

Addressing climate change requires urgent collective action, including reducing greenhouse gas emissions, transitioning to renewable energy, and promoting sustainable practices. Furthermore, it necessitates global cooperation and equitable solutions to support vulnerable communities most affected by climate impacts. The longer we delay, the more severe the consequences will be, making it imperative for individuals, governments, and organizations to work together towards a sustainable future.",1.6074410549331053,4.99999999999787,5.936771729732116e-11,,
582.0,disc,5.0,"Climate change is an urgent issue that affects every aspect of our lives, from the air we breathe to the stability of our economies. We must recognize the role that human activity plays in driving this crisis and take collective action to mitigate its impacts. It's crucial to foster a culture of sustainability, where individuals and businesses alike prioritize practices that protect our planet for future generations.",1.6961522867248409,4.999999999996901,8.521756168175497e-11,,,4.0,"I completely agree that climate change is an urgent issue that permeates all aspects of our lives. Fostering a culture of sustainability is essential, and this includes not only individual responsibility but also the need for systemic changes in how businesses operate. By prioritizing practices that protect our planet, we can create a resilient future that safeguards both our environment and our economy.",1.7148969895041946,4.999999999982167,4.5918610667616277e-10,,
582.0,disc,5.0,"Absolutely, systemic changes in business practices are vital for addressing climate change effectively. We need to encourage companies to adopt sustainable models that not only minimize carbon footprints but also promote social equity and economic resilience. By aligning business interests with environmental stewardship, we can drive significant progress towards a healthier planet while ensuring a thriving economy for all.",1.6741441287046992,4.999999999998341,4.66503236842017e-11,,,4.0,"I wholeheartedly agree that aligning business interests with environmental stewardship is crucial for meaningful progress on climate change. It is essential for companies to adopt sustainable models that not only focus on reducing carbon footprints but also actively contribute to social equity and community well-being. By fostering an environment where sustainability and economic resilience go hand in hand, we can create a future that benefits both people and the planet.",1.4575104780109198,5.0,0.0,,
582.0,disc,5.0,"I couldn't agree more; the intersection of sustainability and social equity is key to creating a truly equitable future. Businesses have a unique opportunity to be catalysts for change by investing in their communities and prioritizing not just profit but also purpose. When we prioritize both environmental and social well-being, we pave the way for holistic solutions that benefit all facets of society, leading to a more sustainable and just world.",1.571195536871051e+110,4.999999999982167,4.591861066713042e-10,,,4.0,"You make an excellent point about the critical intersection of sustainability and social equity in driving meaningful change. Businesses indeed have the potential to be catalysts for a more just and sustainable future by investing in their communities and prioritizing purpose alongside profit. By embracing holistic solutions that address environmental and social well-being, we can cultivate a society where the benefits of progress are shared equitably, ultimately leading to a healthier planet for everyone.",1.6451631805173383,4.999999999996901,8.521756168178234e-11,,
582.0,disc,5.0,"Thank you for your thoughtful response; it's encouraging to see that we share the same vision for a just and sustainable future. Embracing a holistic approach not only strengthens communities but also empowers individuals to take part in the climate action necessary for lasting change. When the benefits of progress are equitably shared, we foster a sense of collective responsibility that can propel us toward innovative solutions for both environmental health and social justice.",1.97041956120496,4.999999999982956,4.1691424843286866e-10,,,4.0,"Thank you for your kind words; it truly is inspiring to engage with others who share this vision for a just and sustainable future. Empowering individuals to participate in climate action is essential, as it fosters a sense of ownership and responsibility for the changes we need to see. By nurturing a culture of collective responsibility, we can unlock innovative solutions that address both environmental health and social justice, paving the way for a brighter future for all.",1.3686801946689753,4.999999999996901,8.521756168069142e-11,,
582.0,disc,5.0,"I completely agree; fostering a sense of ownership among individuals is a powerful catalyst for change. When people feel invested in the outcome, they are more likely to contribute to sustainable practices and advocate for necessary reforms. By continuing to nurture this culture of collective responsibility, we not only drive action on climate change but also inspire hope and resilience in our communities.",1.979978500875607,4.999999999999309,2.0051767199140136e-11,,,4.0,"Absolutely, fostering a sense of ownership is indeed a powerful motivator for individuals to engage with sustainability and climate initiatives. When communities feel a personal stake in the outcomes, it enhances their commitment to advocating for meaningful reforms and participating in sustainable practices. By cultivating this culture of collective responsibility, we not only empower ourselves to take action on climate change but also foster hope and resilience that can uplift entire communities in the face of environmental challenges.",1.7960771379323992,4.999999999997587,6.69708569571575e-11,,
