ID,TEXT_TYPE,INIT_OP_A,TEXT_A,PPL_A,PROBE_INT_A,H_INT_A,PROBE_EXT_A,H_EXT_A,INIT_OP_B,TEXT_B,PPL_B,PROBE_INT_B,H_INT_B,PROBE_EXT_B,H_EXT_B
584.0,tot,5.0,"Climate change is one of the most pressing issues of our time, affecting not only the environment but also public health, economies, and social equity. The evidence is undeniable—rising temperatures, extreme weather events, and melting ice caps are all consequences of human activity. Urgent action is needed, not just from governments but also from individuals and businesses to reduce carbon emissions and shift towards sustainable practices. The time to act is now, as the longer we wait, the more severe the repercussions will be for future generations. It's essential to foster awareness and advocate for policies that prioritize the planet's health. Every step towards sustainability is a step towards a viable future.",1.8898388963584036,4.999999999986112,3.6108648745014206e-10,,,4.0,"Climate change is one of the most pressing issues of our time, posing serious threats to ecosystems, economies, and human health. The scientific consensus is clear: human activities, particularly the burning of fossil fuels, are driving unprecedented changes in our climate. These changes result in extreme weather events, rising sea levels, and altered agricultural patterns, impacting food security and biodiversity. 

Addressing climate change requires urgent collective action, including reducing greenhouse gas emissions, transitioning to renewable energy, and promoting sustainable practices. Furthermore, it necessitates global cooperation and equitable solutions to support vulnerable communities most affected by climate impacts. The longer we delay, the more severe the consequences will be, making it imperative for individuals, governments, and organizations to work together towards a sustainable future.",1.5997056415660655,4.99999999999787,5.936771729732116e-11,,
584.0,disc,5.0,"Climate change is an urgent crisis that we can no longer afford to ignore, as its impacts are felt across the globe in more frequent and severe weather events, rising sea levels, and ecological disruptions. It's critical that we engage in this conversation not just as a collective responsibility but as a moral imperative to ensure a livable planet for future generations. I believe that by sharing knowledge, fostering collaboration, and advocating for sustainable practices, we can create meaningful change that addresses both environmental issues and social equity.",1.8601597379130965,4.999999999995492,1.2229995742928585e-10,,,4.0,"I completely agree that climate change is indeed an urgent crisis we can no longer afford to overlook. Engaging in a collective conversation and taking moral responsibility is essential for fostering the change we need to ensure a livable planet for future generations. By prioritizing collaboration and sustainable practices, we can effectively address both environmental challenges and the social equity issues that are intrinsically linked to climate impacts.",1.86935224335199,5.0,0.0,,
584.0,disc,5.0,"I’m glad to hear we share the same perspective on the urgency of addressing climate change and the importance of collaboration. It's crucial to recognize that the impacts of climate change disproportionately affect vulnerable communities, making social equity an integral part of our climate action strategies. By working together and creating inclusive solutions, we can ensure that our efforts not only tackle environmental challenges but also uplift those most affected by them, paving the way for a more just and sustainable future.",9.771375974660162e+48,4.99999999999787,5.936771729726889e-11,,,4.0,"Absolutely, it's vital to acknowledge that vulnerable communities are on the frontlines of climate impacts, and integrating social equity into our climate action strategies is essential. Creating inclusive solutions not only addresses environmental challenges but also empowers those who have been historically marginalized and disproportionately affected. Together, we can build a more just and sustainable future that uplifts everyone while actively combating the climate crisis.",1.5281884537117438,5.0,0.0,,
584.0,disc,5.0,"You’ve articulated an important point about the need to empower historically marginalized communities while addressing climate change; their voices and experiences are crucial in shaping effective solutions. By ensuring that these communities are involved in decision-making processes, we can create strategies that are not only effective but also equitable and resilient. Our collective efforts must prioritize environmental justice as a core principle, recognizing that a truly sustainable future means leaving no one behind.",2.055444481821302,4.999999999999462,1.5750914282074316e-11,,,4.0,"I wholeheartedly agree that empowering historically marginalized communities and incorporating their voices into decision-making is essential for crafting effective climate solutions. By prioritizing environmental justice, we can create strategies that not only address climate change but also foster resilience and equity in the face of its impacts. A sustainable future must indeed be inclusive, ensuring that no one is left behind and that all communities have the opportunity to thrive in a changing world.",1.4128013921792753,5.0,0.0,,
584.0,disc,5.0,"It's inspiring to see such strong alignment on the importance of inclusivity and environmental justice in our climate strategies. Building resilience is not just about adapting to climate impacts but also about ensuring that all communities have the resources and support they need to thrive amidst the uncertainty. By fostering collaboration and prioritizing diverse perspectives, we can truly create a roadmap for a sustainable future that benefits everyone and strengthens our collective response to the climate crisis.",2.0046788703182075,4.999999999999217,2.262366336426681e-11,,,4.0,"I'm glad to hear that you find this alignment inspiring, as inclusivity and environmental justice must be at the forefront of our climate strategies. Building resilience indeed involves equipping all communities with the necessary resources and support to navigate the uncertainties brought on by climate change. By fostering collaboration and valuing diverse perspectives, we can create a comprehensive roadmap that not only addresses the climate crisis but also promotes equity and prosperity for everyone.",1.4368904095171822,5.0,0.0,,
584.0,disc,5.0,"I completely agree that fostering collaboration and valuing diverse perspectives are key components in developing comprehensive climate strategies. As we work together to build resilience, it's essential to ensure that the voices of those who have historically faced challenges are not just heard but actively engaged in the creation of solutions. By doing so, we not only tackle the climate crisis but also promote a thriving, equitable future that empowers communities and protects our planet for generations to come.",2.4395693219902346,4.999999999999673,9.716755224354033e-12,,,4.0,"You’ve highlighted an essential aspect of the conversation; it’s imperative that we not only hear the voices of marginalized communities but actively engage them in crafting solutions. This engagement not only enriches our climate strategies but also fosters a sense of ownership and empowerment within those communities. Together, we can tackle the climate crisis while building a thriving, equitable future that safeguards our planet for generations to come.",1.7068583112092306,4.9999999999915765,2.2322180986487806e-10,,
