ID,TEXT_TYPE,INIT_OP_A,TEXT_A,PPL_A,PROBE_INT_A,H_INT_A,PROBE_EXT_A,H_EXT_A,INIT_OP_B,TEXT_B,PPL_B,PROBE_INT_B,H_INT_B,PROBE_EXT_B,H_EXT_B
588.0,tot,5.0,"Climate change is one of the most pressing issues of our time, affecting not only the environment but also public health, economies, and social equity. The evidence is undeniable—rising temperatures, extreme weather events, and melting ice caps are all consequences of human activity. Urgent action is needed, not just from governments but also from individuals and businesses to reduce carbon emissions and shift towards sustainable practices. The time to act is now, as the longer we wait, the more severe the repercussions will be for future generations. It's essential to foster awareness and advocate for policies that prioritize the planet's health. Every action counts.",1.8690946168450462,4.999999999995492,1.2229995742957082e-10,,,4.0,"Climate change is one of the most pressing issues of our time, posing serious threats to ecosystems, economies, and human health. The scientific consensus is clear: human activities, particularly the burning of fossil fuels, are driving unprecedented changes in our climate. These changes result in extreme weather events, rising sea levels, and altered agricultural patterns, impacting food security and biodiversity. 

Addressing climate change requires urgent collective action, including reducing greenhouse gas emissions, transitioning to renewable energy, and promoting sustainable practices. Furthermore, it necessitates global cooperation and equitable solutions to support vulnerable communities most affected by climate impacts. The longer we delay, the more severe the consequences will be, making it imperative for individuals, governments, and organizations to work together towards a sustainable future.",1.6015558379215953,4.999999999997587,6.697085695723546e-11,,
588.0,disc,5.0,"Climate change is a critical challenge that we cannot afford to ignore, as it threatens our ecosystems, public health, and economic stability. The alarming rise in global temperatures and the frequency of extreme weather events are clear signs that immediate action is essential. I believe we must work together—individuals, businesses, and governments alike—to implement sustainable practices and advocate for policies that prioritize the health of our planet for the sake of current and future generations.",1.6996264536927743,4.999999999996488,9.61251716219618e-11,,,4.0,"I completely agree with your sentiments—climate change is indeed a critical challenge that demands our immediate attention and concerted action. The emphasis on collaboration among individuals, businesses, and governments is vital, as addressing such a complex issue requires a united front. By prioritizing sustainable practices and advocating for strong environmental policies, we can safeguard our planet for both present and future generations, ensuring a healthier world for all.",1.799640559992334,5.0,0.0,,
588.0,disc,5.0,"I'm glad to hear that you share the same commitment to addressing climate change! Collaboration is indeed key, and it's inspiring to see many people recognizing the power of collective action in tackling this global crisis. Together, we can amplify our voices, promote sustainable practices, and push for bold environmental policies that protect our planet and foster a just, equitable future for everyone.",2.055447669332952,4.999999999998341,4.665032368414676e-11,,,4.0,"Absolutely, the power of collective action cannot be underestimated in our fight against climate change. It's encouraging to witness an increasing awareness of the need for bold environmental policies that not only protect the planet but also prioritize equity and justice for all communities. Together, by amplifying our voices and sharing best practices, we can inspire meaningful change and create a sustainable future that respects both people and the planet.",1.6464253199101737,4.999999999998536,4.135168254500181e-11,,
588.0,disc,5.0,"You're right—equity and justice are essential components of the climate movement, and it's crucial that we ensure all communities are represented and supported in our efforts. By sharing best practices and uplifting diverse voices, we can create more comprehensive solutions that address various challenges faced by marginalized communities. Our united approach has the potential to drive transformative change, fostering a world where both people and the planet thrive together.",2.234517093840509,4.999999999998121,5.2626774604738694e-11,,,4.0,"I wholeheartedly agree that equity and justice must be at the forefront of our climate movement, ensuring that all voices are heard and valued. By actively uplifting marginalized communities and integrating their experiences into our solutions, we can create more effective and inclusive strategies to combat climate change. This united approach not only fosters transformative change but also paves the way for a resilient future where both people and the planet can thrive harmoniously.",1.3413002899439372,5.0,0.0,,
588.0,disc,5.0,"I appreciate your commitment to making equity and justice central to our climate efforts—it's crucial for creating lasting solutions. By actively engaging and collaborating with marginalized communities, we can harness their unique insights and knowledge, leading to more robust and effective strategies. Together, we can build a resilient future that not only addresses climate change but also fosters social cohesion and empowers all individuals to participate in the healing of our planet.",1.8648135544656381,4.999999999999462,1.575091428207751e-11,,,4.0,"Thank you for emphasizing the importance of engaging with marginalized communities; their insights are invaluable in developing robust strategies to tackle climate change. By fostering collaboration and inclusivity, we empower all individuals to contribute to the healing of our planet while also strengthening social cohesion. This holistic approach not only addresses the environmental crisis but also builds a shared sense of purpose and community resilience, enabling us to forge a brighter, more sustainable future for everyone.",2.0618294223651943,5.0,0.0,,
588.0,disc,5.0,"You're absolutely right—the collaboration and inclusivity we foster within our communities not only enrich our climate strategies but also build a collective identity that strengthens our resilience. By valuing the contributions of all individuals, we can create a sense of shared responsibility that drives meaningful action. This holistic approach will not only address the environmental crisis but also inspire hope and unity, empowering us to work together toward a sustainable future for everyone.",2.1241723649367517,4.999999999984263,4.071974932024202e-10,,,4.0,"I couldn't agree more; fostering a sense of shared responsibility is essential for driving impactful action on climate change. When we recognize and value the contributions of all individuals, we create a powerful collective identity that unites us in purpose and strengthens our resilience. This hope-filled approach not only tackles environmental issues but also inspires a collaborative spirit that lays the groundwork for a sustainable future for generations to come.",2.2563403223987972,4.99999999999344,1.754853511566479e-10,,
