ID,TEXT_TYPE,INIT_OP_A,TEXT_A,PPL_A,PROBE_INT_A,H_INT_A,PROBE_EXT_A,H_EXT_A,INIT_OP_B,TEXT_B,PPL_B,PROBE_INT_B,H_INT_B,PROBE_EXT_B,H_EXT_B
58.0,tot,1.0,"I believe that the focus on climate change has been exaggerated and often distracts from more immediate and pressing issues facing humanity, such as poverty, healthcare, and education. Many climate models are speculative, and the economic impact of drastic measures to combat climate change can be detrimental. We should prioritize innovation and adaptation rather than imposing regulations that might hinder growth and development. Ultimately, it's crucial to maintain a balanced perspective on environmental issues without sacrificing progress in other vital areas.",1.7643607694584493,1.9999856538715097,0.00018489732150463276,,,3.0,"Climate change is a complex issue that prompts a wide range of opinions and perspectives. On one hand, there are compelling arguments about the environmental impacts and potential risks to ecosystems and human health. On the other hand, some people raise questions about the effectiveness of proposed solutions and the economic ramifications. It's important to consider multiple viewpoints and the nuances involved in discussions surrounding this topic. Awareness and dialogue may help in addressing the various challenges associated with climate change, regardless of individual stance.",1.1104843979894226e+47,4.437823498677847,0.6853953001757251,,
58.0,disc,1.0,"While climate change is certainly an important topic, I believe the focus on it sometimes overshadows more immediate challenges like poverty and healthcare that demand our attention. It's crucial to recognize that many climate models are based on assumptions that may not fully reflect reality, leading to potentially misguided policies. Instead of imposing stringent regulations, we should prioritize innovative solutions and adaptive measures that can support both environmental sustainability and economic growth.",1.8823589692379454,2.0002955218836886,0.002707703017047692,,,3.0,"You raise valid points about the need to balance immediate challenges like poverty and healthcare with the long-term impacts of climate change. It's true that the assumptions underlying climate models can be debated, and that dialogue on their effectiveness and reliability is essential in shaping appropriate policies. Prioritizing innovative solutions and adaptive measures is a constructive approach, as it allows for both environmental sustainability and economic growth to coexist, fostering a comprehensive strategy for addressing these complex issues.",2.1007801736862763,4.562176500816012,0.6853952957419025,,
58.0,disc,1.0,"I appreciate your acknowledgment of the need for balance in addressing both climate change and pressing human concerns. It’s important to foster a dialogue that critically examines the assumptions in climate models while also exploring the innovative solutions that can drive progress. By focusing on adaptation and technological advancements, we can create a sustainable future that does not compromise economic development or social well-being.",2.0313145223207534,2.002471633767314,0.01734729323447851,,,3.0,"Thank you for your thoughtful response; fostering dialogue is indeed essential for navigating these intertwined issues. Exploring innovative solutions and technological advancements can lead to a sustainable future, but it's equally important to ensure that these strategies are inclusive and equitable for all communities. By engaging in open discussions that integrate diverse perspectives, we can work towards a more holistic approach that addresses both environmental and social needs effectively.",1.8938817588005696,4.880797076404283,0.3653338583582365,,
58.0,disc,1.0,"I completely agree that ensuring inclusivity and equity in our approaches is vital for the success of any strategy aimed at sustainability. Open discussions that incorporate diverse perspectives can help us identify solutions that not only benefit the environment but also uplift marginalized communities. However, we must remain vigilant against solutions that could stifle innovation or place undue burdens on economic growth, as a robust economy is also essential for tackling social inequalities.",2.0674539862566146,2.0293135830975504,0.13235898359949233,,,3.0,"You make an excellent point about the necessity of balancing economic growth with sustainability goals; a healthy economy is indeed crucial for addressing social inequalities. It's essential that our discussions remain open to innovative ideas that drive progress without compromising the well-being of marginalized communities. By being mindful of potential pitfalls in proposed solutions, we can strive for strategies that not only protect the environment but also empower and uplift those who have been left behind.",2.1464365040198383,4.999841563753155,0.001544765931339443,,
58.0,disc,1.0,"I'm glad to see that we share a common understanding of the importance of a thriving economy as a foundation for social equity. While it's vital to consider the impacts of our strategies on marginalized communities, we should also be cautious about over-regulating industries that can drive innovation and job creation. By fostering an environment where business and environmental goals can align, we can empower communities and promote sustainable progress without sacrificing economic opportunity.",1.992242350523436,2.1480495848705026,0.41934804405858905,,,3.0,"I appreciate your emphasis on the need for a balanced approach that fosters innovation while being mindful of regulatory impacts on industries. Creating an environment where business and environmental goals align can indeed empower communities and promote sustainable practices that drive both economic opportunity and social equity. By collaborating with industry leaders and stakeholders, we can explore pathways that support job creation while also addressing the pressing challenges of climate change and inequality effectively.",1.9391052964695004,4.999954602144252,0.0004993774566970661,,
58.0,disc,1.0,"I agree that collaboration with industry leaders and stakeholders is essential for crafting effective solutions that address both economic and environmental challenges. By working together, we can identify practical pathways that encourage sustainable practices while maintaining a focus on job creation and community empowerment. It's all about finding common ground where innovation thrives and the needs of society are met, paving the way for a future that benefits everyone.",1.8085296605961803,2.0229749182180936,0.10944605791424902,,,3.0,"Absolutely, finding that common ground is crucial for creating a future that serves both the economy and the environment. Collaborative efforts between industry, government, and communities can lead to innovative solutions that not only promote sustainability but also enhance job opportunities and social well-being. When we prioritize open communication and partnership, we establish a framework for progress that benefits all stakeholders and drives meaningful change.",5.845719113535378e+59,4.99999916847201,1.2472920238642883e-05,,
