ID,TEXT_TYPE,INIT_OP_A,TEXT_A,PPL_A,PROBE_INT_A,H_INT_A,PROBE_EXT_A,H_EXT_A,INIT_OP_B,TEXT_B,PPL_B,PROBE_INT_B,H_INT_B,PROBE_EXT_B,H_EXT_B
594.0,tot,5.0,"Climate change is one of the most pressing issues of our time, affecting not only the environment but also public health, economies, and social equity. The evidence is undeniable—rising temperatures, extreme weather events, and melting ice caps are all consequences of human activity. Urgent action is needed, not just from governments but also from individuals and businesses to reduce carbon emissions and shift towards sustainable practices. The time to act is now, as the longer we wait, the more severe the repercussions will be for future generations. It's essential to foster awareness and advocate for policies that prioritize the planet's health. Every action counts.",1.871416497949293,4.999999999994211,1.555889639890266e-10,,,4.0,"Climate change is one of the most pressing issues of our time, posing serious threats to ecosystems, economies, and human health. The scientific consensus is clear: human activities, particularly the burning of fossil fuels, are driving unprecedented changes in our climate. These changes result in extreme weather events, rising sea levels, and altered agricultural patterns, impacting food security and biodiversity. 

Addressing climate change requires urgent collective action, including reducing greenhouse gas emissions, transitioning to renewable energy, and promoting sustainable practices. Furthermore, it necessitates global cooperation and equitable solutions to support vulnerable communities most affected by climate impacts. The longer we delay, the more severe the consequences will be, making it imperative for individuals, governments, and organizations to work together towards a sustainable future.",1.5998880271330458,4.999999999997587,6.697085695723546e-11,,
594.0,disc,5.0,"Climate change is a critical challenge that we cannot afford to ignore, as it threatens our ecosystems, public health, and economic stability. The alarming rise in global temperatures and the frequency of extreme weather events are clear signs that immediate action is essential. I believe we must work together—individuals, businesses, and governments alike—to implement sustainable practices and advocate for policies that prioritize the health of our planet for the sake of current and future generations.",1.7079834284317073,4.999999999995492,1.2229995742933882e-10,,,4.0,"I completely agree with your sentiments—climate change is indeed a critical challenge that demands our immediate attention and collective action. It is essential for individuals, businesses, and governments to unite in promoting sustainable practices and policies that prioritize the health of our planet. By working together, we can mitigate the effects of climate change and ensure a sustainable future for both current and future generations.",1.5730159222151143,5.0,0.0,,
594.0,disc,5.0,"I'm glad to hear you share the same urgency regarding climate change; it's encouraging to know that more voices are joining this essential conversation. Collective efforts can significantly amplify our impact, and every step toward sustainability—whether it’s reducing waste, conserving energy, or supporting eco-friendly businesses—matters immensely. Let's continue to promote awareness and share actionable solutions, as fostering a sense of responsibility in our communities is crucial to driving meaningful change.",2.2423282191970753,4.999999999977103,5.83882276820627e-10,,,4.0,"Absolutely, fostering awareness and a sense of responsibility within our communities is key to driving meaningful change. Every action counts, and when individuals commit to sustainable practices, it creates a ripple effect that can inspire others to follow suit. Let's keep emphasizing the importance of collaboration and proactive steps, as together we can pave the way for a more resilient and sustainable future.",1.9648283089867913,5.0,0.0,,
594.0,disc,5.0,"You're right—each individual's commitment to sustainable practices can indeed spark a wider movement and lead to significant change within our communities. Collaboration is crucial; when we unite our efforts, we can amplify our message and have a greater influence on policies and practices that impact the environment. Let’s keep encouraging one another and sharing success stories, as they serve as powerful reminders that collective action can create a lasting positive impact for our planet.",4.476622261808351e+52,4.99999999999787,5.936771729718395e-11,,,4.0,"I couldn't agree more—sharing success stories and encouraging one another reinforces the message that our collective action can yield real, tangible results. By amplifying our voices and collaborating on initiatives, we can influence policies that truly benefit the environment and drive meaningful change. Together, let's continue to inspire hope and innovation, reminding ourselves and others that every effort contributes to a healthier planet.",2.4149278958748877,5.0,0.0,,
594.0,disc,5.0,"Absolutely, sharing our successes not only inspires hope but also demonstrates that practical solutions exist and can be implemented on various scales. By working together and championing innovative ideas, we can effectively advocate for policies that prioritize environmental sustainability and the well-being of all communities. Let's commit to nurturing this spirit of collaboration, as it empowers us all to make a difference and reinforces our shared responsibility to protect the planet for generations to come.",2.0489950873457,4.999999999977103,5.838822768163189e-10,,,4.0,"You're spot on—showcasing practical solutions on different scales is vital for demonstrating that positive change is attainable. By fostering innovation and collaboration, we not only advocate for effective policies but also create a culture of accountability and responsibility toward our environment. Let’s continue to nurture this spirit of unity and empowerment, as it is essential for ensuring a sustainable and thriving planet for future generations.",1.8102626688133947,4.999999999994891,1.379453390416438e-10,,
594.0,disc,5.0,"Thank you for your insightful thoughts! Cultivating a culture of accountability and responsibility is indeed essential, as it encourages individuals and organizations to take ownership of their environmental impact. By continuing to support innovative solutions and fostering a strong sense of community, we can empower everyone to contribute to building a sustainable future, ensuring that we leave a thriving planet for the generations that follow.",1.792711321048885,4.999999999998121,5.262677460461484e-11,,,4.0,"Thank you for your thoughtful response! Cultivating a culture of accountability not only empowers individuals and organizations but also fosters a sense of shared purpose that is crucial for addressing climate challenges. Together, by championing innovative solutions and strengthening community ties, we can create a movement that not only addresses our current environmental needs but also secures a flourishing planet for future generations.",1.8387123517157438,4.99999999999344,1.7548535115732121e-10,,
