ID,TEXT_TYPE,INIT_OP_A,TEXT_A,PPL_A,PROBE_INT_A,H_INT_A,PROBE_EXT_A,H_EXT_A,INIT_OP_B,TEXT_B,PPL_B,PROBE_INT_B,H_INT_B,PROBE_EXT_B,H_EXT_B
602.0,tot,5.0,"Climate change is one of the most pressing issues of our time, affecting not only the environment but also public health, economies, and social equity. The evidence is undeniable—rising temperatures, extreme weather events, and melting ice caps are all consequences of human activity. Urgent action is needed, not just from governments but also from individuals and businesses to reduce carbon emissions and shift towards sustainable practices. The time to act is now, as the longer we wait, the more severe the repercussions will be for future generations. It's essential to foster awareness and advocate for policies that prioritize the planet's health. Every action counts.",1.8619198474021255,4.999999999997587,6.697085695713316e-11,,,5.0,"Climate change is one of the most pressing issues of our time, affecting not only the environment but also public health, economies, and social equity. The evidence is undeniable—rising temperatures, extreme weather events, and melting ice caps are all consequences of human activity. Urgent action is needed, not just from governments but also from individuals and businesses to reduce carbon emissions and shift towards sustainable practices. The time to act is now, as the longer we wait, the more severe the repercussions will be for future generations. It's essential to foster awareness and advocate for policies that prioritize the planet's health. Every step towards sustainability is a step towards a viable future.",1.8863954088383161,4.999999999994891,1.3794533904348902e-10,,
602.0,disc,5.0,"Climate change is an urgent crisis that we can no longer ignore, as its impacts are being felt in every corner of the globe. From unprecedented heatwaves to devastating floods, the evidence clearly shows that human activity is driving these changes, and we must take immediate action to mitigate further harm. As individuals, communities, and global citizens, we all have a role to play in advocating for sustainable practices and supporting policies that prioritize our planet's future.",1.672336690037265,4.999999999997587,6.697085695693612e-11,,,5.0,"I wholeheartedly agree with this sentiment; the urgency of climate change cannot be overstated. It's crucial that we understand our collective responsibility and actively participate in promoting sustainable practices at all levels of society. By supporting policies that prioritize the environment, we can create a healthier planet for ourselves and future generations.",2.0975851462426798,5.0,0.0,,
602.0,disc,5.0,"Absolutely, it's encouraging to see such commitment to collective responsibility in tackling climate change. Each of us has the power to contribute positively, whether through our personal choices or by advocating for systemic change that prioritizes sustainability. Together, we can create a movement that inspires others to take action, ensuring a more resilient and equitable planet for generations to come.",2.0749840368658243,4.999999999998709,3.665422212009436e-11,,,5.0,"Indeed, the power of collective action is immense, and it's inspiring to see this shared commitment to sustainability. By leading by example and fostering conversations about climate action in our communities, we can amplify our impact and inspire others to join the movement. Together, we can build not only resilience but also a just transition that addresses both environmental and social equity, ensuring a brighter future for everyone.",1.8621218698185766,4.9999999999915765,2.232218098650081e-10,,
602.0,disc,5.0,"You're absolutely right; leading by example is a pivotal way to inspire change within our communities. When we engage in open conversations about climate action and highlight the intersectionality of environmental and social justice, we create a more inclusive movement that resonates with a wider audience. By prioritizing equity in our solutions, we can ensure that the benefits of sustainability are shared by all, paving the way for a brighter and more equitable future.",1.7362317619916956,4.999999999990455,2.5175029258573773e-10,,,5.0,"Absolutely, highlighting the intersectionality of environmental and social justice is crucial for creating a truly inclusive movement. When we advocate for solutions that prioritize equity, we empower marginalized communities who are often the most affected by climate change. Only by ensuring that the benefits of sustainability are accessible to everyone can we build a united front that effectively addresses the challenges we face and secures a viable future for all.",1.603119432238235,4.999999999998121,5.262677460438313e-11,,
602.0,disc,5.0,"I couldn't agree more; empowering marginalized communities is essential in our fight against climate change, as they often bear the brunt of its impacts while having the least capacity to adapt. By prioritizing equitable solutions, we not only address the immediate concerns of those most affected but also strengthen our collective resilience as a society. A united front that values inclusivity and justice will ultimately enhance our efforts to secure a sustainable future for everyone and ensure that no one is left behind in this critical journey.",1.640843587570963,4.99999999999886,3.248975296031553e-11,,,5.0,"You're absolutely right; empowering marginalized communities is integral to a comprehensive response to climate change. Addressing their unique challenges not only mitigates immediate impacts but also builds a more resilient and adaptable society overall. By ensuring that everyone is included in our sustainability efforts, we can create a powerful coalition capable of driving lasting change and ensuring a just transition for all.",2.223685904857949,4.999999999997587,6.697085695672258e-11,,
602.0,disc,5.0,"Exactly, addressing the unique challenges faced by marginalized communities is vital for fostering resilience and adaptability in the face of climate change. When we build inclusive coalitions, we tap into diverse perspectives and innovative solutions that can drive more effective and equitable outcomes. This approach not only strengthens our collective ability to tackle current challenges but also lays the groundwork for a sustainable future where justice and opportunity flourish for all.",1.990011299310248,4.99999999999344,1.7548535115453563e-10,,,5.0,"I completely agree; incorporating diverse perspectives is essential for developing innovative solutions that can effectively tackle the multifaceted challenges posed by climate change. By embracing inclusivity within our coalitions, we not only enhance our problem-solving capabilities but also ensure that all voices are heard and valued in the process. This commitment to justice and opportunity ultimately creates a foundation for a more sustainable and equitable future that benefits everyone in our society.",1.7941218816467253,5.0,0.0,,
