ID,TEXT_TYPE,INIT_OP_A,TEXT_A,PPL_A,PROBE_INT_A,H_INT_A,PROBE_EXT_A,H_EXT_A,INIT_OP_B,TEXT_B,PPL_B,PROBE_INT_B,H_INT_B,PROBE_EXT_B,H_EXT_B
604.0,tot,5.0,"Climate change is one of the most pressing issues of our time, affecting not only the environment but also public health, economies, and social equity. The evidence is undeniable—rising temperatures, extreme weather events, and melting ice caps are all consequences of human activity. Urgent action is needed, not just from governments but also from individuals and businesses to reduce carbon emissions and shift towards sustainable practices. The time to act is now, as the longer we wait, the more severe the repercussions will be for future generations. It's essential to foster awareness and advocate for policies that prioritize the planet's health. Every step towards sustainability is a step towards a viable future.",1.8948478536592834,4.99999999999344,1.7548535115877555e-10,,,5.0,"Climate change is one of the most pressing issues of our time, affecting not only the environment but also public health, economies, and social equity. The evidence is undeniable—rising temperatures, extreme weather events, and melting ice caps are all consequences of human activity. Urgent action is needed, not just from governments but also from individuals and businesses to reduce carbon emissions, invest in renewable energy, and promote sustainable practices. Addressing climate change is crucial for ensuring a habitable planet for future generations. We must act decisively and collaboratively to mitigate its impacts and foster a resilient, sustainable future.",1.6842867684388347,4.999999999997587,6.697085695727279e-11,,
604.0,disc,5.0,"Climate change is an urgent crisis that we can no longer afford to ignore, as its impacts are felt across the globe in more frequent and severe weather events, rising sea levels, and ecological disruption. It's critical that we engage in this conversation not just as individuals, but also as a collective, recognizing the role of businesses and governments in implementing sustainable practices. We must prioritize policies that not only address the immediate effects of climate change but also promote long-term resilience and equity for future generations.",2.064411990702089,4.999999999996021,1.0842669486308514e-10,,,5.0,"I wholeheartedly agree that climate change is an urgent crisis demanding our collective attention and action. It is essential for individuals, businesses, and governments to unite in implementing sustainable practices while prioritizing policies that promote both immediate and long-term solutions. Building a resilient future requires us to address not just environmental impacts, but also the social and economic inequalities exacerbated by this global challenge.",1.9134312008148593,5.0,0.0,,
604.0,disc,5.0,"I'm glad to hear your agreement and recognition of the interconnectedness of climate change with social and economic inequalities. It's crucial that we advocate for inclusive approaches that empower marginalized communities, as they often bear the brunt of environmental degradation. By ensuring that sustainability efforts are equitable, we can create a more just and resilient future for everyone, bridging the gap between environmental health and social justice.",1.6378558671277654,4.999999999987744,3.2018966853911874e-10,,,5.0,"Absolutely, empowering marginalized communities is essential in the fight against climate change, as they are disproportionately affected by its impacts. Advocating for inclusive approaches not only addresses environmental inequities but also enriches our collective response to this global crisis. By bridging the gap between environmental health and social justice, we can create a more sustainable and equitable future that benefits everyone, ensuring that no one is left behind in our efforts to combat climate change.",1.6557817971333486,5.0,0.0,,
604.0,disc,5.0,"You make an excellent point about the importance of inclusivity in our climate response. By ensuring that marginalized communities have a seat at the table, we not only enhance the effectiveness of our strategies but also foster a sense of ownership and responsibility among all stakeholders. Together, we can build a unified approach that recognizes the value of every individual, ultimately leading to a more sustainable and equitable future for our planet and all its inhabitants.",1.9282288198250768,4.99999999999344,1.754853511588466e-10,,,5.0,"Thank you for highlighting the significance of inclusivity in our climate response; every voice matters in this critical conversation. When marginalized communities are actively involved, it indeed cultivates a greater sense of ownership and shared responsibility, making our strategies more effective and comprehensive. Together, by embracing diverse perspectives, we can create a unified and impactful approach that not only addresses climate change but also enhances social equity, ensuring a sustainable future for all.",1.8390905439149379,4.999999999995492,1.2229995742878238e-10,,
604.0,disc,5.0,"I completely agree—every voice truly does count, and when we embrace diverse perspectives, we enrich our understanding of the challenges we face. This collective wisdom not only strengthens our climate strategies but also fosters solidarity among communities striving for a common goal. As we move forward, it's vital to remain committed to listening and learning from one another, as this collaborative spirit will be key to achieving a sustainable and equitable future for all.",1.9484300644718258,4.999999999992566,1.9792167650951408e-10,,,5.0,"You bring an important insight to the conversation; collective wisdom truly enhances our approach to tackling climate change. Embracing diverse perspectives fosters solidarity and motivates collaboration, which is essential in achieving our shared goals. As we move forward, let’s commit to ongoing dialogue and mutual learning, as these principles will empower us to create a sustainable and equitable future that benefits all communities.",7.276881992318986e+59,4.99999999999344,1.7548535115760447e-10,,
604.0,disc,5.0,"I appreciate your thoughtful response and wholeheartedly agree that ongoing dialogue and mutual learning are essential components of our climate action efforts. By continuously sharing ideas and experiences, we can adapt our strategies to meet the evolving challenges of climate change while fostering a spirit of collaboration that transcends boundaries. Together, let’s remain engaged and committed to this important conversation, as it will be the driving force behind a sustainable and equitable future for all communities.",2.1625870867320454,4.999999999999746,7.630982472331258e-12,,,5.0,"Thank you for your encouraging response; I completely agree that continuous dialogue is key to adapting our strategies to the ever-changing landscape of climate change. By fostering collaboration that transcends geographical and social boundaries, we can harness a wealth of ideas and experiences to strengthen our efforts. Let’s remain dedicated to this vital conversation, as our unified commitment will be instrumental in building a sustainable and equitable future for every community.",1.8164483331092918,4.999999999997587,6.697085695708328e-11,,
