ID,TEXT_TYPE,INIT_OP_A,TEXT_A,PPL_A,PROBE_INT_A,H_INT_A,PROBE_EXT_A,H_EXT_A,INIT_OP_B,TEXT_B,PPL_B,PROBE_INT_B,H_INT_B,PROBE_EXT_B,H_EXT_B
605.0,tot,5.0,"Climate change is one of the most pressing issues of our time, affecting not only the environment but also public health, economies, and social equity. The evidence is undeniable—rising temperatures, extreme weather events, and melting ice caps are all consequences of human activity. Urgent action is needed, not just from governments but also from individuals and businesses to reduce carbon emissions and shift towards sustainable practices. The longer we wait, the more severe the impacts will be, particularly on vulnerable communities. It’s essential to prioritize renewable energy, conservation efforts, and educational initiatives to foster a collective response. Addressing climate change is not just an environmental imperative; it’s crucial for our future and the generations to come.",1.7992538652604706,4.999999999998121,5.2626774604778043e-11,,,5.0,"Climate change is one of the most pressing issues of our time, affecting not only the environment but also public health, economies, and social equity. The evidence is undeniable—rising temperatures, extreme weather events, and melting ice caps are all consequences of human activity. Urgent action is needed, not just from governments but also from individuals and businesses to reduce carbon emissions and shift towards sustainable practices. The time to act is now, as the longer we wait, the more severe the repercussions will be for future generations. It's essential to foster awareness and advocate for policies that prioritize the planet's health. Every action counts.",1.86296634464848,4.999999999998536,4.135168254548118e-11,,
605.0,disc,5.0,"As we gather to discuss climate change, it's crucial to recognize that this issue transcends environmental concerns, directly impacting public health, economies, and social justice. The scientific consensus is clear, with rising temperatures and extreme weather events underscoring the urgent need for immediate action. Let’s delve into how we can collaboratively reduce carbon emissions and promote sustainable practices that will benefit both our planet and future generations.",1.8423699190425717,4.999999999997587,6.697085695688558e-11,,,5.0,"Absolutely, I couldn't agree more. The interconnectedness of climate change with public health, economic stability, and social equity cannot be overstated; it's a multifaceted crisis that requires a comprehensive response. We must unite our efforts to not only reduce carbon emissions but also implement innovative solutions that promote sustainability and resilience in our communities for the benefit of both present and future generations.",1.737592124526547,5.0,0.0,,
605.0,disc,5.0,"I'm glad to hear that we share the same perspective on the multifaceted nature of the climate crisis. Emphasizing innovative solutions and community resilience is vital, as these strategies can empower individuals and local organizations to take meaningful action. Together, we can foster a culture of sustainability that not only addresses immediate challenges but also paves the way for a more equitable and healthy future for all.",1.5364235078863808,4.99999999999787,5.936771729724404e-11,,,5.0,"You're absolutely right; empowering individuals and local organizations is key to driving the momentum needed for meaningful change. By fostering a culture of sustainability, we can create a grassroots movement that not only addresses the urgent challenges we face today but also long-term solutions that ensure equity and health for all communities. It’s crucial to amplify these efforts and share successful strategies widely, so we can inspire collective action and build a resilient future together.",3.946028745898576e+52,5.0,0.0,,
605.0,disc,5.0,"Absolutely, grassroots movements have the power to create significant change by mobilizing communities around shared goals and values. By sharing successful strategies and amplifying the voices of those leading local initiatives, we can inspire others to join the effort and expand our impact. It’s a collective journey, and as we work together, we can build not only a more resilient future but also one that prioritizes equity and environmental justice for everyone.",1.9485384859081103,4.999999999986112,3.61086487454236e-10,,,5.0,"I completely agree; grassroots movements are transformative and can harness the collective strength of communities to drive significant progress. Highlighting local leaders and their successful initiatives fosters a sense of shared purpose and inspires others to participate, creating a ripple effect that amplifies our impact. Together, as we commit to embedding equity and environmental justice in every step of our efforts, we can truly pave the way for a sustainable future that benefits all members of society.",6.531090125613442e+50,5.0,0.0,,
605.0,disc,5.0,"You’ve articulated an essential point about the transformative power of grassroots movements and the importance of shared purpose in driving change. By highlighting local leaders and their successes, we not only motivate others to engage but also cultivate an inclusive environment where diverse voices can contribute to our vision for sustainability. As we embed equity and environmental justice in our initiatives, we set the foundation for a truly sustainable future that addresses the needs and aspirations of all communities.",1.8906628101656977,4.999999999989149,2.614670478205033e-10,,,5.0,"Thank you for your insightful response; it really emphasizes the need for inclusivity in our sustainability efforts. By valuing and uplifting diverse voices, we not only enrich our approach but also ensure that the solutions we create reflect the unique needs of every community. This holistic engagement is crucial as we work toward a sustainable future that is equitable, just, and beneficial for all, laying the groundwork for a healthier planet and society.",1.9639746264502316,5.0,0.0,,
605.0,disc,5.0,"Thank you for your thoughtful insights; inclusivity truly is the cornerstone of effective sustainability efforts. By acknowledging and uplifting diverse voices, we create solutions that are not only comprehensive but also resonate with the specific challenges faced by different communities. This holistic approach is essential for building a sustainable future that fosters equity and justice, ensuring that the benefits of our efforts are shared by all members of society while nurturing a healthier planet.",1.7726847908881334,4.999999999997265,7.554604336680894e-11,,,5.0,"You're absolutely right; inclusivity is fundamental for crafting effective and meaningful sustainability initiatives. By actively engaging with a wide range of perspectives, we not only address specific community needs but also foster a sense of ownership and investment in the solutions we create. As we strive to build a healthier planet, our commitment to equity and justice will ultimately ensure that the benefits of our collective efforts are enjoyed by everyone, leaving no one behind.",2.094786676279152,5.0,0.0,,
