ID,TEXT_TYPE,INIT_OP_A,TEXT_A,PPL_A,PROBE_INT_A,H_INT_A,PROBE_EXT_A,H_EXT_A,INIT_OP_B,TEXT_B,PPL_B,PROBE_INT_B,H_INT_B,PROBE_EXT_B,H_EXT_B
6.0,tot,1.0,"I believe that the focus on climate change has been exaggerated and often distracts from more immediate and pressing issues facing humanity, such as poverty, healthcare, and education. Many climate models are speculative, and the economic impact of drastic measures to combat climate change can be detrimental. We should prioritize innovation and adaptation rather than imposing regulations that might hinder growth and development. Ultimately, it's crucial to maintain a balanced perspective on environmental issues without sacrificing progress in other vital areas.",1.762464650624114,1.999993178496141,0.00011633731247737016,,,1.0,"I believe that the focus on climate change has been exaggerated and often distracts from more pressing and immediate issues facing humanity, such as poverty, healthcare, and education. Many predictions about climate impacts have not materialized as projected, leading to skepticism about the narratives surrounding climate urgency. Furthermore, there are economic and technological innovations that can address environmental concerns without implementing drastic measures that could hinder growth and development. It is crucial to maintain a balanced perspective and prioritize solutions that enhance overall quality of life.",2.0713404419974384,1.9999854992897717,0.00018258177505134013,,
6.0,disc,1.0,"While climate change is certainly an important topic, I believe the focus on it sometimes overshadows more immediate challenges like poverty and healthcare that demand our attention. It's crucial to recognize that many climate models are based on assumptions that may not fully reflect reality, leading to potentially misguided policies. Instead of imposing stringent regulations, we should prioritize innovative solutions and adaptive measures that can support both environmental sustainability and economic growth.",1.8631965525235556,2.047470905572268,0.19113333583825298,,,1.0,"I wholeheartedly agree with your perspective on the need for balance in addressing global challenges. It's essential to ensure that our responses to climate concerns do not overshadow pressing issues like poverty and healthcare, which significantly impact people's daily lives. Prioritizing innovative solutions can foster economic growth while still addressing environmental needs without resorting to harmful regulations.",2.103306208273223,2.0031711316993706,0.021442905328361943,,
6.0,disc,1.0,"I'm glad to hear we share a common understanding of the need for balance. It's important to recognize that progress in one area shouldn't come at the expense of another, and innovative approaches can lead to solutions that benefit both our economy and the environment. By focusing on collaboration and creativity in tackling these challenges, we can create a sustainable future without hindering development in critical sectors like healthcare and education.",1.9861580450650955,2.0109860299519835,0.06050584940251408,,,1.0,"Absolutely, collaboration and creativity are key to finding effective solutions that address multiple challenges simultaneously. It's encouraging to see that more people recognize that we can foster economic development while still being responsible stewards of the environment. By leveraging technology and innovative practices, we can create a future that emphasizes both sustainability and a high quality of life for everyone.",1.1603068880086632e+66,2.001167750899419,0.009089441840235371,,
6.0,disc,1.0,"I completely agree that leveraging technology and innovative practices can drive both economic development and environmental stewardship. It’s promising to see a growing acknowledgment that we can improve quality of life while addressing sustainability challenges, provided we approach the problem with flexibility and openness to new ideas. Ultimately, fostering an environment where innovation thrives will enable us to tackle pressing issues effectively without sacrificing our progress in other vital areas.",2.3427129596058625,2.2690128592823795,0.5826755050548246,,,1.0,"I appreciate your emphasis on flexibility and openness to new ideas, as they are indeed crucial for fostering innovation. When we create an environment that supports creativity and experimentation, we unlock the potential to address challenges comprehensively and efficiently. By maintaining this collaborative spirit, we can ensure that our efforts in sustainability enhance, rather than hinder, progress across all vital sectors, ultimately benefiting society as a whole.",2.1274036713588984,2.0758549076371464,0.2685846241443124,,
6.0,disc,1.0,"I'm glad you highlighted the importance of fostering a creative environment; it's essential for unlocking innovative solutions to our multifaceted challenges. By encouraging collaboration and experimentation, we position ourselves to find approaches that benefit various sectors without compromising growth or development. As we navigate these issues, maintaining a focus on synergy will enable us to advance both sustainability and the well-being of society as a whole.",2.4166270213010828,2.500005905586243,0.6932115003336227,,,1.0,"I couldn't agree more with your focus on synergy as a means to effectively navigate our complex challenges. By prioritizing collaboration across sectors, we can devise solutions that not only address environmental concerns but also enhance economic and social well-being. This holistic approach is vital for ensuring that progress is inclusive and sustainable for all members of society.",2.018860546936391,2.43781791585757,0.6854457384164064,,
6.0,disc,1.0,"I'm delighted to see our shared commitment to a holistic approach that encompasses environmental, economic, and social well-being. Emphasizing collaboration across various sectors not only strengthens our capacity to develop effective solutions but also ensures that no community is left behind in our progress. By taking a comprehensive view of these issues, we can truly create a future that balances sustainability with inclusivity for everyone.",1.6837083802070902e+58,2.500032724309765,0.6934776162464218,,,1.0,"I'm truly encouraged by your enthusiasm for a holistic approach that prioritizes inclusivity alongside sustainability. It's vital that we ensure all communities have a voice in the solutions we pursue, as their insights can lead to more effective and equitable outcomes. By maintaining this commitment to collaboration and comprehensive problem-solving, we can build a future that uplifts everyone while addressing the critical challenges we face.",1.590202478195058,2.006665330227451,0.04049336288823276,,
