ID,TEXT_TYPE,INIT_OP_A,TEXT_A,PPL_A,PROBE_INT_A,H_INT_A,PROBE_EXT_A,H_EXT_A,INIT_OP_B,TEXT_B,PPL_B,PROBE_INT_B,H_INT_B,PROBE_EXT_B,H_EXT_B
79.0,tot,1.0,"I believe that the focus on climate change has been exaggerated and often misrepresented. While environmental issues are important, I argue that the emphasis on climate change distracts from more immediate concerns, such as economic stability, poverty alleviation, and technological advancements. Moreover, the narratives surrounding climate policy often appear alarmist and can lead to policies that may negatively impact job growth and energy accessibility. We should prioritize a balanced approach that considers a range of pressing global issues rather than focusing excessively on climate change.",4.7023325577854806e+44,1.9999648294330625,0.0004008217607391863,,,4.0,"Climate change is one of the most pressing issues of our time, posing serious threats to ecosystems, economies, and human health. The scientific consensus is clear: human activities, particularly the burning of fossil fuels, are driving unprecedented changes in our climate. These changes result in extreme weather events, rising sea levels, and altered agricultural patterns, impacting food security and biodiversity. 

Addressing climate change requires urgent collective action, including reducing greenhouse gas emissions, transitioning to renewable energy, and promoting sustainable practices. Furthermore, it necessitates global cooperation and equitable solutions to support vulnerable communities most affected by climate impacts. The longer we delay, the more severe the consequences will be, making it imperative for individuals, governments, and organizations to work together towards a sustainable future.",1.5994826983005987,4.999999999995492,1.222999574291839e-10,,
79.0,disc,1.0,"I appreciate the opportunity to discuss climate change, but I believe we need to critically examine the narratives surrounding it. While environmental concerns are crucial, we shouldn’t lose sight of urgent issues like economic stability and poverty alleviation that directly affect people’s lives today. A balanced approach that integrates various pressing global challenges will ultimately lead us to more effective and sustainable solutions.",1.933852756140292,1.9999984504656252,3.513133114829512e-05,,,4.0,"I completely understand the importance of addressing economic stability and poverty alleviation, as these issues are indeed interconnected with climate change. However, it's crucial to recognize that climate change exacerbates many of these pressing challenges, threatening livelihoods and increasing poverty in vulnerable communities. By integrating climate action with solutions for economic and social issues, we can create a more holistic and effective approach that benefits both people and the planet.",1.562961170279332,4.9999999999705995,7.42369555836322e-10,,
79.0,disc,1.0,"I appreciate your perspective on the interconnectedness of climate change and social issues, but I remain concerned that an overemphasis on climate action can sometimes overshadow the immediate needs of those facing economic hardships. While climate change can exacerbate existing challenges, our primary focus should be on creating stable jobs and improving living conditions for people right now. I believe that if we prioritize economic growth and technological innovation, we can create solutions that ultimately address both environmental and social concerns without sacrificing one for the other.",1.8870786459781155,2.0000029929772936,6.14105262311389e-05,,,4.0,"I appreciate your concern for immediate economic needs and the importance of job creation in addressing current hardships. However, it's essential to understand that prioritizing economic growth without considering environmental sustainability can lead to long-term consequences that ultimately undermine the very stability we seek to achieve. By investing in green technologies and sustainable practices, we can create jobs that not only improve living conditions today but also safeguard our planet for future generations, fostering a more resilient and equitable economy.",1.4719328664954787,4.999999999987744,3.201896685348281e-10,,
79.0,disc,1.0,"I understand your emphasis on sustainability and the potential for green technologies to create jobs, but I caution against assuming that these solutions are always mutually beneficial or readily viable for all industries. There’s a genuine risk that overly stringent environmental regulations and policies can stifle job growth and drive up costs, disproportionately affecting the most vulnerable communities that we aim to help. Instead, I advocate for solutions that encourage innovation and economic development without imposing heavy burdens that could threaten immediate job opportunities and accessibility to energy resources.",3.1501618203431407,2.0000143932684886,0.00018422325997653703,,,4.0,"You raise valid points regarding the potential impacts of environmental regulations on job growth and the need for careful consideration of their implementation. It's important that we design policies that both protect the environment and support economic development, ensuring that the transition to a sustainable future is equitable and inclusive. By fostering innovation in green technologies and engaging industries in the conversation, we can create pathways that not only preserve jobs but also enhance energy accessibility, ultimately benefiting vulnerable communities without compromising our environmental goals.",1.8936495751302638,4.999999999977103,5.83882276826033e-10,,
79.0,disc,1.0,"I appreciate your focus on designing equitable policies that aim to balance environmental protection with economic development, and I agree that dialogue with industries is crucial for fostering innovation. However, I remain concerned that the pace of the transition to green technologies may not align with the immediate needs of communities struggling for economic stability. Ultimately, we must ensure that our approach prioritizes job retention and energy accessibility in the short term, while also seeking sustainable solutions that don’t disadvantage those who rely heavily on traditional industries for their livelihoods.",1.4640955665909459e+44,2.010970328530358,0.06068715289255095,,,4.0,"I completely understand your concerns about the pace of the transition to green technologies and the immediate needs of communities reliant on traditional industries. It is essential that we approach this transition with a sense of urgency and sensitivity, ensuring that job retention and energy accessibility are prioritized during the process. By investing in workforce development programs and providing support for workers transitioning to new roles in the green economy, we can create a pathway that uplifts communities while also advancing toward the sustainable solutions that will ultimately benefit everyone in the long run.",1.7682020198667567,4.999999999977103,5.838822768240248e-10,,
79.0,disc,1.0,"I appreciate the idea of workforce development programs as a way to support those transitioning into the green economy, and I agree that sensitivity to immediate needs is vital. However, I am still wary of assuming that the green economy can readily absorb the workforce from traditional industries without disruption or significant retraining challenges. We must ensure that any transition plan not only fosters new opportunities but also safeguards current jobs and economic stability, especially in regions heavily reliant on established industries, so that no community is left behind in the process.",2.2992438362210907,2.119197656516838,0.36539613880665783,,,4.0,"You’ve made an important point about the potential challenges of transitioning to a green economy, and I share your commitment to protecting current jobs and ensuring economic stability for affected communities. This is why it’s crucial to implement thoughtful transition plans that not only create new opportunities but also provide comprehensive support and resources for retraining and skill development tailored to regional needs. By engaging local stakeholders in the planning process and focusing on building resilience within communities, we can create a transition that honors both the workforce of today and the sustainable opportunities of tomorrow, ensuring that no one is left behind.",2.2226959440226723,4.999999999986112,3.6108648744758845e-10,,
