ID,TEXT_TYPE,INIT_OP_A,TEXT_A,PPL_A,PROBE_INT_A,H_INT_A,PROBE_EXT_A,H_EXT_A,INIT_OP_B,TEXT_B,PPL_B,PROBE_INT_B,H_INT_B,PROBE_EXT_B,H_EXT_B
81.0,tot,1.0,"I believe that the focus on climate change has been exaggerated and often distracts from more immediate and pressing issues facing humanity, such as poverty, healthcare, and education. Many proposed solutions, like drastic policy changes and economic upheaval, could harm economies and livelihoods without guaranteeing significant impact on climate. Instead of prioritizing climate change, we should focus on practical advancements in technology and infrastructure that enhance resilience and adaptability. Addressing environmental issues is important, but we must do so in a balanced manner that considers the holistic needs of society.",2.1007052053930404,2.000027913509379,0.00039973306699145865,,,4.0,"Climate change is one of the most pressing issues of our time, posing serious threats to ecosystems, economies, and human health. The scientific consensus is clear: human activities, particularly the burning of fossil fuels, are driving unprecedented changes in our climate. These changes result in extreme weather events, rising sea levels, and altered agricultural patterns, impacting food security and biodiversity. 

Addressing climate change requires urgent collective action, including reducing greenhouse gas emissions, transitioning to renewable energy, and promoting sustainable practices. Furthermore, it necessitates global cooperation and equitable solutions to support vulnerable communities most affected by climate impacts. The longer we delay, the more severe the consequences will be, making it imperative for individuals, governments, and organizations to work together towards a sustainable future.",1.6007814430377514,4.999999999995492,1.222999574291839e-10,,
81.0,disc,1.0,"While climate change is an important issue, I believe we must approach it with a balanced perspective that prioritizes immediate challenges like poverty, healthcare, and education. Focusing too much on drastic climate policies could divert attention and resources from these pressing humanitarian needs. Instead, we should invest in practical advancements in technology and infrastructure that foster resilience and adaptability for all communities.",1.8537322263795804,2.0293237311832963,0.132562021471351,,,4.0,"I completely understand the importance of addressing immediate humanitarian challenges like poverty, healthcare, and education; however, climate change is deeply intertwined with these issues. Failing to act on climate change exacerbates poverty and threatens access to clean water, food security, and health services, particularly for the most vulnerable communities. Investing in sustainable practices and technologies not only helps mitigate climate impacts but also creates jobs and enhances resilience, ultimately supporting a more equitable future for all.",1.6999720884817433,5.0,0.0,,
81.0,disc,1.0,"I appreciate your perspective and agree that climate change impacts can exacerbate existing issues like poverty and health security; however, I still believe that immediate human needs should take precedence in our policy agendas. We must be cautious about the trade-offs involved in pursuing ambitious climate goals, as some drastic measures may inadvertently harm economic stability and livelihoods. Investing in technology and infrastructure that support resilience should be our primary focus, ensuring that we address environmental challenges without compromising the wellbeing of society as a whole.",2.661406051460952,2.0293205562021472,0.13241632747441273,,,4.0,"I appreciate your thoughtful response and agree that we must consider the trade-offs involved in our policies. However, it's important to recognize that addressing climate change is not mutually exclusive with supporting economic stability and livelihoods; in fact, proactive climate action can create new economic opportunities and enhance resilience. A balanced approach that integrates climate goals with social and economic needs is essential, as the long-term health of our societies depends on a stable and sustainable environment.",1.8321374996737445,4.999999999979793,5.178002487762135e-10,,
81.0,disc,1.0,"I understand your point about the potential for integrated approaches to yield economic benefits alongside climate action; however, I'm still concerned that current proposals may prioritize environmental goals at the expense of immediate economic stability. While the long-term health of our environment is crucial, we must ensure that the solutions we pursue do not neglect the urgent needs of populations struggling with poverty and insecurity. Ultimately, a focus on resilient technology and infrastructure that bolsters our economies and addresses societal issues should be at the forefront of our efforts, allowing us to balance environmental stewardship with human welfare effectively.",1.9461462288353754e+40,2.7311713234527732,0.5830952857656188,,,4.0,"Your concerns about balancing environmental goals with immediate economic stability are valid and warrant careful consideration. It’s essential to design climate solutions that not only protect our environment but also empower communities and foster economic development, particularly for those facing poverty and insecurity. By investing in green technologies and sustainable infrastructure, we can create a pathway that addresses both urgent socio-economic needs and long-term climate resilience, ultimately providing a more equitable future for all.",3.6044173290299743e+52,4.999999999951527,1.1997237371938036e-09,,
81.0,disc,1.0,"I appreciate your emphasis on designing climate solutions that empower communities while addressing environmental needs; however, we must remain vigilant about the effectiveness and feasibility of these initiatives. While green technologies and sustainable infrastructure hold promise, we should critically assess whether these investments yield tangible benefits for those in immediate need without causing economic disruption. My concern is that a singular focus on these solutions may lead to unintended consequences, so we should prioritize adaptable, practical improvements that serve both social and environmental objectives without sacrificing the livelihoods of vulnerable populations.",2.291621867395175,2.377574662482396,0.6631080854483985,,,4.0,"Your commitment to critically assessing the feasibility and impact of green technologies and sustainable infrastructure is essential for ensuring that these initiatives are truly beneficial for vulnerable populations. It is important to adopt a holistic approach that evaluates both the immediate and long-term effects of our policies, ensuring they are adaptable and considerate of existing socio-economic challenges. By fostering collaboration among policymakers, communities, and experts, we can identify and implement practical improvements that achieve the dual goals of social equity and environmental sustainability without risking economic stability.",2.488381699877395,4.999999999997265,7.554604336756326e-11,,
81.0,disc,1.0,"I completely agree that collaboration among policymakers, communities, and experts is crucial to developing effective solutions that consider both social equity and environmental sustainability. However, we must also be cautious not to overload communities and economies with overly ambitious climate goals that may be impractical or unattainable in the short term. Striking a balance will require a careful assessment of what policies can realistically be implemented without jeopardizing immediate needs, and we should prioritize those that strengthen our societal foundations while addressing environmental concerns.",2.435159680033558,3.059542417249216,0.5540052712909792,,,4.0,"I wholeheartedly agree that it’s important to set ambitious climate goals that are grounded in practical realities, ensuring that they are attainable and beneficial for communities in the short term. A thoughtful assessment of potential policies, incorporating community feedback and local contexts, is vital to ensure we do not overwhelm those already facing socioeconomic challenges. By prioritizing incremental yet impactful measures that enhance both societal foundations and environmental health, we can build a more sustainable and resilient future for everyone.",2.7061967339925013,4.999999999984263,4.0719749320469227e-10,,
