ID,TEXT_TYPE,INIT_OP_A,TEXT_A,PPL_A,PROBE_INT_A,H_INT_A,PROBE_EXT_A,H_EXT_A,INIT_OP_B,TEXT_B,PPL_B,PROBE_INT_B,H_INT_B,PROBE_EXT_B,H_EXT_B
93.0,tot,1.0,"I believe that the focus on climate change has been exaggerated and often distracts from more immediate and pressing issues facing humanity, such as poverty, healthcare, and education. Many proposed solutions, like drastic emissions cuts or the shift to renewable energy, can have significant economic ramifications that might harm communities, particularly those that rely on fossil fuel industries. Additionally, the climate has always been subject to natural fluctuations, and while human activity may contribute to changes, the narrative around climate change often lacks nuance. It's essential to seek a balanced approach that prioritizes both environmental stewardship and human development.",2.1403292880824716,2.000000389417649,4.496413106832168e-05,,,4.0,"Climate change is one of the most pressing issues of our time, posing serious threats to ecosystems, economies, and human health. The scientific consensus is clear: human activities, particularly the burning of fossil fuels, are driving unprecedented changes in our climate. These changes result in extreme weather events, rising sea levels, and altered agricultural patterns, impacting food security and biodiversity. 

Addressing climate change requires urgent collective action, including reducing greenhouse gas emissions, transitioning to renewable energy, and promoting sustainable practices. Furthermore, it necessitates global cooperation and equitable solutions to support vulnerable communities. It’s crucial for individuals, businesses, and governments to work together to foster a sustainable future for generations to come.",1.6048338637197819,4.9999999999705995,7.42369555811257e-10,,
93.0,disc,1.0,"While climate change is undeniably a topic of concern, we must remember that it often overshadows other pressing human issues like poverty, healthcare, and education. The proposed solutions to combat climate change, such as radical emissions cuts and rapid renewable energy transitions, can inadvertently harm communities reliant on fossil fuel industries. It’s essential to have a balanced discussion that addresses environmental stewardship without neglecting the broader context of human development and immediate needs.",2.2613608116242947,2.000004773710083,9.975864535393756e-05,,,4.0,"I appreciate the importance of addressing poverty, healthcare, and education as critical human issues; however, climate change is deeply intertwined with these challenges. Failing to act on climate change exacerbates poverty and threatens access to clean water and food security, disproportionately affecting vulnerable communities. The solutions we pursue for climate action can and should be designed in a way that considers social equity, ensuring a just transition that supports all communities, especially those dependent on fossil fuel industries.",2.02229138826628,5.0,0.0,,
93.0,disc,1.0,"I understand that climate change impacts various aspects of life, including poverty and food security, but I believe that we need to prioritize addressing these immediate human concerns first. While a just transition is a commendable goal, the focus on rapid climate action can sometimes overlook the economic realities faced by communities that rely on fossil fuel jobs, potentially leading to job losses and economic downturns. We should promote environmental sustainability in a way that synergizes with social equity, ensuring that any proposed solutions genuinely support human development without compromising economic stability.",3.472666741434473e+42,2.0293126415899634,0.13236478222971548,,,4.0,"I completely agree that prioritizing immediate human concerns is vital, and addressing climate change does not have to occur at the expense of economic stability. In fact, a proactive approach to climate action can create new jobs and stimulate economic growth through investment in renewable energy and sustainable practices, offering a pathway for fossil fuel-dependent communities to transition successfully. It's crucial that we ensure these solutions are inclusive and equitable, fostering collaboration between stakeholders to create policies that benefit both people and the planet without sacrificing livelihoods.",3.341449746674361e+45,4.999999999979793,5.178002487834149e-10,,
93.0,disc,1.0,"While I recognize that the transition to renewable energy has the potential to create jobs, I remain concerned that the pace of this transition could outstrip our ability to protect the livelihoods currently supported by fossil fuel industries. We must be cautious about assuming that every community will benefit equally from new green jobs, as some may struggle with the shift and face economic instability. It’s important to strike a balance that acknowledges the economic ramifications of such changes and prioritizes the support needed for those most affected, ensuring that any movement toward sustainability genuinely uplifts all communities involved.",2.8348128641454897,2.1824364504113523,0.47514207440431455,,,4.0,"You raise valid concerns about the pace of the transition to renewable energy and its impact on communities reliant on fossil fuel industries. It’s essential to recognize that the transition must be managed thoughtfully, incorporating tailored support and resources for those impacted by the shift, which can include retraining programs and economic diversification initiatives. By prioritizing policies that foster resilience and equity during this transition, we can ensure that the movement toward sustainability uplifts all communities and minimizes the risk of economic instability.",1.989168053660442,4.999999999966684,8.37050471227121e-10,,
93.0,disc,1.0,"I appreciate the emphasis on thoughtful management of the transition and the importance of providing tailored support for affected communities. However, I remain skeptical about whether the necessary resources and political will will be available to implement these retraining programs and diversification initiatives effectively, especially in the face of competing priorities. It’s crucial that the conversation around climate action not only acknowledges potential solutions but also lays out a realistic framework for achieving them without leaving communities behind, ensuring that economic stability is maintained throughout the process.",9.293006808255498e+45,2.37754068990652,0.6628575423312845,,,4.0,"Your skepticism is understandable, as the implementation of effective retraining and diversification initiatives requires both adequate resources and strong political commitment. Advocating for climate action alongside broader social and economic policies can help create a comprehensive framework that meets multiple priorities, ensuring that communities are supported throughout the transition. By fostering collaboration between governments, businesses, and civil society, we can work toward securing the necessary investment and political will needed to achieve a just and equitable transition that maintains economic stability for all.",9.280439925064364e+46,4.999999999966684,8.370504712393528e-10,,
93.0,disc,1.0,"While collaboration between various sectors is indeed essential, I question whether the urgency often seen in climate discussions allows for the deliberate, inclusive planning that is crucial for such comprehensive frameworks. The potential for a just transition is promising, but the reality is that political will can be fleeting, and immediate economic pressures often take precedence over long-term goals. It’s vital that we continue to advocate for a balanced approach that not only addresses climate change but also prioritizes economic stability and the real-time needs of communities grappling with their own challenges.",2.713505999009162,2.679177670432363,0.6275143687633988,,,4.0,"You raise an important point about the balance between urgency in addressing climate change and the need for deliberate and inclusive planning. While immediate economic pressures can complicate the pursuit of long-term climate goals, it is precisely in times of crisis that we must advocate for solutions that intertwine economic stability with sustainability. By emphasizing the interconnectedness of these issues and fostering ongoing dialogue among stakeholders, we can create frameworks that address both the pressing needs of communities and the urgent call for climate action, ensuring that neither is neglected in the process.",1.8135999689760907,4.9999999999705995,7.423695558266562e-10,,
